water/SRR1616981_1.fastq.gz	refseq/bacteria/GCF_902164675.1/GCF_902164675.1_25426_7_101_genomic.fna.gz	0.0374	0.0686	96.69	0.089	95.76-97.30	0.089	0.07-0.12	1	1.049	711/23211	89.36	NZ_LR607336.1 Klebsiella grimontii strain 4928STDY7071328 chromosome 1
water/SRR1616981_1.fastq.gz	refseq/bacteria/GCF_014287995.1/GCF_014287995.1_ASM1428799v1_genomic.fna.gz	0.0373	0.0343	96.47	0.088	95.34-97.64	0.088	0.06-0.12	1	1.168	368/12876	89.17	NZ_JACOPL010000001.1 Agathobaculum faecis strain NSJ-28 N50_ctg001, whole genome shotgun sequence
water/SRR1616981_1.fastq.gz	refseq/bacteria/GCF_928721995.1/GCF_928721995.1_min17_bin56_genomic.fna.gz	0.0368	0.0258	97.03	0.087	95.76-98.52	0.087	0.05-0.13	1	1.029	315/9260	89.67	NZ_OV788642.1 MAG: Duodenibacillus massiliensis isolate min17_bin56 chromosome 1, complete sequence
water/SRR1616981_1.fastq.gz	refseq/bacteria/GCF_900624755.1/GCF_900624755.1_81E7_genomic.fna.gz	0.0368	0.0407	97.91	0.087	96.93-99.01	0.087	0.06-0.12	1	1.042	697/15652	90.45	NZ_UYXI01000001.1 Alistipes senegalensis isolate Alistipes senegalensis 81E7, whole genome shotgun sequence
water/SRR1616981_1.fastq.gz	refseq/bacteria/GCF_014337215.1/GCF_014337215.1_ASM1433721v1_genomic.fna.gz	0.0367	0.0437	96.50	0.087	95.39-97.37	0.087	0.07-0.12	1	1.040	480/16955	89.14	NZ_CP060635.1 Wansuia hejianensis strain NSJ-29 chromosome, complete genome
water/SRR1616981_1.fastq.gz	refseq/bacteria/GCF_008632235.1/GCF_008632235.1_ASM863223v1_genomic.fna.gz	0.0361	0.0551	96.96	0.086	95.87-98.05	0.086	0.06-0.12	1	1.055	689/21295	89.52	NZ_VWSY01000001.1 [Clostridium] symbiosum strain LT0011 NODE_1_length_3271684_cov_105.736103, whole genome shotgun sequence
water/SRR1616981_1.fastq.gz	refseq/bacteria/GCF_900168025.1/GCF_900168025.1_IMG-taxon_2588253727_annotated_assembly_genomic.fna.gz	0.0360	0.0305	96.77	0.085	95.41-98.37	0.085	0.05-0.13	1	1.035	368/12105	89.34	NZ_FUYN01000019.1 Acetoanaerobium noterae strain ATCC 35199, whole genome shotgun sequence
water/SRR1616981_1.fastq.gz	refseq/bacteria/GCF_003812345.1/GCF_003812345.1_ASM381234v1_genomic.fna.gz	0.0359	0.0551	98.64	0.085	97.96-99.56	0.085	0.06-0.10	1	1.035	1208/22012	91.06	NZ_CP033744.1 Citrobacter freundii strain FDAARGOS_549 chromosome, complete genome
water/SRR1616981_1.fastq.gz	refseq/bacteria/GCF_014297275.1/GCF_014297275.1_ASM1429727v1_genomic.fna.gz	0.0353	0.0292	97.43	0.084	96.39-98.79	0.084	0.05-0.11	1	1.208	424/11453	89.91	NZ_JACOQK010000001.1 Clostridium facile strain NSJ-27 1, whole genome shotgun sequence
water/SRR1616981_1.fastq.gz	refseq/bacteria/GCF_004138125.1/GCF_004138125.1_ASM413812v1_genomic.fna.gz	0.0345	0.0310	95.64	0.082	94.14-97.36	0.082	0.04-0.13	1	1.050	259/12692	88.20	NZ_RXHS01000012.1 Seramator thermalis strain SYSU GA16112 Scaffold10_1, whole genome shotgun sequence
water/SRR1616981_1.fastq.gz	refseq/bacteria/GCF_028355655.1/GCF_028355655.1_ASM2835565v1_genomic.fna.gz	0.0342	0.0511	97.20	0.081	96.16-98.10	0.081	0.06-0.11	1	1.052	698/21039	89.60	NZ_CP110645.1 Aeromonas salmonicida strain AS3 chromosome, complete genome
water/SRR1616981_1.fastq.gz	refseq/bacteria/GCF_003634345.1/GCF_003634345.1_ASM363434v1_genomic.fna.gz	0.0326	0.0335	97.67	0.077	96.54-98.74	0.077	0.05-0.11	1	1.046	541/14745	89.89	NZ_RBXN01000001.1 Coprobacter fastidiosus NSB1 = JCM 33896 strain NSB1 Ga0131254_101, whole genome shotgun sequence
water/SRR1616981_1.fastq.gz	refseq/bacteria/GCF_000155515.2/GCF_000155515.2_ASM15551v2_genomic.fna.gz	0.0325	0.0296	96.51	0.077	95.31-97.87	0.077	0.05-0.12	1	1.040	325/12830	88.82	NC_022112.1 Lacticaseibacillus paracasei subsp. paracasei 8700:2, complete sequence
water/SRR1616981_1.fastq.gz	refseq/bacteria/GCF_014384895.1/GCF_014384895.1_ASM1438489v1_genomic.fna.gz	0.0294	0.0349	96.56	0.070	95.19-97.78	0.070	0.05-0.10	1	1.059	392/16827	88.58	NZ_JACRSQ010000001.1 Bianquea renquensis strain NSJ-32 H6_ctg0001, whole genome shotgun sequence
water/SRR1616981_1.fastq.gz	refseq/bacteria/GCF_009828745.1/GCF_009828745.1_ASM982874v1_genomic.fna.gz	0.0292	0.0192	96.90	0.069	95.23-99.82	0.069	0.03-0.12	1	1.037	241/9314	88.88	NZ_WTSX01000010.1 Erysipelothrix anatis strain D17_0559-3-2-1 NODE_10_length_86863_cov_127.359493, whole genome shotgun sequence
water/SRR1616981_1.fastq.gz	refseq/bacteria/GCF_000420525.1/GCF_000420525.1_ASM42052v1_genomic.fna.gz	0.0287	0.0226	95.76	0.068	93.57-97.80	0.068	0.03-0.13	1	1.381	197/11158	87.79	NZ_ATVC01000001.1 Aquaspirillum serpens DSM 68 G465DRAFT_scaffold00001.1_C, whole genome shotgun sequence
water/SRR1616981_1.fastq.gz	refseq/bacteria/GCF_014288115.1/GCF_014288115.1_ASM1428811v1_genomic.fna.gz	0.0284	0.0247	98.16	0.067	96.93-99.43	0.067	0.04-0.10	1	1.064	467/12439	89.95	NZ_JACOOK010000001.1 Alistipes hominis strain New-7 N7_ctg01, whole genome shotgun sequence
water/SRR1616981_1.fastq.gz	refseq/bacteria/GCF_017815575.1/GCF_017815575.1_ASM1781557v1_genomic.fna.gz	0.0280	0.0300	96.35	0.066	94.94-98.12	0.066	0.03-0.10	1	1.045	314/15074	88.26	NZ_CP072608.1 Desulfovibrio desulfuricans strain L4 chromosome, complete genome
water/SRR1616981_1.fastq.gz	refseq/bacteria/GCF_014118685.1/GCF_014118685.1_ASM1411868v1_genomic.fna.gz	0.0278	0.0208	95.86	0.066	94.08-97.84	0.066	0.03-0.11	1	1.042	190/10752	87.79	NZ_JACFAK010000010.1 Flaviflexus huanghaiensis strain CICC 10486 Scaffold10_1, whole genome shotgun sequence
water/SRR1616981_1.fastq.gz	refseq/bacteria/GCF_020892115.1/GCF_020892115.1_ASM2089211v1_genomic.fna.gz	0.0277	0.0277	97.27	0.066	95.85-98.85	0.066	0.04-0.10	1	1.089	383/13847	89.07	NZ_AP024846.1 [Clostridium] scindens strain G10 chromosome, complete genome
water/SRR1616981_1.fastq.gz	refseq/bacteria/GCF_006770265.1/GCF_006770265.1_ASM677026v1_genomic.fna.gz	0.0272	0.0177	95.92	0.065	94.12-97.38	0.065	0.04-0.11	1	1.025	161/9117	87.79	NZ_CP017194.1 Lactococcus carnosus strain TMW 2.1612 chromosome, complete genome
water/SRR1616981_1.fastq.gz	refseq/bacteria/GCF_900454855.1/GCF_900454855.1_57800_F01_genomic.fna.gz	0.0268	0.0252	95.92	0.064	93.91-98.14	0.064	0.03-0.11	1	1.017	230/13115	87.77	NZ_UGTJ01000003.1 Prevotella buccae strain NCTC13063, whole genome shotgun sequence
water/SRR1616981_1.fastq.gz	refseq/bacteria/GCF_009721605.1/GCF_009721605.1_ASM972160v1_genomic.fna.gz	0.0268	0.0537	96.97	0.064	95.76-98.12	0.064	0.04-0.09	1	1.104	695/28611	88.70	NZ_WNME01000001.1 Hungatella hathewayi strain 123Y-2 ctg_1, whole genome shotgun sequence
water/SRR1616981_1.fastq.gz	refseq/bacteria/GCF_002028545.1/GCF_002028545.1_ASM202854v1_genomic.fna.gz	0.0266	0.0313	96.03	0.063	94.62-97.52	0.063	0.04-0.10	1	1.076	301/16789	87.83	NZ_MWPQ01000040.1 Nitrobacter vulgaris strain Ab1 NvAb1_1, whole genome shotgun sequence
water/SRR1616981_1.fastq.gz	refseq/bacteria/GCF_900087655.1/GCF_900087655.1_PFRJS14_genomic.fna.gz	0.0265	0.0200	98.08	0.063	96.80-100.00	0.063	0.03-0.09	1	1.038	391/10769	89.86	NZ_LT593929.1 Propionibacterium freudenreichii isolate PFRJS14 chromosome I, complete sequence
water/SRR1616981_1.fastq.gz	refseq/bacteria/GCF_009734005.1/GCF_009734005.1_ASM973400v2_genomic.fna.gz	0.0243	0.0213	98.40	0.058	97.10-100.18	0.058	0.03-0.09	1	1.085	402/11515	89.74	NZ_CP038996.1 Enterococcus faecium strain SRR24 chromosome, complete genome
water/SRR1616981_1.fastq.gz	refseq/bacteria/GCF_900637515.1/GCF_900637515.1_51184_A01_genomic.fna.gz	0.0231	0.0147	96.19	0.055	93.82-97.33	0.055	0.04-0.11	1	1.020	151/9184	87.59	NZ_LR134375.1 Veillonella dispar strain NCTC11831 chromosome 1, complete sequence
water/SRR1616981_1.fastq.gz	refseq/bacteria/GCF_014645135.1/GCF_014645135.1_ASM1464513v1_genomic.fna.gz	0.0225	0.0277	97.15	0.053	95.81-99.88	0.053	0.02-0.08	1	1.013	389/17651	88.42	NZ_BMLH01000001.1 Rheinheimera tangshanensis strain CGMCC 1.6362 sequence01, whole genome shotgun sequence
water/SRR1616981_1.fastq.gz	refseq/bacteria/GCF_902364025.1/GCF_902364025.1_MGYG-HGUT-00172_genomic.fna.gz	0.0223	0.0437	95.12	0.053	93.87-97.57	0.053	0.02-0.08	1	1.091	319/28403	86.52	NZ_CABJCG010000001.1 Enterocloster lavalensis isolate MGYG-HGUT-00172, whole genome shotgun sequence
water/SRR1616981_1.fastq.gz	refseq/bacteria/GCF_000393015.1/GCF_000393015.1_Ente_faec_T5_V1_genomic.fna.gz	0.0217	0.0188	97.38	0.051	95.68-99.33	0.051	0.02-0.09	1	1.021	280/12389	88.49	NZ_KB944666.1 Enterococcus faecalis EnGen0336 strain T5 acAro-supercont1.1, whole genome shotgun sequence
water/SRR1616981_1.fastq.gz	refseq/bacteria/GCF_002208805.2/GCF_002208805.2_ASM220880v2_genomic.fna.gz	0.0209	0.0158	96.34	0.050	93.99-97.42	0.050	0.04-0.09	1	1.018	166/10573	87.46	NZ_CP022096.2 Staphylococcus pettenkoferi strain FDAARGOS_288 chromosome, complete genome
water/SRR1616981_1.fastq.gz	refseq/bacteria/GCF_009676365.1/GCF_009676365.1_ASM967636v1_genomic.fna.gz	0.0208	0.0126	97.07	0.049	94.78-98.31	0.049	0.03-0.10	1	1.018	167/8472	88.10	NZ_CP046037.1 Latilactobacillus sakei strain CBA3614 chromosome, complete genome
water/SRR1616981_1.fastq.gz	refseq/bacteria/GCF_000455225.1/GCF_000455225.1_Megasphaera_massiliensis_genomic.fna.gz	0.0203	0.0167	100.00	0.048	99.03-101.97	0.048	0.03-0.07	1	1.073	617/11495	91.00	NZ_HF954532.1 Megasphaera massiliensis strain NP3, whole genome shotgun sequence
water/SRR1616981_1.fastq.gz	refseq/bacteria/GCF_000243335.1/GCF_000243335.1_ASM24333v1_genomic.fna.gz	0.0202	0.0275	96.46	0.048	94.91-98.16	0.048	0.03-0.08	1	1.017	301/19059	87.48	NZ_JH597773.1 Leptonema illini DSM 21528 Lepilscaffold_1, whole genome shotgun sequence
water/SRR1616981_1.fastq.gz	refseq/bacteria/GCF_020181435.1/GCF_020181435.1_ASM2018143v1_genomic.fna.gz	0.0198	0.0196	96.49	0.047	94.61-98.22	0.047	0.03-0.08	1	1.018	219/14073	87.43	NZ_CP084016.1 Anaerostipes caccae strain NBRC 114412 chromosome, complete genome
water/SRR1616981_1.fastq.gz	refseq/bacteria/GCF_000092425.1/GCF_000092425.1_ASM9242v1_genomic.fna.gz	0.0194	0.0191	97.65	0.046	96.12-99.35	0.046	0.02-0.07	1	1.019	312/14098	88.43	NC_014221.1 Truepera radiovictrix DSM 17093, complete sequence
water/SRR1616981_1.fastq.gz	refseq/bacteria/GCF_009738105.1/GCF_009738105.1_ASM973810v1_genomic.fna.gz	0.0186	0.0114	97.71	0.044	95.52-98.73	0.044	0.03-0.08	1	1.016	186/8566	88.38	NZ_CP044221.1 Streptococcus mutans strain NCH105 chromosome, complete genome
water/SRR1616981_1.fastq.gz	refseq/bacteria/GCF_008868535.1/GCF_008868535.1_ASM886853v1_genomic.fna.gz	0.0167	0.0094	97.70	0.040	95.47-98.13	0.040	0.04-0.08	1	1.013	155/7953	88.07	NZ_WBOA01000001.1 Lactobacillus gasseri strain BIO6369 Lactobacillus_gasseri_BIO6369_1, whole genome shotgun sequence
water/SRR1616981_1.fastq.gz	refseq/bacteria/GCF_003054045.1/GCF_003054045.1_ASM305404v1_genomic.fna.gz	0.0113	0.0180	96.87	0.027	94.02-96.98	0.027	0.02-0.06	1	1.022	231/22663	86.25	NZ_QBKH01000001.1 Sphingobacterium faecium strain DSM 11690 Ga0183459_101, whole genome shotgun sequence
water/SRR1616981_1.fastq.gz	refseq/bacteria/GCF_013389455.1/GCF_013389455.1_ASM1338945v1_genomic.fna.gz	0.0111	0.0131	98.87	0.026	96.51-99.79	0.026	0.02-0.05	1	1.003	313/16454	88.00	NZ_CP058278.1 Flavobacterium inviolabile strain P2-65 chromosome, complete genome
water/SRR1616981_1.fastq.gz	refseq/bacteria/GCF_000482805.1/GCF_000482805.1_ASM48280v1_genomic.fna.gz	0.0096	0.0080	99.96	0.023	97.19-100.20	0.023	0.02-0.05	1	1.004	272/11791	88.55	NZ_AXWT01000001.1 Deinococcus murrayi DSM 11303 H565DRAFT_scaffold00001.1_C, whole genome shotgun sequence
sludge/SRR5722941_1.fastq.gz	refseq/bacteria/GCF_000368805.1/GCF_000368805.1_Acin_john_ANC_3681_V1_genomic.fna.gz	100.0000	100.0000	99.06	30.000	NA-NA	HIGH	NA-NA	30	44.385	11290/15127	99.06	NZ_KB849702.1 Acinetobacter johnsonii ANC 3681 acLro-supercont1.1, whole genome shotgun sequence
soil/SRR5642310_1.fastq.gz	refseq/bacteria/GCF_900185755.1/GCF_900185755.1_NDB4MOL1_Assembly_1_genomic.fna.gz	100.0000	100.0000	95.63	0.650	95.52-95.80	0.650	0.61-0.69	1	1.450	3640/29881	93.43	NZ_FYAX01000048.1 Cupriavidus metallidurans isolate NDB4MOL1, whole genome shotgun sequence
sediment/SRR5650808_1.fastq.gz	refseq/bacteria/GCF_000237825.1/GCF_000237825.1_ASM23782v1_genomic.fna.gz	37.8302	33.4287	95.86	23.000	NA-NA	HIGH	NA-NA	23	16.535	2167/8040	95.86	NZ_CM001377.1 Thermanaerovibrio velox DSM 12556 chromosome, whole genome shotgun sequence
sediment/SRR5650808_1.fastq.gz	refseq/bacteria/GCF_000512735.1/GCF_000512735.1_ASM51273v1_genomic.fna.gz	26.3167	18.8061	95.41	16.000	NA-NA	HIGH	NA-NA	16	16.336	1534/6574	95.41	NZ_CP007028.1 Thermocrinis ruber strain DSM 23557 chromosome, complete genome
sediment/SRR5650808_1.fastq.gz	refseq/bacteria/GCF_000376665.1/GCF_000376665.1_ASM37666v1_genomic.fna.gz	11.5136	16.7626	98.14	7.000	NA-NA	HIGH	NA-NA	7	5.361	7365/13167	98.14	NC_021081.1 Meiothermus ruber DSM 1279, complete sequence
sediment/SRR5650808_1.fastq.gz	refseq/bacteria/GCF_002117565.1/GCF_002117565.1_ASM211756v1_genomic.fna.gz	8.2240	9.9570	98.16	5.000	NA-NA	HIGH	NA-NA	5	5.896	6227/11074	98.16	NZ_NDEZ01000001.1 Anoxybacillus ayderensis strain MT-Cab contig00001, whole genome shotgun sequence
sediment/SRR5650808_1.fastq.gz	refseq/bacteria/GCF_003345255.1/GCF_003345255.1_ASM334525v1_genomic.fna.gz	6.5792	9.4564	97.38	4.000	NA-NA	HIGH	NA-NA	4	4.555	5749/13072	97.38	NZ_CP029331.1 Pseudothauera hydrothermalis strain GD-2 chromosome, complete genome
sediment/SRR5650808_1.fastq.gz	refseq/bacteria/GCF_003337435.1/GCF_003337435.1_ASM333743v1_genomic.fna.gz	4.9344	6.0252	96.57	3.000	NA-NA	HIGH	NA-NA	3	3.444	3751/11081	96.57	NZ_QPJS01000001.1 Schleiferia thermophila strain DSM 21410 Ga0244498_101, whole genome shotgun sequence
sediment/SRR5650808_1.fastq.gz	refseq/bacteria/GCF_000429065.1/GCF_000429065.1_ASM42906v1_genomic.fna.gz	1.9199	2.3876	98.57	1.167	98.44-98.66	1.167	1.11-1.24	2	2.107	5061/11265	97.45	NZ_AUBD01000001.1 Silanimonas lenta DSM 16282 G408DRAFT_scaffold00001.1_C, whole genome shotgun sequence
sediment/SRR5650808_1.fastq.gz	refseq/bacteria/GCF_001399775.1/GCF_001399775.1_ASM139977v1_genomic.fna.gz	1.8429	2.0248	98.83	1.120	98.70-98.96	1.120	1.05-1.19	2	2.593	4758/9839	97.68	NZ_CP010822.1 Thermus aquaticus Y51MC23 chromosome, complete genome
sediment/SRR5650808_1.fastq.gz	refseq/bacteria/GCF_000021685.1/GCF_000021685.1_ASM2168v1_genomic.fna.gz	0.8392	1.1516	96.02	0.510	95.67-96.38	0.510	0.45-0.57	1	1.651	1448/12517	93.28	NC_011959.1 Thermomicrobium roseum DSM 5159, complete sequence
soil/SRR5468418_1.fastq.gz	refseq/bacteria/GCF_012932215.1/GCF_012932215.1_ASM1293221v1_genomic.fna.gz	10.6001	9.3658	97.46	0.221	96.97-97.83	0.221	0.19-0.25	1	1.196	1575/17062	92.60	NZ_CP048788.1 Roseobacter ponti strain DSM 106830 chromosome, complete genome
soil/SRR5468418_1.fastq.gz	refseq/bacteria/GCF_019798055.1/GCF_019798055.1_AS10_genomic.fna.gz	10.5392	9.9781	97.09	0.220	96.67-97.56	0.220	0.19-0.25	1	1.218	1503/18552	92.21	NZ_JAHOPH010000001.1 Salsipaludibacter albus strain AS10 AS10_1, whole genome shotgun sequence
soil/SRR5468418_1.fastq.gz	refseq/bacteria/GCF_001723295.1/GCF_001723295.1_ASM172329v1_genomic.fna.gz	9.5527	6.3845	97.34	0.199	96.75-97.93	0.199	0.16-0.24	1	1.288	1033/12792	92.20	NZ_LPWD01000001.1 Methyloceanibacter marginalis strain R-67177 contig_1, whole genome shotgun sequence
soil/SRR5468418_1.fastq.gz	refseq/bacteria/GCF_030284385.1/GCF_030284385.1_ASM3028438v1_genomic.fna.gz	9.3037	4.7639	96.67	0.194	95.99-97.27	0.194	0.16-0.24	1	1.168	631/9943	91.49	NZ_CP127221.1 Altererythrobacter rubellus strain NBRC 112769 chromosome, complete genome
soil/SRR5468418_1.fastq.gz	refseq/bacteria/GCF_024054565.1/GCF_024054565.1_ASM2405456v1_genomic.fna.gz	9.1730	15.9471	98.54	0.191	98.26-98.85	0.191	0.17-0.21	1	1.125	3820/33832	93.21	NZ_JAMXLR010000010.1 Aeoliella straminimaris strain ICT_H6.2 Contig_10_309.366, whole genome shotgun sequence
soil/SRR5468418_1.fastq.gz	refseq/bacteria/GCF_019711355.1/GCF_019711355.1_ASM1971135v1_genomic.fna.gz	8.9704	5.4885	96.25	0.187	95.60-96.88	0.187	0.15-0.23	1	1.138	638/11880	91.00	NZ_CP081297.1 Qipengyuania psychrotolerans strain 1XM2-8 chromosome
soil/SRR5468418_1.fastq.gz	refseq/bacteria/GCF_007747995.1/GCF_007747995.1_ASM774799v1_genomic.fna.gz	7.5214	13.0272	95.42	0.157	94.91-96.12	0.157	0.12-0.19	1	1.086	1152/33145	89.73	NZ_CP036276.1 Symmachiella dynata strain Mal52 chromosome, complete genome
soil/SRR5468418_1.fastq.gz	refseq/bacteria/GCF_900172295.1/GCF_900172295.1_P.litorisediminis_CECT8287_Spades_Prokka_genomic.fna.gz	7.5028	6.6896	95.50	0.156	94.83-96.19	0.156	0.12-0.19	1	1.161	616/17283	89.80	NZ_FWFL01000038.1 Roseovarius litorisediminis strain CECT 8287, whole genome shotgun sequence
soil/SRR5468418_1.fastq.gz	refseq/bacteria/GCF_003058085.1/GCF_003058085.1_ASM305808v1_genomic.fna.gz	6.9309	7.2142	96.04	0.144	95.42-96.68	0.144	0.12-0.18	1	1.133	790/20092	90.09	NZ_QBUD01000001.1 Yoonia sediminilitoris strain DSM 29955 Ga0183446_101, whole genome shotgun sequence
soil/SRR5468418_1.fastq.gz	refseq/bacteria/GCF_900184815.1/GCF_900184815.1_B.aestuarii_CECT8489_Spades_Prokka_genomic.fna.gz	6.8193	6.0840	96.78	0.142	95.93-97.45	0.142	0.11-0.18	1	1.121	877/17367	90.82	NZ_FXXQ01000065.1 Boseongicola aestuarii strain CECT 8489, whole genome shotgun sequence
soil/SRR5468418_1.fastq.gz	refseq/bacteria/GCF_000382125.1/GCF_000382125.1_ASM38212v1_genomic.fna.gz	6.6953	5.8319	95.92	0.140	95.20-96.58	0.140	0.11-0.17	1	1.125	626/16790	89.93	NZ_KB907546.1 Eudoraea adriatica DSM 19308 G504DRAFT_scaffold00001.1, whole genome shotgun sequence
soil/SRR5468418_1.fastq.gz	refseq/bacteria/GCF_008065115.1/GCF_008065115.1_ASM806511v1_genomic.fna.gz	6.3915	9.2251	96.29	0.133	95.72-96.95	0.133	0.11-0.16	1	1.083	1102/27876	90.10	NZ_CP042913.1 Bythopirellula goksoeyrii strain Pr1d chromosome
soil/SRR5476649_1.fastq.gz	refseq/bacteria/GCF_018288855.1/GCF_018288855.1_ASM1828885v1_genomic.fna.gz	59.1132	52.3881	98.98	9.000	NA-NA	HIGH	NA-NA	9	8.890	16882/23214	98.98	NZ_CP065024.1 Rahnella inusitata isolate Se8.10.12 chromosome
soil/SRR5476649_1.fastq.gz	refseq/bacteria/GCF_019166075.1/GCF_019166075.1_ASM1916607v1_genomic.fna.gz	19.7044	24.0297	96.68	3.000	NA-NA	HIGH	NA-NA	3	2.784	11297/32172	96.68	NZ_JAHTGR010000100.1 Duganella violaceicalia strain HSC-15S17 NODE_100_length_650_cov_22.950287, whole genome shotgun sequence
soil/SRR5476649_1.fastq.gz	refseq/bacteria/GCF_002028325.1/GCF_002028325.1_ASM202832v1_genomic.fna.gz	6.0581	6.7247	95.24	0.922	95.11-95.41	0.922	0.85-0.97	2	3.136	4030/29124	93.82	NZ_CP018420.1 Pseudomonas veronii strain R02 chromosome, complete genome
soil/SRR5476649_1.fastq.gz	refseq/bacteria/GCF_023231945.1/GCF_023231945.1_ASM2323194v1_genomic.fna.gz	5.7682	5.8617	95.27	0.878	95.07-95.42	0.878	0.81-0.95	2	2.168	3622/27068	93.72	NZ_JAJLJH010000001.1 Scleromatobacter humisilvae strain BS-T2-15 contig00001, whole genome shotgun sequence
soil/SRR5476649_1.fastq.gz	refseq/bacteria/GCF_001612705.2/GCF_001612705.2_ASM161270v2_genomic.fna.gz	3.8847	4.3147	98.39	0.591	98.27-98.55	0.591	0.56-0.62	1	2.029	8557/29095	96.13	NZ_CP012400.2 Pseudomonas yamanorum strain LBUM636 chromosome, complete genome
soil/SRR5476649_1.fastq.gz	refseq/bacteria/GCF_904848625.1/GCF_904848625.1_LMG_28140_genomic.fna.gz	2.8128	3.5496	98.46	0.428	98.30-98.64	0.428	0.40-0.45	1	1.308	7472/33698	95.26	NZ_CAJHCP010000001.1 Paraburkholderia metrosideri strain LMG 28140 isolate LMG 28140, whole genome shotgun sequence
soil/SRR5476649_1.fastq.gz	refseq/bacteria/GCF_012927345.1/GCF_012927345.1_ASM1292734v1_genomic.fna.gz	1.4023	2.1975	95.28	0.213	94.83-95.65	0.213	0.18-0.25	1	1.534	1869/41356	90.49	NZ_JABBGJ010000001.1 Paraburkholderia polaris strain RP-4-7 contig1, whole genome shotgun sequence
soil/SRR5476649_1.fastq.gz	refseq/bacteria/GCF_000686725.1/GCF_000686725.1_ASM68672v1_genomic.fna.gz	1.2562	0.9339	96.67	0.191	96.13-97.10	0.191	0.16-0.23	1	1.100	1218/19484	91.45	NZ_KK366007.1 Clostridium akagii DSM 12554 BR66DRAFT_scaffold00001.1, whole genome shotgun sequence
sediment/SRR5468432_1.fastq.gz	refseq/bacteria/GCF_000972705.2/GCF_000972705.2_ASM97270v2_genomic.fna.gz	31.8674	43.2824	97.25	0.625	97.11-97.42	0.625	0.58-0.65	1	1.367	4705/23659	94.92	NZ_LATL02000001.1 Limnoraphis robusta CS-951 contig001, whole genome shotgun sequence
sediment/SRR5468432_1.fastq.gz	refseq/bacteria/GCF_000020465.1/GCF_000020465.1_ASM2046v1_genomic.fna.gz	18.3221	9.4013	96.84	0.359	96.45-97.27	0.359	0.31-0.41	1	1.196	1304/11393	93.25	NC_010803.1 Chlorobium limicola DSM 245, complete sequence
sediment/SRR5468432_1.fastq.gz	refseq/bacteria/GCF_003316845.1/GCF_003316845.1_ASM331684v1_genomic.fna.gz	12.4462	11.8733	97.16	0.244	96.69-97.54	0.244	0.21-0.28	1	1.135	2001/22053	92.55	NZ_QMIK01000011.1 Cognataquiflexum aquatile strain Z0201 Scaffold10_1, whole genome shotgun sequence
sediment/SRR5468432_1.fastq.gz	refseq/bacteria/GCF_006265165.1/GCF_006265165.1_ASM626516v1_genomic.fna.gz	9.2909	4.5078	98.55	0.182	98.04-99.01	0.182	0.16-0.21	1	1.143	1225/11252	93.10	NZ_VDCH01000010.1 Chlorobaculum thiosulfatiphilum strain DSM 249 NODE_10_length_79169_cov_14.2384, whole genome shotgun sequence
sediment/SRR5468432_1.fastq.gz	refseq/bacteria/GCF_003314435.2/GCF_003314435.2_ASM331443v2_genomic.fna.gz	9.2738	6.4380	96.96	0.182	96.31-97.49	0.182	0.15-0.22	1	1.093	1042/15946	91.58	NZ_QNVY02000001.1 Flavobacterium petrolei strain Kopri-42 1, whole genome shotgun sequence
sediment/SRR5468432_1.fastq.gz	refseq/bacteria/GCF_009649845.1/GCF_009649845.1_ASM964984v1_genomic.fna.gz	8.9866	17.9568	95.19	0.176	94.73-95.64	0.176	0.15-0.20	1	1.229	1684/46182	89.87	NZ_WJIE01000001.1 Polyangium spumosum strain DSM 14734 Scaffold1, whole genome shotgun sequence
sediment/SRR5468432_1.fastq.gz	refseq/bacteria/GCF_000015125.1/GCF_000015125.1_ASM1512v1_genomic.fna.gz	7.0723	4.1157	96.24	0.139	95.43-97.21	0.139	0.10-0.18	1	1.074	513/12718	90.16	NC_008639.1 Chlorobium phaeobacteroides DSM 266, complete sequence
sediment/SRR5468432_1.fastq.gz	refseq/bacteria/GCF_904423815.1/GCF_904423815.1_G1764_genomic.fna.gz	2.7406	2.4247	96.34	0.054	94.81-98.31	0.054	0.03-0.09	1	1.023	354/20563	87.72	NZ_CAJFZX010000001.1 Metabacillus idriensis strain DSM-37031, whole genome shotgun sequence
soil/SRR5585586_1.fastq.gz	refseq/bacteria/GCF_003062295.1/GCF_003062295.1_ASM306229v1_genomic.fna.gz	29.8853	36.8285	96.01	3.000	NA-NA	HIGH	NA-NA	3	4.125	10817/38225	96.01	NZ_PYCN01000099.1 Bradyrhizobium algeriense strain RST91 NODE_100_length_3566_cov_94.1788_ID_5792, whole genome shotgun sequence
soil/SRR5585586_1.fastq.gz	refseq/bacteria/GCF_009708035.1/GCF_009708035.1_ASM970803v1_genomic.fna.gz	11.5372	6.2377	96.56	1.158	96.43-96.67	1.158	1.08-1.23	2	2.331	4064/16943	95.50	NZ_WMBQ01000001.1 Hyphomicrobium album strain XQ2 xq_1, whole genome shotgun sequence
soil/SRR5585586_1.fastq.gz	refseq/bacteria/GCF_007992495.1/GCF_007992495.1_ASM799249v1_genomic.fna.gz	9.9233	13.5169	96.28	0.996	96.18-96.36	0.996	0.95-1.04	2	2.764	8498/42079	94.97	NZ_BKAJ01000001.1 Reyranella soli strain NBRC 108950 sequence001, whole genome shotgun sequence
soil/SRR5585586_1.fastq.gz	refseq/bacteria/GCF_004798725.1/GCF_004798725.1_ASM479872v1_genomic.fna.gz	6.8697	7.0464	95.84	0.690	95.72-95.98	0.690	0.65-0.72	1	1.631	4431/31918	93.83	NZ_CP039287.1 Cupriavidus necator H16 chromosome 1, complete sequence
soil/SRR5585586_1.fastq.gz	refseq/bacteria/GCF_001542405.1/GCF_001542405.1_ASM154240v1_genomic.fna.gz	6.7826	7.6001	96.67	0.681	96.53-96.79	0.681	0.65-0.72	1	1.516	5590/31541	94.57	NZ_LNCD01000001.1 Rhizobium altiplani strain BR 10423 contig1, whole genome shotgun sequence
soil/SRR5585586_1.fastq.gz	refseq/bacteria/GCF_004216665.1/GCF_004216665.1_ASM421666v1_genomic.fna.gz	6.7740	3.5969	96.70	0.680	96.47-96.95	0.680	0.61-0.74	1	1.793	3013/16549	94.65	NZ_SGWY01000001.1 Agromyces ramosus strain DSM 43045 Ga0310469_11, whole genome shotgun sequence
soil/SRR5585586_1.fastq.gz	refseq/bacteria/GCF_013752735.1/GCF_013752735.1_ASM1375273v1_genomic.fna.gz	6.3708	8.1315	95.62	0.640	95.49-95.80	0.640	0.59-0.67	1	1.797	4978/39440	93.54	NZ_CP058354.1 Bradyrhizobium japonicum strain 5038 chromosome, complete genome
soil/SRR5585586_1.fastq.gz	refseq/bacteria/GCF_016820515.1/GCF_016820515.1_ASM1682051v1_genomic.fna.gz	5.8530	3.4248	97.20	0.588	97.04-97.38	0.588	0.54-0.63	1	1.439	3498/18282	94.81	NZ_JADHDV010000001.1 Pseudoxanthomonas beigongshangi strain REN9 scaffold1, whole genome shotgun sequence
soil/SRR5585586_1.fastq.gz	refseq/bacteria/GCF_009935415.1/GCF_009935415.1_ASM993541v1_genomic.fna.gz	5.4906	4.2537	97.68	0.551	97.53-97.85	0.551	0.51-0.57	1	1.349	5028/24171	95.06	NZ_NKAQ01000001.1 Priestia megaterium strain 22-2 22-2_R1_(paired)_contig_1, whole genome shotgun sequence
soil/SRR5585586_1.fastq.gz	refseq/bacteria/GCF_016919345.1/GCF_016919345.1_ASM1691934v1_genomic.fna.gz	5.3091	4.7855	95.12	0.533	94.90-95.30	0.533	0.48-0.57	1	1.568	2585/27962	92.61	NZ_CP070349.1 Mycolicibacterium septicum strain PDNC012 chromosome
soil/SRR5585586_1.fastq.gz	refseq/bacteria/GCF_003010965.1/GCF_003010965.1_ASM301096v1_genomic.fna.gz	5.2045	4.5780	96.76	0.522	96.59-96.92	0.522	0.49-0.55	1	1.324	4139/27495	94.07	NZ_PGGM01000010.1 Phyllobacterium sophorae strain CCBAU 03422 NODE_10_length_232145_cov_44.9623, whole genome shotgun sequence
soil/SRR5679028_1.fastq.gz	refseq/bacteria/GCF_000786195.1/GCF_000786195.1_ASM78619v1_genomic.fna.gz	3.6277	2.7168	99.30	1.422	99.24-99.36	1.422	1.37-1.47	2	2.245	9943/16069	98.46	NZ_JSUH01000001.1 Kocuria polaris strain CMS 76or contig01, whole genome shotgun sequence
soil/SRR5679028_1.fastq.gz	refseq/bacteria/GCF_004785795.1/GCF_004785795.1_ASM478579v1_genomic.fna.gz	3.4308	3.3975	96.88	1.345	96.78-96.97	1.345	1.28-1.43	2	2.518	5919/20883	96.01	NZ_SRRO01000001.1 Nocardioides eburneiflavus strain MMS17-SY213 EXE59_contig1, whole genome shotgun sequence
soil/SRR5679028_1.fastq.gz	refseq/bacteria/GCF_029906185.1/GCF_029906185.1_ASM2990618v1_genomic.fna.gz	2.5282	1.8574	95.88	0.991	95.73-96.04	0.991	0.91-1.07	2	2.827	2913/16047	94.64	NZ_JARYGX010000005.1 Luteimonas composti strain CC-YY355 1665, whole genome shotgun sequence
