water/SRR5995680_1.fastq.gz	refseq/bacteria/GCF_002803295.2/GCF_002803295.2_ASM280329v2_genomic.fna.gz	6.3925	2.6035	96.43	0.116	95.10-98.39	0.116	0.06-0.17	1	1.044	203/5546	89.88	NZ_PGGB02000018.1 Caedibacter taeniospiralis strain 51K plasmid pKAP, whole genome shotgun sequence
water/SRR5995680_1.fastq.gz	refseq/bacteria/GCF_010499255.1/GCF_010499255.1_ASM1049925v1_genomic.fna.gz	5.2579	5.1519	96.15	0.095	94.98-97.42	0.095	0.06-0.14	1	1.081	381/13706	89.09	NZ_JAAGRN010000001.1 Sheuella amnicola strain NBD-18 contig00001, whole genome shotgun sequence
water/SRR5995680_1.fastq.gz	refseq/bacteria/GCF_004005965.1/GCF_004005965.1_ASM400596v1_genomic.fna.gz	4.8216	3.9936	95.55	0.087	94.21-97.36	0.087	0.05-0.13	1	1.037	244/11521	88.31	NZ_SACY01000010.1 Sandaracinomonas limnophila strain FSY-15 NODE_10_length, whole genome shotgun sequence
water/SRR5995680_1.fastq.gz	refseq/bacteria/GCF_029866485.1/GCF_029866485.1_ASM2986648v1_genomic.fna.gz	3.8074	2.9741	96.54	0.069	95.09-98.56	0.069	0.03-0.11	1	1.074	244/10617	88.54	NZ_CP092332.1 Flavobacterium keumense strain K3R-10 chromosome, complete genome
water/SRR5995680_1.fastq.gz	refseq/bacteria/GCF_001274785.1/GCF_001274785.1_ASM127478v1_genomic.fna.gz	1.9717	2.9262	95.44	0.036	93.14-95.87	0.036	0.03-0.07	1	1.095	179/20810	85.78	NZ_LHPI01000001.1 Vibrio hepatarius strain DSM 19134 contig0001, whole genome shotgun sequence
water/SRR9030901_1.fastq.gz	refseq/bacteria/GCF_900111775.1/GCF_900111775.1_ASM90011177v1_genomic.fna.gz	33.9494	40.0180	98.88	11.000	NA-NA	HIGH	NA-NA	11	12.001	11077/15710	98.88	NZ_FOJJ01000041.1 Desulfuromonas acetexigens isolate DSM 1397, whole genome shotgun sequence
water/SRR9030901_1.fastq.gz	refseq/archaea/GCF_000430905.1/GCF_000430905.1_ASM43090v1_genomic.fna.gz	21.6042	11.8011	99.66	7.000	NA-NA	HIGH	NA-NA	7	7.088	6555/7293	99.66	NZ_AUMX01000001.1 Methanocorpusculum bavaricum DSM 4179 H575DRAFT_scaffold00001.1_C, whole genome shotgun sequence
water/SRR9030901_1.fastq.gz	refseq/bacteria/GCF_002837135.1/GCF_002837135.1_ASM283713v1_genomic.fna.gz	5.0667	4.3774	99.12	1.642	99.06-99.20	1.642	1.54-1.70	2	2.567	7119/11471	98.47	NZ_NWBQ01000001.1 Macromonas bipunctata strain DSM 12705 DSM12705_1_(paired)_trimmed_(paired)_contig_1, whole genome shotgun sequence
water/SRR9030901_1.fastq.gz	refseq/bacteria/GCF_900115715.1/GCF_900115715.1_IMG-taxon_2663762798_annotated_assembly_genomic.fna.gz	2.8308	4.1743	96.69	0.917	96.57-96.84	0.917	0.85-0.97	1	1.743	4190/19344	95.19	NZ_FOXM01000043.1 Pseudomonas sagittaria strain JCM 18195, whole genome shotgun sequence
water/SRR9030901_1.fastq.gz	refseq/bacteria/GCF_028596105.1/GCF_028596105.1_ASM2859610v1_genomic.fna.gz	2.7944	4.2309	97.25	0.905	97.11-97.40	0.905	0.84-0.96	1	1.738	4978/19430	95.70	NZ_CP117193.1 Acidovorax temperans strain LMJ chromosome, complete genome
water/SRR9030901_1.fastq.gz	refseq/bacteria/GCF_003568725.2/GCF_003568725.2_ASM356872v2_genomic.fna.gz	2.6959	3.2403	99.07	0.873	98.94-99.17	0.873	0.83-0.92	1	1.648	7176/16198	97.41	NZ_QXNC01000001.1 Simplicispira metamorpha strain NBRC 13960 Scaffold1, whole genome shotgun sequence
water/SRR9030901_1.fastq.gz	refseq/bacteria/GCF_000023225.1/GCF_000023225.1_ASM2322v1_genomic.fna.gz	2.5863	3.2634	97.08	0.838	96.93-97.24	0.838	0.77-0.89	1	2.000	4000/17086	95.42	NC_013173.1 Desulfomicrobium baculatum DSM 4028, complete sequence
water/SRR9030901_1.fastq.gz	refseq/bacteria/GCF_003063245.1/GCF_003063245.1_ASM306324v1_genomic.fna.gz	2.4803	1.9172	96.35	0.804	96.11-96.56	0.804	0.72-0.88	1	1.993	1842/10265	94.61	NZ_MUXE01000010.1 Arcobacter caeni strain RW17-10 NODE_10_length_92888_cov_40.4833_ID_2067, whole genome shotgun sequence
water/SRR9030901_1.fastq.gz	refseq/bacteria/GCF_000190435.1/GCF_000190435.1_ASM19043v1_genomic.fna.gz	2.1107	2.2404	99.34	0.684	99.23-99.48	0.684	0.64-0.72	1	1.437	5797/14078	97.18	NC_015152.1 Sphaerochaeta globosa str. Buddy, complete sequence
water/SRR9030901_1.fastq.gz	refseq/bacteria/GCF_000421765.1/GCF_000421765.1_ASM42176v1_genomic.fna.gz	2.1037	2.0349	96.75	0.682	96.55-96.98	0.682	0.61-0.74	1	1.708	2370/13093	94.64	NZ_ATXQ01000001.1 Denitrificimonas caeni DSM 24390 H591DRAFT_scaffold00001.1_C, whole genome shotgun sequence
water/SRR9030901_1.fastq.gz	refseq/bacteria/GCF_900207575.1/GCF_900207575.1_IMG-taxon_2740891861_annotated_assembly_genomic.fna.gz	1.8880	2.2998	99.32	0.612	99.20-99.46	0.612	0.57-0.64	1	1.368	6189/16423	96.90	NZ_OAOQ01000061.1 Cereibacter ovatus strain JA234, whole genome shotgun sequence
water/SRR9030901_1.fastq.gz	refseq/bacteria/GCF_000835165.1/GCF_000835165.1_ASM83516v1_genomic.fna.gz	1.7580	1.5355	98.63	0.570	98.46-98.82	0.570	0.52-0.61	1	1.316	3389/11770	96.06	NZ_CP007790.1 Corynebacterium marinum DSM 44953 chromosome, complete genome
water/SRR9030901_1.fastq.gz	refseq/bacteria/GCF_003544815.1/GCF_003544815.1_ASM354481v1_genomic.fna.gz	1.7125	1.4465	95.06	0.555	94.70-95.43	0.555	0.48-0.62	1	1.697	983/10918	92.53	NZ_CP032100.1 Arcobacter suis CECT 7833 chromosome, complete genome
water/SRR9030901_1.fastq.gz	refseq/bacteria/GCF_900106925.1/GCF_900106925.1_IMG-taxon_2684622843_annotated_assembly_genomic.fna.gz	1.5169	2.6149	98.58	0.492	98.42-98.75	0.492	0.46-0.52	2	1.321	8197/23188	96.70	NZ_FNNZ01000080.1 Thiocapsa roseopersicina strain DSM 217, whole genome shotgun sequence
water/SRR9030901_1.fastq.gz	refseq/archaea/GCF_000328665.1/GCF_000328665.1_ASM32866v1_genomic.fna.gz	1.4770	1.2829	97.49	0.479	97.24-97.72	0.479	0.44-0.51	1	1.257	2007/11397	94.55	NC_019977.1 Methanomethylovorans hollandica DSM 15978, complete sequence
water/SRR9030901_1.fastq.gz	refseq/bacteria/GCF_004363195.1/GCF_004363195.1_ASM436319v1_genomic.fna.gz	1.3485	1.4105	98.88	0.437	98.73-99.09	0.437	0.40-0.46	1	1.255	3558/13968	95.68	NZ_SNYP01000001.1 Phaeovulum veldkampii DSM 11550 Ga0310482_101, whole genome shotgun sequence
water/SRR9030901_1.fastq.gz	refseq/bacteria/GCF_904846345.1/GCF_904846345.1_ASM90484634v1_genomic.fna.gz	1.1887	1.2083	97.91	0.385	97.68-98.13	0.385	0.35-0.41	1	1.266	2319/13706	94.43	NZ_CAJHAJ010000001.1 Psychrobacter maritimus isolate Psychrobacter maritimus Pi2-25, whole genome shotgun sequence
water/SRR9030901_1.fastq.gz	refseq/bacteria/GCF_000012965.1/GCF_000012965.1_ASM1296v1_genomic.fna.gz	1.1385	0.8022	97.88	0.369	97.62-98.22	0.369	0.32-0.40	1	1.263	1512/9337	94.30	NC_007575.1 Sulfurimonas denitrificans DSM 1251, complete sequence
water/SRR9030901_1.fastq.gz	refseq/bacteria/GCF_003660105.1/GCF_003660105.1_ASM366010v1_genomic.fna.gz	1.1019	0.7435	96.51	0.357	96.10-96.93	0.357	0.31-0.40	1	1.379	924/9032	92.91	NZ_CP032823.1 Aliarcobacter cryaerophilus ATCC 43158 chromosome, complete genome
water/SRR9030901_1.fastq.gz	refseq/bacteria/GCF_024499545.1/GCF_024499545.1_ASM2449954v1_genomic.fna.gz	1.0310	0.8787	97.94	0.334	97.63-98.29	0.334	0.29-0.36	1	1.207	1659/10911	94.10	NZ_CP071251.1 Turicibacter bilis strain PIG517 chromosome, complete genome
water/SRR9030901_1.fastq.gz	refseq/bacteria/GCF_004342175.1/GCF_004342175.1_ASM434217v1_genomic.fna.gz	0.9084	1.1842	97.29	0.294	96.93-97.58	0.294	0.27-0.33	1	1.158	2006/17600	93.23	NZ_SMAO01000001.1 Thiobaca trueperi strain DSM 13587 Ga0244666_101, whole genome shotgun sequence
water/SRR9030901_1.fastq.gz	refseq/bacteria/GCF_022869165.1/GCF_022869165.1_ASM2286916v1_genomic.fna.gz	0.7264	0.8264	98.60	0.235	98.23-98.96	0.235	0.20-0.26	1	1.204	2124/14980	93.89	NZ_CP094929.1 Sphaerochaeta associata strain GLS2T chromosome, complete genome
water/SRR9030901_1.fastq.gz	refseq/bacteria/GCF_904846155.1/GCF_904846155.1_ASM90484615v1_genomic.fna.gz	0.7140	0.7920	97.14	0.231	96.62-97.55	0.231	0.20-0.26	1	1.149	1265/14353	92.46	NZ_CAJGZP010000001.1 Psychrobacter fulvigenes isolate Psychrobacter fulvigenes KC-40, whole genome shotgun sequence
water/SRR9030901_1.fastq.gz	refseq/bacteria/GCF_020783375.1/GCF_020783375.1_ASM2078337v1_genomic.fna.gz	0.6701	0.9579	96.88	0.217	96.33-97.31	0.217	0.18-0.26	1	1.199	1462/19547	91.98	NZ_CP086067.1 Stutzerimonas chloritidismutans strain 6L11 chromosome, complete genome
water/SRR9030901_1.fastq.gz	refseq/bacteria/GCF_000272005.1/GCF_000272005.1_ASM27200v1_genomic.fna.gz	0.5611	0.6271	96.06	0.182	95.48-96.70	0.182	0.14-0.22	1	1.099	729/14895	90.73	NZ_AKKU01000001.1 Alishewanella agri BL06 contig001, whole genome shotgun sequence
water/SRR9030901_1.fastq.gz	refseq/archaea/GCF_000204415.1/GCF_000204415.1_ASM20441v1_genomic.fna.gz	0.5595	0.5420	98.16	0.181	97.74-98.63	0.181	0.15-0.21	1	1.111	1159/12153	92.70	NC_015416.1 Methanothrix soehngenii GP6, complete sequence
water/SRR9030901_1.fastq.gz	refseq/bacteria/GCF_003641245.1/GCF_003641245.1_ASM364124v1_genomic.fna.gz	0.5121	0.4489	97.22	0.166	96.53-97.83	0.166	0.14-0.21	1	1.114	760/11583	91.59	NZ_CP032788.1 Corynebacterium xerosis strain GS 1 chromosome, complete genome
water/SRR9030901_1.fastq.gz	refseq/bacteria/GCF_000368805.1/GCF_000368805.1_Acin_john_ANC_3681_V1_genomic.fna.gz	0.4625	0.5241	96.65	0.150	95.94-97.35	0.150	0.12-0.19	1	1.072	750/15127	90.76	NZ_KB849702.1 Acinetobacter johnsonii ANC 3681 acLro-supercont1.1, whole genome shotgun sequence
water/SRR9030901_1.fastq.gz	refseq/bacteria/GCF_006539865.1/GCF_006539865.1_ASM653986v1_genomic.fna.gz	0.3882	0.5723	96.19	0.126	95.36-97.04	0.126	0.09-0.16	1	1.111	856/19894	90.35	NZ_BJNV01000001.1 Zoogloea ramigera strain NBRC 15342 sequence001, whole genome shotgun sequence
water/SRR9030901_1.fastq.gz	refseq/bacteria/GCF_000423525.1/GCF_000423525.1_ASM42352v1_genomic.fna.gz	0.3429	0.2646	95.49	0.111	94.26-97.02	0.111	0.07-0.16	1	1.059	270/10416	88.88	NZ_AUID01000001.1 Proteocatella sphenisci DSM 23131 G558DRAFT_scaffold00001.1_C, whole genome shotgun sequence
water/SRR9030901_1.fastq.gz	refseq/archaea/GCF_000007065.1/GCF_000007065.1_ASM706v1_genomic.fna.gz	0.3362	0.4407	97.88	0.109	97.04-98.50	0.109	0.09-0.14	1	1.076	921/16933	91.04	NC_003901.1 Methanosarcina mazei Go1, complete sequence
water/SRR9030901_1.fastq.gz	refseq/bacteria/GCF_009695865.1/GCF_009695865.1_ASM969586v1_genomic.fna.gz	0.3165	0.2046	96.15	0.103	94.80-97.47	0.103	0.06-0.15	1	1.041	268/8565	89.43	NZ_VUNB01000001.1 Baileyella intestinalis strain RF-744-FAT-WT-3 seq1, whole genome shotgun sequence
water/SRR9030901_1.fastq.gz	refseq/archaea/GCF_029007355.1/GCF_029007355.1_ASM2900735v1_genomic.fna.gz	0.2912	0.1836	96.00	0.094	94.54-98.02	0.094	0.05-0.15	1	1.040	223/8547	88.90	NZ_JAQXHQ010000001.1 MAG: Methanobrevibacter boviskoreani isolate SUG2185 k141_3078662, whole genome shotgun sequence
water/SRR9030901_1.fastq.gz	refseq/bacteria/GCF_900110375.1/GCF_900110375.1_IMG-taxon_2619618873_annotated_assembly_genomic.fna.gz	0.2627	0.2960	95.90	0.085	94.75-97.32	0.085	0.05-0.12	1	1.049	349/15187	88.54	NZ_FODN01000019.1 Flavobacterium sinopsychrotolerans strain CGMCC 1.8704, whole genome shotgun sequence
water/SRR9030901_1.fastq.gz	refseq/bacteria/GCF_900113055.1/GCF_900113055.1_IMG-taxon_2622736429_annotated_assembly_genomic.fna.gz	0.2462	0.2285	96.90	0.080	95.62-98.15	0.080	0.05-0.12	1	1.124	380/12681	89.30	NZ_FONZ01000009.1 Flavimobilis marinus strain DSM 19083, whole genome shotgun sequence
water/SRR9030901_1.fastq.gz	refseq/bacteria/GCF_025660415.1/GCF_025660415.1_ASM2566041v1_genomic.fna.gz	0.2205	0.2310	95.02	0.071	93.29-96.99	0.071	0.03-0.12	1	1.019	206/14056	87.26	NZ_JAOUSE010000001.1 Caldibacillus thermolactis strain DSM 23332 DSM23332_1, whole genome shotgun sequence
water/SRR9030901_1.fastq.gz	refseq/bacteria/GCF_028355655.1/GCF_028355655.1_ASM2835565v1_genomic.fna.gz	0.0980	0.1554	96.10	0.032	93.02-96.47	0.032	0.03-0.07	1	1.071	198/21039	86.03	NZ_CP110645.1 Aeromonas salmonicida strain AS3 chromosome, complete genome
sludge/SRR6007447_1.fastq.gz	refseq/bacteria/GCF_000233695.2/GCF_000233695.2_ASM23369v3_genomic.fna.gz	54.1428	60.3384	98.36	63.000	NA-NA	HIGH	NA-NA	63	55.408	9794/16328	98.36	NZ_CM001488.1 Desulfobacter postgatei 2ac9 chromosome, whole genome shotgun sequence
sludge/SRR6007447_1.fastq.gz	refseq/bacteria/GCF_900101955.1/GCF_900101955.1_IMG-taxon_2602042025_annotated_assembly_genomic.fna.gz	28.3605	22.1854	98.76	33.000	NA-NA	HIGH	NA-NA	33	31.984	8161/12029	98.76	NZ_FNAQ01000039.1 Desulfuromonas thiophila strain DSM 8987, whole genome shotgun sequence
sludge/SRR6007447_1.fastq.gz	refseq/bacteria/GCF_000147715.2/GCF_000147715.2_ASM14771v3_genomic.fna.gz	6.8753	5.7368	99.33	8.000	NA-NA	HIGH	NA-NA	8	7.964	9483/11694	99.33	NC_017934.1 Mesotoga prima MesG1.Ag.4.2, complete sequence
sludge/SRR6007447_1.fastq.gz	refseq/bacteria/GCF_900111775.1/GCF_900111775.1_ASM90011177v1_genomic.fna.gz	3.4376	3.5500	99.26	4.000	NA-NA	HIGH	NA-NA	4	4.788	12484/15710	99.26	NZ_FOJJ01000041.1 Desulfuromonas acetexigens isolate DSM 1397, whole genome shotgun sequence
sludge/SRR6007447_1.fastq.gz	refseq/bacteria/GCF_001192835.1/GCF_001192835.1_ASM119283v1_genomic.fna.gz	0.9745	1.2334	97.23	1.134	97.12-97.32	1.134	1.08-1.19	2	1.979	5468/19005	96.06	NZ_DF968182.1 Lentimicrobium saccharophilum strain TBC1, whole genome shotgun sequence
sludge/SRR6007447_1.fastq.gz	refseq/bacteria/GCF_900167465.1/GCF_900167465.1_IMG-taxon_2585428117_annotated_assembly_genomic.fna.gz	0.7764	0.7774	95.08	0.903	94.89-95.28	0.903	0.82-0.98	2	3.114	2013/15420	93.64	NZ_FUWR01000042.1 Trichlorobacter thiogenes strain ATCC BAA-34, whole genome shotgun sequence
sludge/SRR6007447_1.fastq.gz	refseq/bacteria/GCF_018336855.1/GCF_018336855.1_ASM1833685v1_genomic.fna.gz	0.4553	0.4390	97.64	0.530	97.49-97.87	0.530	0.49-0.56	1	1.277	2899/14499	94.94	NZ_CP059558.1 Acinetobacter junii strain YR7 chromosome, complete genome
sludge/SRR6007447_1.fastq.gz	refseq/bacteria/GCF_004028015.1/GCF_004028015.1_ASM402801v1_genomic.fna.gz	0.4344	0.6190	97.34	0.505	97.23-97.53	0.505	0.47-0.53	1	1.280	3857/21994	94.54	NZ_CP034181.1 Mycobacteroides abscessus strain GZ002 chromosome, complete genome
sludge/SRR6007447_1.fastq.gz	refseq/bacteria/GCF_001306035.1/GCF_001306035.1_ASM130603v1_genomic.fna.gz	0.4037	0.4789	99.12	0.470	98.96-99.32	0.470	0.43-0.50	1	1.397	5059/17143	96.14	NZ_LGCM01000065.1 Levilinea saccharolytica strain KIBI-1 contig_1, whole genome shotgun sequence
sludge/SRR6007447_1.fastq.gz	refseq/bacteria/GCF_000310225.1/GCF_000310225.1_ASM31022v1_genomic.fna.gz	0.3871	0.5451	95.75	0.450	95.43-96.00	0.450	0.40-0.49	1	1.457	2056/20784	92.81	NZ_AMXF01000001.1 Thauera phenylacetica B4P Cont1, whole genome shotgun sequence
sludge/SRR6007447_1.fastq.gz	refseq/bacteria/GCF_028550395.1/GCF_028550395.1_ASM2855039v1_genomic.fna.gz	0.3580	0.4036	97.97	0.417	97.78-98.24	0.417	0.38-0.44	1	1.235	3191/17367	94.68	NZ_JAQQKW010000001.1 Asticcacaulis currens strain DXS10W DXS10W_ctg01, whole genome shotgun sequence
sludge/SRR6007447_1.fastq.gz	refseq/bacteria/GCF_018853465.1/GCF_018853465.1_ASM1885346v1_genomic.fna.gz	0.3560	0.2828	96.68	0.414	96.37-97.02	0.414	0.37-0.45	1	1.242	1453/11940	93.43	NZ_JABBOU010000001.1 Acidithiobacillus montserratensis strain GG1-14 Contig1, whole genome shotgun sequence
sludge/SRR6007447_1.fastq.gz	refseq/bacteria/GCF_012927165.1/GCF_012927165.1_ASM1292716v1_genomic.fna.gz	0.3385	0.5534	98.42	0.394	98.26-98.61	0.394	0.36-0.42	1	1.540	5162/25001	95.04	NZ_JABBGA010000001.1 Zoogloea dura strain G-4-1-14 contig1, whole genome shotgun sequence
sludge/SRR6007447_1.fastq.gz	refseq/bacteria/GCF_002245655.1/GCF_002245655.1_ASM224565v1_genomic.fna.gz	0.2250	0.2479	96.12	0.262	95.66-96.58	0.262	0.22-0.30	1	1.480	1240/17122	91.88	NZ_NOIH01000001.1 Thauera propionica strain KNDSS-Mac4 contig_1, whole genome shotgun sequence
sludge/SRR6007447_1.fastq.gz	refseq/archaea/GCF_000328665.1/GCF_000328665.1_ASM32866v1_genomic.fna.gz	0.2244	0.1708	97.46	0.261	96.94-97.96	0.261	0.21-0.31	1	2.201	1410/11397	93.48	NC_019977.1 Methanomethylovorans hollandica DSM 15978, complete sequence
sludge/SRR6007447_1.fastq.gz	refseq/bacteria/GCF_000236665.1/GCF_000236665.1_ASM23666v1_genomic.fna.gz	0.1673	0.1786	97.62	0.195	97.08-98.05	0.195	0.17-0.23	1	1.213	1447/16159	92.51	NC_016616.1 Azospira oryzae PS, complete sequence
sludge/SRR6007447_1.fastq.gz	refseq/bacteria/GCF_000022305.1/GCF_000022305.1_ASM2230v1_genomic.fna.gz	0.1338	0.1424	97.59	0.156	96.89-98.15	0.156	0.13-0.19	1	1.243	1145/16377	91.78	NC_011992.1 [Acidovorax] ebreus TPSY, complete sequence
sludge/SRR6007447_1.fastq.gz	refseq/bacteria/GCF_000237205.1/GCF_000237205.1_ASM23720v1_genomic.fna.gz	0.1324	0.0975	98.27	0.154	97.66-98.83	0.154	0.13-0.19	1	1.082	958/11266	92.36	NC_015713.1 Simkania negevensis Z chromosome gsn.131, complete sequence
sludge/SRR6007447_1.fastq.gz	refseq/bacteria/GCF_000253115.1/GCF_000253115.1_ASM25311v1_genomic.fna.gz	0.1219	0.1293	95.96	0.142	95.25-96.78	0.142	0.11-0.18	1	1.138	595/15675	89.99	NC_014145.1 Thiomonas arsenitoxydans, complete sequence
sludge/SRR6007447_1.fastq.gz	refseq/bacteria/GCF_019704535.1/GCF_019704535.1_ASM1970453v1_genomic.fna.gz	0.1189	0.1515	98.78	0.138	98.25-99.27	0.138	0.11-0.16	1	1.116	1760/19356	92.56	NZ_AP024722.1 Stutzerimonas stutzeri strain F2a chromosome, complete genome
sludge/SRR6007447_1.fastq.gz	refseq/bacteria/GCF_001293685.1/GCF_001293685.1_ASM129368v1_genomic.fna.gz	0.1181	0.1858	96.45	0.137	95.59-97.03	0.137	0.11-0.18	1	1.349	1153/23987	90.67	NZ_BCAG01000001.1 Desulfatitalea tepidiphila strain S28bF, whole genome shotgun sequence
sludge/SRR6007447_1.fastq.gz	refseq/bacteria/GCF_001597285.1/GCF_001597285.1_ASM159728v1_genomic.fna.gz	0.1089	0.1346	95.79	0.127	94.96-96.63	0.127	0.09-0.16	1	1.085	624/19115	89.55	NZ_CP014784.1 Pseudomonas alcaligenes strain NEB 585 chromosome, complete genome
sludge/SRR6007447_1.fastq.gz	refseq/bacteria/GCF_014397415.1/GCF_014397415.1_ASM1439741v1_genomic.fna.gz	0.1011	0.1125	96.39	0.118	95.51-97.22	0.118	0.09-0.16	1	0.892	854/17062	90.79	NZ_CP060731.1 Pseudoxanthomonas mexicana strain GTZY2 chromosome, complete genome
sludge/SRR6007447_1.fastq.gz	refseq/bacteria/GCF_003860565.1/GCF_003860565.1_ASM386056v1_genomic.fna.gz	0.1003	0.0776	96.23	0.117	95.23-97.51	0.117	0.07-0.16	1	1.072	404/11754	89.70	NZ_CP034157.1 Cloacibacterium normanense strain NRS-1 chromosome, complete genome
sludge/SRR6007447_1.fastq.gz	refseq/bacteria/GCF_000422285.1/GCF_000422285.1_ASM42228v1_genomic.fna.gz	0.0993	0.1300	96.12	0.116	95.25-97.16	0.116	0.08-0.15	1	1.248	763/20210	89.97	NZ_AULM01000001.1 Desulfatiglans anilini DSM 4660 H567DRAFT_scaffold00001.1_C, whole genome shotgun sequence
sludge/SRR6007447_1.fastq.gz	refseq/bacteria/GCF_011682075.1/GCF_011682075.1_ASM1168207v1_genomic.fna.gz	0.0983	0.1168	98.89	0.114	98.28-99.49	0.114	0.09-0.13	1	1.100	1418/18045	92.12	NZ_VSMK01000111.1 Cupidesulfovibrio liaohensis strain XJ01 NODE_1, whole genome shotgun sequence
sludge/SRR6007447_1.fastq.gz	refseq/bacteria/GCF_022869165.1/GCF_022869165.1_ASM2286916v1_genomic.fna.gz	0.0913	0.0910	96.97	0.106	96.05-97.98	0.106	0.07-0.14	1	1.047	597/14980	90.13	NZ_CP094929.1 Sphaerochaeta associata strain GLS2T chromosome, complete genome
sludge/SRR6007447_1.fastq.gz	refseq/bacteria/GCF_025742995.1/GCF_025742995.1_ASM2574299v1_genomic.fna.gz	0.0911	0.0479	96.60	0.106	95.19-98.01	0.106	0.07-0.17	1	1.030	296/7980	89.92	NZ_JAOVQM010000001.1 Paracholeplasma manati strain Oakley NODE_1_length_461962_cov_280.188769, whole genome shotgun sequence
sludge/SRR6007447_1.fastq.gz	refseq/bacteria/GCF_005144965.1/GCF_005144965.1_ASM514496v1_genomic.fna.gz	0.0873	0.0706	97.84	0.102	96.95-98.66	0.102	0.08-0.13	1	1.130	594/11761	90.82	NZ_CP039704.1 Hankyongella ginsenosidimutans strain W1-2-3 chromosome, complete genome
sludge/SRR6007447_1.fastq.gz	refseq/bacteria/GCF_003226565.1/GCF_003226565.1_ASM322656v1_genomic.fna.gz	0.0820	0.1150	96.66	0.095	95.80-97.81	0.095	0.06-0.12	1	1.236	709/21357	89.60	NZ_QKOE01000099.1 Parazoarcus communis SWub3 = DSM 12120 strain SWub3 NODE_100_length_579_cov_135.741150, whole genome shotgun sequence
sludge/SRR6007447_1.fastq.gz	refseq/bacteria/GCF_003024515.2/GCF_003024515.2_ASM302451v2_genomic.fna.gz	0.0808	0.1058	96.14	0.094	95.21-97.70	0.094	0.06-0.13	1	1.246	561/20082	89.10	NZ_PYIX02000001.1 Acinetobacter sichuanensis strain WCHAc060041 1, whole genome shotgun sequence
sludge/SRR6007447_1.fastq.gz	refseq/bacteria/GCF_006740045.1/GCF_006740045.1_ASM674004v1_genomic.fna.gz	0.0805	0.1054	98.46	0.094	97.67-99.25	0.094	0.07-0.12	1	1.049	1132/19881	91.17	NZ_AP019749.1 Comamonas terrigena NBRC 13299 chromosome, complete genome
sludge/SRR6007447_1.fastq.gz	refseq/bacteria/GCF_900116825.1/GCF_900116825.1_IMG-taxon_2634166357_annotated_assembly_genomic.fna.gz	0.0781	0.0910	95.69	0.091	94.56-97.20	0.091	0.05-0.13	1	1.160	450/17546	88.85	NZ_FPBX01000115.1 Paenacidovorax caeni strain R-24608, whole genome shotgun sequence
sludge/SRR6007447_1.fastq.gz	refseq/bacteria/GCF_900445995.1/GCF_900445995.1_48290_B02_genomic.fna.gz	0.0673	0.0649	95.76	0.078	94.29-97.75	0.078	0.04-0.12	1	1.027	295/14540	88.19	NZ_UIGE01000002.1 Brevundimonas diminuta strain NCTC8545, whole genome shotgun sequence
sludge/SRR6007447_1.fastq.gz	refseq/bacteria/GCF_014109845.1/GCF_014109845.1_ASM1410984v1_genomic.fna.gz	0.0655	0.0707	96.22	0.076	94.82-97.78	0.076	0.04-0.12	1	1.080	413/16288	88.82	NZ_CP043567.1 Stenotrophomonas acidaminiphila strain T0-18 chromosome, complete genome
sludge/SRR6007447_1.fastq.gz	refseq/bacteria/GCF_000367525.1/GCF_000367525.1_ASM36752v2_genomic.fna.gz	0.0613	0.0545	97.92	0.071	96.73-99.43	0.071	0.04-0.11	1	1.038	502/13569	89.91	NZ_HF570956.1 Phycicoccus elongatus Lp2, whole genome shotgun sequence
sludge/SRR6007447_1.fastq.gz	refseq/bacteria/GCF_024362265.1/GCF_024362265.1_ASM2436226v1_genomic.fna.gz	0.0544	0.0566	97.06	0.063	95.71-98.81	0.063	0.03-0.10	1	0.966	417/15718	88.95	NZ_CP101471.1 Microbacterium liquefaciens strain DND4 chromosome, complete genome
sludge/SRR6007447_1.fastq.gz	refseq/bacteria/GCF_904830995.1/GCF_904830995.1_G1452_genomic.fna.gz	0.0428	0.0394	96.29	0.050	94.37-97.87	0.050	0.03-0.08	1	1.247	223/14331	87.43	NZ_CAJGVD010000001.1 Brevundimonas aurantiaca strain Marseille-P3291, whole genome shotgun sequence
sludge/SRR6007447_1.fastq.gz	refseq/bacteria/GCF_009662475.1/GCF_009662475.1_ASM966247v1_genomic.fna.gz	0.0418	0.0401	98.57	0.049	97.12-100.71	0.049	0.02-0.08	1	1.058	428/13693	89.42	NZ_CP045571.1 Acidithiobacillus thiooxidans ATCC 19377 chromosome, complete genome
sludge/SRR6007447_1.fastq.gz	refseq/bacteria/GCF_900168155.1/GCF_900168155.1_IMG-taxon_2595698220_annotated_assembly_genomic.fna.gz	0.0262	0.0287	97.04	0.030	94.59-97.39	0.030	0.03-0.06	1	1.025	203/16648	86.75	NZ_FUYQ01000044.1 Parabacteroides chartae strain DSM 24967, whole genome shotgun sequence
sludge/SRR9276153_1.fastq.gz	refseq/bacteria/GCF_900289045.1/GCF_900289045.1_MPGL2_genomic.fna.gz	21.9766	18.6950	99.46	7.000	NA-NA	HIGH	NA-NA	7	7.908	13716/16216	99.46	NZ_LT985188.1 Micropruina glycogenica isolate 1 chromosome 1, complete sequence
sludge/SRR9276153_1.fastq.gz	refseq/bacteria/GCF_012939995.1/GCF_012939995.1_ASM1293999v1_genomic.fna.gz	21.9766	21.3255	99.12	7.000	NA-NA	HIGH	NA-NA	7	7.482	14048/18451	99.12	NZ_SPMZ01000001.1 Candidatus Competibacter phosphatis strain SBR_G GAO5_binned_c1, whole genome shotgun sequence
sludge/SRR9276153_1.fastq.gz	refseq/bacteria/GCF_004011805.1/GCF_004011805.1_ASM401180v1_genomic.fna.gz	15.6975	24.6102	98.88	5.000	NA-NA	HIGH	NA-NA	5	5.877	21451/30462	98.88	NZ_ML137196.1 Piscinibacter defluvii strain SH-1 CL100079052_L01_505.Scaf1, whole genome shotgun sequence
sludge/SRR9276153_1.fastq.gz	refseq/bacteria/GCF_020084865.1/GCF_020084865.1_ASM2008486v1_genomic.fna.gz	6.0729	3.7841	98.26	1.934	98.14-98.34	1.934	1.82-2.15	2	2.736	5975/11937	97.79	NZ_CP071953.1 Candidatus Kaistella beijingensis strain PM-38 chromosome, complete genome
sludge/SRR9276153_1.fastq.gz	refseq/bacteria/GCF_000310185.1/GCF_000310185.1_ASM31018v1_genomic.fna.gz	3.8589	3.6550	99.19	1.229	99.12-99.27	1.229	1.18-1.27	2	2.347	10083/18026	98.14	NZ_AMXD01000001.1 Thauera aminoaromatica S2 Cont1, whole genome shotgun sequence
sludge/SRR9276153_1.fastq.gz	refseq/bacteria/GCF_009746125.1/GCF_009746125.1_ASM974612v1_genomic.fna.gz	3.4837	3.4424	98.66	1.110	98.57-98.74	1.110	1.05-1.16	2	1.978	8465/18914	97.44	NZ_CP041352.1 Casimicrobium huifangae strain SJ-1 chromosome, complete genome
sludge/SRR9276153_1.fastq.gz	refseq/bacteria/GCF_000024365.1/GCF_000024365.1_ASM2436v1_genomic.fna.gz	3.3324	4.4684	98.55	1.061	98.48-98.62	1.061	1.02-1.10	2	2.125	10425/24692	97.26	NC_013235.1 Nakamurella multipartita DSM 44233, complete sequence
sludge/SRR9276153_1.fastq.gz	refseq/bacteria/GCF_905220995.1/GCF_905220995.1_NSPZN2_genomic.fna.gz	3.3242	3.5600	96.18	1.059	96.04-96.32	1.059	0.98-1.14	2	2.530	4243/20838	95.00	NZ_CAJNBJ010000001.1 Nitrospira defluvii isolate Candidatus Nitrospira sp. ZN2, whole genome shotgun sequence
sludge/SRR9276153_1.fastq.gz	refseq/bacteria/GCF_028201335.1/GCF_028201335.1_ASM2820133v1_genomic.fna.gz	3.3152	2.1189	97.93	1.056	97.80-98.04	1.056	1.00-1.11	2	2.083	4320/12440	96.65	NZ_JAPEVV010000001.1 Thermomonas mangrovi strain 2C3345 C3345_ctg01, whole genome shotgun sequence
sludge/SRR9276153_1.fastq.gz	refseq/bacteria/GCF_020034655.1/GCF_020034655.1_ASM2003465v1_genomic.fna.gz	3.1466	1.9394	98.72	1.002	98.58-98.82	1.002	0.95-1.06	1	1.861	5115/11836	97.33	NZ_JAIQDJ010000001.1 Thermomonas beijingensis strain RSS-23 RSS23_ctg001, whole genome shotgun sequence
sludge/SRR9276153_1.fastq.gz	refseq/bacteria/GCF_002374275.1/GCF_002374275.1_ASM237427v1_genomic.fna.gz	2.3826	1.8825	95.86	0.759	95.65-96.07	0.759	0.69-0.81	1	1.547	2269/15500	93.99	NZ_NWUR01000001.1 Sphingopyxis terrae subsp. ummariensis strain DSM 24316 contig1, whole genome shotgun sequence
sludge/SRR9276153_1.fastq.gz	refseq/bacteria/GCF_017161445.1/GCF_017161445.1_ASM1716144v1_genomic.fna.gz	2.1633	2.3236	96.15	0.689	95.97-96.32	0.689	0.63-0.74	1	1.546	3154/20848	94.09	NZ_CP071060.1 Niveibacterium microcysteis strain HC41 chromosome, complete genome
sludge/SRR9276153_1.fastq.gz	refseq/bacteria/GCF_000519045.1/GCF_000519045.1_ASM51904v1_genomic.fna.gz	2.0169	1.6187	95.01	0.642	94.73-95.25	0.642	0.57-0.71	1	2.094	1610/15580	92.94	NZ_KI912532.1 Dechloromonas agitata is5 K420DRAFT_scaffold00001.1, whole genome shotgun sequence
