Sample_file	Genome_file	Taxonomic_abundance	Sequence_abundance	Adjusted_ANI	Eff_cov	ANI_5-95_percentile	Eff_lambda	Lambda_5-95_percentile	Median_cov	Mean_cov_geq1	Containment_ind	Naive_ANI	Contig_name
soil/SRR5262247_1.fastq.gz	refseq/bacteria/GCF_001440475.1/GCF_001440475.1_ASM144047v1_genomic.fna.gz	100.0000	100.0000	95.56	0.473	95.38-95.79	0.473	0.43-0.51	1	1.751	3717/38198	92.76	NZ_LLYB01000001.1 Bradyrhizobium lablabi strain CCBAU 23086 C4762, whole genome shotgun sequence
sludge/SRR2119803_1.fastq.gz	refseq/viral/GCF_001505215.1/GCF_001505215.1_ViralProj307948_genomic.fna.gz	94.0467	15.4899	96.15	26.000	NA-NA	HIGH	NA-NA	26	20.807	83/280	96.15	NC_028809.1 Pseudomonas phage PaMx74, partial genome
sludge/SRR2119803_1.fastq.gz	refseq/bacteria/GCF_001632805.1/GCF_001632805.1_ASM163280v1_genomic.fna.gz	2.8189	39.8266	96.50	0.779	96.40-96.65	0.779	0.72-0.82	1	1.458	3964/21743	94.66	NZ_CP007220.1 Mycobacteroides chelonae CCUG 47445 chromosome, complete genome
sludge/SRR2119803_1.fastq.gz	refseq/bacteria/GCF_027570695.1/GCF_027570695.1_ASM2757069v1_genomic.fna.gz	1.0590	19.0771	98.54	0.293	98.33-98.76	0.293	0.27-0.31	1	1.159	4539/27662	94.34	NZ_CP107719.1 Mycolicibacterium fortuitum strain MF GZ001 chromosome, complete genome
sludge/SRR2119803_1.fastq.gz	refseq/bacteria/GCF_000344135.1/GCF_000344135.1_ASM34413v1_genomic.fna.gz	0.8022	10.0623	98.26	0.222	97.86-98.65	0.222	0.19-0.25	1	1.130	2273/19254	93.34	NZ_BAOP01000115.1 Gordonia malaquae NBRC 108250, whole genome shotgun sequence
sludge/SRR2119803_1.fastq.gz	refseq/bacteria/GCF_013408555.1/GCF_013408555.1_ASM1340855v1_genomic.fna.gz	0.6693	6.3302	95.28	0.185	94.56-95.93	0.185	0.14-0.23	1	1.093	559/14482	90.03	NZ_JACBZN010000001.1 Aeromicrobium tamlense strain DSM 19087 Ga0104580_01, whole genome shotgun sequence
sludge/SRR2119803_1.fastq.gz	refseq/bacteria/GCF_000247715.1/GCF_000247715.1_ASM24771v1_genomic.fna.gz	0.2788	4.5774	97.87	0.077	96.98-98.63	0.077	0.06-0.10	1	1.036	971/24908	90.06	NC_016906.1 Gordonia polyisoprenivorans VH2, complete sequence
sludge/SRR2119803_1.fastq.gz	refseq/bacteria/GCF_008727715.1/GCF_008727715.1_ASM872771v1_genomic.fna.gz	0.1671	2.8274	96.84	0.046	95.30-98.87	0.046	0.02-0.07	1	1.020	444/25935	87.70	NZ_CP044218.1 Mesorhizobium terrae strain NIBRBAC000500504 chromosome, complete genome
sludge/SRR2119803_1.fastq.gz	refseq/bacteria/GCF_019141545.1/GCF_019141545.1_ASM1914154v1_genomic.fna.gz	0.1580	1.8090	96.27	0.044	94.12-97.38	0.044	0.03-0.08	1	1.017	235/17396	87.04	NZ_CP065892.1 Paracoccus marcusii strain CP157 chromosome, complete genome
soil/SRR5381886_1.fastq.gz	refseq/bacteria/GCF_009708035.1/GCF_009708035.1_ASM970803v1_genomic.fna.gz	16.4169	15.8786	95.56	0.248	95.00-96.04	0.248	0.21-0.29	1	1.171	936/16943	91.08	NZ_WMBQ01000001.1 Hyphomicrobium album strain XQ2 xq_1, whole genome shotgun sequence
soil/SRR5381886_1.fastq.gz	refseq/bacteria/GCF_019679455.1/GCF_019679455.1_ASM1967945v1_genomic.fna.gz	11.9406	11.7245	95.65	0.181	95.10-96.29	0.181	0.14-0.22	1	1.154	739/17267	90.33	NZ_JAIEZQ010000001.1 Nocardioides jiangsuensis strain WL0053 NODE_1_length_1786811_cov_46.119113, whole genome shotgun sequence
soil/SRR5381886_1.fastq.gz	refseq/archaea/GCF_000220175.1/GCF_000220175.1_ASM22017v1_genomic.fna.gz	11.8601	4.7189	97.89	0.179	97.08-98.58	0.179	0.14-0.23	1	1.103	603/6947	92.42	NZ_AFPU01000001.1 Nitrosarchaeum koreense MY1 MY1, whole genome shotgun sequence
soil/SRR5381886_1.fastq.gz	refseq/bacteria/GCF_900113175.1/GCF_900113175.1_IMG-taxon_2615840724_annotated_assembly_genomic.fna.gz	11.0323	9.2349	99.34	0.167	98.93-99.83	0.167	0.14-0.19	1	1.091	1871/14610	93.59	NZ_FOOK01000061.1 Planifilum fulgidum strain DSM 44945, whole genome shotgun sequence
soil/SRR5381886_1.fastq.gz	refseq/bacteria/GCF_009811375.1/GCF_009811375.1_ASM981137v1_genomic.fna.gz	7.9089	13.1141	96.56	0.120	95.87-97.33	0.120	0.10-0.15	1	1.098	1118/28650	90.07	NZ_BKDH01000001.1 Variovorax boronicumulans strain HAB30 Contig01, whole genome shotgun sequence
soil/SRR5381886_1.fastq.gz	refseq/bacteria/GCF_002028545.1/GCF_002028545.1_ASM202854v1_genomic.fna.gz	7.8926	7.6190	97.13	0.119	96.41-97.85	0.119	0.09-0.15	1	1.130	791/16789	90.61	NZ_MWPQ01000040.1 Nitrobacter vulgaris strain Ab1 NvAb1_1, whole genome shotgun sequence
soil/SRR5381886_1.fastq.gz	refseq/bacteria/GCF_003001905.1/GCF_003001905.1_ASM300190v1_genomic.fna.gz	7.3226	6.5009	97.75	0.111	97.03-98.38	0.111	0.09-0.14	1	1.081	817/15307	90.98	NZ_PVNE01000001.1 Planifilum fimeticola strain DSM 44946 Ga0180967_101, whole genome shotgun sequence
soil/SRR5381886_1.fastq.gz	refseq/bacteria/GCF_017161365.1/GCF_017161365.1_ASM1716136v1_genomic.fna.gz	7.1824	7.7977	96.74	0.109	95.83-97.69	0.109	0.08-0.15	1	1.075	689/18219	89.97	NZ_CP039124.1 Thermobispora bispora strain ZC4 chromosome, complete genome
soil/SRR5381886_1.fastq.gz	refseq/bacteria/GCF_003386795.1/GCF_003386795.1_ASM338679v1_genomic.fna.gz	6.4709	7.0024	96.33	0.098	95.34-97.51	0.098	0.06-0.13	1	1.073	564/18803	89.30	NZ_QTUC01000001.1 Thermasporomyces composti strain DSM 22891 Ga0197492_11, whole genome shotgun sequence
soil/SRR5381886_1.fastq.gz	refseq/bacteria/GCF_003269955.1/GCF_003269955.1_ASM326995v1_genomic.fna.gz	3.2053	4.2193	97.80	0.049	96.64-99.38	0.049	0.03-0.07	1	1.065	556/22843	88.70	NZ_LWAG01000056.1 Priestia endophytica strain 3617_2C map unlocalized plasmid pBEH1 3617_2C_contig_58, whole genome shotgun sequence
soil/SRR5381886_1.fastq.gz	refseq/bacteria/GCF_020075705.1/GCF_020075705.1_ASM2007570v1_genomic.fna.gz	2.6879	3.9383	96.19	0.041	94.68-98.26	0.041	0.02-0.06	1	1.017	302/24574	86.77	NZ_JAIQUM010000001.1 Metabacillus rhizolycopersici strain DBTR6 ZB100000, whole genome shotgun sequence
soil/SRR5381886_1.fastq.gz	refseq/bacteria/GCF_019272935.1/GCF_019272935.1_ASM1927293v1_genomic.fna.gz	2.6609	2.6101	98.85	0.040	97.36-101.10	0.040	0.02-0.06	1	1.024	458/16183	89.14	NZ_CP040553.1 Parageobacillus caldoxylosilyticus strain ER4B chromosome, complete genome
soil/SRR5381886_1.fastq.gz	refseq/bacteria/GCF_008370715.1/GCF_008370715.1_ASM837071v1_genomic.fna.gz	1.8021	3.0054	96.02	0.027	93.86-96.26	0.027	0.02-0.05	1	1.022	225/28704	85.52	NZ_CP034725.1 Pseudomonas brassicacearum strain 3Re2-7 chromosome, complete genome
soil/SRR5381886_1.fastq.gz	refseq/bacteria/GCF_900104905.1/GCF_900104905.1_IMG-taxon_2639762619_annotated_assembly_genomic.fna.gz	1.6166	2.6359	97.66	0.024	95.45-98.88	0.024	0.02-0.05	1	1.045	336/28183	86.69	NZ_FNTC01000002.1 Pseudomonas jessenii strain LMG 21605, whole genome shotgun sequence
water/SRR3471267_1.fastq.gz	refseq/bacteria/GCF_000195975.1/GCF_000195975.1_ASM19597v1_genomic.fna.gz	92.4139	95.9811	100.00	414.000	NA-NA	HIGH	NA-NA	414	442.031	10364/10374	100.00	NC_005070.1 Parasynechococcus marenigrum WH 8102, complete sequence
water/SRR3471267_1.fastq.gz	refseq/viral/GCF_000889515.1/GCF_000889515.1_ViralProj61009_genomic.fna.gz	1.7858	0.1512	96.98	8.000	NA-NA	HIGH	NA-NA	8	9.054	336/868	96.98	NC_014765.1 Bathycoccus sp. RCC1105 virus BpV1, complete genome
water/SRR3471267_1.fastq.gz	refseq/bacteria/GCF_001281385.1/GCF_001281385.1_ASM128138v1_genomic.fna.gz	1.5626	1.1427	98.95	7.000	NA-NA	HIGH	NA-NA	7	8.163	5367/7447	98.95	NZ_CP006911.1 Candidatus Pseudothioglobus singularis PS1 chromosome, complete genome
water/SRR3471267_1.fastq.gz	refseq/bacteria/GCF_900107355.1/GCF_900107355.1_IMG-taxon_2693429861_annotated_assembly_genomic.fna.gz	1.3393	1.8819	99.61	6.000	NA-NA	HIGH	NA-NA	6	7.126	12717/14336	99.61	NZ_FNPR01000018.1 Lentibacter algarum strain DSM 24677, whole genome shotgun sequence
water/SRR3471267_1.fastq.gz	refseq/viral/GCF_001019995.1/GCF_001019995.1_ViralProj285603_genomic.fna.gz	0.2773	0.0226	99.13	1.242	98.83-99.51	1.242	1.01-1.47	2	2.483	453/822	98.10	NC_027132.1 Synechococcus phage ACG-2014i isolate Syn7803US120, complete genome
water/SRR3471267_1.fastq.gz	refseq/viral/GCF_000905875.1/GCF_000905875.1_ViralProj192868_genomic.fna.gz	0.2717	0.0049	97.51	1.217	96.66-98.55	1.217	0.67-1.90	2	2.283	60/182	96.48	NC_020483.1 Pelagibacter phage HTVC019P, complete genome
water/SRR3471267_1.fastq.gz	refseq/bacteria/GCF_012276695.1/GCF_012276695.1_ASM1227669v1_genomic.fna.gz	0.2428	0.1415	96.87	1.088	96.63-97.08	1.088	0.96-1.22	2	2.431	1464/5743	95.69	NZ_CP038852.1 Candidatus Pelagibacter giovannonii strain NP1 chromosome, complete genome
water/SRR3471267_1.fastq.gz	refseq/viral/GCF_000901695.1/GCF_000901695.1_ViralProj181073_genomic.fna.gz	0.2333	0.0172	99.38	1.045	99.05-99.77	1.045	0.85-1.25	1	1.680	403/743	98.05	NC_019443.1 Synechococcus phage metaG-MbCM1, complete genome
water/SRR3471267_1.fastq.gz	refseq/viral/GCF_002604645.1/GCF_002604645.1_ASM260464v1_genomic.fna.gz	0.2041	0.0167	98.30	0.914	97.77-98.85	0.914	0.75-1.08	1	1.642	307/851	96.76	NC_062735.1 Synechococcus phage ACG-2014j isolate Syn7803US23, complete genome
water/SRR3471267_1.fastq.gz	refseq/viral/GCF_002578465.1/GCF_002578465.1_ASM257846v1_genomic.fna.gz	0.1984	0.0036	97.54	0.889	96.39-98.99	0.889	0.48-1.42	1	1.633	49/175	95.98	NC_047701.1 Uncultured phage_MedDCM-OCT-S42-C7 DNA, complete genome, group G8, isolate: uvMED-CGR-C97-MedDCM-OCT-S42-C7
water/SRR3471267_1.fastq.gz	refseq/bacteria/GCF_000384455.1/GCF_000384455.1_ASM38445v1_genomic.fna.gz	0.1954	0.1062	98.45	0.875	98.21-98.68	0.875	0.77-0.96	2	2.456	2068/5506	96.89	NZ_ARVY01000001.1 Candidatus Pelagibacter ubique HTCC1040 YWSDRAFT_scaffold_0.1_C, whole genome shotgun sequence
water/SRR3471267_1.fastq.gz	refseq/viral/GCF_000906035.1/GCF_000906035.1_ViralProj195482_genomic.fna.gz	0.1635	0.0143	96.69	0.733	95.93-97.43	0.733	0.52-0.98	1	1.644	163/873	94.73	NC_020864.1 Micromonas pusilla virus 12T genomic sequence
water/SRR3471267_1.fastq.gz	refseq/archaea/GCF_002156965.1/GCF_002156965.1_ASM215696v1_genomic.fna.gz	0.1530	0.0888	96.74	0.685	96.39-97.07	0.685	0.60-0.78	1	1.835	1033/5711	94.63	NZ_CP021324.1 Candidatus Nitrosomarinus catalina strain SPOT01 chromosome, complete genome
water/SRR3471267_1.fastq.gz	refseq/viral/GCF_000982345.1/GCF_000982345.1_ViralProj282478_genomic.fna.gz	0.1267	0.0095	96.35	0.568	95.27-97.39	0.568	0.37-0.84	1	1.382	102/728	93.86	NC_026924.1 Synechococcus phage ACG-2014g isolate Syn7803US105, complete genome
water/SRR3471267_1.fastq.gz	refseq/viral/GCF_001399225.1/GCF_001399225.1_ViralProj298991_genomic.fna.gz	0.1266	0.0098	98.00	0.567	97.22-98.77	0.567	0.39-0.74	1	1.406	180/762	95.45	NC_028093.1 Ostreococcus lucimarinus virus 7 isolate OlV7, complete genome
water/SRR3471267_1.fastq.gz	refseq/viral/GCF_002597145.1/GCF_002597145.1_ASM259714v1_genomic.fna.gz	0.1236	0.0091	97.80	0.554	97.08-98.57	0.554	0.40-0.70	1	1.543	164/753	95.20	NC_047719.1 Synechococcus phage ACG-2014b isolate Syn9311C4, complete genome
water/SRR3471267_1.fastq.gz	refseq/bacteria/GCF_001890925.1/GCF_001890925.1_ASM189092v1_genomic.fna.gz	0.0950	0.1665	97.34	0.426	97.15-97.65	0.426	0.38-0.45	1	1.341	2744/17748	94.16	NZ_MLCB01000001.1 Planktotalea frisia strain SH6-1 PFRI_contig000001, whole genome shotgun sequence
water/SRR3471267_1.fastq.gz	refseq/viral/GCF_000906915.1/GCF_000906915.1_ViralProj195484_genomic.fna.gz	0.0914	0.0077	99.09	0.410	98.32-99.88	0.410	0.30-0.54	1	1.436	225/867	95.74	NC_020837.1 Synechococcus phage S-CAM1 genomic sequence
water/SRR3471267_1.fastq.gz	refseq/viral/GCF_000905255.1/GCF_000905255.1_ViralProj192865_genomic.fna.gz	0.0893	0.0056	95.28	0.400	93.54-97.56	0.400	0.15-0.71	1	1.143	49/641	92.04	NC_020484.1 Pelagibacter phage HTVC008M, complete genome
water/SRR3471267_1.fastq.gz	refseq/bacteria/GCF_026262685.1/GCF_026262685.1_ASM2626268v1_genomic.fna.gz	0.0763	0.1418	96.51	0.342	96.12-96.83	0.342	0.30-0.39	1	1.212	1857/18821	92.80	NZ_SHNP01000001.1 Candidatus Seongchinamella marina strain IMCC8485 NODE_1, whole genome shotgun sequence
water/SRR3471267_1.fastq.gz	refseq/bacteria/GCF_000376705.1/GCF_000376705.1_ASM37670v1_genomic.fna.gz	0.0621	0.0676	96.24	0.278	95.67-96.69	0.278	0.24-0.33	1	1.143	819/10772	92.02	NC_021085.1 Cutibacterium acnes HL096PA1, complete sequence
water/SRR3471267_1.fastq.gz	refseq/viral/GCF_002582805.1/GCF_002582805.1_ASM258280v1_genomic.fna.gz	0.0582	0.0011	98.19	0.261	NA-NA	0.261	NA-NA	1	1.103	29/205	93.89	NC_047709.1 Uncultured phage_MedDCM-OCT-S45-C4 DNA, complete genome, group G7, isolate: uvMED-CGR-U-MedDCM-OCT-S45-C4
water/SRR3471267_1.fastq.gz	refseq/viral/GCF_000905435.1/GCF_000905435.1_ViralProj195483_genomic.fna.gz	0.0572	0.0046	95.48	0.256	93.80-97.66	0.256	0.13-0.40	1	1.089	45/801	91.13	NC_020852.1 Ostreococcus lucimarinus virus OlV5 genomic sequence
water/SRR3471267_1.fastq.gz	refseq/viral/GCF_000982365.1/GCF_000982365.1_ViralProj282475_genomic.fna.gz	0.0525	0.0040	96.70	0.235	94.90-98.99	0.235	0.11-0.42	1	1.016	62/758	92.24	NC_026923.1 Synechococcus phage ACG-2014d isolate Syn7803C102, complete genome
water/SRR1534154_1.fastq.gz	refseq/bacteria/GCF_000376705.1/GCF_000376705.1_ASM37670v1_genomic.fna.gz	70.3047	69.9314	99.98	27.000	NA-NA	HIGH	NA-NA	27	27.110	10709/10772	99.98	NC_021085.1 Cutibacterium acnes HL096PA1, complete sequence
water/SRR1534154_1.fastq.gz	refseq/bacteria/GCF_000007985.2/GCF_000007985.2_ASM798v2_genomic.fna.gz	15.6233	23.2463	96.93	6.000	NA-NA	HIGH	NA-NA	6	6.596	6265/16461	96.93	NC_002939.5 Geobacter sulfurreducens PCA, complete sequence
water/SRR1534154_1.fastq.gz	refseq/viral/GCF_000900255.1/GCF_000900255.1_ViralProj177531_genomic.fna.gz	3.0773	0.0355	97.39	1.182	96.26-98.56	1.182	0.55-1.80	2	2.064	47/150	96.33	NC_018841.1 Propionibacterium phage P101A, complete genome
water/SRR1534154_1.fastq.gz	refseq/viral/GCF_003423365.1/GCF_003423365.1_ASM342336v1_genomic.fna.gz	2.6674	0.0437	99.86	1.024	99.06-100.77	1.024	0.63-1.53	2	2.658	111/178	98.49	NC_049951.1 Enterobacteria phage O276, complete genome
water/SRR1534154_1.fastq.gz	refseq/viral/GCF_000840245.1/GCF_000840245.1_ViralProj14204_genomic.fna.gz	2.6039	0.0493	96.53	1.000	95.24-97.93	1.000	0.47-1.88	2	2.638	47/212	95.26	NC_001416.1 Enterobacteria phage lambda, complete genome
water/SRR1534154_1.fastq.gz	refseq/bacteria/GCF_003384605.1/GCF_003384605.1_ASM338460v1_genomic.fna.gz	2.4168	2.2626	97.85	0.928	97.66-97.97	0.928	0.88-1.00	1	1.975	3279/10348	96.36	NZ_PCZS01000001.1 Cutibacterium namnetense strain T34998 Contig_1_consensus_sequence, whole genome shotgun sequence
water/SRR1534154_1.fastq.gz	refseq/bacteria/GCF_003664585.1/GCF_003664585.1_ASM366458v1_genomic.fna.gz	2.3827	3.5334	97.28	0.915	97.15-97.41	0.915	0.86-0.97	1	1.919	4267/16380	95.75	NZ_RCHI01000001.1 Sinirhodobacter hankyongi strain BO-81 contig_1, whole genome shotgun sequence
water/SRR1534154_1.fastq.gz	refseq/bacteria/GCF_006094375.1/GCF_006094375.1_ASM609437v1_genomic.fna.gz	0.9240	0.8979	95.14	0.355	94.56-95.65	0.355	0.30-0.43	1	1.189	681/10390	91.58	NZ_CP035288.1 Staphylococcus epidermidis strain ATCC 14990 chromosome, complete genome
soil/SRR5177928_1.fastq.gz	refseq/bacteria/GCF_022808815.1/GCF_022808815.1_ASM2280881v1_genomic.fna.gz	68.8226	64.2792	97.68	21.000	NA-NA	HIGH	NA-NA	21	19.015	7128/14757	97.68	NZ_JAKZLC010000001.1 Geothrix sp. SG195 Scaffold1, whole genome shotgun sequence
soil/SRR5177928_1.fastq.gz	refseq/bacteria/GCF_027925345.1/GCF_027925345.1_ASM2792534v1_genomic.fna.gz	26.2182	29.0548	98.40	8.000	NA-NA	HIGH	NA-NA	8	7.845	10421/17205	98.40	NZ_BSDS01000001.1 Geobacter hydrogenophilus strain H2 sequence1, whole genome shotgun sequence
soil/SRR5177928_1.fastq.gz	refseq/bacteria/GCF_004117875.1/GCF_004117875.1_ASM411787v1_genomic.fna.gz	2.0864	2.8210	98.36	0.637	98.25-98.50	0.637	0.60-0.67	1	1.453	5872/19932	96.13	NZ_RAHW01000001.1 Geomonas oryzae strain S43 contig1, whole genome shotgun sequence
soil/SRR5177928_1.fastq.gz	refseq/bacteria/GCF_008728855.1/GCF_008728855.1_ASM872885v1_genomic.fna.gz	1.8527	2.9929	96.48	0.565	96.37-96.66	0.565	0.52-0.59	1	1.466	3674/25278	93.97	NZ_CP042906.1 Hypericibacter terrae strain R5913 chromosome, complete genome
soil/SRR5177928_1.fastq.gz	refseq/bacteria/GCF_000956535.1/GCF_000956535.1_ASM95653v1_genomic.fna.gz	1.0201	0.8520	95.17	0.311	94.54-95.88	0.311	0.25-0.38	1	1.319	702/11686	91.33	NZ_JYIY01000001.1 Microbacterium ginsengisoli strain DSM 18659 RR49_contig000001, whole genome shotgun sequence
water/SRR4018495_1.fastq.gz	refseq/viral/GCF_002758635.1/GCF_002758635.1_ASM275863v1_genomic.fna.gz	98.0955	62.1842	96.25	294.000	NA-NA	HIGH	NA-NA	294	325.625	56/183	96.25	NC_042057.1 Enterobacteria phage DE3, complete genome
water/SRR4018495_1.fastq.gz	refseq/bacteria/GCF_002288305.1/GCF_002288305.1_ASM228830v1_genomic.fna.gz	0.4351	7.4660	99.16	1.304	99.02-99.31	1.304	1.21-1.41	2	2.599	2856/5031	98.19	NZ_CP016779.1 Candidatus Nanopelagicus abundans isolate MMS-IIB-91 chromosome, complete genome
water/SRR4018495_1.fastq.gz	refseq/bacteria/GCF_002287885.2/GCF_002287885.2_ASM228788v2_genomic.fna.gz	0.2316	4.2344	95.30	0.694	94.98-95.73	0.694	0.56-0.79	1	1.634	620/5377	93.27	NZ_CP016768.2 Candidatus Nanopelagicus limnes isolate MMS-21-122 chromosome, complete genome
water/SRR4018495_1.fastq.gz	refseq/viral/GCF_000842945.1/GCF_000842945.1_ViralProj14247_genomic.fna.gz	0.2224	0.1477	99.93	0.667	99.26-101.07	0.667	0.42-0.95	1	1.186	97/195	97.77	NC_004616.1 Staphylococcus prophage phi 12, complete genome
water/SRR4018495_1.fastq.gz	refseq/bacteria/GCF_013374815.1/GCF_013374815.1_ASM1337481v1_genomic.fna.gz	0.2132	14.9983	98.67	0.639	98.55-98.81	0.639	0.60-0.67	1	1.402	6328/19782	96.39	NZ_CP055292.1 Shigella sonnei strain SE6-1 chromosome, complete genome
water/SRR4018495_1.fastq.gz	refseq/viral/GCF_001015325.1/GCF_001015325.1_ViralProj284780_genomic.fna.gz	0.1628	0.1109	98.57	0.488	97.17-100.54	0.488	0.24-0.81	1	1.208	53/208	95.69	NC_021190.1 Enterobacteria phage phi80, complete genome
water/SRR4018495_1.fastq.gz	refseq/viral/GCF_000871605.1/GCF_000871605.1_ViralProj19749_genomic.fna.gz	0.1529	0.0991	99.77	0.458	98.33-101.60	0.458	0.22-0.77	1	1.167	60/170	96.70	NC_009526.1 Staphylococcus phage 80alpha, complete genome
water/SRR4018495_1.fastq.gz	refseq/bacteria/GCF_006363895.1/GCF_006363895.1_ASM636389v1_genomic.fna.gz	0.1259	2.3612	97.53	0.377	97.09-98.05	0.377	0.31-0.44	1	1.885	810/5424	94.05	NZ_CP040953.1 Candidatus Methylopumilus universalis strain MMS-RVI-51 chromosome
water/SRR4018495_1.fastq.gz	refseq/bacteria/GCF_002688585.1/GCF_002688585.1_ASM268858v1_genomic.fna.gz	0.1138	1.9503	97.41	0.341	96.82-97.96	0.341	0.26-0.40	1	1.633	646/4924	93.66	NZ_CP024034.1 Candidatus Fonsibacter ubiquis strain LSUCC0530 isolate LSUCC0530 chromosome, complete genome
water/SRR4018495_1.fastq.gz	refseq/bacteria/GCF_002288185.1/GCF_002288185.1_ASM228818v1_genomic.fna.gz	0.0851	1.7148	95.04	0.255	94.14-95.85	0.255	0.18-0.34	1	1.155	284/5915	90.67	NZ_CP016776.1 Candidatus Planktophila vernalis isolate MMS-IIA-15 chromosome, complete genome
water/SRR4018495_1.fastq.gz	refseq/bacteria/GCF_006364455.1/GCF_006364455.1_ASM636445v1_genomic.fna.gz	0.0799	1.5373	97.36	0.239	96.61-98.18	0.239	0.17-0.30	1	1.266	530/5580	92.69	NZ_CP040979.1 Candidatus Methylopumilus planktonicus strain MMS-VI-155 chromosome
water/SRR4018495_1.fastq.gz	refseq/bacteria/GCF_002288325.1/GCF_002288325.1_ASM228832v1_genomic.fna.gz	0.0445	0.9098	96.05	0.133	94.86-97.65	0.133	0.08-0.20	1	1.158	221/5988	89.90	NZ_CP016780.1 Candidatus Planktophila lacus isolate MMS-IIB-106 chromosome, complete genome
water/SRR4018495_1.fastq.gz	refseq/bacteria/GCF_000332315.1/GCF_000332315.1_ASM33231v1_genomic.fna.gz	0.0191	1.5898	96.54	0.057	95.19-98.42	0.057	0.03-0.08	1	1.025	433/22625	88.02	NZ_KB235933.1 Prochlorothrix hollandica PCC 9006 = CALU 1027 strain PCC 9006 Pro9006DRAFT_Contig5.9, whole genome shotgun sequence
water/SRR4018495_1.fastq.gz	refseq/bacteria/GCF_000420765.1/GCF_000420765.1_ASM42076v1_genomic.fna.gz	0.0180	0.6962	96.02	0.054	93.48-96.55	0.054	0.05-0.12	1	2.662	213/11374	87.96	NZ_ATVO01000001.1 Sandarakinorhabdus limnophila DSM 17366 G566DRAFT_scaffold00010.10_C, whole genome shotgun sequence
water/SRR3138946_1.fastq.gz	refseq/bacteria/GCF_000368805.1/GCF_000368805.1_Acin_john_ANC_3681_V1_genomic.fna.gz	41.5136	40.0372	97.51	0.794	97.36-97.67	0.794	0.73-0.84	1	1.538	3853/15127	95.68	NZ_KB849702.1 Acinetobacter johnsonii ANC 3681 acLro-supercont1.1, whole genome shotgun sequence
water/SRR3138946_1.fastq.gz	refseq/bacteria/GCF_018336855.1/GCF_018336855.1_ASM1833685v1_genomic.fna.gz	18.6248	17.4452	97.53	0.356	97.33-97.84	0.356	0.32-0.38	1	1.206	2040/14499	93.87	NZ_CP059558.1 Acinetobacter junii strain YR7 chromosome, complete genome
water/SRR3138946_1.fastq.gz	refseq/bacteria/GCF_904830995.1/GCF_904830995.1_G1452_genomic.fna.gz	14.1550	12.6622	97.81	0.271	97.47-98.17	0.271	0.24-0.30	1	1.144	1751/14331	93.44	NZ_CAJGVD010000001.1 Brevundimonas aurantiaca strain Marseille-P3291, whole genome shotgun sequence
water/SRR3138946_1.fastq.gz	refseq/bacteria/GCF_000759995.1/GCF_000759995.1_ASM75999v1_genomic.fna.gz	9.0964	9.0858	95.55	0.174	94.90-96.28	0.174	0.13-0.22	1	1.079	645/15930	90.17	NZ_BBND01000057.1 Acinetobacter tjernbergiae strain DSM 14971, whole genome shotgun sequence
water/SRR3138946_1.fastq.gz	refseq/bacteria/GCF_002504085.1/GCF_002504085.1_ASM250408v1_genomic.fna.gz	7.1879	10.8328	96.03	0.137	95.34-96.87	0.137	0.10-0.17	1	1.055	879/23317	89.97	NZ_CP023741.1 Sphingobium yanoikuyae strain S72 chromosome, complete genome
water/SRR3138946_1.fastq.gz	refseq/bacteria/GCF_000369005.1/GCF_000369005.1_Acin_beij_CIP_110307_V1_genomic.fna.gz	6.2106	6.0283	96.49	0.119	95.64-97.39	0.119	0.08-0.15	1	1.038	581/15098	90.02	NZ_KB849763.1 Acinetobacter beijerinckii CIP 110307 acLZq-supercont1.1, whole genome shotgun sequence
water/SRR3138946_1.fastq.gz	refseq/bacteria/GCF_002198095.1/GCF_002198095.1_ASM219809v1_genomic.fna.gz	3.2117	3.9086	95.08	0.061	93.47-97.33	0.061	0.03-0.10	1	1.021	237/18421	86.90	NZ_NHMK01000003.1 Deinococcus indicus strain DR1 Masurca_129_len:99725, whole genome shotgun sequence
sludge/SRR3732729_1.fastq.gz	refseq/viral/GCF_000839625.1/GCF_000839625.1_ViralProj14086_genomic.fna.gz	87.5206	7.8781	95.64	98.000	NA-NA	HIGH	NA-NA	98	102.981	52/207	95.64	NC_001901.1 Bacteriophage N15, complete genome
sludge/SRR3732729_1.fastq.gz	refseq/bacteria/GCF_017815575.1/GCF_017815575.1_ASM1781557v1_genomic.fna.gz	4.4653	30.8113	98.69	5.000	NA-NA	HIGH	NA-NA	5	5.463	10007/15074	98.69	NZ_CP072608.1 Desulfovibrio desulfuricans strain L4 chromosome, complete genome
sludge/SRR3732729_1.fastq.gz	refseq/bacteria/GCF_018905915.1/GCF_018905915.1_ASM1890591v1_genomic.fna.gz	3.5723	22.7254	96.63	4.000	NA-NA	HIGH	NA-NA	4	5.322	4815/13957	96.63	NZ_CP064782.1 Azospira inquinata strain Azo-3 chromosome, complete genome
sludge/SRR3732729_1.fastq.gz	refseq/bacteria/GCF_900128905.1/GCF_900128905.1_IMG-taxon_2695420932_annotated_assembly_genomic.fna.gz	3.5723	28.5587	96.75	4.000	NA-NA	HIGH	NA-NA	4	5.117	6414/17864	96.75	NZ_FQTV01000038.1 Bacteroides luti strain DSM 26991, whole genome shotgun sequence
sludge/SRR3732729_1.fastq.gz	refseq/bacteria/GCF_008705175.1/GCF_008705175.1_ASM870517v1_genomic.fna.gz	0.8695	10.0264	95.70	0.974	95.58-95.86	0.974	0.89-1.04	2	2.249	4050/25004	94.30	NZ_CP043998.1 Clostridium diolis strain DSM 15410 chromosome, complete genome
sludge/SRR2308974_1.fastq.gz	refseq/bacteria/GCF_009800965.1/GCF_009800965.1_ASM980096v1_genomic.fna.gz	16.6330	17.2757	99.57	1.844	99.53-99.61	1.844	1.77-1.90	2	2.784	15735/21190	99.04	NZ_WUAF01000100.1 Cognatazoarcus halotolerans strain HKLI-1 NODE_100_length_255_cov_89.437500, whole genome shotgun sequence
sludge/SRR2308974_1.fastq.gz	refseq/bacteria/GCF_000179015.2/GCF_000179015.2_ASM17901v2_genomic.fna.gz	16.1515	16.3280	99.48	1.791	99.43-99.53	1.791	1.73-1.86	2	2.806	14683/20497	98.93	NC_014910.1 Alicycliphilus denitrificans BC, complete sequence
sludge/SRR2308974_1.fastq.gz	refseq/bacteria/GCF_012939995.1/GCF_012939995.1_ASM1293999v1_genomic.fna.gz	12.1856	11.1723	98.98	1.351	98.91-99.06	1.351	1.29-1.40	2	2.342	10081/18451	98.07	NZ_SPMZ01000001.1 Candidatus Competibacter phosphatis strain SBR_G GAO5_binned_c1, whole genome shotgun sequence
sludge/SRR2308974_1.fastq.gz	refseq/bacteria/GCF_004341245.1/GCF_004341245.1_ASM434124v1_genomic.fna.gz	11.3392	10.4245	98.21	1.257	98.13-98.29	1.257	1.20-1.31	2	2.333	7882/18937	97.21	NZ_SLWY01000001.1 Plasticicumulans lactativorans strain DSM 25287 Ga0310538_101, whole genome shotgun sequence
sludge/SRR2308974_1.fastq.gz	refseq/bacteria/GCF_000310185.1/GCF_000310185.1_ASM31018v1_genomic.fna.gz	8.2810	7.4107	99.22	0.918	99.13-99.32	0.918	0.88-0.96	1	1.821	8790/18026	97.71	NZ_AMXD01000001.1 Thauera aminoaromatica S2 Cont1, whole genome shotgun sequence
sludge/SRR2308974_1.fastq.gz	refseq/bacteria/GCF_008728855.1/GCF_008728855.1_ASM872885v1_genomic.fna.gz	7.8124	9.6264	99.10	0.866	99.00-99.17	0.866	0.84-0.90	1	1.574	11228/25278	97.42	NZ_CP042906.1 Hypericibacter terrae strain R5913 chromosome, complete genome
sludge/SRR2308974_1.fastq.gz	refseq/bacteria/GCF_905220995.1/GCF_905220995.1_NSPZN2_genomic.fna.gz	5.1855	5.2470	95.25	0.575	95.01-95.51	0.575	0.51-0.63	1	1.854	2095/20838	92.86	NZ_CAJNBJ010000001.1 Nitrospira defluvii isolate Candidatus Nitrospira sp. ZN2, whole genome shotgun sequence
sludge/SRR2308974_1.fastq.gz	refseq/bacteria/GCF_014644535.1/GCF_014644535.1_ASM1464453v1_genomic.fna.gz	3.2218	4.3124	98.62	0.357	98.46-98.80	0.357	0.33-0.38	1	1.247	5485/27492	94.93	NZ_BMKW01000001.1 Neoroseomonas lacus strain CGMCC 1.3617 sequence01, whole genome shotgun sequence
sludge/SRR2308974_1.fastq.gz	refseq/bacteria/GCF_003417535.1/GCF_003417535.1_ASM341753v1_genomic.fna.gz	2.8260	2.7076	95.29	0.313	94.83-95.67	0.313	0.27-0.36	1	1.737	1264/19848	91.50	NZ_QVLS01000001.1 Hydrogenophaga borbori strain LA-38 contig_1, whole genome shotgun sequence
sludge/SRR2308974_1.fastq.gz	refseq/bacteria/GCF_902860075.1/GCF_902860075.1_LMG_26846_genomic.fna.gz	2.1615	3.1075	95.50	0.240	95.08-95.95	0.240	0.20-0.27	1	1.435	1583/29835	90.96	NZ_CADIKT010000001.1 Achromobacter insuavis strain LMG 26846 isolate LMG 26846, whole genome shotgun sequence
