published_soil/SRR22411281_1.fastq.gz	refseq/bacteria/GCF_006438965.1/GCF_006438965.1_ASM643896v1_genomic.fna.gz	4.3063	0.0845	96.42	0.840	96.21-96.60	0.615	0.56-0.67	1	1.737	2799/18249	94.13	NZ_RCZM01000001.1 Pedococcus bigeumensis strain S9.3A scaffold1.1, whole genome shotgun sequence
published_soil/SRR22411281_1.fastq.gz	refseq/bacteria/GCF_011604665.1/GCF_011604665.1_ASM1160466v1_genomic.fna.gz	4.1873	0.1347	97.86	0.817	97.74-97.98	0.598	0.57-0.63	1	1.597	7069/29926	95.45	NZ_CP050066.1 Bradyrhizobium symbiodeficiens strain 101S1MB chromosome, complete genome
published_soil/SRR22411281_1.fastq.gz	refseq/bacteria/GCF_010093345.1/GCF_010093345.1_ASM1009334v1_genomic.fna.gz	3.7899	0.0694	96.63	0.739	96.44-96.86	0.541	0.50-0.58	1	1.647	2520/16984	94.03	NZ_PDWT01000010.1 Pseudoxanthomonas yeongjuensis strain DSM 18204 NODE_10_length_85764_cov_31.4004, whole genome shotgun sequence
published_soil/SRR22411281_1.fastq.gz	refseq/bacteria/GCF_002531755.2/GCF_002531755.2_ASM253175v2_genomic.fna.gz	3.6398	0.1269	96.22	0.710	96.06-96.40	0.520	0.48-0.55	1	1.368	3918/31389	93.51	NZ_CP034998.1 Rhizobium acidisoli strain FH23 chromosome, complete genome
published_soil/SRR22411281_1.fastq.gz	refseq/bacteria/GCF_013170785.1/GCF_013170785.1_ASM1317078v1_genomic.fna.gz	3.6075	0.1208	98.47	0.704	98.31-98.57	0.515	0.49-0.54	1	1.465	7867/30880	95.68	NZ_CP033507.1 Mesorhizobium jarvisii strain ATCC 33669 chromosome, complete genome
published_soil/SRR22411281_1.fastq.gz	refseq/bacteria/GCF_030486595.1/GCF_030486595.1_ASM3048659v1_genomic.fna.gz	3.4875	0.1264	97.30	0.680	97.15-97.46	0.498	0.47-0.53	1	1.444	5773/33551	94.48	NZ_JAUJZH010000001.1 Variovorax ginsengisoli strain CGMCC 1.12090 L12090_1, whole genome shotgun sequence
published_soil/SRR22411281_1.fastq.gz	refseq/bacteria/GCF_014646815.1/GCF_014646815.1_ASM1464681v1_genomic.fna.gz	3.3844	0.0741	95.32	0.660	95.08-95.64	0.483	0.43-0.53	1	1.580	1817/20414	92.49	NZ_BMNZ01000001.1 Terrabacter tumescens strain JCM 1365 sequence01, whole genome shotgun sequence
published_soil/SRR22411281_1.fastq.gz	refseq/bacteria/GCF_013185915.1/GCF_013185915.1_ASM1318591v1_genomic.fna.gz	3.3245	0.0681	97.90	0.648	97.71-98.14	0.475	0.43-0.50	1	1.456	3811/18965	94.96	NZ_JAAZUH010000001.1 Stenotrophomonas bentonitica strain DSM 103927 NODE_1, whole genome shotgun sequence
published_soil/SRR22411281_1.fastq.gz	refseq/bacteria/GCF_014712225.1/GCF_014712225.1_ASM1471222v1_genomic.fna.gz	3.0204	0.0692	97.78	0.589	97.63-98.00	0.431	0.40-0.46	1	1.380	3797/21248	94.60	NZ_JACXBW010000001.1 Pseudarthrobacter sulfonivorans strain ALL 1, whole genome shotgun sequence
published_soil/SRR22411281_1.fastq.gz	refseq/bacteria/GCF_005862185.2/GCF_005862185.2_ASM586218v2_genomic.fna.gz	2.8832	0.0909	97.13	0.562	96.97-97.36	0.412	0.38-0.44	1	1.357	4053/29011	93.85	NZ_CP054027.1 Rhizobium hidalgonense strain JKLM 19E chromosome, complete genome
published_soil/SRR22411281_1.fastq.gz	refseq/bacteria/GCF_900103325.1/GCF_900103325.1_IMG-taxon_2596583656_annotated_assembly_genomic.fna.gz	2.8634	0.0940	95.78	0.558	95.54-96.01	0.409	0.37-0.44	1	1.354	2728/30231	92.53	NZ_FMXM01000121.1 Mesorhizobium qingshengii strain CGMCC 1.12097, whole genome shotgun sequence
published_soil/SRR22411281_1.fastq.gz	refseq/bacteria/GCF_000264295.1/GCF_000264295.1_Rh17631_genomic.fna.gz	2.7729	0.0504	96.57	0.541	96.35-96.90	0.396	0.35-0.43	1	1.521	1921/16903	93.23	NZ_AJXT01000001.1 Rhodanobacter spathiphylli B39 contig001, whole genome shotgun sequence
published_soil/SRR22411281_1.fastq.gz	refseq/bacteria/GCF_024756225.1/GCF_024756225.1_ASM2475622v1_genomic.fna.gz	2.7258	0.0937	95.74	0.532	95.51-96.00	0.389	0.35-0.42	1	1.323	2715/31737	92.38	NZ_JANUHC010000001.1 Telluria mixta strain LMG 11547 1, whole genome shotgun sequence
published_soil/SRR22411281_1.fastq.gz	refseq/bacteria/GCF_007572485.1/GCF_007572485.1_ASM757248v1_genomic.fna.gz	2.3438	0.0689	96.13	0.457	95.82-96.43	0.335	0.30-0.37	1	1.290	2329/27225	92.38	NZ_VCIZ01000010.1 Cupriavidus campinensis strain S14E4C NODE_10_length_219434_cov_31.1521, whole genome shotgun sequence
published_soil/SRR22411281_1.fastq.gz	refseq/bacteria/GCF_001544475.1/GCF_001544475.1_ASM1544475v2_genomic.fna.gz	2.3418	0.0829	98.77	0.457	98.59-98.96	0.334	0.31-0.35	1	1.224	6454/32628	94.91	NZ_FCNW02000001.1 Caballeronia humi isolate LMG 22934, whole genome shotgun sequence
published_soil/SRR22411281_1.fastq.gz	refseq/bacteria/GCF_021919345.1/GCF_021919345.1_ASM2191934v1_genomic.fna.gz	2.2909	0.0477	98.23	0.447	98.07-98.49	0.327	0.30-0.34	1	1.290	3118/19038	94.33	NZ_CP089293.1 Paenarthrobacter nicotinovorans strain ATCC 49919 chromosome, complete genome
published_soil/SRR22411281_1.fastq.gz	refseq/bacteria/GCF_000264315.1/GCF_000264315.1_Rh18449_genomic.fna.gz	2.2503	0.0406	95.49	0.439	94.97-95.96	0.321	0.28-0.37	1	1.324	1136/16928	91.65	NZ_AJXU01000001.1 Rhodanobacter fulvus Jip2 contig001, whole genome shotgun sequence
published_soil/SRR22411281_1.fastq.gz	refseq/bacteria/GCF_010977555.1/GCF_010977555.1_ASM1097755v1_genomic.fna.gz	2.1367	0.0592	97.32	0.417	97.05-97.59	0.305	0.28-0.33	1	1.323	2941/25288	93.29	NZ_CP048815.1 Caulobacter rhizosphaerae strain KCTC 52515 chromosome, complete genome
published_soil/SRR22411281_1.fastq.gz	refseq/bacteria/GCF_022803015.1/GCF_022803015.1_ASM2280301v1_genomic.fna.gz	2.0400	0.0447	96.35	0.398	95.87-96.67	0.291	0.26-0.33	1	1.268	1659/20220	92.25	NZ_JAFKON010000010.1 Arthrobacter humicola strain 53 NODE_10_length_134337_cov_44.500089, whole genome shotgun sequence
published_soil/SRR22411281_1.fastq.gz	refseq/bacteria/GCF_001544535.1/GCF_001544535.1_ASM1544535v2_genomic.fna.gz	1.9371	0.0880	95.63	0.378	95.31-95.91	0.277	0.25-0.30	1	1.203	2560/41462	91.41	NZ_FCON02000001.1 Caballeronia choica isolate LMG 22940, whole genome shotgun sequence
published_soil/SRR22411281_1.fastq.gz	refseq/bacteria/GCF_023913775.1/GCF_023913775.1_ASM2391377v1_genomic.fna.gz	1.8655	0.0557	96.32	0.364	95.95-96.65	0.266	0.24-0.30	1	1.236	2051/27445	91.97	NZ_JAMXAX010000100.1 Acidovorax facilis strain DSM 649 NODE_100_length_21850_cov_17.221701, whole genome shotgun sequence
published_soil/SRR22411281_1.fastq.gz	refseq/bacteria/GCF_004134805.1/GCF_004134805.1_ASM413480v1_genomic.fna.gz	1.8384	0.0330	96.23	0.359	95.63-96.66	0.263	0.22-0.31	1	1.324	1058/14732	91.86	NZ_SDPM01000001.1 Agromyces atrinae strain DSM 23870 Scaffold1, whole genome shotgun sequence
published_soil/SRR22411281_1.fastq.gz	refseq/bacteria/GCF_900102525.1/GCF_900102525.1_IMG-taxon_2675903146_annotated_assembly_genomic.fna.gz	1.8111	0.0444	97.23	0.353	96.90-97.55	0.259	0.22-0.29	1	1.304	2227/22743	92.78	NZ_FNBZ01000020.1 Bosea robiniae strain DSM 26672, whole genome shotgun sequence
published_soil/SRR22411281_1.fastq.gz	refseq/bacteria/GCF_000442985.1/GCF_000442985.1_AtP4V1.0_genomic.fna.gz	1.6497	0.0427	97.22	0.322	96.72-97.60	0.236	0.21-0.27	1	1.191	2149/23989	92.51	NZ_CM002258.1 Agrobacterium fabacearum P4 chromosome 1, whole genome shotgun sequence
published_soil/SRR22411281_1.fastq.gz	refseq/bacteria/GCF_900105535.1/GCF_900105535.1_IMG-taxon_2634166282_annotated_assembly_genomic.fna.gz	1.6367	0.0339	97.52	0.319	97.02-97.88	0.234	0.20-0.27	1	1.183	1845/18850	92.78	NZ_LT629779.1 Pseudarthrobacter equi strain IMMIB L-1606 chromosome I
published_soil/SRR22411281_1.fastq.gz	refseq/bacteria/GCF_001742225.1/GCF_001742225.1_ASM174222v1_genomic.fna.gz	1.6060	0.0516	96.40	0.313	96.01-96.83	0.229	0.20-0.26	1	1.342	1999/29229	91.71	NZ_CP017075.1 Novosphingobium resinovorum strain SA1 chromosome, complete genome
published_soil/SRR22411281_1.fastq.gz	refseq/bacteria/GCF_001544515.1/GCF_001544515.1_ASM1544515v2_genomic.fna.gz	1.5141	0.0577	95.50	0.295	95.13-95.85	0.216	0.19-0.25	1	1.216	1683/35246	90.65	NZ_FCOL02000001.1 Caballeronia terrestris isolate LMG 22937, whole genome shotgun sequence
published_soil/SRR22411281_1.fastq.gz	refseq/bacteria/GCF_002902965.1/GCF_002902965.1_ASM290296v1_genomic.fna.gz	1.4933	0.0800	97.80	0.291	97.50-98.01	0.213	0.20-0.23	1	1.153	4726/48004	92.79	NZ_CP026105.1 Paraburkholderia hospita strain DSM 17164 chromosome 1, complete sequence
published_soil/SRR22411281_1.fastq.gz	refseq/bacteria/GCF_001545035.1/GCF_001545035.1_ASM154503v2_genomic.fna.gz	1.4558	0.0531	96.37	0.284	95.99-96.73	0.208	0.18-0.23	1	1.153	2052/33614	91.38	NZ_FCOJ02000194.1 Caballeronia glebae isolate LMG 29325, whole genome shotgun sequence
published_soil/SRR22411281_1.fastq.gz	refseq/bacteria/GCF_000619905.2/GCF_000619905.2_ASM61990v2_genomic.fna.gz	1.2781	0.0191	95.54	0.249	94.77-96.33	0.183	0.14-0.23	1	1.139	561/13534	90.24	NZ_CP012371.1 Nitrosospira briensis C-128 chromosome, complete genome
published_soil/SRR22411281_1.fastq.gz	refseq/bacteria/GCF_001298955.1/GCF_001298955.1_11861_6_29_genomic.fna.gz	1.1881	0.0371	96.50	0.232	96.06-96.96	0.170	0.15-0.19	1	1.144	1534/28980	90.96	NZ_CYTC01000001.1 Achromobacter kerstersii strain ATCC 31444, whole genome shotgun sequence
published_soil/SRR22411281_1.fastq.gz	refseq/bacteria/GCF_024055635.1/GCF_024055635.1_ASM2405563v1_genomic.fna.gz	1.1841	0.0245	95.09	0.231	94.38-95.84	0.169	0.13-0.21	1	1.324	639/19053	89.63	NZ_JAMXMB010000001.1 Microbacterium yannicii strain DSM 23203 138, whole genome shotgun sequence
published_soil/SRR22411281_1.fastq.gz	refseq/bacteria/GCF_003240585.1/GCF_003240585.1_ASM324058v1_genomic.fna.gz	0.9907	0.0301	95.56	0.193	95.01-96.27	0.141	0.11-0.17	1	1.192	931/28157	89.59	NZ_PCDP01000079.1 Rhizobium tubonense strain CCBAU 85046 NODE_105_length_439_cov_265.981_ID_209, whole genome shotgun sequence
published_soil/SRR22411281_1.fastq.gz	refseq/bacteria/GCF_009192765.1/GCF_009192765.1_ASM919276v1_genomic.fna.gz	0.7539	0.0199	97.21	0.147	96.51-97.88	0.108	0.08-0.13	1	1.085	1073/24694	90.38	NZ_VOHQ01000001.1 Agriterribacter humi strain YJ03 1, whole genome shotgun sequence
published_soil/SRR22411281_1.fastq.gz	refseq/bacteria/GCF_014641595.1/GCF_014641595.1_ASM1464159v1_genomic.fna.gz	0.6020	0.0221	96.39	0.117	95.45-97.23	0.086	0.07-0.11	1	1.052	929/34320	89.01	NZ_BMIA01000001.1 Dyadobacter endophyticus strain CGMCC 1.15288 sequence01, whole genome shotgun sequence
published_soil/SRR22411281_1.fastq.gz	refseq/archaea/GCF_000969885.1/GCF_000969885.1_ASM96988v1_genomic.fna.gz	0.3165	0.0046	96.25	0.062	93.82-97.08	0.045	0.03-0.09	1	1.022	181/13094	87.10	NZ_CP009501.1 Methanosarcina thermophila TM-1 chromosome, complete genome
published_soil/SRR22411280_1.fastq.gz	refseq/bacteria/GCF_021919345.1/GCF_021919345.1_ASM2191934v1_genomic.fna.gz	4.7954	0.1567	99.36	1.410	99.28-99.42	1.033	1.00-1.07	1	1.808	10183/19038	98.00	NZ_CP089293.1 Paenarthrobacter nicotinovorans strain ATCC 49919 chromosome, complete genome
published_soil/SRR22411280_1.fastq.gz	refseq/bacteria/GCF_001598455.1/GCF_001598455.1_ASM159845v1_genomic.fna.gz	4.4218	0.1445	95.00	1.300	94.83-95.16	0.952	0.88-1.02	1	1.717	2510/19560	93.59	NZ_BCYZ01000001.1 Sphingomonas pruni NBRC 15498, whole genome shotgun sequence
published_soil/SRR22411280_1.fastq.gz	refseq/bacteria/GCF_002531755.2/GCF_002531755.2_ASM253175v2_genomic.fna.gz	3.7447	0.2047	96.83	1.101	96.71-96.95	0.806	0.76-0.85	1	1.698	6508/31389	95.05	NZ_CP034998.1 Rhizobium acidisoli strain FH23 chromosome, complete genome
published_soil/SRR22411280_1.fastq.gz	refseq/bacteria/GCF_024756225.1/GCF_024756225.1_ASM2475622v1_genomic.fna.gz	3.7079	0.2000	96.54	1.090	96.42-96.65	0.798	0.76-0.83	1	1.659	5964/31737	94.75	NZ_JANUHC010000001.1 Telluria mixta strain LMG 11547 1, whole genome shotgun sequence
published_soil/SRR22411280_1.fastq.gz	refseq/bacteria/GCF_900105635.1/GCF_900105635.1_IMG-taxon_2639762655_annotated_assembly_genomic.fna.gz	3.4607	0.1619	96.59	1.018	96.43-96.73	0.745	0.70-0.79	1	1.629	4894/26894	94.65	NZ_FNTT01000002.1 Pseudomonas kilonensis strain DSM 13647, whole genome shotgun sequence
published_soil/SRR22411280_1.fastq.gz	refseq/bacteria/GCF_013185915.1/GCF_013185915.1_ASM1318591v1_genomic.fna.gz	3.3654	0.1082	96.56	0.990	96.42-96.71	0.725	0.67-0.77	1	1.617	3365/18965	94.57	NZ_JAAZUH010000001.1 Stenotrophomonas bentonitica strain DSM 103927 NODE_1, whole genome shotgun sequence
published_soil/SRR22411280_1.fastq.gz	refseq/bacteria/GCF_006438965.1/GCF_006438965.1_ASM643896v1_genomic.fna.gz	3.3193	0.1022	95.68	0.976	95.46-95.91	0.715	0.65-0.77	1	1.719	2434/18249	93.71	NZ_RCZM01000001.1 Pedococcus bigeumensis strain S9.3A scaffold1.1, whole genome shotgun sequence
published_soil/SRR22411280_1.fastq.gz	refseq/bacteria/GCF_011604665.1/GCF_011604665.1_ASM1160466v1_genomic.fna.gz	3.3150	0.1673	98.02	0.975	97.93-98.14	0.714	0.68-0.74	1	1.676	8415/29926	95.99	NZ_CP050066.1 Bradyrhizobium symbiodeficiens strain 101S1MB chromosome, complete genome
published_soil/SRR22411280_1.fastq.gz	refseq/bacteria/GCF_022808325.1/GCF_022808325.1_ASM2280832v1_genomic.fna.gz	3.2665	0.0653	96.01	0.961	95.76-96.25	0.703	0.63-0.77	1	1.897	1760/11980	94.00	NZ_JALGCL010000001.1 Lysobacter sedimenti strain 50 XZ-50_scaffold1, whole genome shotgun sequence
published_soil/SRR22411280_1.fastq.gz	refseq/bacteria/GCF_005862185.2/GCF_005862185.2_ASM586218v2_genomic.fna.gz	3.1997	0.1583	98.28	0.941	98.16-98.40	0.689	0.65-0.72	1	1.640	8604/29011	96.16	NZ_CP054027.1 Rhizobium hidalgonense strain JKLM 19E chromosome, complete genome
published_soil/SRR22411280_1.fastq.gz	refseq/bacteria/GCF_014712225.1/GCF_014712225.1_ASM1471222v1_genomic.fna.gz	2.8787	0.1034	97.85	0.846	97.72-98.01	0.620	0.58-0.65	1	1.520	5108/21248	95.51	NZ_JACXBW010000001.1 Pseudarthrobacter sulfonivorans strain ALL 1, whole genome shotgun sequence
published_soil/SRR22411280_1.fastq.gz	refseq/bacteria/GCF_030486595.1/GCF_030486595.1_ASM3048659v1_genomic.fna.gz	2.7444	0.1560	97.72	0.807	97.56-97.83	0.591	0.56-0.63	1	1.480	7455/33551	95.26	NZ_JAUJZH010000001.1 Variovorax ginsengisoli strain CGMCC 1.12090 L12090_1, whole genome shotgun sequence
published_soil/SRR22411280_1.fastq.gz	refseq/bacteria/GCF_013170785.1/GCF_013170785.1_ASM1317078v1_genomic.fna.gz	2.5933	0.1362	98.30	0.763	98.17-98.43	0.558	0.53-0.59	1	1.459	7940/30880	95.71	NZ_CP033507.1 Mesorhizobium jarvisii strain ATCC 33669 chromosome, complete genome
published_soil/SRR22411280_1.fastq.gz	refseq/bacteria/GCF_022803015.1/GCF_022803015.1_ASM2280301v1_genomic.fna.gz	2.2663	0.0779	96.98	0.666	96.84-97.22	0.488	0.44-0.52	1	1.381	3081/20220	94.11	NZ_JAFKON010000010.1 Arthrobacter humicola strain 53 NODE_10_length_134337_cov_44.500089, whole genome shotgun sequence
published_soil/SRR22411280_1.fastq.gz	refseq/bacteria/GCF_014646815.1/GCF_014646815.1_ASM1464681v1_genomic.fna.gz	2.1784	0.0748	95.36	0.641	95.09-95.64	0.469	0.42-0.51	1	1.566	1794/20414	92.46	NZ_BMNZ01000001.1 Terrabacter tumescens strain JCM 1365 sequence01, whole genome shotgun sequence
published_soil/SRR22411280_1.fastq.gz	refseq/bacteria/GCF_900103325.1/GCF_900103325.1_IMG-taxon_2596583656_annotated_assembly_genomic.fna.gz	2.0280	0.1045	95.46	0.596	95.26-95.71	0.437	0.40-0.47	1	1.360	2583/30231	92.37	NZ_FMXM01000121.1 Mesorhizobium qingshengii strain CGMCC 1.12097, whole genome shotgun sequence
published_soil/SRR22411280_1.fastq.gz	refseq/bacteria/GCF_000018665.1/GCF_000018665.1_ASM1866v1_genomic.fna.gz	2.0275	0.1001	97.82	0.596	97.66-98.00	0.437	0.41-0.46	1	1.302	5186/28420	94.66	NC_010002.1 Delftia acidovorans SPH-1, complete sequence
published_soil/SRR22411280_1.fastq.gz	refseq/bacteria/GCF_001544475.1/GCF_001544475.1_ASM1544475v2_genomic.fna.gz	1.9339	0.1074	98.98	0.569	98.82-99.11	0.416	0.39-0.44	1	1.278	8260/32628	95.67	NZ_FCNW02000001.1 Caballeronia humi isolate LMG 22934, whole genome shotgun sequence
published_soil/SRR22411280_1.fastq.gz	refseq/bacteria/GCF_900105535.1/GCF_900105535.1_IMG-taxon_2634166282_annotated_assembly_genomic.fna.gz	1.8543	0.0603	98.31	0.545	98.17-98.51	0.399	0.37-0.42	1	1.368	3730/18850	94.91	NZ_LT629779.1 Pseudarthrobacter equi strain IMMIB L-1606 chromosome I
published_soil/SRR22411280_1.fastq.gz	refseq/bacteria/GCF_011068405.5/GCF_011068405.5_ASM1106840v5_genomic.fna.gz	1.7768	0.1487	95.09	0.522	94.83-95.33	0.383	0.35-0.41	1	1.472	3056/44669	91.71	NZ_CP088280.1 Bradyrhizobium barranii subsp. barranii strain 323S2 chromosome, complete genome
published_soil/SRR22411280_1.fastq.gz	refseq/bacteria/GCF_000412675.1/GCF_000412675.1_ASM41267v1_genomic.fna.gz	1.7437	0.0783	96.24	0.513	95.96-96.49	0.375	0.34-0.41	1	1.245	2563/26347	92.76	NC_021505.1 Pseudomonas putida NBRC 14164, complete sequence
published_soil/SRR22411280_1.fastq.gz	refseq/bacteria/GCF_000264295.1/GCF_000264295.1_Rh17631_genomic.fna.gz	1.6540	0.0472	97.00	0.486	96.76-97.31	0.356	0.32-0.38	1	1.499	2023/16903	93.38	NZ_AJXT01000001.1 Rhodanobacter spathiphylli B39 contig001, whole genome shotgun sequence
published_soil/SRR22411280_1.fastq.gz	refseq/bacteria/GCF_001544535.1/GCF_001544535.1_ASM1544535v2_genomic.fna.gz	1.6416	0.1170	95.85	0.483	95.62-96.06	0.353	0.33-0.38	1	1.248	3385/41462	92.24	NZ_FCON02000001.1 Caballeronia choica isolate LMG 22940, whole genome shotgun sequence
published_soil/SRR22411280_1.fastq.gz	refseq/bacteria/GCF_010977555.1/GCF_010977555.1_ASM1097755v1_genomic.fna.gz	1.6226	0.0706	98.40	0.477	98.26-98.58	0.349	0.33-0.37	1	1.314	4631/25288	94.67	NZ_CP048815.1 Caulobacter rhizosphaerae strain KCTC 52515 chromosome, complete genome
published_soil/SRR22411280_1.fastq.gz	refseq/bacteria/GCF_007572485.1/GCF_007572485.1_ASM757248v1_genomic.fna.gz	1.5046	0.0694	95.67	0.442	95.30-96.02	0.324	0.29-0.37	1	1.254	1953/27225	91.85	NZ_VCIZ01000010.1 Cupriavidus campinensis strain S14E4C NODE_10_length_219434_cov_31.1521, whole genome shotgun sequence
published_soil/SRR22411280_1.fastq.gz	refseq/bacteria/GCF_024055635.1/GCF_024055635.1_ASM2405563v1_genomic.fna.gz	1.4745	0.0478	97.51	0.434	97.28-97.83	0.318	0.28-0.34	1	1.333	2427/19053	93.57	NZ_JAMXMB010000001.1 Microbacterium yannicii strain DSM 23203 138, whole genome shotgun sequence
published_soil/SRR22411280_1.fastq.gz	refseq/bacteria/GCF_010093345.1/GCF_010093345.1_ASM1009334v1_genomic.fna.gz	1.4135	0.0406	96.13	0.416	95.74-96.56	0.304	0.26-0.35	1	1.387	1342/16984	92.14	NZ_PDWT01000010.1 Pseudoxanthomonas yeongjuensis strain DSM 18204 NODE_10_length_85764_cov_31.4004, whole genome shotgun sequence
published_soil/SRR22411280_1.fastq.gz	refseq/bacteria/GCF_900102525.1/GCF_900102525.1_IMG-taxon_2675903146_annotated_assembly_genomic.fna.gz	1.3562	0.0522	97.48	0.399	97.17-97.82	0.292	0.25-0.32	1	1.274	2670/22743	93.32	NZ_FNBZ01000020.1 Bosea robiniae strain DSM 26672, whole genome shotgun sequence
published_soil/SRR22411280_1.fastq.gz	refseq/bacteria/GCF_001544515.1/GCF_001544515.1_ASM1544515v2_genomic.fna.gz	1.3004	0.0778	96.37	0.382	96.04-96.60	0.280	0.25-0.31	1	1.219	2794/35246	92.15	NZ_FCOL02000001.1 Caballeronia terrestris isolate LMG 22937, whole genome shotgun sequence
published_soil/SRR22411280_1.fastq.gz	refseq/bacteria/GCF_000264315.1/GCF_000264315.1_Rh18449_genomic.fna.gz	1.2822	0.0363	96.54	0.377	96.11-96.94	0.276	0.24-0.32	1	1.294	1405/16928	92.29	NZ_AJXU01000001.1 Rhodanobacter fulvus Jip2 contig001, whole genome shotgun sequence
published_soil/SRR22411280_1.fastq.gz	refseq/bacteria/GCF_008868005.1/GCF_008868005.1_ASM886800v1_genomic.fna.gz	1.2340	0.0327	95.96	0.363	95.46-96.34	0.266	0.23-0.31	1	1.332	1052/15713	91.65	NZ_WAAO01000001.1 Microbacterium algeriense strain G1 contig00001, whole genome shotgun sequence
published_soil/SRR22411280_1.fastq.gz	refseq/bacteria/GCF_007035805.1/GCF_007035805.1_ASM703580v1_genomic.fna.gz	1.2214	0.0425	99.09	0.359	98.90-99.33	0.263	0.24-0.28	1	1.149	3621/20329	94.59	NZ_AP019630.1 Enterobacter asburiae strain 17Nkhm-UP2 chromosome, complete genome
published_soil/SRR22411280_1.fastq.gz	refseq/bacteria/GCF_001545035.1/GCF_001545035.1_ASM154503v2_genomic.fna.gz	1.1623	0.0665	96.98	0.342	96.66-97.27	0.250	0.23-0.28	1	1.171	2937/33614	92.44	NZ_FCOJ02000194.1 Caballeronia glebae isolate LMG 29325, whole genome shotgun sequence
published_soil/SRR22411280_1.fastq.gz	refseq/bacteria/GCF_001742225.1/GCF_001742225.1_ASM174222v1_genomic.fna.gz	1.1590	0.0585	96.47	0.341	96.10-96.86	0.250	0.22-0.28	1	1.342	2184/29229	91.97	NZ_CP017075.1 Novosphingobium resinovorum strain SA1 chromosome, complete genome
published_soil/SRR22411280_1.fastq.gz	refseq/bacteria/GCF_019038595.1/GCF_019038595.1_ASM1903859v1_genomic.fna.gz	1.1500	0.0260	97.67	0.338	97.15-98.07	0.248	0.21-0.28	1	1.149	1447/13421	93.07	NZ_JAHOPF010000001.1 Kaistella soli strain DKR-2 contig1, whole genome shotgun sequence
published_soil/SRR22411280_1.fastq.gz	refseq/bacteria/GCF_003240585.1/GCF_003240585.1_ASM324058v1_genomic.fna.gz	1.1319	0.0540	95.32	0.333	94.91-95.64	0.244	0.22-0.28	1	1.245	1407/28157	90.79	NZ_PCDP01000079.1 Rhizobium tubonense strain CCBAU 85046 NODE_105_length_439_cov_265.981_ID_209, whole genome shotgun sequence
published_soil/SRR22411280_1.fastq.gz	refseq/bacteria/GCF_002902965.1/GCF_002902965.1_ASM290296v1_genomic.fna.gz	1.1263	0.0947	98.08	0.331	97.86-98.28	0.243	0.22-0.26	1	1.153	5783/48004	93.40	NZ_CP026105.1 Paraburkholderia hospita strain DSM 17164 chromosome 1, complete sequence
published_soil/SRR22411280_1.fastq.gz	refseq/bacteria/GCF_019968625.1/GCF_019968625.1_ASM1996862v1_genomic.fna.gz	1.1079	0.0476	97.37	0.326	97.06-97.78	0.239	0.20-0.26	1	1.214	2419/25442	92.69	NZ_CP082965.1 Achromobacter mucicolens strain IA chromosome
published_soil/SRR22411280_1.fastq.gz	refseq/bacteria/GCF_024809135.1/GCF_024809135.1_ASM2480913v1_genomic.fna.gz	1.1060	0.0296	95.29	0.325	94.71-95.85	0.238	0.19-0.29	1	1.229	774/15904	90.71	NZ_JANUFG010000001.1 Microbacterium phyllosphaerae strain JUb90 Ga0480635_01, whole genome shotgun sequence
published_soil/SRR22411280_1.fastq.gz	refseq/bacteria/GCF_023913775.1/GCF_023913775.1_ASM2391377v1_genomic.fna.gz	1.0698	0.0501	96.17	0.315	95.78-96.51	0.230	0.21-0.26	1	1.175	1722/27445	91.46	NZ_JAMXAX010000100.1 Acidovorax facilis strain DSM 649 NODE_100_length_21850_cov_17.221701, whole genome shotgun sequence
published_soil/SRR22411280_1.fastq.gz	refseq/bacteria/GCF_014156615.1/GCF_014156615.1_ASM1415661v1_genomic.fna.gz	1.0580	0.0377	97.90	0.311	97.56-98.26	0.228	0.20-0.25	1	1.121	2276/21127	93.06	NZ_SBFD01000001.1 Pantoea pleuroti strain JZB 2120015 Scaffold1, whole genome shotgun sequence
published_soil/SRR22411280_1.fastq.gz	refseq/bacteria/GCF_000442985.1/GCF_000442985.1_AtP4V1.0_genomic.fna.gz	1.0487	0.0426	96.96	0.308	96.51-97.41	0.226	0.19-0.26	1	1.172	1905/23989	92.15	NZ_CM002258.1 Agrobacterium fabacearum P4 chromosome 1, whole genome shotgun sequence
published_soil/SRR22411280_1.fastq.gz	refseq/bacteria/GCF_024349785.1/GCF_024349785.1_ASM2434978v1_genomic.fna.gz	1.0259	0.0390	97.37	0.302	96.90-97.71	0.221	0.19-0.25	1	1.255	1974/22140	92.50	NZ_AP018817.1 Sphingomonas bisphenolicum strain AO1 chromosome 1, complete sequence
published_soil/SRR22411280_1.fastq.gz	refseq/bacteria/GCF_000619905.2/GCF_000619905.2_ASM61990v2_genomic.fna.gz	0.9662	0.0226	95.71	0.284	95.07-96.27	0.208	0.17-0.25	1	1.131	666/13534	90.74	NZ_CP012371.1 Nitrosospira briensis C-128 chromosome, complete genome
published_soil/SRR22411280_1.fastq.gz	refseq/bacteria/GCF_904848585.1/GCF_904848585.1_LMG_28727_genomic.fna.gz	0.9300	0.0582	95.70	0.273	95.22-96.06	0.200	0.18-0.23	1	1.131	1719/36199	90.64	NZ_CAJHCR010000001.1 Paraburkholderia kirstenboschensis strain LMG 28727 isolate LMG 28727, whole genome shotgun sequence
published_soil/SRR22411280_1.fastq.gz	refseq/bacteria/GCF_013327855.1/GCF_013327855.1_ASM1332785v1_genomic.fna.gz	0.8480	0.0288	95.34	0.249	94.68-95.94	0.183	0.15-0.22	1	1.191	784/20097	90.06	NZ_JABUMX010000010.1 Phyllobacterium pellucidum strain BT25 5178.BT25.1_10_BT25.00010_5178.BT25.1, whole genome shotgun sequence
published_soil/SRR22411280_1.fastq.gz	refseq/bacteria/GCF_009935415.1/GCF_009935415.1_ASM993541v1_genomic.fna.gz	0.8102	0.0331	96.96	0.238	96.51-97.42	0.174	0.15-0.20	1	1.095	1519/24171	91.46	NZ_NKAQ01000001.1 Priestia megaterium strain 22-2 22-2_R1_(paired)_contig_1, whole genome shotgun sequence
published_soil/SRR22411280_1.fastq.gz	refseq/bacteria/GCF_014268485.2/GCF_014268485.2_ASM1426848v2_genomic.fna.gz	0.7949	0.0384	95.81	0.234	95.25-96.31	0.171	0.14-0.20	1	1.147	1202/28163	90.33	NZ_CP077090.1 Pseudomonas zeae strain OE 48.2 chromosome, complete genome
published_soil/SRR22411280_1.fastq.gz	refseq/bacteria/GCF_001298955.1/GCF_001298955.1_11861_6_29_genomic.fna.gz	0.7708	0.0378	96.76	0.227	96.35-97.16	0.166	0.14-0.19	1	1.114	1637/28980	91.15	NZ_CYTC01000001.1 Achromobacter kerstersii strain ATCC 31444, whole genome shotgun sequence
published_soil/SRR22411280_1.fastq.gz	refseq/bacteria/GCF_011046895.1/GCF_011046895.1_ASM1104689v1_genomic.fna.gz	0.7207	0.0262	97.91	0.212	97.45-98.28	0.155	0.14-0.18	1	1.148	1638/21481	92.03	NZ_CP049250.1 Rhizobium rhizoryzae strain DSM 29514 chromosome, complete genome
published_soil/SRR22411280_1.fastq.gz	refseq/bacteria/GCF_009192765.1/GCF_009192765.1_ASM919276v1_genomic.fna.gz	0.6786	0.0281	96.75	0.200	96.12-97.35	0.146	0.12-0.18	1	1.096	1234/24694	90.79	NZ_VOHQ01000001.1 Agriterribacter humi strain YJ03 1, whole genome shotgun sequence
published_soil/SRR22411280_1.fastq.gz	refseq/bacteria/GCF_015034585.1/GCF_015034585.1_ASM1503458v1_genomic.fna.gz	0.6259	0.0172	95.66	0.184	94.77-96.62	0.135	0.09-0.18	1	1.216	524/15871	89.58	NZ_CP063232.1 Thermobifida fusca strain UPMC 901 chromosome, complete genome
published_soil/SRR22411280_1.fastq.gz	refseq/bacteria/GCF_000751215.2/GCF_000751215.2_Bglat_v2_genomic.fna.gz	0.6156	0.0361	96.99	0.181	96.49-97.52	0.133	0.11-0.15	1	1.173	1714/34807	90.74	NZ_CCNS02000139.1 Caballeronia glathei strain LMG 14190, whole genome shotgun sequence
published_soil/SRR22411280_1.fastq.gz	refseq/bacteria/GCF_902860155.1/GCF_902860155.1_LMG_1861_genomic.fna.gz	0.5844	0.0263	96.17	0.172	95.44-96.77	0.126	0.10-0.16	1	1.110	966/26759	89.84	NZ_CADILD010000001.1 Achromobacter piechaudii strain LMG 1861 isolate LMG 1861, whole genome shotgun sequence
