published_soil/SRR22411266_1.fastq.gz	refseq/bacteria/GCF_900102045.1/GCF_900102045.1_IMG-taxon_2639762638_annotated_assembly_genomic.fna.gz	4.1104	0.2262	99.26	1.827	99.20-99.30	1.338	1.30-1.38	2	2.123	16344/27621	98.32	NZ_FNKJ01000003.1 Pseudomonas moorei strain DSM 12647, whole genome shotgun sequence
published_soil/SRR22411266_1.fastq.gz	refseq/bacteria/GCF_021919345.1/GCF_021919345.1_ASM2191934v1_genomic.fna.gz	3.9750	0.1498	99.24	1.767	99.18-99.30	1.294	1.25-1.33	2	2.030	11028/19038	98.25	NZ_CP089293.1 Paenarthrobacter nicotinovorans strain ATCC 49919 chromosome, complete genome
published_soil/SRR22411266_1.fastq.gz	refseq/bacteria/GCF_002531755.2/GCF_002531755.2_ASM253175v2_genomic.fna.gz	3.4316	0.2163	96.83	1.525	96.74-96.93	1.117	1.08-1.16	2	1.997	7884/31389	95.64	NZ_CP034998.1 Rhizobium acidisoli strain FH23 chromosome, complete genome
published_soil/SRR22411266_1.fastq.gz	refseq/bacteria/GCF_008801925.2/GCF_008801925.2_ASM880192v2_genomic.fna.gz	3.1533	0.2371	95.49	1.401	95.41-95.60	1.026	0.97-1.08	1	1.654	5880/37776	94.18	NZ_CP062803.1 Cupriavidus basilensis strain DSM 11853 chromosome 1, complete sequence
published_soil/SRR22411266_1.fastq.gz	refseq/bacteria/GCF_000015725.1/GCF_000015725.1_ASM1572v1_genomic.fna.gz	2.9058	0.1134	96.13	1.292	95.98-96.29	0.946	0.87-1.00	2	2.211	3499/19092	94.67	NC_008825.1 Methylibium petroleiphilum PM1, complete sequence
published_soil/SRR22411266_1.fastq.gz	refseq/bacteria/GCF_023913775.1/GCF_023913775.1_ASM2391377v1_genomic.fna.gz	2.7423	0.1481	97.16	1.219	97.06-97.27	0.893	0.85-0.93	1	1.584	6735/27445	95.57	NZ_JAMXAX010000100.1 Acidovorax facilis strain DSM 649 NODE_100_length_21850_cov_17.221701, whole genome shotgun sequence
published_soil/SRR22411266_1.fastq.gz	refseq/bacteria/GCF_005862185.2/GCF_005862185.2_ASM586218v2_genomic.fna.gz	2.6433	0.1507	98.34	1.175	98.26-98.44	0.860	0.82-0.89	1	1.965	10146/29011	96.67	NZ_CP054027.1 Rhizobium hidalgonense strain JKLM 19E chromosome, complete genome
published_soil/SRR22411266_1.fastq.gz	refseq/bacteria/GCF_022808325.1/GCF_022808325.1_ASM2280832v1_genomic.fna.gz	2.6118	0.0602	96.23	1.161	96.03-96.46	0.850	0.76-0.92	1	2.113	2141/11980	94.60	NZ_JALGCL010000001.1 Lysobacter sedimenti strain 50 XZ-50_scaffold1, whole genome shotgun sequence
published_soil/SRR22411266_1.fastq.gz	refseq/bacteria/GCF_001742225.1/GCF_001742225.1_ASM174222v1_genomic.fna.gz	2.3948	0.1393	96.03	1.064	95.88-96.15	0.779	0.73-0.83	1	1.563	4640/29229	94.24	NZ_CP017075.1 Novosphingobium resinovorum strain SA1 chromosome, complete genome
published_soil/SRR22411266_1.fastq.gz	refseq/bacteria/GCF_013170785.1/GCF_013170785.1_ASM1317078v1_genomic.fna.gz	2.3743	0.1437	98.90	1.055	98.81-98.97	0.773	0.75-0.80	1	1.701	12011/30880	97.00	NZ_CP033507.1 Mesorhizobium jarvisii strain ATCC 33669 chromosome, complete genome
published_soil/SRR22411266_1.fastq.gz	refseq/bacteria/GCF_014712225.1/GCF_014712225.1_ASM1471222v1_genomic.fna.gz	2.3667	0.0980	98.22	1.052	98.11-98.33	0.770	0.73-0.80	1	1.773	6671/21248	96.33	NZ_JACXBW010000001.1 Pseudarthrobacter sulfonivorans strain ALL 1, whole genome shotgun sequence
published_soil/SRR22411266_1.fastq.gz	refseq/bacteria/GCF_011604665.1/GCF_011604665.1_ASM1160466v1_genomic.fna.gz	2.3193	0.1349	98.09	1.031	98.01-98.19	0.755	0.72-0.79	1	1.752	8939/29926	96.18	NZ_CP050066.1 Bradyrhizobium symbiodeficiens strain 101S1MB chromosome, complete genome
published_soil/SRR22411266_1.fastq.gz	refseq/bacteria/GCF_006438965.1/GCF_006438965.1_ASM643896v1_genomic.fna.gz	2.1269	0.0755	96.57	0.945	96.43-96.74	0.692	0.64-0.73	1	1.801	3188/18249	94.53	NZ_RCZM01000001.1 Pedococcus bigeumensis strain S9.3A scaffold1.1, whole genome shotgun sequence
published_soil/SRR22411266_1.fastq.gz	refseq/bacteria/GCF_900110105.1/GCF_900110105.1_IMG-taxon_2651870109_annotated_assembly_genomic.fna.gz	2.1185	0.1465	95.64	0.942	95.48-95.80	0.690	0.64-0.72	1	1.781	4520/35491	93.57	NZ_FOCL01000028.1 Mucilaginibacter gossypiicola strain Gh-48, whole genome shotgun sequence
published_soil/SRR22411266_1.fastq.gz	refseq/bacteria/GCF_014646815.1/GCF_014646815.1_ASM1464681v1_genomic.fna.gz	1.9919	0.0788	95.95	0.885	95.74-96.15	0.648	0.59-0.70	1	1.705	2763/20414	93.75	NZ_BMNZ01000001.1 Terrabacter tumescens strain JCM 1365 sequence01, whole genome shotgun sequence
published_soil/SRR22411266_1.fastq.gz	refseq/bacteria/GCF_030486595.1/GCF_030486595.1_ASM3048659v1_genomic.fna.gz	1.9066	0.1250	97.39	0.847	97.24-97.51	0.621	0.58-0.66	1	1.570	6985/33551	95.06	NZ_JAUJZH010000001.1 Variovorax ginsengisoli strain CGMCC 1.12090 L12090_1, whole genome shotgun sequence
published_soil/SRR22411266_1.fastq.gz	refseq/bacteria/GCF_014268485.2/GCF_014268485.2_ASM1426848v2_genomic.fna.gz	1.7773	0.0991	97.12	0.790	96.97-97.27	0.578	0.54-0.61	1	1.462	5091/28163	94.63	NZ_CP077090.1 Pseudomonas zeae strain OE 48.2 chromosome, complete genome
published_soil/SRR22411266_1.fastq.gz	refseq/bacteria/GCF_003667725.1/GCF_003667725.1_ASM366772v1_genomic.fna.gz	1.7554	0.0820	97.80	0.780	97.65-97.95	0.571	0.54-0.60	1	1.378	5280/23726	95.27	NZ_CP033022.1 Agrobacterium fabrum strain 1D132 chromosome circular, complete sequence
published_soil/SRR22411266_1.fastq.gz	refseq/bacteria/GCF_008123425.1/GCF_008123425.1_ASM812342v1_genomic.fna.gz	1.7547	0.1468	95.16	0.780	95.00-95.33	0.571	0.53-0.60	1	1.569	4134/43423	92.69	NZ_VSSS01000001.1 Bradyrhizobium rifense strain CTAW71 CTAW71_S1_R1__contig_1, whole genome shotgun sequence
published_soil/SRR22411266_1.fastq.gz	refseq/bacteria/GCF_010093345.1/GCF_010093345.1_ASM1009334v1_genomic.fna.gz	1.7162	0.0568	96.73	0.763	96.53-96.94	0.559	0.51-0.59	1	1.669	2680/16984	94.22	NZ_PDWT01000010.1 Pseudoxanthomonas yeongjuensis strain DSM 18204 NODE_10_length_85764_cov_31.4004, whole genome shotgun sequence
published_soil/SRR22411266_1.fastq.gz	refseq/bacteria/GCF_024756225.1/GCF_024756225.1_ASM2475622v1_genomic.fna.gz	1.7123	0.1065	95.99	0.761	95.85-96.18	0.557	0.52-0.59	1	1.495	3884/31737	93.45	NZ_JANUHC010000001.1 Telluria mixta strain LMG 11547 1, whole genome shotgun sequence
published_soil/SRR22411266_1.fastq.gz	refseq/bacteria/GCF_000442985.1/GCF_000442985.1_AtP4V1.0_genomic.fna.gz	1.7075	0.0800	98.71	0.759	98.56-98.88	0.556	0.52-0.58	1	1.391	6981/23989	96.10	NZ_CM002258.1 Agrobacterium fabacearum P4 chromosome 1, whole genome shotgun sequence
published_soil/SRR22411266_1.fastq.gz	refseq/bacteria/GCF_001544475.1/GCF_001544475.1_ASM1544475v2_genomic.fna.gz	1.6746	0.1073	99.09	0.744	99.01-99.21	0.545	0.52-0.57	1	1.379	10536/32628	96.42	NZ_FCNW02000001.1 Caballeronia humi isolate LMG 22934, whole genome shotgun sequence
published_soil/SRR22411266_1.fastq.gz	refseq/bacteria/GCF_013185915.1/GCF_013185915.1_ASM1318591v1_genomic.fna.gz	1.6396	0.0608	96.08	0.729	95.87-96.30	0.534	0.49-0.57	1	1.415	2320/18965	93.45	NZ_JAAZUH010000001.1 Stenotrophomonas bentonitica strain DSM 103927 NODE_1, whole genome shotgun sequence
published_soil/SRR22411266_1.fastq.gz	refseq/bacteria/GCF_900103325.1/GCF_900103325.1_IMG-taxon_2596583656_annotated_assembly_genomic.fna.gz	1.6289	0.0967	96.09	0.724	95.95-96.29	0.530	0.50-0.56	1	1.469	3680/30231	93.43	NZ_FMXM01000121.1 Mesorhizobium qingshengii strain CGMCC 1.12097, whole genome shotgun sequence
published_soil/SRR22411266_1.fastq.gz	refseq/bacteria/GCF_900105535.1/GCF_900105535.1_IMG-taxon_2634166282_annotated_assembly_genomic.fna.gz	1.6235	0.0609	98.86	0.722	98.73-99.02	0.528	0.49-0.55	1	1.462	5529/18850	96.12	NZ_LT629779.1 Pseudarthrobacter equi strain IMMIB L-1606 chromosome I
published_soil/SRR22411266_1.fastq.gz	refseq/bacteria/GCF_004306555.1/GCF_004306555.1_ASM430655v1_genomic.fna.gz	1.5960	0.1019	97.44	0.709	97.28-97.61	0.519	0.49-0.55	1	1.591	6025/32590	94.70	NZ_SILH01000002.1 Rhizobium leguminosarum strain SM52 map unlocalized plasmid pSM52_Rh01 p_SM52_Rh01, whole genome shotgun sequence
published_soil/SRR22411266_1.fastq.gz	refseq/bacteria/GCF_002934665.1/GCF_002934665.1_ASM293466v1_genomic.fna.gz	1.5499	0.0871	96.47	0.689	96.29-96.65	0.504	0.47-0.53	1	1.433	3775/28471	93.69	NZ_NIRS01000001.1 Pseudomonas laurylsulfatiphila strain AP3_16 contig1, whole genome shotgun sequence
published_soil/SRR22411266_1.fastq.gz	refseq/bacteria/GCF_022803015.1/GCF_022803015.1_ASM2280301v1_genomic.fna.gz	1.5428	0.0612	97.08	0.686	96.92-97.30	0.502	0.46-0.53	1	1.505	3262/20220	94.28	NZ_JAFKON010000010.1 Arthrobacter humicola strain 53 NODE_10_length_134337_cov_44.500089, whole genome shotgun sequence
published_soil/SRR22411266_1.fastq.gz	refseq/bacteria/GCF_013347285.1/GCF_013347285.1_ASM1334728v1_genomic.fna.gz	1.5188	0.0869	95.18	0.675	94.98-95.41	0.494	0.45-0.54	1	1.372	2494/29012	92.39	NZ_CP054619.1 Azospirillum oryzae strain KACC 14407 chromosome, complete genome
published_soil/SRR22411266_1.fastq.gz	refseq/bacteria/GCF_014207355.1/GCF_014207355.1_ASM1420735v1_genomic.fna.gz	1.4289	0.0866	95.10	0.635	94.84-95.30	0.465	0.43-0.50	1	1.368	2497/31285	92.17	NZ_JACHEF010000001.1 Mesorhizobium sangaii strain DSM 100039 Ga0415300_01, whole genome shotgun sequence
published_soil/SRR22411266_1.fastq.gz	refseq/bacteria/GCF_000264295.1/GCF_000264295.1_Rh17631_genomic.fna.gz	1.3439	0.0442	96.70	0.597	96.50-96.99	0.437	0.40-0.47	1	1.494	2176/16903	93.60	NZ_AJXT01000001.1 Rhodanobacter spathiphylli B39 contig001, whole genome shotgun sequence
published_soil/SRR22411266_1.fastq.gz	refseq/bacteria/GCF_001544535.1/GCF_001544535.1_ASM1544535v2_genomic.fna.gz	1.3266	0.1090	95.76	0.590	95.55-95.94	0.432	0.41-0.46	1	1.321	3863/41462	92.63	NZ_FCON02000001.1 Caballeronia choica isolate LMG 22940, whole genome shotgun sequence
published_soil/SRR22411266_1.fastq.gz	refseq/bacteria/GCF_010977555.1/GCF_010977555.1_ASM1097755v1_genomic.fna.gz	1.3046	0.0654	98.16	0.580	98.01-98.33	0.425	0.40-0.44	1	1.370	5032/25288	94.93	NZ_CP048815.1 Caulobacter rhizosphaerae strain KCTC 52515 chromosome, complete genome
published_soil/SRR22411266_1.fastq.gz	refseq/bacteria/GCF_019038595.1/GCF_019038595.1_ASM1903859v1_genomic.fna.gz	1.2789	0.0333	98.13	0.568	97.95-98.37	0.416	0.38-0.44	1	1.257	2596/13421	94.84	NZ_JAHOPF010000001.1 Kaistella soli strain DKR-2 contig1, whole genome shotgun sequence
published_soil/SRR22411266_1.fastq.gz	refseq/bacteria/GCF_903166585.1/GCF_903166585.1_Q2390_genomic.fna.gz	1.1919	0.0593	98.41	0.530	98.27-98.60	0.388	0.36-0.41	1	1.245	5048/25299	94.93	NZ_CAESCM010000001.1 Pedobacter ghigonis strain Marseille-Q2390, whole genome shotgun sequence
published_soil/SRR22411266_1.fastq.gz	refseq/bacteria/GCF_014268495.2/GCF_014268495.2_ASM1426849v2_genomic.fna.gz	1.1693	0.0631	95.30	0.520	94.94-95.61	0.381	0.34-0.43	1	1.305	1970/27142	91.89	NZ_CP077087.1 Pseudomonas monsensis strain PGSB 8459 chromosome, complete genome
published_soil/SRR22411266_1.fastq.gz	refseq/bacteria/GCF_009192765.1/GCF_009192765.1_ASM919276v1_genomic.fna.gz	1.1415	0.0546	98.70	0.507	98.59-98.90	0.372	0.35-0.39	1	1.209	5214/24694	95.11	NZ_VOHQ01000001.1 Agriterribacter humi strain YJ03 1, whole genome shotgun sequence
published_soil/SRR22411266_1.fastq.gz	refseq/bacteria/GCF_001544515.1/GCF_001544515.1_ASM1544515v2_genomic.fna.gz	1.0804	0.0745	96.19	0.480	95.92-96.47	0.352	0.32-0.39	1	1.301	3202/35246	92.55	NZ_FCOL02000001.1 Caballeronia terrestris isolate LMG 22937, whole genome shotgun sequence
published_soil/SRR22411266_1.fastq.gz	refseq/bacteria/GCF_000619905.2/GCF_000619905.2_ASM61990v2_genomic.fna.gz	1.0680	0.0288	95.36	0.475	94.88-95.74	0.348	0.30-0.40	1	1.216	931/13534	91.73	NZ_CP012371.1 Nitrosospira briensis C-128 chromosome, complete genome
published_soil/SRR22411266_1.fastq.gz	refseq/bacteria/GCF_002902965.1/GCF_002902965.1_ASM290296v1_genomic.fna.gz	1.0334	0.1002	98.66	0.459	98.54-98.80	0.336	0.32-0.35	1	1.225	9212/48004	94.81	NZ_CP026105.1 Paraburkholderia hospita strain DSM 17164 chromosome 1, complete sequence
published_soil/SRR22411266_1.fastq.gz	refseq/bacteria/GCF_900102525.1/GCF_900102525.1_IMG-taxon_2675903146_annotated_assembly_genomic.fna.gz	1.0089	0.0448	97.99	0.448	97.80-98.23	0.328	0.30-0.35	1	1.283	3480/22743	94.12	NZ_FNBZ01000020.1 Bosea robiniae strain DSM 26672, whole genome shotgun sequence
published_soil/SRR22411266_1.fastq.gz	refseq/bacteria/GCF_010093305.1/GCF_010093305.1_ASM1009330v1_genomic.fna.gz	0.9945	0.0337	96.40	0.442	96.04-96.76	0.324	0.28-0.36	1	1.416	1588/17404	92.57	NZ_PDWS01000010.1 Pseudoxanthomonas sacheonensis strain DSM 19373 NODE_10_length_143637_cov_18.2513, whole genome shotgun sequence
published_soil/SRR22411266_1.fastq.gz	refseq/bacteria/GCF_024809135.1/GCF_024809135.1_ASM2480913v1_genomic.fna.gz	0.9748	0.0301	95.51	0.433	95.00-95.94	0.317	0.27-0.38	1	1.367	1073/15904	91.67	NZ_JANUFG010000001.1 Microbacterium phyllosphaerae strain JUb90 Ga0480635_01, whole genome shotgun sequence
published_soil/SRR22411266_1.fastq.gz	refseq/bacteria/GCF_000383275.1/GCF_000383275.1_ASM38327v1_genomic.fna.gz	0.9460	0.0587	96.52	0.420	96.26-96.80	0.308	0.28-0.34	1	1.221	2868/31787	92.53	NZ_KB911034.1 Paraburkholderia caledonica strain 376MFSha3.1 H281DRAFT_scaffold00001.1, whole genome shotgun sequence
published_soil/SRR22411266_1.fastq.gz	refseq/bacteria/GCF_001545035.1/GCF_001545035.1_ASM154503v2_genomic.fna.gz	0.8933	0.0589	97.64	0.397	97.40-97.92	0.291	0.26-0.31	1	1.225	4132/33614	93.46	NZ_FCOJ02000194.1 Caballeronia glebae isolate LMG 29325, whole genome shotgun sequence
published_soil/SRR22411266_1.fastq.gz	refseq/bacteria/GCF_000264315.1/GCF_000264315.1_Rh18449_genomic.fna.gz	0.8846	0.0289	95.26	0.393	94.70-95.80	0.288	0.24-0.34	1	1.342	963/16928	91.17	NZ_AJXU01000001.1 Rhodanobacter fulvus Jip2 contig001, whole genome shotgun sequence
published_soil/SRR22411266_1.fastq.gz	refseq/bacteria/GCF_900277125.1/GCF_900277125.1_ASM90027712v1_genomic.fna.gz	0.8784	0.0461	96.24	0.390	95.86-96.58	0.286	0.25-0.32	1	1.203	1969/25463	92.07	NZ_OPYN01000001.1 Pseudomonas inefficax strain JV551A3, whole genome shotgun sequence
published_soil/SRR22411266_1.fastq.gz	refseq/bacteria/GCF_029542105.1/GCF_029542105.1_ASM2954210v1_genomic.fna.gz	0.8298	0.0501	98.24	0.369	98.01-98.48	0.270	0.25-0.29	1	1.153	4285/30757	93.84	NZ_CP107037.1 Paenibacillus amylolyticus strain SQR-21 chromosome
published_soil/SRR22411266_1.fastq.gz	refseq/bacteria/GCF_000023865.1/GCF_000023865.1_ASM2386v1_genomic.fna.gz	0.8187	0.0297	98.70	0.364	98.44-99.03	0.266	0.24-0.29	1	1.196	2973/18599	94.26	NC_013159.1 Saccharomonospora viridis DSM 43017, complete sequence
published_soil/SRR22411266_1.fastq.gz	refseq/bacteria/GCF_907164545.1/GCF_907164545.1_R-69919_genomic.fna.gz	0.8040	0.0403	95.57	0.357	95.19-95.96	0.262	0.23-0.30	1	1.188	1477/25602	91.21	NZ_CAJQZB010000001.1 Paraburkholderia gardini strain R-69919 isolate R-69919, whole genome shotgun sequence
published_soil/SRR22411266_1.fastq.gz	refseq/bacteria/GCF_000708285.2/GCF_000708285.2_Genome_Assembly_for_Pedobacter_borealis_DSM19626_genomic.fna.gz	0.7943	0.0370	95.35	0.353	94.92-95.67	0.259	0.22-0.30	1	1.158	1251/23547	90.97	NZ_JAUG01000001.1 Pedobacter borealis DSM 19626 Contig001, whole genome shotgun sequence
published_soil/SRR22411266_1.fastq.gz	refseq/bacteria/GCF_902860155.1/GCF_902860155.1_LMG_1861_genomic.fna.gz	0.7804	0.0405	97.55	0.347	97.25-97.82	0.254	0.23-0.28	1	1.218	2854/26759	93.03	NZ_CADILD010000001.1 Achromobacter piechaudii strain LMG 1861 isolate LMG 1861, whole genome shotgun sequence
published_soil/SRR22411266_1.fastq.gz	refseq/bacteria/GCF_000751215.2/GCF_000751215.2_Bglat_v2_genomic.fna.gz	0.7457	0.0505	96.07	0.331	95.73-96.36	0.243	0.22-0.27	1	1.181	2209/34807	91.49	NZ_CCNS02000139.1 Caballeronia glathei strain LMG 14190, whole genome shotgun sequence
published_soil/SRR22411266_1.fastq.gz	refseq/bacteria/GCF_003240585.1/GCF_003240585.1_ASM324058v1_genomic.fna.gz	0.7296	0.0401	96.30	0.324	95.92-96.66	0.237	0.21-0.27	1	1.252	1894/28157	91.66	NZ_PCDP01000079.1 Rhizobium tubonense strain CCBAU 85046 NODE_105_length_439_cov_265.981_ID_209, whole genome shotgun sequence
published_soil/SRR22411266_1.fastq.gz	refseq/bacteria/GCF_001267925.1/GCF_001267925.1_ASM126792v1_genomic.fna.gz	0.7280	0.0304	96.38	0.324	95.92-96.87	0.237	0.20-0.27	1	1.213	1410/20469	91.73	NZ_CP011409.1 Herbaspirillum hiltneri N3 chromosome, complete genome
published_soil/SRR22411266_1.fastq.gz	refseq/bacteria/GCF_013204795.1/GCF_013204795.1_ASM1320479v1_genomic.fna.gz	0.7200	0.0377	97.99	0.320	97.65-98.31	0.234	0.21-0.26	1	1.145	3052/26887	93.22	NZ_JABMKW010000010.1 Pedobacter panaciterrae strain LMG 23400 Contig_10_427.475, whole genome shotgun sequence
published_soil/SRR22411266_1.fastq.gz	refseq/bacteria/GCF_904848585.1/GCF_904848585.1_LMG_28727_genomic.fna.gz	0.7168	0.0518	95.70	0.319	95.36-96.00	0.233	0.21-0.26	1	1.165	1967/36199	91.03	NZ_CAJHCR010000001.1 Paraburkholderia kirstenboschensis strain LMG 28727 isolate LMG 28727, whole genome shotgun sequence
published_soil/SRR22411266_1.fastq.gz	refseq/bacteria/GCF_001544695.2/GCF_001544695.2_ASM154469v2_genomic.fna.gz	0.6875	0.0559	95.19	0.306	94.77-95.54	0.224	0.19-0.26	1	1.174	1831/41218	90.44	NZ_FCOM02000349.1 Caballeronia arvi isolate LMG 29317, whole genome shotgun sequence
published_soil/SRR22411266_1.fastq.gz	refseq/bacteria/GCF_003330785.1/GCF_003330785.1_ASM333078v1_genomic.fna.gz	0.6551	0.0414	95.54	0.291	95.07-95.98	0.213	0.18-0.25	1	1.151	1536/32226	90.65	NZ_CP024934.1 Paraburkholderia graminis strain PHS1 chromosome PHS1_A, complete sequence
published_soil/SRR22411266_1.fastq.gz	refseq/bacteria/GCF_900102085.1/GCF_900102085.1_IMG-taxon_2654588110_annotated_assembly_genomic.fna.gz	0.6527	0.0356	96.48	0.290	96.06-96.85	0.212	0.18-0.24	1	1.127	1805/28058	91.53	NZ_FMVM01000034.1 Paenibacillus polysaccharolyticus strain BL9, whole genome shotgun sequence
published_soil/SRR22411266_1.fastq.gz	refseq/bacteria/GCF_025660415.1/GCF_025660415.1_ASM2566041v1_genomic.fna.gz	0.5803	0.0160	96.41	0.258	95.82-96.97	0.189	0.15-0.23	1	1.120	798/14056	91.16	NZ_JAOUSE010000001.1 Caldibacillus thermolactis strain DSM 23332 DSM23332_1, whole genome shotgun sequence
published_soil/SRR22411266_1.fastq.gz	refseq/bacteria/GCF_009935415.1/GCF_009935415.1_ASM993541v1_genomic.fna.gz	0.5761	0.0271	96.76	0.256	96.32-97.21	0.188	0.16-0.21	1	1.111	1522/24171	91.47	NZ_NKAQ01000001.1 Priestia megaterium strain 22-2 22-2_R1_(paired)_contig_1, whole genome shotgun sequence
published_soil/SRR22411266_1.fastq.gz	refseq/bacteria/GCF_019048385.1/GCF_019048385.1_ASM1904838v1_genomic.fna.gz	0.5343	0.0211	97.12	0.237	96.51-97.58	0.174	0.15-0.21	1	1.092	1333/20203	91.60	NZ_CP077366.1 Pantoea agglomerans strain FDAARGOS 1447 chromosome, complete genome
published_soil/SRR22411266_1.fastq.gz	refseq/archaea/GCF_000969885.1/GCF_000969885.1_ASM96988v1_genomic.fna.gz	0.5182	0.0136	98.43	0.230	97.92-98.89	0.169	0.15-0.20	1	1.099	1273/13094	92.76	NZ_CP009501.1 Methanosarcina thermophila TM-1 chromosome, complete genome
published_soil/SRR22411266_1.fastq.gz	refseq/bacteria/GCF_001298955.1/GCF_001298955.1_11861_6_29_genomic.fna.gz	0.5039	0.0285	96.58	0.224	96.14-97.02	0.164	0.14-0.19	1	1.136	1525/28980	90.94	NZ_CYTC01000001.1 Achromobacter kerstersii strain ATCC 31444, whole genome shotgun sequence
published_soil/SRR22411266_1.fastq.gz	refseq/bacteria/GCF_010894405.1/GCF_010894405.1_ASM1089440v1_genomic.fna.gz	0.4711	0.0532	95.47	0.209	95.07-95.98	0.153	0.13-0.18	1	1.141	1989/57371	89.72	NZ_JAAIYA010000100.1 Pyxidicoccus caerfyrddinensis strain CA032A NODE_100_length_1223_cov_59.3394, whole genome shotgun sequence
published_soil/SRR22411266_1.fastq.gz	refseq/bacteria/GCF_015034585.1/GCF_015034585.1_ASM1503458v1_genomic.fna.gz	0.4504	0.0142	96.33	0.200	95.58-97.02	0.147	0.11-0.19	1	1.253	700/15871	90.42	NZ_CP063232.1 Thermobifida fusca strain UPMC 901 chromosome, complete genome
published_soil/SRR22411266_1.fastq.gz	refseq/bacteria/GCF_003254155.1/GCF_003254155.1_ASM325415v1_genomic.fna.gz	0.3850	0.0106	95.79	0.171	94.70-96.79	0.125	0.09-0.18	1	1.092	446/14015	89.47	NZ_QKZI01000001.1 Psychrobacillus insolitus strain DSM 5 Ga0215656_101, whole genome shotgun sequence
published_soil/SRR22411277_1.fastq.gz	refseq/bacteria/GCF_023913775.1/GCF_023913775.1_ASM2391377v1_genomic.fna.gz	13.9529	0.6763	97.34	3.999	NA-NA	HIGH	NA-NA	3	2.928	11896/27445	97.34	NZ_JAMXAX010000100.1 Acidovorax facilis strain DSM 649 NODE_100_length_21850_cov_17.221701, whole genome shotgun sequence
published_soil/SRR22411277_1.fastq.gz	refseq/bacteria/GCF_002531755.2/GCF_002531755.2_ASM253175v2_genomic.fna.gz	7.6063	0.4303	97.09	2.180	97.03-97.16	1.596	1.52-1.67	2	2.350	10110/31389	96.41	NZ_CP034998.1 Rhizobium acidisoli strain FH23 chromosome, complete genome
published_soil/SRR22411277_1.fastq.gz	refseq/bacteria/GCF_022808325.1/GCF_022808325.1_ASM2280832v1_genomic.fna.gz	3.5276	0.0730	95.94	1.011	95.73-96.20	0.740	0.67-0.81	1	2.020	1793/11980	94.06	NZ_JALGCL010000001.1 Lysobacter sedimenti strain 50 XZ-50_scaffold1, whole genome shotgun sequence
published_soil/SRR22411277_1.fastq.gz	refseq/bacteria/GCF_005862185.2/GCF_005862185.2_ASM586218v2_genomic.fna.gz	3.5050	0.1794	98.87	1.004	98.78-98.96	0.736	0.71-0.76	1	1.898	10808/29011	96.87	NZ_CP054027.1 Rhizobium hidalgonense strain JKLM 19E chromosome, complete genome
published_soil/SRR22411277_1.fastq.gz	refseq/bacteria/GCF_003612055.1/GCF_003612055.1_ASM361205v1_genomic.fna.gz	3.1710	0.2518	95.72	0.909	95.62-95.87	0.665	0.62-0.70	1	1.433	5704/44709	93.57	NZ_RAWB01001000.1 Corallococcus llansteffanensis strain CA051B NODE_1000_1563_cov_16.0822, whole genome shotgun sequence
published_soil/SRR22411277_1.fastq.gz	refseq/bacteria/GCF_011604665.1/GCF_011604665.1_ASM1160466v1_genomic.fna.gz	2.6561	0.1387	97.53	0.761	97.38-97.66	0.557	0.53-0.59	1	1.616	6032/29926	94.96	NZ_CP050066.1 Bradyrhizobium symbiodeficiens strain 101S1MB chromosome, complete genome
published_soil/SRR22411277_1.fastq.gz	refseq/bacteria/GCF_013170785.1/GCF_013170785.1_ASM1317078v1_genomic.fna.gz	2.6214	0.1424	98.48	0.751	98.34-98.61	0.550	0.52-0.58	1	1.473	8304/30880	95.85	NZ_CP033507.1 Mesorhizobium jarvisii strain ATCC 33669 chromosome, complete genome
published_soil/SRR22411277_1.fastq.gz	refseq/bacteria/GCF_006438965.1/GCF_006438965.1_ASM643896v1_genomic.fna.gz	2.4890	0.0793	96.29	0.713	96.07-96.54	0.522	0.48-0.56	1	1.621	2380/18249	93.64	NZ_RCZM01000001.1 Pedococcus bigeumensis strain S9.3A scaffold1.1, whole genome shotgun sequence
published_soil/SRR22411277_1.fastq.gz	refseq/bacteria/GCF_010093345.1/GCF_010093345.1_ASM1009334v1_genomic.fna.gz	2.4744	0.0735	95.96	0.709	95.71-96.23	0.519	0.47-0.56	1	1.547	1959/16984	93.27	NZ_PDWT01000010.1 Pseudoxanthomonas yeongjuensis strain DSM 18204 NODE_10_length_85764_cov_31.4004, whole genome shotgun sequence
published_soil/SRR22411277_1.fastq.gz	refseq/bacteria/GCF_014712225.1/GCF_014712225.1_ASM1471222v1_genomic.fna.gz	2.4337	0.0905	97.76	0.697	97.60-97.95	0.511	0.48-0.55	1	1.434	4309/21248	94.98	NZ_JACXBW010000001.1 Pseudarthrobacter sulfonivorans strain ALL 1, whole genome shotgun sequence
published_soil/SRR22411277_1.fastq.gz	refseq/bacteria/GCF_024756225.1/GCF_024756225.1_ASM2475622v1_genomic.fna.gz	2.2575	0.1260	95.66	0.647	95.49-95.89	0.474	0.43-0.51	1	1.339	3094/31737	92.77	NZ_JANUHC010000001.1 Telluria mixta strain LMG 11547 1, whole genome shotgun sequence
published_soil/SRR22411277_1.fastq.gz	refseq/bacteria/GCF_030486595.1/GCF_030486595.1_ASM3048659v1_genomic.fna.gz	2.2081	0.1299	97.31	0.633	97.15-97.46	0.463	0.43-0.49	1	1.411	5456/33551	94.31	NZ_JAUJZH010000001.1 Variovorax ginsengisoli strain CGMCC 1.12090 L12090_1, whole genome shotgun sequence
published_soil/SRR22411277_1.fastq.gz	refseq/bacteria/GCF_000015725.1/GCF_000015725.1_ASM1572v1_genomic.fna.gz	2.1665	0.0759	96.29	0.621	96.10-96.56	0.455	0.41-0.49	1	1.508	2219/19092	93.29	NC_008825.1 Methylibium petroleiphilum PM1, complete sequence
published_soil/SRR22411277_1.fastq.gz	refseq/bacteria/GCF_014646815.1/GCF_014646815.1_ASM1464681v1_genomic.fna.gz	2.1402	0.0760	95.52	0.613	95.25-95.74	0.449	0.40-0.49	1	1.485	1824/20414	92.50	NZ_BMNZ01000001.1 Terrabacter tumescens strain JCM 1365 sequence01, whole genome shotgun sequence
published_soil/SRR22411277_1.fastq.gz	refseq/bacteria/GCF_013185915.1/GCF_013185915.1_ASM1318591v1_genomic.fna.gz	2.1375	0.0711	96.53	0.613	96.32-96.76	0.449	0.41-0.48	1	1.487	2358/18965	93.50	NZ_JAAZUH010000001.1 Stenotrophomonas bentonitica strain DSM 103927 NODE_1, whole genome shotgun sequence
published_soil/SRR22411277_1.fastq.gz	refseq/bacteria/GCF_900102045.1/GCF_900102045.1_IMG-taxon_2639762638_annotated_assembly_genomic.fna.gz	2.1073	0.1041	98.69	0.604	98.55-98.83	0.442	0.42-0.46	1	1.322	6675/27621	95.52	NZ_FNKJ01000003.1 Pseudomonas moorei strain DSM 12647, whole genome shotgun sequence
published_soil/SRR22411277_1.fastq.gz	refseq/bacteria/GCF_900103325.1/GCF_900103325.1_IMG-taxon_2596583656_annotated_assembly_genomic.fna.gz	2.0581	0.1097	95.87	0.590	95.63-96.12	0.432	0.40-0.46	1	1.374	2931/30231	92.75	NZ_FMXM01000121.1 Mesorhizobium qingshengii strain CGMCC 1.12097, whole genome shotgun sequence
published_soil/SRR22411277_1.fastq.gz	refseq/bacteria/GCF_021919345.1/GCF_021919345.1_ASM2191934v1_genomic.fna.gz	1.9932	0.0674	98.97	0.571	98.80-99.13	0.418	0.39-0.44	1	1.344	4814/19038	95.66	NZ_CP089293.1 Paenarthrobacter nicotinovorans strain ATCC 49919 chromosome, complete genome
published_soil/SRR22411277_1.fastq.gz	refseq/bacteria/GCF_900105635.1/GCF_900105635.1_IMG-taxon_2639762655_annotated_assembly_genomic.fna.gz	1.8155	0.0879	96.09	0.520	95.79-96.35	0.381	0.35-0.42	1	1.263	2527/26894	92.66	NZ_FNTT01000002.1 Pseudomonas kilonensis strain DSM 13647, whole genome shotgun sequence
published_soil/SRR22411277_1.fastq.gz	refseq/bacteria/GCF_022803015.1/GCF_022803015.1_ASM2280301v1_genomic.fna.gz	1.6475	0.0586	96.04	0.472	95.66-96.36	0.346	0.30-0.39	1	1.335	1729/20220	92.37	NZ_JAFKON010000010.1 Arthrobacter humicola strain 53 NODE_10_length_134337_cov_44.500089, whole genome shotgun sequence
