published_soil/SRR22411283_1.fastq.gz	refseq/bacteria/GCF_015034585.1/GCF_015034585.1_ASM1503458v1_genomic.fna.gz	0.5084	0.0154	96.27	0.159	95.50-97.37	0.117	0.08-0.15	1	1.214	556/15871	89.75	NZ_CP063232.1 Thermobifida fusca strain UPMC 901 chromosome, complete genome
published_soil/SRR22411283_1.fastq.gz	refseq/bacteria/GCF_019038595.1/GCF_019038595.1_ASM1903859v1_genomic.fna.gz	0.3536	0.0088	97.97	0.111	96.91-99.19	0.081	0.05-0.11	1	1.046	568/13421	90.30	NZ_JAHOPF010000001.1 Kaistella soli strain DKR-2 contig1, whole genome shotgun sequence
published_soil/SRR22411283_1.fastq.gz	refseq/bacteria/GCF_000427385.1/GCF_000427385.1_ASM42738v1_genomic.fna.gz	0.3377	0.0136	96.57	0.106	95.49-97.83	0.078	0.05-0.11	1	1.064	544/20942	88.89	NZ_KE386489.1 Methylocaldum szegediense O-12 strain O12 MetszDRAFT_MSL.1, whole genome shotgun sequence
published_soil/SRR22411283_1.fastq.gz	refseq/bacteria/GCF_013204795.1/GCF_013204795.1_ASM1320479v1_genomic.fna.gz	0.3361	0.0168	96.50	0.105	95.60-97.67	0.077	0.05-0.10	1	1.046	676/26887	88.80	NZ_JABMKW010000010.1 Pedobacter panaciterrae strain LMG 23400 Contig_10_427.475, whole genome shotgun sequence
published_soil/SRR22411283_1.fastq.gz	refseq/bacteria/GCF_009935415.1/GCF_009935415.1_ASM993541v1_genomic.fna.gz	0.2942	0.0132	96.59	0.092	95.59-97.79	0.068	0.05-0.09	1	1.033	551/24171	88.52	NZ_NKAQ01000001.1 Priestia megaterium strain 22-2 22-2_R1_(paired)_contig_1, whole genome shotgun sequence
published_soil/SRR22411283_1.fastq.gz	refseq/archaea/GCF_000969885.1/GCF_000969885.1_ASM96988v1_genomic.fna.gz	0.2869	0.0072	97.12	0.090	95.66-98.89	0.066	0.04-0.10	1	1.032	345/13094	88.93	NZ_CP009501.1 Methanosarcina thermophila TM-1 chromosome, complete genome
published_soil/SRR22411283_1.fastq.gz	refseq/bacteria/GCF_003710245.1/GCF_003710245.1_ASM371024v1_genomic.fna.gz	0.2810	0.0112	95.44	0.088	94.12-97.13	0.065	0.03-0.10	1	1.043	323/21436	87.34	NZ_RHDS01000001.1 [Curtobacterium] plantarum strain LMG 16222 LMG16222.00001, whole genome shotgun sequence
published_soil/SRR22411285_1.fastq.gz	refseq/bacteria/GCF_000015725.1/GCF_000015725.1_ASM1572v1_genomic.fna.gz	4.2057	0.1081	95.96	1.285	95.81-96.15	0.941	0.85-1.00	2	2.049	3298/19092	94.49	NC_008825.1 Methylibium petroleiphilum PM1, complete sequence
published_soil/SRR22411285_1.fastq.gz	refseq/bacteria/GCF_022808325.1/GCF_022808325.1_ASM2280832v1_genomic.fna.gz	3.8573	0.0586	96.08	1.179	95.87-96.32	0.863	0.77-0.95	2	2.317	2051/11980	94.47	NZ_JALGCL010000001.1 Lysobacter sedimenti strain 50 XZ-50_scaffold1, whole genome shotgun sequence
published_soil/SRR22411285_1.fastq.gz	refseq/bacteria/GCF_900105635.1/GCF_900105635.1_IMG-taxon_2639762655_annotated_assembly_genomic.fna.gz	3.6581	0.1299	96.79	1.118	96.67-96.91	0.819	0.77-0.87	1	1.526	5547/26894	95.04	NZ_FNTT01000002.1 Pseudomonas kilonensis strain DSM 13647, whole genome shotgun sequence
published_soil/SRR22411285_1.fastq.gz	refseq/bacteria/GCF_002531755.2/GCF_002531755.2_ASM253175v2_genomic.fna.gz	3.4448	0.1429	96.45	1.053	96.32-96.57	0.771	0.72-0.82	1	1.637	5583/31389	94.58	NZ_CP034998.1 Rhizobium acidisoli strain FH23 chromosome, complete genome
published_soil/SRR22411285_1.fastq.gz	refseq/bacteria/GCF_011604665.1/GCF_011604665.1_ASM1160466v1_genomic.fna.gz	3.1981	0.1225	97.94	0.977	97.85-98.05	0.716	0.69-0.74	1	1.716	8218/29926	95.92	NZ_CP050066.1 Bradyrhizobium symbiodeficiens strain 101S1MB chromosome, complete genome
published_soil/SRR22411285_1.fastq.gz	refseq/bacteria/GCF_006438965.1/GCF_006438965.1_ASM643896v1_genomic.fna.gz	3.1844	0.0744	96.75	0.973	96.61-96.93	0.713	0.65-0.76	1	1.879	3445/18249	94.76	NZ_RCZM01000001.1 Pedococcus bigeumensis strain S9.3A scaffold1.1, whole genome shotgun sequence
published_soil/SRR22411285_1.fastq.gz	refseq/bacteria/GCF_005862185.2/GCF_005862185.2_ASM586218v2_genomic.fna.gz	3.0526	0.1146	98.63	0.933	98.51-98.73	0.683	0.65-0.71	1	1.570	9524/29011	96.47	NZ_CP054027.1 Rhizobium hidalgonense strain JKLM 19E chromosome, complete genome
published_soil/SRR22411285_1.fastq.gz	refseq/bacteria/GCF_013170785.1/GCF_013170785.1_ASM1317078v1_genomic.fna.gz	2.9014	0.1156	98.50	0.887	98.40-98.62	0.649	0.62-0.68	1	1.598	9414/30880	96.24	NZ_CP033507.1 Mesorhizobium jarvisii strain ATCC 33669 chromosome, complete genome
published_soil/SRR22411285_1.fastq.gz	refseq/bacteria/GCF_014712225.1/GCF_014712225.1_ASM1471222v1_genomic.fna.gz	2.8895	0.0788	97.76	0.883	97.61-97.92	0.647	0.61-0.68	1	1.564	5107/21248	95.51	NZ_JACXBW010000001.1 Pseudarthrobacter sulfonivorans strain ALL 1, whole genome shotgun sequence
published_soil/SRR22411285_1.fastq.gz	refseq/bacteria/GCF_900277125.1/GCF_900277125.1_ASM90027712v1_genomic.fna.gz	2.6271	0.0907	96.85	0.803	96.71-97.00	0.588	0.55-0.61	1	1.343	4264/25463	94.40	NZ_OPYN01000001.1 Pseudomonas inefficax strain JV551A3, whole genome shotgun sequence
published_soil/SRR22411285_1.fastq.gz	refseq/bacteria/GCF_014646815.1/GCF_014646815.1_ASM1464681v1_genomic.fna.gz	2.5000	0.0651	95.48	0.764	95.24-95.71	0.559	0.51-0.61	1	1.660	2147/20414	92.99	NZ_BMNZ01000001.1 Terrabacter tumescens strain JCM 1365 sequence01, whole genome shotgun sequence
published_soil/SRR22411285_1.fastq.gz	refseq/bacteria/GCF_010669145.1/GCF_010669145.1_ASM1066914v1_genomic.fna.gz	2.4188	0.0784	97.23	0.739	97.10-97.40	0.541	0.50-0.56	1	1.370	4224/23745	94.58	NZ_CP048632.1 Rhizobium oryzihabitans strain M15 chromosome M15-11, complete sequence
published_soil/SRR22411285_1.fastq.gz	refseq/bacteria/GCF_900103325.1/GCF_900103325.1_IMG-taxon_2596583656_annotated_assembly_genomic.fna.gz	2.4130	0.0943	96.35	0.737	96.19-96.50	0.540	0.51-0.57	1	1.492	4065/30231	93.73	NZ_FMXM01000121.1 Mesorhizobium qingshengii strain CGMCC 1.12097, whole genome shotgun sequence
published_soil/SRR22411285_1.fastq.gz	refseq/bacteria/GCF_024756225.1/GCF_024756225.1_ASM2475622v1_genomic.fna.gz	2.3879	0.0977	95.74	0.730	95.59-95.91	0.534	0.49-0.57	1	1.414	3474/31737	93.11	NZ_JANUHC010000001.1 Telluria mixta strain LMG 11547 1, whole genome shotgun sequence
published_soil/SRR22411285_1.fastq.gz	refseq/bacteria/GCF_024809135.1/GCF_024809135.1_ASM2480913v1_genomic.fna.gz	2.3805	0.0483	98.13	0.727	97.98-98.33	0.533	0.49-0.56	1	1.428	3746/15904	95.44	NZ_JANUFG010000001.1 Microbacterium phyllosphaerae strain JUb90 Ga0480635_01, whole genome shotgun sequence
published_soil/SRR22411285_1.fastq.gz	refseq/bacteria/GCF_000661955.1/GCF_000661955.1_ASM66195v1_genomic.fna.gz	2.0949	0.0539	98.08	0.640	97.90-98.28	0.469	0.43-0.50	1	1.407	4149/19728	95.09	NZ_CP007597.1 Stenotrophomonas rhizophila strain DSM 14405 chromosome
published_soil/SRR22411285_1.fastq.gz	refseq/bacteria/GCF_013185915.1/GCF_013185915.1_ASM1318591v1_genomic.fna.gz	2.0859	0.0509	95.53	0.637	95.23-95.81	0.467	0.41-0.50	1	1.439	1749/18965	92.60	NZ_JAAZUH010000001.1 Stenotrophomonas bentonitica strain DSM 103927 NODE_1, whole genome shotgun sequence
published_soil/SRR22411285_1.fastq.gz	refseq/bacteria/GCF_030486595.1/GCF_030486595.1_ASM3048659v1_genomic.fna.gz	1.9741	0.0852	96.99	0.603	96.83-97.17	0.442	0.41-0.47	1	1.430	4762/33551	93.90	NZ_JAUJZH010000001.1 Variovorax ginsengisoli strain CGMCC 1.12090 L12090_1, whole genome shotgun sequence
published_soil/SRR22411285_1.fastq.gz	refseq/bacteria/GCF_010093345.1/GCF_010093345.1_ASM1009334v1_genomic.fna.gz	1.9735	0.0430	95.55	0.603	95.23-95.87	0.442	0.38-0.50	1	1.532	1514/16984	92.50	NZ_PDWT01000010.1 Pseudoxanthomonas yeongjuensis strain DSM 18204 NODE_10_length_85764_cov_31.4004, whole genome shotgun sequence
published_soil/SRR22411285_1.fastq.gz	refseq/bacteria/GCF_001544475.1/GCF_001544475.1_ASM1544475v2_genomic.fna.gz	1.8693	0.0788	99.05	0.571	98.92-99.21	0.418	0.40-0.43	1	1.297	8483/32628	95.75	NZ_FCNW02000001.1 Caballeronia humi isolate LMG 22934, whole genome shotgun sequence
published_soil/SRR22411285_1.fastq.gz	refseq/bacteria/GCF_010977555.1/GCF_010977555.1_ASM1097755v1_genomic.fna.gz	1.8622	0.0615	97.47	0.569	97.35-97.65	0.417	0.39-0.44	1	1.377	3989/25288	94.22	NZ_CP048815.1 Caulobacter rhizosphaerae strain KCTC 52515 chromosome, complete genome
published_soil/SRR22411285_1.fastq.gz	refseq/bacteria/GCF_000619905.2/GCF_000619905.2_ASM61990v2_genomic.fna.gz	1.8616	0.0331	95.44	0.569	95.02-95.80	0.417	0.36-0.48	1	1.285	1104/13534	92.23	NZ_CP012371.1 Nitrosospira briensis C-128 chromosome, complete genome
published_soil/SRR22411285_1.fastq.gz	refseq/bacteria/GCF_022803015.1/GCF_022803015.1_ASM2280301v1_genomic.fna.gz	1.8163	0.0474	96.62	0.555	96.38-96.87	0.406	0.36-0.44	1	1.431	2380/20220	93.33	NZ_JAFKON010000010.1 Arthrobacter humicola strain 53 NODE_10_length_134337_cov_44.500089, whole genome shotgun sequence
published_soil/SRR22411285_1.fastq.gz	refseq/bacteria/GCF_000264295.1/GCF_000264295.1_Rh17631_genomic.fna.gz	1.8077	0.0391	95.64	0.552	95.24-95.97	0.405	0.36-0.45	1	1.483	1442/16903	92.37	NZ_AJXT01000001.1 Rhodanobacter spathiphylli B39 contig001, whole genome shotgun sequence
published_soil/SRR22411285_1.fastq.gz	refseq/bacteria/GCF_000020125.1/GCF_000020125.1_ASM2012v1_genomic.fna.gz	1.7216	0.0783	95.66	0.526	95.35-95.89	0.385	0.35-0.43	1	1.243	2887/34996	92.27	NC_010681.1 Paraburkholderia phytofirmans PsJN chromosome 1, complete sequence
published_soil/SRR22411285_1.fastq.gz	refseq/bacteria/GCF_001544535.1/GCF_001544535.1_ASM1544535v2_genomic.fna.gz	1.6618	0.0899	95.72	0.508	95.47-95.90	0.372	0.35-0.40	1	1.271	3378/41462	92.23	NZ_FCON02000001.1 Caballeronia choica isolate LMG 22940, whole genome shotgun sequence
published_soil/SRR22411285_1.fastq.gz	refseq/bacteria/GCF_900105535.1/GCF_900105535.1_IMG-taxon_2634166282_annotated_assembly_genomic.fna.gz	1.6571	0.0409	98.32	0.506	98.17-98.56	0.371	0.34-0.39	1	1.421	3548/18850	94.76	NZ_LT629779.1 Pseudarthrobacter equi strain IMMIB L-1606 chromosome I
published_soil/SRR22411285_1.fastq.gz	refseq/bacteria/GCF_000264315.1/GCF_000264315.1_Rh18449_genomic.fna.gz	1.5811	0.0339	95.91	0.483	95.54-96.23	0.354	0.31-0.39	1	1.415	1420/16928	92.32	NZ_AJXU01000001.1 Rhodanobacter fulvus Jip2 contig001, whole genome shotgun sequence
published_soil/SRR22411285_1.fastq.gz	refseq/bacteria/GCF_023913775.1/GCF_023913775.1_ASM2391377v1_genomic.fna.gz	1.5434	0.0549	96.66	0.472	96.44-96.92	0.345	0.31-0.37	1	1.258	2856/27445	92.96	NZ_JAMXAX010000100.1 Acidovorax facilis strain DSM 649 NODE_100_length_21850_cov_17.221701, whole genome shotgun sequence
published_soil/SRR22411285_1.fastq.gz	refseq/bacteria/GCF_009192765.1/GCF_009192765.1_ASM919276v1_genomic.fna.gz	1.4822	0.0467	98.41	0.453	98.26-98.65	0.332	0.31-0.35	1	1.190	4329/24694	94.54	NZ_VOHQ01000001.1 Agriterribacter humi strain YJ03 1, whole genome shotgun sequence
published_soil/SRR22411285_1.fastq.gz	refseq/bacteria/GCF_014268485.2/GCF_014268485.2_ASM1426848v2_genomic.fna.gz	1.4783	0.0543	97.12	0.452	96.89-97.35	0.331	0.30-0.35	1	1.305	3270/28163	93.29	NZ_CP077090.1 Pseudomonas zeae strain OE 48.2 chromosome, complete genome
published_soil/SRR22411285_1.fastq.gz	refseq/bacteria/GCF_002902965.1/GCF_002902965.1_ASM290296v1_genomic.fna.gz	1.4232	0.0908	98.35	0.435	98.19-98.53	0.318	0.30-0.33	1	1.209	7976/48004	94.37	NZ_CP026105.1 Paraburkholderia hospita strain DSM 17164 chromosome 1, complete sequence
published_soil/SRR22411285_1.fastq.gz	refseq/bacteria/GCF_021919345.1/GCF_021919345.1_ASM2191934v1_genomic.fna.gz	1.4129	0.0350	97.94	0.432	97.73-98.24	0.316	0.29-0.33	1	1.334	2770/19038	93.97	NZ_CP089293.1 Paenarthrobacter nicotinovorans strain ATCC 49919 chromosome, complete genome
published_soil/SRR22411285_1.fastq.gz	refseq/bacteria/GCF_020682705.1/GCF_020682705.1_ASM2068270v1_genomic.fna.gz	1.3445	0.0299	96.80	0.411	96.41-97.11	0.301	0.26-0.34	1	1.290	1698/17467	92.76	NZ_JAGTTN010000001.1 Microbacterium allomyrinae strain BWT-G7 contig1, whole genome shotgun sequence
published_soil/SRR22411285_1.fastq.gz	refseq/bacteria/GCF_010093305.1/GCF_010093305.1_ASM1009330v1_genomic.fna.gz	1.3355	0.0298	97.00	0.408	96.63-97.34	0.299	0.26-0.33	1	1.501	1817/17404	92.97	NZ_PDWS01000010.1 Pseudoxanthomonas sacheonensis strain DSM 19373 NODE_10_length_143637_cov_18.2513, whole genome shotgun sequence
published_soil/SRR22411285_1.fastq.gz	refseq/bacteria/GCF_001544515.1/GCF_001544515.1_ASM1544515v2_genomic.fna.gz	1.3130	0.0596	95.63	0.401	95.25-95.93	0.294	0.26-0.33	1	1.251	2295/35246	91.57	NZ_FCOL02000001.1 Caballeronia terrestris isolate LMG 22937, whole genome shotgun sequence
published_soil/SRR22411285_1.fastq.gz	refseq/archaea/GCF_000969885.1/GCF_000969885.1_ASM96988v1_genomic.fna.gz	1.2292	0.0213	97.95	0.376	97.56-98.32	0.275	0.24-0.31	1	1.136	1693/13094	93.61	NZ_CP009501.1 Methanosarcina thermophila TM-1 chromosome, complete genome
published_soil/SRR22411285_1.fastq.gz	refseq/bacteria/GCF_003330785.1/GCF_003330785.1_ASM333078v1_genomic.fna.gz	1.2175	0.0506	97.62	0.372	97.34-97.87	0.272	0.25-0.30	1	1.221	3721/32226	93.27	NZ_CP024934.1 Paraburkholderia graminis strain PHS1 chromosome PHS1_A, complete sequence
published_soil/SRR22411285_1.fastq.gz	refseq/bacteria/GCF_003240585.1/GCF_003240585.1_ASM324058v1_genomic.fna.gz	1.2055	0.0436	95.85	0.368	95.46-96.17	0.270	0.24-0.31	1	1.223	1832/28157	91.56	NZ_PCDP01000079.1 Rhizobium tubonense strain CCBAU 85046 NODE_105_length_439_cov_265.981_ID_209, whole genome shotgun sequence
published_soil/SRR22411285_1.fastq.gz	refseq/bacteria/GCF_000383275.1/GCF_000383275.1_ASM38327v1_genomic.fna.gz	1.1901	0.0486	96.64	0.364	96.25-96.87	0.266	0.24-0.30	1	1.173	2631/31787	92.28	NZ_KB911034.1 Paraburkholderia caledonica strain 376MFSha3.1 H281DRAFT_scaffold00001.1, whole genome shotgun sequence
published_soil/SRR22411285_1.fastq.gz	refseq/bacteria/GCF_900102525.1/GCF_900102525.1_IMG-taxon_2675903146_annotated_assembly_genomic.fna.gz	1.1752	0.0343	97.35	0.359	97.00-97.64	0.263	0.23-0.30	1	1.333	2350/22743	92.94	NZ_FNBZ01000020.1 Bosea robiniae strain DSM 26672, whole genome shotgun sequence
published_soil/SRR22411285_1.fastq.gz	refseq/bacteria/GCF_001545035.1/GCF_001545035.1_ASM154503v2_genomic.fna.gz	1.1646	0.0505	96.54	0.356	96.17-96.86	0.261	0.23-0.29	1	1.200	2641/33614	92.12	NZ_FCOJ02000194.1 Caballeronia glebae isolate LMG 29325, whole genome shotgun sequence
published_soil/SRR22411285_1.fastq.gz	refseq/bacteria/GCF_009935415.1/GCF_009935415.1_ASM993541v1_genomic.fna.gz	1.1642	0.0361	96.73	0.356	96.34-97.06	0.261	0.23-0.29	1	1.147	2016/24171	92.30	NZ_NKAQ01000001.1 Priestia megaterium strain 22-2 22-2_R1_(paired)_contig_1, whole genome shotgun sequence
published_soil/SRR22411285_1.fastq.gz	refseq/bacteria/GCF_019038595.1/GCF_019038595.1_ASM1903859v1_genomic.fna.gz	1.1078	0.0190	96.77	0.338	96.23-97.26	0.248	0.21-0.30	1	1.163	1086/13421	92.21	NZ_JAHOPF010000001.1 Kaistella soli strain DKR-2 contig1, whole genome shotgun sequence
published_soil/SRR22411285_1.fastq.gz	refseq/bacteria/GCF_013204795.1/GCF_013204795.1_ASM1320479v1_genomic.fna.gz	1.0605	0.0366	97.58	0.324	97.21-97.92	0.237	0.21-0.26	1	1.140	2718/26887	92.87	NZ_JABMKW010000010.1 Pedobacter panaciterrae strain LMG 23400 Contig_10_427.475, whole genome shotgun sequence
published_soil/SRR22411285_1.fastq.gz	refseq/bacteria/GCF_000442985.1/GCF_000442985.1_AtP4V1.0_genomic.fna.gz	1.0480	0.0323	96.21	0.320	95.75-96.65	0.235	0.20-0.27	1	1.165	1547/23989	91.54	NZ_CM002258.1 Agrobacterium fabacearum P4 chromosome 1, whole genome shotgun sequence
published_soil/SRR22411285_1.fastq.gz	refseq/bacteria/GCF_024498135.1/GCF_024498135.1_ASM2449813v1_genomic.fna.gz	1.0186	0.0336	95.42	0.311	94.92-95.83	0.228	0.19-0.27	1	1.193	1255/25799	90.71	NZ_JANHOH010000001.1 Mucilaginibacter aquariorum strain JC4 contig1, whole genome shotgun sequence
published_soil/SRR22411285_1.fastq.gz	refseq/bacteria/GCF_001742225.1/GCF_001742225.1_ASM174222v1_genomic.fna.gz	0.9956	0.0381	95.53	0.304	95.04-96.00	0.223	0.19-0.26	1	1.457	1460/29229	90.79	NZ_CP017075.1 Novosphingobium resinovorum strain SA1 chromosome, complete genome
published_soil/SRR22411285_1.fastq.gz	refseq/bacteria/GCF_904848585.1/GCF_904848585.1_LMG_28727_genomic.fna.gz	0.9949	0.0473	95.62	0.304	95.23-95.93	0.223	0.20-0.25	1	1.158	1840/36199	90.84	NZ_CAJHCR010000001.1 Paraburkholderia kirstenboschensis strain LMG 28727 isolate LMG 28727, whole genome shotgun sequence
published_soil/SRR22411285_1.fastq.gz	refseq/bacteria/GCF_000751215.2/GCF_000751215.2_Bglat_v2_genomic.fna.gz	0.9765	0.0435	95.05	0.298	94.62-95.42	0.219	0.19-0.25	1	1.236	1447/34807	90.25	NZ_CCNS02000139.1 Caballeronia glathei strain LMG 14190, whole genome shotgun sequence
published_soil/SRR22411285_1.fastq.gz	refseq/bacteria/GCF_012647205.1/GCF_012647205.1_ASM1264720v1_genomic.fna.gz	0.9145	0.0339	95.24	0.279	94.75-95.68	0.205	0.17-0.24	1	1.154	1169/28081	90.25	NZ_CP051487.1 Pseudomonas umsongensis strain CY-1 chromosome, complete genome
published_soil/SRR22411285_1.fastq.gz	refseq/bacteria/GCF_001298955.1/GCF_001298955.1_11861_6_29_genomic.fna.gz	0.8994	0.0335	95.85	0.275	95.42-96.30	0.201	0.18-0.23	1	1.156	1451/28980	90.79	NZ_CYTC01000001.1 Achromobacter kerstersii strain ATCC 31444, whole genome shotgun sequence
published_soil/SRR22411285_1.fastq.gz	refseq/bacteria/GCF_905220825.1/GCF_905220825.1_LMG_22931_genomic.fna.gz	0.8891	0.0425	95.21	0.272	94.75-95.67	0.199	0.17-0.23	1	1.143	1514/37678	90.15	NZ_CAJNBC010000001.1 Paraburkholderia nemoris strain LMG 22931 isolate LMG 22931, whole genome shotgun sequence
published_soil/SRR22411285_1.fastq.gz	refseq/bacteria/GCF_015034585.1/GCF_015034585.1_ASM1503458v1_genomic.fna.gz	0.7855	0.0164	96.81	0.240	96.18-97.37	0.176	0.14-0.21	1	1.232	966/15871	91.37	NZ_CP063232.1 Thermobifida fusca strain UPMC 901 chromosome, complete genome
published_soil/SRR22411285_1.fastq.gz	refseq/bacteria/GCF_003254155.1/GCF_003254155.1_ASM325415v1_genomic.fna.gz	0.5437	0.0099	95.85	0.166	94.64-96.76	0.122	0.09-0.18	1	1.081	445/14015	89.47	NZ_QKZI01000001.1 Psychrobacillus insolitus strain DSM 5 Ga0215656_101, whole genome shotgun sequence
published_soil/SRR22411278_1.fastq.gz	refseq/bacteria/GCF_022808325.1/GCF_022808325.1_ASM2280832v1_genomic.fna.gz	5.8412	0.0596	95.39	0.790	95.11-95.75	0.578	0.50-0.63	1	1.725	1253/11980	92.98	NZ_JALGCL010000001.1 Lysobacter sedimenti strain 50 XZ-50_scaffold1, whole genome shotgun sequence
published_soil/SRR22411278_1.fastq.gz	refseq/bacteria/GCF_030486595.1/GCF_030486595.1_ASM3048659v1_genomic.fna.gz	5.1284	0.1486	97.65	0.693	97.51-97.81	0.508	0.48-0.53	1	1.451	6534/33551	94.86	NZ_JAUJZH010000001.1 Variovorax ginsengisoli strain CGMCC 1.12090 L12090_1, whole genome shotgun sequence
published_soil/SRR22411278_1.fastq.gz	refseq/bacteria/GCF_006438965.1/GCF_006438965.1_ASM643896v1_genomic.fna.gz	5.1179	0.0804	95.93	0.692	95.67-96.22	0.507	0.45-0.55	1	1.687	2058/18249	93.20	NZ_RCZM01000001.1 Pedococcus bigeumensis strain S9.3A scaffold1.1, whole genome shotgun sequence
published_soil/SRR22411278_1.fastq.gz	refseq/bacteria/GCF_003667725.1/GCF_003667725.1_ASM366772v1_genomic.fna.gz	5.0227	0.1037	97.86	0.679	97.72-98.05	0.497	0.46-0.52	1	1.314	4848/23726	95.01	NZ_CP033022.1 Agrobacterium fabrum strain 1D132 chromosome circular, complete sequence
published_soil/SRR22411278_1.fastq.gz	refseq/bacteria/GCF_014712225.1/GCF_014712225.1_ASM1471222v1_genomic.fna.gz	4.8967	0.0897	97.11	0.662	96.97-97.32	0.485	0.45-0.51	1	1.346	3366/21248	94.23	NZ_JACXBW010000001.1 Pseudarthrobacter sulfonivorans strain ALL 1, whole genome shotgun sequence
published_soil/SRR22411278_1.fastq.gz	refseq/bacteria/GCF_014646815.1/GCF_014646815.1_ASM1464681v1_genomic.fna.gz	4.6166	0.0808	95.23	0.624	94.86-95.48	0.457	0.41-0.50	1	1.497	1685/20414	92.27	NZ_BMNZ01000001.1 Terrabacter tumescens strain JCM 1365 sequence01, whole genome shotgun sequence
published_soil/SRR22411278_1.fastq.gz	refseq/bacteria/GCF_011604665.1/GCF_011604665.1_ASM1160466v1_genomic.fna.gz	4.1208	0.1060	96.91	0.557	96.73-97.14	0.408	0.38-0.44	1	1.517	3888/29926	93.63	NZ_CP050066.1 Bradyrhizobium symbiodeficiens strain 101S1MB chromosome, complete genome
published_soil/SRR22411278_1.fastq.gz	refseq/bacteria/GCF_024756225.1/GCF_024756225.1_ASM2475622v1_genomic.fna.gz	4.0982	0.1127	95.48	0.554	95.24-95.74	0.406	0.37-0.44	1	1.348	2575/31737	92.22	NZ_JANUHC010000001.1 Telluria mixta strain LMG 11547 1, whole genome shotgun sequence
published_soil/SRR22411278_1.fastq.gz	refseq/bacteria/GCF_021919345.1/GCF_021919345.1_ASM2191934v1_genomic.fna.gz	3.9646	0.0660	98.72	0.536	98.58-98.92	0.392	0.36-0.41	1	1.287	4234/19038	95.27	NZ_CP089293.1 Paenarthrobacter nicotinovorans strain ATCC 49919 chromosome, complete genome
published_soil/SRR22411278_1.fastq.gz	refseq/bacteria/GCF_022803015.1/GCF_022803015.1_ASM2280301v1_genomic.fna.gz	3.7392	0.0656	96.53	0.505	96.26-96.86	0.370	0.33-0.40	1	1.278	2143/20220	93.02	NZ_JAFKON010000010.1 Arthrobacter humicola strain 53 NODE_10_length_134337_cov_44.500089, whole genome shotgun sequence
published_soil/SRR22411278_1.fastq.gz	refseq/bacteria/GCF_013170785.1/GCF_013170785.1_ASM1317078v1_genomic.fna.gz	3.6811	0.0985	97.75	0.498	97.60-98.01	0.364	0.33-0.38	1	1.306	4773/30880	94.15	NZ_CP033507.1 Mesorhizobium jarvisii strain ATCC 33669 chromosome, complete genome
published_soil/SRR22411278_1.fastq.gz	refseq/bacteria/GCF_014268485.2/GCF_014268485.2_ASM1426848v2_genomic.fna.gz	3.4262	0.0844	97.68	0.463	97.50-97.94	0.339	0.31-0.36	1	1.192	3995/28163	93.89	NZ_CP077090.1 Pseudomonas zeae strain OE 48.2 chromosome, complete genome
published_soil/SRR22411278_1.fastq.gz	refseq/bacteria/GCF_900102045.1/GCF_900102045.1_IMG-taxon_2639762638_annotated_assembly_genomic.fna.gz	3.0916	0.0752	97.96	0.418	97.75-98.21	0.306	0.28-0.33	1	1.206	3916/27621	93.89	NZ_FNKJ01000003.1 Pseudomonas moorei strain DSM 12647, whole genome shotgun sequence
published_soil/SRR22411278_1.fastq.gz	refseq/bacteria/GCF_001544535.1/GCF_001544535.1_ASM1544535v2_genomic.fna.gz	2.7773	0.1009	95.60	0.375	95.29-95.87	0.275	0.25-0.30	1	1.218	2525/41462	91.37	NZ_FCON02000001.1 Caballeronia choica isolate LMG 22940, whole genome shotgun sequence
published_soil/SRR22411278_1.fastq.gz	refseq/bacteria/GCF_007993815.1/GCF_007993815.1_ASM799381v1_genomic.fna.gz	2.7145	0.0507	95.54	0.367	95.06-95.98	0.269	0.23-0.31	1	1.266	1266/21617	91.25	NZ_VJWE01000011.1 Acidovorax delafieldii strain DSM 64 Ga0064100_101, whole genome shotgun sequence
published_soil/SRR22411278_1.fastq.gz	refseq/bacteria/GCF_001544475.1/GCF_001544475.1_ASM1544475v2_genomic.fna.gz	2.6670	0.0755	98.55	0.360	98.32-98.77	0.264	0.24-0.28	1	1.189	4931/32628	94.09	NZ_FCNW02000001.1 Caballeronia humi isolate LMG 22934, whole genome shotgun sequence
published_soil/SRR22411278_1.fastq.gz	refseq/bacteria/GCF_012647205.1/GCF_012647205.1_ASM1264720v1_genomic.fna.gz	2.6125	0.0650	96.47	0.353	96.09-96.89	0.259	0.22-0.29	1	1.155	2142/28081	92.03	NZ_CP051487.1 Pseudomonas umsongensis strain CY-1 chromosome, complete genome
published_soil/SRR22411278_1.fastq.gz	refseq/bacteria/GCF_900105535.1/GCF_900105535.1_IMG-taxon_2634166282_annotated_assembly_genomic.fna.gz	2.2753	0.0377	97.64	0.308	97.21-98.01	0.225	0.20-0.25	1	1.256	1855/18850	92.79	NZ_LT629779.1 Pseudarthrobacter equi strain IMMIB L-1606 chromosome I
published_soil/SRR22411278_1.fastq.gz	refseq/bacteria/GCF_001742225.1/GCF_001742225.1_ASM174222v1_genomic.fna.gz	2.1582	0.0555	96.67	0.292	96.29-97.12	0.214	0.18-0.24	1	1.318	2018/29229	91.74	NZ_CP017075.1 Novosphingobium resinovorum strain SA1 chromosome, complete genome
published_soil/SRR22411278_1.fastq.gz	refseq/bacteria/GCF_001545035.1/GCF_001545035.1_ASM154503v2_genomic.fna.gz	2.1008	0.0612	95.52	0.284	95.14-96.02	0.208	0.18-0.24	1	1.146	1560/33614	90.57	NZ_FCOJ02000194.1 Caballeronia glebae isolate LMG 29325, whole genome shotgun sequence
published_soil/SRR22411278_1.fastq.gz	refseq/bacteria/GCF_000018665.1/GCF_000018665.1_ASM1866v1_genomic.fna.gz	2.0989	0.0528	95.56	0.284	95.13-96.03	0.208	0.18-0.24	1	1.279	1336/28420	90.61	NC_010002.1 Delftia acidovorans SPH-1, complete sequence
published_soil/SRR22411278_1.fastq.gz	refseq/bacteria/GCF_900102525.1/GCF_900102525.1_IMG-taxon_2675903146_annotated_assembly_genomic.fna.gz	2.0206	0.0396	96.21	0.273	95.70-96.66	0.200	0.17-0.24	1	1.366	1277/22743	91.13	NZ_FNBZ01000020.1 Bosea robiniae strain DSM 26672, whole genome shotgun sequence
published_soil/SRR22411278_1.fastq.gz	refseq/bacteria/GCF_900100255.1/GCF_900100255.1_IMG-taxon_2596583650_annotated_assembly_genomic.fna.gz	2.0148	0.0297	97.78	0.272	97.23-98.23	0.199	0.17-0.23	1	1.160	1574/16990	92.61	NZ_FMTS01000019.1 Asticcacaulis taihuensis strain CGMCC 1.3431, whole genome shotgun sequence
published_soil/SRR22411278_1.fastq.gz	refseq/bacteria/GCF_005862185.2/GCF_005862185.2_ASM586218v2_genomic.fna.gz	1.9898	0.0502	97.47	0.269	97.06-97.85	0.197	0.17-0.22	1	1.215	2400/29011	92.28	NZ_CP054027.1 Rhizobium hidalgonense strain JKLM 19E chromosome, complete genome
published_soil/SRR22411278_1.fastq.gz	refseq/bacteria/GCF_001544515.1/GCF_001544515.1_ASM1544515v2_genomic.fna.gz	1.7961	0.0548	96.12	0.243	95.65-96.50	0.178	0.15-0.21	1	1.162	1726/35246	90.73	NZ_FCOL02000001.1 Caballeronia terrestris isolate LMG 22937, whole genome shotgun sequence
published_soil/SRR22411278_1.fastq.gz	refseq/bacteria/GCF_019038595.1/GCF_019038595.1_ASM1903859v1_genomic.fna.gz	1.7106	0.0197	96.08	0.231	95.23-96.73	0.169	0.13-0.21	1	1.084	620/13421	90.56	NZ_JAHOPF010000001.1 Kaistella soli strain DKR-2 contig1, whole genome shotgun sequence
published_soil/SRR22411278_1.fastq.gz	refseq/bacteria/GCF_000442985.1/GCF_000442985.1_AtP4V1.0_genomic.fna.gz	1.6732	0.0346	96.88	0.226	96.34-97.32	0.166	0.14-0.19	1	1.132	1399/23989	91.24	NZ_CM002258.1 Agrobacterium fabacearum P4 chromosome 1, whole genome shotgun sequence
published_soil/SRR22411278_1.fastq.gz	refseq/bacteria/GCF_001750725.1/GCF_001750725.1_ASM175072v1_genomic.fna.gz	1.4602	0.0269	96.63	0.197	96.11-97.13	0.145	0.12-0.17	1	1.078	1013/21312	90.64	NZ_CP017279.1 Enterobacter ludwigii strain EN-119 chromosome, complete genome
