../wallen_disk/reads/SRR19064321_1.fastq.gz	gtdb_genomes_reps_r214/database/GCF/015/560/805/GCF_015560805.1_genomic.fna.gz	0.0744	0.0648	98.45	1.120	98.32-98.60	0.732	0.67-0.77	1	1.441	4269/13108	96.45	NZ_JADMSO010000010.1 Mediterraneibacter glycyrrhizinilyticus strain BSD2780061687b_171204_B1 NODE_10_length_104764_cov_61.4239, whole genome shotgun sequence
../wallen_disk/reads/SRR19064321_1.fastq.gz	gtdb_genomes_reps_r214/database/GCF/003/477/705/GCF_003477705.1_genomic.fna.gz	0.0735	0.0631	97.08	1.107	96.87-97.30	0.724	0.65-0.78	1	1.518	2639/12554	95.09	NZ_QUDV01000001.1 Dorea sp. AF36-15AT AF36-15AT.Scaf1, whole genome shotgun sequence
../wallen_disk/reads/SRR19064321_1.fastq.gz	gtdb_genomes_reps_r214/database/GCA/025/148/635/GCA_025148635.1_genomic.fna.gz	0.0735	0.1027	98.49	1.106	98.39-98.62	0.723	0.68-0.75	1	1.657	6717/20251	96.50	CP102269.1 Butyricimonas virosa strain DSM 23226 chromosome, complete genome
../wallen_disk/reads/SRR19064321_1.fastq.gz	gtdb_genomes_reps_r214/database/GCA/014/385/265/GCA_014385265.1_genomic.fna.gz	0.0718	0.0579	98.69	1.081	98.54-98.87	0.707	0.65-0.74	1	1.430	4129/12010	96.61	JACRTJ010000018.1 Lachnospiraceae bacterium BX10 BX10_ctg00001, whole genome shotgun sequence
../wallen_disk/reads/SRR19064321_1.fastq.gz	gtdb_genomes_reps_r214/database/GCF/009/696/275/GCF_009696275.1_genomic.fna.gz	0.0717	0.1273	97.21	1.080	97.08-97.36	0.706	0.66-0.74	2	2.430	5603/26083	95.16	NZ_VUMI01000001.1 Eisenbergiella porci strain WCA-389-WT-23B seq1, whole genome shotgun sequence
../wallen_disk/reads/SRR19064321_1.fastq.gz	gtdb_genomes_reps_r214/database/GCF/000/265/365/GCF_000265365.1_genomic.fna.gz	0.0711	0.0771	98.58	1.070	98.44-98.76	0.699	0.65-0.74	1	1.386	5444/15352	96.71	NC_018011.1 Alistipes finegoldii DSM 17242, complete sequence
../wallen_disk/reads/SRR19064321_1.fastq.gz	gtdb_genomes_reps_r214/database/GCF/008/727/735/GCF_008727735.1_genomic.fna.gz	0.0676	0.0573	96.72	1.017	96.53-96.93	0.665	0.61-0.71	1	1.398	2206/12524	94.55	NZ_CP044227.1 Flintibacter sp. KGMB00164 chromosome, complete genome
../wallen_disk/reads/SRR19064321_1.fastq.gz	gtdb_genomes_reps_r214/database/GCF/000/210/055/GCF_000210055.1_genomic.fna.gz	0.0661	0.0693	98.97	0.996	98.82-99.14	0.651	0.60-0.69	1	1.473	5200/14631	96.72	NC_021021.1 Gordonibacter pamelaeae 7-10-1-b, complete sequence
../wallen_disk/reads/SRR19064321_1.fastq.gz	gtdb_genomes_reps_r214/database/GCF/018/228/705/GCF_018228705.1_genomic.fna.gz	0.0659	0.0632	98.29	0.992	98.13-98.46	0.648	0.60-0.69	1	1.685	4020/13883	96.08	NZ_CP073694.1 Dysosmobacter sp. Marseille-Q4140 chromosome
../wallen_disk/reads/SRR19064321_1.fastq.gz	gtdb_genomes_reps_r214/database/GCF/000/172/175/GCF_000172175.1_genomic.fna.gz	0.0658	0.1156	99.05	0.990	98.95-99.18	0.647	0.61-0.67	1	1.330	9657/25907	96.87	NZ_ABJL02000008.1 Bacteroides intestinalis DSM 17393 B_intestinalis-2.0.1_Cont607, whole genome shotgun sequence
../wallen_disk/reads/SRR19064321_1.fastq.gz	gtdb_genomes_reps_r214/database/GCA/018/369/555/GCA_018369555.1_genomic.fna.gz	0.0653	0.0441	98.48	0.984	98.28-98.67	0.643	0.58-0.69	1	1.401	2967/9891	96.19	JAGZCC010000103.1 [Clostridium] spiroforme isolate L3_108_000G1_dasL3_108_000G1_metabat.metabat.11 L3_108_000G1_scaffold_10118, whole genome shotgun sequence
../wallen_disk/reads/SRR19064321_1.fastq.gz	gtdb_genomes_reps_r214/database/GCF/900/120/005/GCF_900120005.1_genomic.fna.gz	0.0645	0.0689	98.83	0.970	98.68-98.98	0.634	0.59-0.67	1	1.415	5283/15778	96.53	NZ_LT635438.1 Holdemania sp. Marseille-P2844 strain Marseille-P2844T, whole genome shotgun sequence
../wallen_disk/reads/SRR19064321_1.fastq.gz	gtdb_genomes_reps_r214/database/GCA/000/434/635/GCA_000434635.1_genomic.fna.gz	0.0633	0.0461	97.57	0.953	97.37-97.78	0.623	0.56-0.67	1	1.390	2352/10683	95.24	HF987968.1 Firmicutes bacterium CAG:110 genomic scaffold, scf9, whole genome shotgun sequence
../wallen_disk/reads/SRR19064321_1.fastq.gz	gtdb_genomes_reps_r214/database/GCF/010/120/595/GCF_010120595.1_genomic.fna.gz	0.0631	0.0386	98.20	0.951	98.01-98.42	0.621	0.57-0.67	1	1.499	2310/8584	95.85	NZ_CP038020.1 Streptococcus thermophilus strain ATCC 19258 chromosome, complete genome
../wallen_disk/reads/SRR19064321_1.fastq.gz	gtdb_genomes_reps_r214/database/GCF/900/199/635/GCF_900199635.1_genomic.fna.gz	0.0625	0.0571	97.96	0.941	97.79-98.17	0.615	0.56-0.65	1	1.419	3325/13445	95.59	NZ_LT962681.1 Anaerotruncus massiliensis strain AT3, whole genome shotgun sequence
../wallen_disk/reads/SRR19064321_1.fastq.gz	gtdb_genomes_reps_r214/database/GCA/900/542/375/GCA_900542375.1_genomic.fna.gz	0.0621	0.0351	99.31	0.935	99.13-99.49	0.611	0.56-0.65	1	1.392	3162/8383	96.90	UQNI01000001.1 uncultured Ruminococcaceae bacterium isolate UMGS454 genome assembly, contig: NODE_241_length_67032_cov_4.336265, whole genome shotgun sequence
../wallen_disk/reads/SRR19064321_1.fastq.gz	gtdb_genomes_reps_r214/database/GCF/000/024/265/GCF_000024265.1_genomic.fna.gz	0.0586	0.0619	98.37	0.883	98.20-98.56	0.577	0.53-0.62	1	1.410	4189/15631	95.84	NC_013204.1 Eggerthella lenta DSM 2243, complete sequence
../wallen_disk/reads/SRR19064321_1.fastq.gz	gtdb_genomes_reps_r214/database/GCF/001/701/045/GCF_001701045.1_genomic.fna.gz	0.0585	0.0610	98.08	0.881	97.93-98.28	0.576	0.53-0.61	1	1.337	3650/14917	95.56	NZ_CP016757.1 Cloacibacillus porcorum strain CL-84 (T) chromosome, complete genome
../wallen_disk/reads/SRR19064321_1.fastq.gz	gtdb_genomes_reps_r214/database/GCA/905/214/955/GCA_905214955.1_genomic.fna.gz	0.0565	0.0496	98.75	0.850	98.59-98.96	0.556	0.51-0.59	1	1.336	3841/13052	96.13	CAJMON010000001.1 TPA_asm: uncultured bacterium isolate ERR1430502-bin.37 genome assembly, contig: NODE_210_length_96799_cov_9.753597, whole genome shotgun sequence
../wallen_disk/reads/SRR19064321_1.fastq.gz	gtdb_genomes_reps_r214/database/GCA/002/320/595/GCA_002320595.1_genomic.fna.gz	0.0558	0.0388	97.08	0.840	96.85-97.40	0.549	0.48-0.59	1	1.337	1771/10318	94.47	DCKB01000023.1 MAG TPA_asm: Christensenella sp. UBA1685 UBA1685_contig_1030, whole genome shotgun sequence
../wallen_disk/reads/SRR19064321_1.fastq.gz	gtdb_genomes_reps_r214/database/GCA/900/542/045/GCA_900542045.1_genomic.fna.gz	0.0519	0.0501	98.73	0.782	98.57-98.94	0.511	0.47-0.54	1	1.305	3912/14279	95.91	UQMI01000001.1 uncultured Blautia sp. isolate UMGS421 genome assembly, contig: NODE_51_length_147997_cov_44.278373, whole genome shotgun sequence
../wallen_disk/reads/SRR19064321_1.fastq.gz	gtdb_genomes_reps_r214/database/GCA/900/541/345/GCA_900541345.1_genomic.fna.gz	0.0516	0.0403	98.48	0.778	98.30-98.70	0.508	0.46-0.54	1	1.289	2902/11385	95.69	UQJE01000001.1 uncultured Blautia sp. isolate UMGS335 genome assembly, contig: NODE_74_length_104851_cov_3.90395, whole genome shotgun sequence
../wallen_disk/reads/SRR19064321_1.fastq.gz	gtdb_genomes_reps_r214/database/GCF/002/160/765/GCF_002160765.1_genomic.fna.gz	0.0510	0.0547	98.61	0.768	98.45-98.85	0.502	0.46-0.53	1	1.424	4209/16017	95.78	NZ_NFLF01000001.1 Lachnoclostridium sp. An138 An138_contig_1, whole genome shotgun sequence
../wallen_disk/reads/SRR19064321_1.fastq.gz	gtdb_genomes_reps_r214/database/GCA/904/399/395/GCA_904399395.1_genomic.fna.gz	0.0503	0.0427	98.78	0.757	98.62-98.98	0.495	0.45-0.53	1	1.281	3447/12677	95.89	CAJFPJ010000001.1 uncultured Clostridia bacterium isolate Coassembly_mag_77 genome assembly, contig: MAGpy_11413_min2k_bin_77_fak87_61479, whole genome shotgun sequence
../wallen_disk/reads/SRR19064321_1.fastq.gz	gtdb_genomes_reps_r214/database/GCF/900/099/625/GCF_900099625.1_genomic.fna.gz	0.0496	0.0362	98.46	0.746	98.26-98.74	0.488	0.44-0.52	1	1.309	2633/10807	95.55	NZ_FMTF01000051.1 Lactococcus lactis strain ATCC 19435, whole genome shotgun sequence
../wallen_disk/reads/SRR19064321_1.fastq.gz	gtdb_genomes_reps_r214/database/GCF/002/160/815/GCF_002160815.1_genomic.fna.gz	0.0489	0.0363	98.30	0.736	98.09-98.55	0.481	0.43-0.52	1	1.322	2483/10857	95.35	NZ_NFLH01000001.1 Massilimicrobiota sp. An134 An134_contig_1, whole genome shotgun sequence
../wallen_disk/reads/SRR19064321_1.fastq.gz	gtdb_genomes_reps_r214/database/GCF/000/156/195/GCF_000156195.1_genomic.fna.gz	0.0477	0.0678	98.30	0.718	98.13-98.50	0.470	0.43-0.50	1	1.289	5077/20883	95.54	NZ_GG688349.1 Bacteroides finegoldii DSM 17565 Scfld32, whole genome shotgun sequence
../wallen_disk/reads/SRR19064321_1.fastq.gz	gtdb_genomes_reps_r214/database/GCA/019/118/705/GCA_019118705.1_genomic.fna.gz	0.0470	0.0305	98.15	0.707	97.93-98.45	0.462	0.41-0.50	1	1.317	2051/9692	95.11	DWYK01000063.1 MAG TPA_asm: Candidatus Merdibacter merdigallinarum isolate ChiGjej6B6-453 ChiGjej6B6M5__C102091_L13138_SAMN08009849, whole genome shotgun sequence
../wallen_disk/reads/SRR19064321_1.fastq.gz	gtdb_genomes_reps_r214/database/GCF/020/215/665/GCF_020215665.1_genomic.fna.gz	0.0462	0.0838	98.30	0.695	98.16-98.48	0.454	0.43-0.48	1	1.291	5819/26520	95.22	NZ_CP084061.1 Blautia sp. NBRC 113351 chromosome, complete genome
../wallen_disk/reads/SRR19064321_1.fastq.gz	gtdb_genomes_reps_r214/database/GCA/018/716/575/GCA_018716575.1_genomic.fna.gz	0.0450	0.0297	98.59	0.678	98.40-98.88	0.443	0.40-0.48	1	1.229	2279/9690	95.44	DVJR01000114.1 MAG TPA_asm: Candidatus Scatomonas merdavium isolate ChiSjej5B23-9500 ChiSjej5B23M5__C102579_L20700_SRR6323335, whole genome shotgun sequence
../wallen_disk/reads/SRR19064321_1.fastq.gz	gtdb_genomes_reps_r214/database/GCF/004/341/945/GCF_004341945.1_genomic.fna.gz	0.0448	0.0384	98.98	0.675	98.80-99.24	0.441	0.40-0.47	1	1.262	3326/12562	95.80	NZ_SMBP01000001.1 Longicatena caecimuris strain DSM 29481 Ga0244710_101, whole genome shotgun sequence
../wallen_disk/reads/SRR19064321_1.fastq.gz	gtdb_genomes_reps_r214/database/GCF/014/337/215/GCF_014337215.1_genomic.fna.gz	0.0416	0.0478	99.29	0.627	99.12-99.53	0.410	0.37-0.43	1	1.269	4742/16955	95.97	NZ_CP060635.1 Wansuia hejianensis strain NSJ-29 chromosome, complete genome
../wallen_disk/reads/SRR19064321_1.fastq.gz	gtdb_genomes_reps_r214/database/GCF/002/234/575/GCF_002234575.2_genomic.fna.gz	0.0414	0.0796	96.76	0.624	96.57-96.99	0.408	0.38-0.43	1	1.263	3492/28270	93.48	NZ_CP022464.2 Enterocloster bolteae strain ATCC BAA-613 chromosome, complete genome
../wallen_disk/reads/SRR19064321_1.fastq.gz	gtdb_genomes_reps_r214/database/GCF/014/384/805/GCF_014384805.1_genomic.fna.gz	0.0409	0.0262	97.15	0.616	96.87-97.53	0.403	0.35-0.44	1	1.222	1347/9744	93.82	NZ_JACRSS010000001.1 Guopingia tenuis strain NSJ-63 L27_ctg001, whole genome shotgun sequence
../wallen_disk/reads/SRR19064321_1.fastq.gz	gtdb_genomes_reps_r214/database/GCF/009/557/455/GCF_009557455.1_genomic.fna.gz	0.0398	0.0349	98.95	0.599	98.76-99.19	0.391	0.36-0.42	1	1.224	3149/12995	95.53	NZ_CP045651.1 Alistipes sp. dk3624 chromosome, complete genome
../wallen_disk/reads/SRR19064321_1.fastq.gz	gtdb_genomes_reps_r214/database/GCA/902/362/775/GCA_902362775.1_genomic.fna.gz	0.0391	0.0328	98.34	0.588	98.14-98.59	0.384	0.34-0.41	1	1.430	2438/12434	94.88	CABIXV010000001.1 Clostridiales bacterium isolate MGYG-HGUT-00059 genome assembly, contig: .14207_7_18.1, whole genome shotgun sequence
../wallen_disk/reads/SRR19064321_1.fastq.gz	gtdb_genomes_reps_r214/database/GCF/001/553/935/GCF_001553935.1_genomic.fna.gz	0.0390	0.0345	97.94	0.588	97.72-98.21	0.384	0.35-0.41	1	1.230	2227/13056	94.45	NZ_CP014232.1 Actinomyces oris strain T14V chromosome, complete genome
../wallen_disk/reads/SRR19064321_1.fastq.gz	gtdb_genomes_reps_r214/database/GCF/900/086/725/GCF_900086725.1_genomic.fna.gz	0.0386	0.0473	99.13	0.580	98.99-99.40	0.379	0.34-0.40	1	1.294	4490/18152	95.59	NZ_LT574828.1 Bariatricus massiliensis strain AT12, whole genome shotgun sequence
../wallen_disk/reads/SRR19064321_1.fastq.gz	gtdb_genomes_reps_r214/database/GCA/019/420/265/GCA_019420265.1_genomic.fna.gz	0.0382	0.0177	97.25	0.576	96.82-97.78	0.376	0.31-0.43	1	1.202	903/6713	93.73	JAHZHM010000001.1 MAG: Clostridiales bacterium isolate HRGM_Genome_3303 HRGM_Genome_3303_1, whole genome shotgun sequence
../wallen_disk/reads/SRR19064321_1.fastq.gz	gtdb_genomes_reps_r214/database/GCA/905/214/345/GCA_905214345.1_genomic.fna.gz	0.0382	0.0308	98.59	0.575	98.34-98.89	0.376	0.33-0.40	1	1.326	2484/12043	95.04	CAJMLV010000001.1 TPA_asm: uncultured bacterium isolate ERR1600613-bin.6 genome assembly, contig: NODE_151_length_131838_cov_9.631667, whole genome shotgun sequence
../wallen_disk/reads/SRR19064321_1.fastq.gz	gtdb_genomes_reps_r214/database/GCA/944/349/545/GCA_944349545.1_genomic.fna.gz	0.0379	0.0283	98.46	0.570	98.22-98.75	0.373	0.34-0.40	1	1.223	2160/11026	94.88	CALVNG010000001.1 MAG: uncultured Eubacteriales bacterium isolate BRZ_N__bin162 genome assembly, contig: BRZ_N__NODE_733_length_84221_cov_14.272687, whole genome shotgun sequence
../wallen_disk/reads/SRR19064321_1.fastq.gz	gtdb_genomes_reps_r214/database/GCF/014/333/425/GCF_014333425.1_genomic.fna.gz	0.0375	0.0375	98.16	0.565	97.99-98.43	0.369	0.34-0.40	1	1.299	2701/14844	94.65	NZ_JACRYT010000001.1 Zhenpiania hominis strain BX12 BX-12_ctg0001, whole genome shotgun sequence
../wallen_disk/reads/SRR19064321_1.fastq.gz	gtdb_genomes_reps_r214/database/GCF/018/228/665/GCF_018228665.1_genomic.fna.gz	0.0374	0.0350	96.75	0.563	96.38-97.13	0.368	0.32-0.41	1	1.293	1529/13422	93.23	NZ_CP073692.1 Faecalicatena sp. Marseille-Q4148 chromosome
../wallen_disk/reads/SRR19064321_1.fastq.gz	gtdb_genomes_reps_r214/database/GCA/900/548/385/GCA_900548385.1_genomic.fna.gz	0.0373	0.0490	98.33	0.562	98.19-98.56	0.367	0.34-0.39	1	1.203	3682/19804	94.72	URKJ01000001.1 uncultured bacterium isolate UMGS1084 genome assembly, contig: NODE_3_length_278923_cov_10.502801, whole genome shotgun sequence
../wallen_disk/reads/SRR19064321_1.fastq.gz	gtdb_genomes_reps_r214/database/GCA/900/539/765/GCA_900539765.1_genomic.fna.gz	0.0361	0.0215	96.71	0.543	96.23-97.14	0.355	0.30-0.41	1	1.222	961/8876	93.08	UQDF01000001.1 uncultured Porphyromonas sp. isolate UMGS166 genome assembly, contig: NODE_16_length_110386_cov_14.189222, whole genome shotgun sequence
../wallen_disk/reads/SRR19064321_1.fastq.gz	gtdb_genomes_reps_r214/database/GCA/900/541/585/GCA_900541585.1_genomic.fna.gz	0.0356	0.0320	98.88	0.536	98.67-99.21	0.350	0.31-0.38	1	1.172	2994/13259	95.31	UQKD01000001.1 uncultured Alistipes sp. isolate UMGS368 genome assembly, contig: NODE_6_length_228387_cov_12.389183, whole genome shotgun sequence
../wallen_disk/reads/SRR19064321_1.fastq.gz	gtdb_genomes_reps_r214/database/GCA/022/846/075/GCA_022846075.1_genomic.fna.gz	0.0355	0.0333	97.42	0.535	97.16-97.74	0.350	0.31-0.38	1	1.328	1921/14167	93.76	AP025582.1 Oscillospiraceae bacterium CE91-St43 DNA, complete genome
../wallen_disk/reads/SRR19064321_1.fastq.gz	gtdb_genomes_reps_r214/database/GCF/020/687/245/GCF_020687245.1_genomic.fna.gz	0.0350	0.0302	97.19	0.528	96.80-97.51	0.345	0.30-0.39	1	1.909	1593/12801	93.50	NZ_JAJEQG010000010.1 Faecalibacterium longum CLA-AA-H243 NODE_10_length_77401_cov_21.251280, whole genome shotgun sequence
../wallen_disk/reads/SRR19064321_1.fastq.gz	gtdb_genomes_reps_r214/database/GCF/900/291/975/GCF_900291975.1_genomic.fna.gz	0.0349	0.0327	98.49	0.526	98.25-98.80	0.344	0.31-0.38	1	1.417	2481/13270	94.73	NZ_OMPN01000002.1 Intestinibacillus sp. Marseille-P4005, whole genome shotgun sequence
../wallen_disk/reads/SRR19064321_1.fastq.gz	gtdb_genomes_reps_r214/database/GCA/944/386/565/GCA_944386565.1_genomic.fna.gz	0.0347	0.0245	98.61	0.523	98.35-99.00	0.342	0.30-0.37	1	1.343	2020/10532	94.81	CALXBO010000001.1 MAG: uncultured Ruthenibacterium sp. isolate BRZ_PB__bin102 genome assembly, contig: BRZ_PB__NODE_110_length_139308_cov_18.250569, whole genome shotgun sequence
../wallen_disk/reads/SRR19064321_1.fastq.gz	gtdb_genomes_reps_r214/database/GCF/003/574/295/GCF_003574295.1_genomic.fna.gz	0.0344	0.0303	97.66	0.517	97.38-98.14	0.338	0.29-0.37	1	1.398	1840/12994	93.89	NZ_BHGK01000001.1 Mediterraneibacter butyricigenes strain KCTC 15684 Contigs1, whole genome shotgun sequence
../wallen_disk/reads/SRR19064321_1.fastq.gz	gtdb_genomes_reps_r214/database/GCF/000/466/485/GCF_000466485.1_genomic.fna.gz	0.0342	0.0479	98.79	0.515	98.63-99.04	0.336	0.31-0.36	1	1.190	4159/20744	94.95	NZ_KE992784.1 [Clostridium] symbiosum ATCC 14940 Scaffold0, whole genome shotgun sequence
../wallen_disk/reads/SRR19064321_1.fastq.gz	gtdb_genomes_reps_r214/database/GCF/005/845/215/GCF_005845215.1_genomic.fna.gz	0.0340	0.0645	98.33	0.512	98.17-98.54	0.335	0.31-0.35	1	1.313	4934/28288	94.52	NZ_SPHO01000010.1 Clostridium sp. 1001271st1 H5 strain 1001271st1_H5 NODE_10_length_250554_cov_22.7303, whole genome shotgun sequence
../wallen_disk/reads/SRR19064321_1.fastq.gz	gtdb_genomes_reps_r214/database/GCA/003/526/375/GCA_003526375.1_genomic.fna.gz	0.0336	0.0510	98.60	0.506	98.46-98.83	0.331	0.30-0.34	1	1.183	4199/22633	94.71	DPDG01000102.1 MAG TPA_asm: Lentisphaeria bacterium isolate UBA11452 contig_10518, whole genome shotgun sequence
../wallen_disk/reads/SRR19064321_1.fastq.gz	gtdb_genomes_reps_r214/database/GCA/003/112/755/GCA_003112755.1_genomic.fna.gz	0.0335	0.0417	97.58	0.504	97.29-97.93	0.330	0.29-0.36	1	1.531	2252/16161	93.84	BFBT01000001.1 Lawsonibacter asaccharolyticus DNA, contig01, whole genome shotgun sequence
../wallen_disk/reads/SRR19064321_1.fastq.gz	gtdb_genomes_reps_r214/database/GCF/004/154/955/GCF_004154955.1_genomic.fna.gz	0.0334	0.0313	97.96	0.503	97.76-98.30	0.329	0.29-0.35	1	1.368	2090/13798	94.09	NZ_CP011524.1 Intestinimonas butyriciproducens strain SRB-521-5-I chromosome, complete genome
../wallen_disk/reads/SRR19064321_1.fastq.gz	gtdb_genomes_reps_r214/database/GCF/000/157/995/GCF_000157995.1_genomic.fna.gz	0.0332	0.0380	98.27	0.500	98.06-98.59	0.327	0.29-0.35	1	1.246	2813/16420	94.47	NZ_GG657585.1 Holdemania filiformis DSM 12042 Scfld138, whole genome shotgun sequence
../wallen_disk/reads/SRR19064321_1.fastq.gz	gtdb_genomes_reps_r214/database/GCF/000/154/285/GCF_000154285.1_genomic.fna.gz	0.0325	0.0207	97.49	0.490	97.16-97.98	0.320	0.28-0.36	1	1.211	1168/9170	93.57	NZ_DS483478.1 Amedibacillus dolichus DSM 3991 Scfld_02_18, whole genome shotgun sequence
../wallen_disk/reads/SRR19064321_1.fastq.gz	gtdb_genomes_reps_r214/database/GCA/905/199/445/GCA_905199445.1_genomic.fna.gz	0.0319	0.0286	99.16	0.480	98.90-99.44	0.314	0.29-0.34	1	1.215	2828/13357	95.12	CAJKGK010000001.1 TPA_asm: uncultured Lachnospiraceae bacterium isolate ERR1600560-bin.9 genome assembly, contig: NODE_7_length_333122_cov_11.147439, whole genome shotgun sequence
../wallen_disk/reads/SRR19064321_1.fastq.gz	gtdb_genomes_reps_r214/database/GCF/002/221/595/GCF_002221595.1_genomic.fna.gz	0.0314	0.0263	98.45	0.473	98.20-98.80	0.309	0.27-0.33	1	1.179	1949/11682	94.39	NZ_NHMP01000010.1 Turicimonas muris strain YL45 NODE_10_length_86772_cov_154.734_ID_4070, whole genome shotgun sequence
../wallen_disk/reads/SRR19064321_1.fastq.gz	gtdb_genomes_reps_r214/database/GCF/008/121/495/GCF_008121495.1_genomic.fna.gz	0.0313	0.0323	98.52	0.472	98.28-98.83	0.308	0.28-0.34	1	1.365	2581/14950	94.49	NZ_CP043051.1 [Ruminococcus] gnavus ATCC 29149 strain JCM6515 chromosome, complete genome
../wallen_disk/reads/SRR19064321_1.fastq.gz	gtdb_genomes_reps_r214/database/GCF/001/937/445/GCF_001937445.1_genomic.fna.gz	0.0310	0.0291	96.49	0.467	95.98-96.85	0.305	0.27-0.36	1	1.182	1247/14024	92.49	NZ_MSKS01000001.1 Actinomyces oris strain WE8B-23 WE8B-23_contig001, whole genome shotgun sequence
../wallen_disk/reads/SRR19064321_1.fastq.gz	gtdb_genomes_reps_r214/database/GCF/943/193/075/GCF_943193075.1_genomic.fna.gz	0.0308	0.0186	97.63	0.464	97.21-98.07	0.303	0.26-0.35	1	1.215	1140/8935	93.57	NZ_CALPCT010000001.1 Streptococcus sp. DSM 110150 isolate Streptococcus_sp_nov_DSM110150 NODE_1_length_176179_cov_45.772331, whole genome shotgun sequence
../wallen_disk/reads/SRR19064321_1.fastq.gz	gtdb_genomes_reps_r214/database/GCA/003/481/775/GCA_003481775.1_genomic.fna.gz	0.0308	0.0428	97.87	0.463	97.65-98.18	0.303	0.27-0.33	1	1.300	2838/20668	93.80	QULU01000001.1 Clostridiaceae bacterium OM02-2AC OM02-2AC.Scaf1, whole genome shotgun sequence
../wallen_disk/reads/SRR19064321_1.fastq.gz	gtdb_genomes_reps_r214/database/GCA/003/150/225/GCA_003150225.1_genomic.fna.gz	0.0305	0.0130	99.01	0.459	98.70-99.52	0.300	0.25-0.33	1	1.175	1151/5915	94.86	QAND01000021.1 MAG: Firmicutes bacterium isolate CIM:MAG 959 contig_110950, whole genome shotgun sequence
../wallen_disk/reads/SRR19064321_1.fastq.gz	gtdb_genomes_reps_r214/database/GCA/900/542/005/GCA_900542005.1_genomic.fna.gz	0.0304	0.0257	98.52	0.458	98.23-98.86	0.300	0.26-0.33	1	1.163	2104/12645	94.38	UQLW01000001.1 uncultured Clostridiales bacterium isolate UMGS416 genome assembly, contig: NODE_79_length_145387_cov_4.995328, whole genome shotgun sequence
../wallen_disk/reads/SRR19064321_1.fastq.gz	gtdb_genomes_reps_r214/database/GCA/900/155/415/GCA_900155415.1_genomic.fna.gz	0.0301	0.0224	97.95	0.453	97.58-98.34	0.296	0.26-0.33	1	1.200	1475/10708	93.81	LT700187.1 Christensenella sp. Marseille-P2438 genome assembly, chromosome: contig00001
../wallen_disk/reads/SRR19064321_1.fastq.gz	gtdb_genomes_reps_r214/database/GCA/900/761/925/GCA_900761925.1_genomic.fna.gz	0.0296	0.0207	98.27	0.446	97.96-98.69	0.291	0.25-0.32	1	1.162	1571/10451	94.07	CAAFER010000001.1 TPA_asm: uncultured Shuttleworthia sp., isolate HGM12545, WGS project CAAFER010000000 data, contig: SRS104400_31_k99_976, whole genome shotgun sequence
../wallen_disk/reads/SRR19064321_1.fastq.gz	gtdb_genomes_reps_r214/database/GCF/018/408/705/GCF_018408705.1_genomic.fna.gz	0.0296	0.0293	97.71	0.445	97.36-98.05	0.291	0.25-0.31	1	1.423	1795/14246	93.54	NZ_AP023420.1 Pusillibacter faecalis strain MM59 chromosome
../wallen_disk/reads/SRR19064321_1.fastq.gz	gtdb_genomes_reps_r214/database/GCA/916/438/365/GCA_916438365.1_genomic.fna.gz	0.0294	0.0182	96.68	0.443	96.14-97.27	0.289	0.24-0.35	1	1.175	755/8395	92.52	CAKAEY010000001.1 TPA_asm: uncultured Sanguibacter sp. isolate DRR214962_bin.2_metaWRAP_v1.1_MAG genome assembly, contig: BNJV01000374, whole genome shotgun sequence
../wallen_disk/reads/SRR19064321_1.fastq.gz	gtdb_genomes_reps_r214/database/GCA/904/420/575/GCA_904420575.1_genomic.fna.gz	0.0287	0.0247	98.37	0.433	98.07-98.73	0.283	0.25-0.31	1	1.202	1941/12836	94.09	CAJFVW010000001.1 uncultured Gordonibacter sp. isolate Coassembly_mag_502 genome assembly, contig: MAGpy_11413_min2k_bin_502_fak87_7924, whole genome shotgun sequence
../wallen_disk/reads/SRR19064321_1.fastq.gz	gtdb_genomes_reps_r214/database/GCF/009/696/065/GCF_009696065.1_genomic.fna.gz	0.0287	0.0270	97.22	0.432	96.80-97.60	0.283	0.24-0.32	1	1.331	1464/13906	93.00	NZ_VUMS01000001.1 Oliverpabstia intestinalis strain BSM-380-WT-5A seq1, whole genome shotgun sequence
../wallen_disk/reads/SRR19064321_1.fastq.gz	gtdb_genomes_reps_r214/database/GCA/902/363/665/GCA_902363665.1_genomic.fna.gz	0.0287	0.0346	97.11	0.432	96.71-97.50	0.283	0.24-0.32	1	1.562	1784/17267	92.94	CABJAW010000001.1 Lachnospiraceae bacterium isolate MGYG-HGUT-00137 genome assembly, contig: .21673_4_12.1, whole genome shotgun sequence
../wallen_disk/reads/SRR19064321_1.fastq.gz	gtdb_genomes_reps_r214/database/GCA/902/373/545/GCA_902373545.1_genomic.fna.gz	0.0286	0.0195	97.93	0.431	97.48-98.42	0.281	0.24-0.32	1	1.165	1325/10116	93.65	CABKMZ010000001.1 uncultured Actinomyces sp. isolate MGYG-HGUT-01285 genome assembly, contig: NODE_11_length_114815_cov_22.1871, whole genome shotgun sequence
../wallen_disk/reads/SRR19064321_1.fastq.gz	gtdb_genomes_reps_r214/database/GCA/001/304/875/GCA_001304875.1_genomic.fna.gz	0.0278	0.0279	98.75	0.419	98.47-99.11	0.274	0.24-0.30	1	1.290	2462/14776	94.38	BBZO01000001.1 Clostridia bacterium UC5.1-2E3 DNA, contig: contig00001, whole genome shotgun sequence
../wallen_disk/reads/SRR19064321_1.fastq.gz	gtdb_genomes_reps_r214/database/GCA/018/713/105/GCA_018713105.1_genomic.fna.gz	0.0278	0.0280	98.37	0.419	98.00-98.73	0.274	0.24-0.31	1	1.178	2170/14773	94.00	DVFT01000060.1 MAG TPA_asm: Candidatus Limivivens merdigallinarum isolate ChiSjej3B21-11622 ChiSjej3B21M5__C101575_L11650_SRR6323095, whole genome shotgun sequence
../wallen_disk/reads/SRR19064321_1.fastq.gz	gtdb_genomes_reps_r214/database/GCF/016/899/775/GCF_016899775.1_genomic.fna.gz	0.0270	0.0277	95.75	0.406	95.15-96.27	0.265	0.22-0.32	1	1.294	941/14935	91.47	NZ_JACJJE010000100.1 Pseudoflavonifractor capillosus strain An827 An827_NODE_100_length_5328_cov_81.407, whole genome shotgun sequence
../wallen_disk/reads/SRR19064321_1.fastq.gz	gtdb_genomes_reps_r214/database/GCA/900/543/485/GCA_900543485.1_genomic.fna.gz	0.0268	0.0192	98.49	0.403	98.13-98.87	0.263	0.23-0.29	1	1.204	1575/10637	94.02	UQRM01000001.1 uncultured Eubacterium sp. isolate UMGS574 genome assembly, contig: NODE_13_length_185936_cov_8.707655, whole genome shotgun sequence
../wallen_disk/reads/SRR19064321_1.fastq.gz	gtdb_genomes_reps_r214/database/GCA/022/846/035/GCA_022846035.1_genomic.fna.gz	0.0262	0.0211	96.98	0.395	96.52-97.45	0.258	0.22-0.30	1	1.265	1059/11768	92.53	AP025580.1 Christensenellaceae bacterium CE91-St37 DNA, complete genome
../wallen_disk/reads/SRR19064321_1.fastq.gz	gtdb_genomes_reps_r214/database/GCA/905/200/545/GCA_905200545.1_genomic.fna.gz	0.0258	0.0201	97.46	0.388	97.00-97.93	0.254	0.22-0.28	1	1.220	1215/11739	92.94	CAJKKQ010000001.1 TPA_asm: uncultured Oscillibacter sp. isolate ERR260183-bin.7 genome assembly, contig: NODE_2_length_239758_cov_7.899146, whole genome shotgun sequence
../wallen_disk/reads/SRR19064321_1.fastq.gz	gtdb_genomes_reps_r214/database/GCF/000/157/975/GCF_000157975.1_genomic.fna.gz	0.0254	0.0268	98.38	0.383	98.04-98.73	0.250	0.22-0.28	1	1.199	2158/15522	93.83	NZ_GG657710.1 Blautia hydrogenotrophica DSM 10507 Scfld93, whole genome shotgun sequence
../wallen_disk/reads/SRR19064321_1.fastq.gz	gtdb_genomes_reps_r214/database/GCF/019/042/275/GCF_019042275.1_genomic.fna.gz	0.0252	0.0419	98.47	0.380	98.23-98.73	0.248	0.23-0.27	1	1.268	3397/24111	93.87	NZ_JAHQCW010000001.1 Diplocloster agilis strain ASD5720 Scaffold_1, whole genome shotgun sequence
