../wallen_disk/reads/SRR19064326_1.fastq.gz	gtdb_genomes_reps_r214/database/GCF/003/287/405/GCF_003287405.1_genomic.fna.gz	0.5726	0.3848	97.76	7.351	NA-NA	HIGH	NA-NA	5	4.943	6408/12932	97.76	NZ_PRLD01000040.1 Faecalibacterium prausnitzii strain APC923/51-1 NODE_109_length_3421_cov_1544.05, whole genome shotgun sequence
../wallen_disk/reads/SRR19064326_1.fastq.gz	gtdb_genomes_reps_r214/database/GCA/900/543/625/GCA_900543625.1_genomic.fna.gz	0.5676	0.2572	97.80	7.288	NA-NA	HIGH	NA-NA	5	4.901	4371/8707	97.80	UQSF01000001.1 uncultured Clostridiales bacterium isolate UMGS596 genome assembly, contig: NODE_6_length_233473_cov_17.826093, whole genome shotgun sequence
../wallen_disk/reads/SRR19064326_1.fastq.gz	gtdb_genomes_reps_r214/database/GCA/021/029/595/GCA_021029595.1_genomic.fna.gz	0.5560	0.3660	97.77	7.139	NA-NA	HIGH	NA-NA	4	4.800	6349/12777	97.77	JAJJOY010000010.1 Oscillospiraceae bacterium MH27-2 scaffold10_size106044, whole genome shotgun sequence
../wallen_disk/reads/SRR19064326_1.fastq.gz	gtdb_genomes_reps_r214/database/GCF/020/554/845/GCF_020554845.1_genomic.fna.gz	0.5380	0.4895	98.45	6.908	NA-NA	HIGH	NA-NA	4	4.645	10865/17617	98.45	NZ_JAJCIA010000001.1 Blautia faecis strain DFI.3.66 LDJIBEFH_1, whole genome shotgun sequence
../wallen_disk/reads/SRR19064326_1.fastq.gz	gtdb_genomes_reps_r214/database/GCA/902/363/045/GCA_902363045.1_genomic.fna.gz	0.5269	0.3919	97.49	6.765	NA-NA	HIGH	NA-NA	4	4.549	6402/14090	97.49	CABIYX010000001.1 Clostridiales bacterium isolate MGYG-HGUT-00086 genome assembly, contig: .18048_2_82.1, whole genome shotgun sequence
../wallen_disk/reads/SRR19064326_1.fastq.gz	gtdb_genomes_reps_r214/database/GCF/005/844/325/GCF_005844325.1_genomic.fna.gz	0.5167	0.2506	96.58	6.634	NA-NA	HIGH	NA-NA	4	4.461	3245/9543	96.58	NZ_SPFY01000010.1 Collinsella aerofaciens strain 1001271st1_C3 NODE_10_length_66753_cov_18.9749, whole genome shotgun sequence
../wallen_disk/reads/SRR19064326_1.fastq.gz	gtdb_genomes_reps_r214/database/GCA/025/150/425/GCA_025150425.1_genomic.fna.gz	0.5145	0.3073	97.32	6.605	NA-NA	HIGH	NA-NA	4	4.442	4918/11421	97.32	CP102281.1 [Eubacterium] siraeum strain DSM 15702 chromosome, complete genome
../wallen_disk/reads/SRR19064326_1.fastq.gz	gtdb_genomes_reps_r214/database/GCA/900/755/095/GCA_900755095.1_genomic.fna.gz	0.5015	0.3994	96.36	6.440	NA-NA	HIGH	NA-NA	3	4.330	4918/15512	96.36	CAAEFE010000001.1 TPA_asm: uncultured Bacteroides sp., isolate HGM04659, WGS project CAAEFE010000000 data, contig: ERS473029_19_k99_64, whole genome shotgun sequence
../wallen_disk/reads/SRR19064326_1.fastq.gz	gtdb_genomes_reps_r214/database/GCF/018/784/445/GCF_018784445.1_genomic.fna.gz	0.4865	0.3667	97.93	6.246	NA-NA	HIGH	NA-NA	3	4.200	7583/14510	97.93	NZ_WQOH01000072.1 Gemmiger formicilis strain MCC627 NODE_102_length_126_cov_79.071426, whole genome shotgun sequence
../wallen_disk/reads/SRR19064326_1.fastq.gz	gtdb_genomes_reps_r214/database/GCA/003/112/755/GCA_003112755.1_genomic.fna.gz	0.4752	0.4510	98.98	6.101	NA-NA	HIGH	NA-NA	3	4.103	11750/16161	98.98	BFBT01000001.1 Lawsonibacter asaccharolyticus DNA, contig01, whole genome shotgun sequence
../wallen_disk/reads/SRR19064326_1.fastq.gz	gtdb_genomes_reps_r214/database/GCF/900/209/925/GCF_900209925.1_genomic.fna.gz	0.4678	0.3645	97.13	6.006	NA-NA	HIGH	NA-NA	4	4.039	5880/14496	97.13	NZ_LT907978.1 Anaerobutyricum hallii isolate EH1 chromosome I
../wallen_disk/reads/SRR19064326_1.fastq.gz	gtdb_genomes_reps_r214/database/GCF/005/121/165/GCF_005121165.3_genomic.fna.gz	0.4630	0.3670	99.26	5.944	NA-NA	HIGH	NA-NA	4	3.997	11966/15083	99.26	NZ_CP034413.3 Dysosmobacter welbionis strain J115 chromosome, complete genome
../wallen_disk/reads/SRR19064326_1.fastq.gz	gtdb_genomes_reps_r214/database/GCF/009/696/065/GCF_009696065.1_genomic.fna.gz	0.4477	0.3209	97.90	5.749	NA-NA	HIGH	NA-NA	3	3.866	7206/13906	97.90	NZ_VUMS01000001.1 Oliverpabstia intestinalis strain BSM-380-WT-5A seq1, whole genome shotgun sequence
../wallen_disk/reads/SRR19064326_1.fastq.gz	gtdb_genomes_reps_r214/database/GCA/019/410/105/GCA_019410105.1_genomic.fna.gz	0.4437	0.1431	97.37	5.697	NA-NA	HIGH	NA-NA	3	3.831	2721/6219	97.37	DXTB01000001.1 MAG TPA_asm: Clostridiales bacterium isolate HRGM_Genome_2519 HRGM_Genome_2519_1, whole genome shotgun sequence
../wallen_disk/reads/SRR19064326_1.fastq.gz	gtdb_genomes_reps_r214/database/GCF/000/239/295/GCF_000239295.1_genomic.fna.gz	0.4397	0.3723	97.95	5.645	NA-NA	HIGH	NA-NA	3	3.796	8615/16381	97.95	NZ_JH417617.1 Flavonifractor plautii ATCC 29863 Scfld0, whole genome shotgun sequence
../wallen_disk/reads/SRR19064326_1.fastq.gz	gtdb_genomes_reps_r214/database/GCA/014/385/265/GCA_014385265.1_genomic.fna.gz	0.4373	0.2690	98.22	5.615	NA-NA	HIGH	NA-NA	3	3.776	6885/12010	98.22	JACRTJ010000018.1 Lachnospiraceae bacterium BX10 BX10_ctg00001, whole genome shotgun sequence
../wallen_disk/reads/SRR19064326_1.fastq.gz	gtdb_genomes_reps_r214/database/GCA/900/544/375/GCA_900544375.1_genomic.fna.gz	0.4345	0.2371	99.44	5.578	NA-NA	HIGH	NA-NA	3	3.751	8951/10661	99.44	UQUZ01000001.1 uncultured Ruminococcaceae bacterium isolate UMGS668 genome assembly, contig: NODE_82_length_151150_cov_5.108342, whole genome shotgun sequence
../wallen_disk/reads/SRR19064326_1.fastq.gz	gtdb_genomes_reps_r214/database/GCA/900/538/475/GCA_900538475.1_genomic.fna.gz	0.4344	0.2923	99.16	5.578	NA-NA	HIGH	NA-NA	3	3.751	10158/13190	99.16	UPYT01000001.1 uncultured Clostridium sp. isolate UMGS34 genome assembly, contig: NODE_3_length_366558_cov_10.7446, whole genome shotgun sequence
../wallen_disk/reads/SRR19064326_1.fastq.gz	gtdb_genomes_reps_r214/database/GCF/000/205/025/GCF_000205025.1_genomic.fna.gz	0.3709	0.2328	98.59	4.763	NA-NA	HIGH	NA-NA	3	3.203	7772/12065	98.59	NZ_GL883674.1 Parasutterella excrementihominis YIT 11859 Scfld0, whole genome shotgun sequence
../wallen_disk/reads/SRR19064326_1.fastq.gz	gtdb_genomes_reps_r214/database/GCF/000/225/345/GCF_000225345.1_genomic.fna.gz	0.3658	0.2912	98.02	4.696	NA-NA	HIGH	NA-NA	3	3.158	8146/15124	98.02	NC_015977.1 Roseburia hominis A2-183, complete sequence
../wallen_disk/reads/SRR19064326_1.fastq.gz	gtdb_genomes_reps_r214/database/GCF/902/364/025/GCF_902364025.1_genomic.fna.gz	0.3498	0.5042	97.01	4.492	NA-NA	HIGH	NA-NA	3	3.020	11098/28403	97.01	NZ_CABJCG010000001.1 Enterocloster lavalensis isolate MGYG-HGUT-00172, whole genome shotgun sequence
../wallen_disk/reads/SRR19064326_1.fastq.gz	gtdb_genomes_reps_r214/database/GCA/001/312/505/GCA_001312505.1_genomic.fna.gz	0.3478	0.2512	96.98	4.465	NA-NA	HIGH	NA-NA	3	3.002	5406/13972	96.98	BBDW01000001.1 Ruminococcus faecis JCM 15917 DNA, contig: JCM15917.contig00001, whole genome shotgun sequence
../wallen_disk/reads/SRR19064326_1.fastq.gz	gtdb_genomes_reps_r214/database/GCA/905/198/295/GCA_905198295.1_genomic.fna.gz	0.2776	0.1830	99.18	3.565	99.15-99.27	2.397	2.00-2.50	2	2.734	9142/12893	98.90	CAJKBW010000001.1 TPA_asm: uncultured Ruminococcaceae bacterium isolate ERR1600664-bin.7 genome assembly, contig: NODE_591_length_63678_cov_6.025117, whole genome shotgun sequence
../wallen_disk/reads/SRR19064326_1.fastq.gz	gtdb_genomes_reps_r214/database/GCF/000/701/705/GCF_000701705.1_genomic.fna.gz	0.2742	0.2814	97.38	3.521	97.32-97.55	2.367	1.96-2.48	2	2.740	7901/19755	97.09	NZ_JNJP01000001.1 Bilophila wadsworthia ATCC 49260 T370DRAFT_scaffold00001.1_C, whole genome shotgun sequence
../wallen_disk/reads/SRR19064326_1.fastq.gz	gtdb_genomes_reps_r214/database/GCA/900/544/295/GCA_900544295.1_genomic.fna.gz	0.2560	0.1590	98.75	3.287	98.70-98.87	2.210	1.97-2.29	2	2.738	7245/11932	98.40	UQUO01000001.1 uncultured Clostridiales bacterium isolate UMGS658 genome assembly, contig: NODE_8_length_274339_cov_19.3444, whole genome shotgun sequence
../wallen_disk/reads/SRR19064326_1.fastq.gz	gtdb_genomes_reps_r214/database/GCA/019/418/625/GCA_019418625.1_genomic.fna.gz	0.2520	0.1421	99.02	3.236	98.99-99.15	2.176	1.91-2.22	2	2.537	7263/11031	98.66	DYBL01000001.1 MAG TPA_asm: Clostridiales bacterium isolate HRGM_Genome_1975 HRGM_Genome_1975_1, whole genome shotgun sequence
../wallen_disk/reads/SRR19064326_1.fastq.gz	gtdb_genomes_reps_r214/database/GCF/900/199/635/GCF_900199635.1_genomic.fna.gz	0.2440	0.1701	99.14	3.132	99.12-99.23	2.106	1.92-2.14	2	2.602	9096/13445	98.75	NZ_LT962681.1 Anaerotruncus massiliensis strain AT3, whole genome shotgun sequence
../wallen_disk/reads/SRR19064326_1.fastq.gz	gtdb_genomes_reps_r214/database/GCF/000/011/065/GCF_000011065.1_genomic.fna.gz	0.2147	0.2994	97.62	2.756	97.56-97.67	1.853	1.79-1.93	2	2.734	10998/26733	97.18	NC_004663.1 Bacteroides thetaiotaomicron VPI-5482, complete sequence
../wallen_disk/reads/SRR19064326_1.fastq.gz	gtdb_genomes_reps_r214/database/GCF/001/881/565/GCF_001881565.1_genomic.fna.gz	0.2087	0.3495	98.73	2.680	98.69-98.78	1.802	1.75-1.86	2	2.404	18513/32672	98.18	NZ_MPDJ01000001.1 Eisenbergiella tayi strain DSM 26961 scaffold1, whole genome shotgun sequence
../wallen_disk/reads/SRR19064326_1.fastq.gz	gtdb_genomes_reps_r214/database/GCA/025/150/245/GCA_025150245.1_genomic.fna.gz	0.2065	0.1459	97.78	2.651	97.69-97.86	1.783	1.69-1.87	2	2.454	5630/13409	97.24	CP102279.1 Dorea formicigenerans strain ATCC 27755 chromosome, complete genome
../wallen_disk/reads/SRR19064326_1.fastq.gz	gtdb_genomes_reps_r214/database/GCF/003/425/665/GCF_003425665.1_genomic.fna.gz	0.2035	0.1125	99.22	2.613	99.16-99.30	1.757	1.66-1.82	2	2.429	7023/10667	98.66	NZ_QQRQ01000001.1 Evtepia gabavorous strain KLE1738 KLE1738_1, whole genome shotgun sequence
../wallen_disk/reads/SRR19064326_1.fastq.gz	gtdb_genomes_reps_r214/database/GCA/904/393/115/GCA_904393115.1_genomic.fna.gz	0.2006	0.1214	98.93	2.576	98.88-99.01	1.732	1.64-1.80	2	2.244	7055/11856	98.34	CAJFMX010000001.1 uncultured Clostridia bacterium isolate Chicken_8_mag_198 genome assembly, contig: MAGpy_11413_8_idba_bin_198_fascaffold_24, whole genome shotgun sequence
../wallen_disk/reads/SRR19064326_1.fastq.gz	gtdb_genomes_reps_r214/database/GCA/000/435/395/GCA_000435395.1_genomic.fna.gz	0.1985	0.1122	98.39	2.549	98.30-98.47	1.714	1.62-1.81	2	2.324	5369/10722	97.79	FR893566.1 Firmicutes bacterium CAG:94 genomic scaffold, scf5, whole genome shotgun sequence
../wallen_disk/reads/SRR19064326_1.fastq.gz	gtdb_genomes_reps_r214/database/GCF/009/696/275/GCF_009696275.1_genomic.fna.gz	0.1959	0.2652	97.60	2.516	97.54-97.66	1.692	1.63-1.77	2	2.444	10161/26083	97.00	NZ_VUMI01000001.1 Eisenbergiella porci strain WCA-389-WT-23B seq1, whole genome shotgun sequence
../wallen_disk/reads/SRR19064326_1.fastq.gz	gtdb_genomes_reps_r214/database/GCF/000/420/465/GCF_000420465.1_genomic.fna.gz	0.1954	0.1469	96.39	2.509	96.27-96.47	1.687	1.59-1.79	2	2.233	3878/14747	95.78	NZ_ATUZ01000001.1 Desulfovibrio desulfuricans DSM 642 G449DRAFT_scaffold00010.10_C, whole genome shotgun sequence
../wallen_disk/reads/SRR19064326_1.fastq.gz	gtdb_genomes_reps_r214/database/GCA/025/145/845/GCA_025145845.1_genomic.fna.gz	0.1825	0.1541	98.52	2.343	98.45-98.59	1.575	1.50-1.65	2	2.251	8060/15600	97.89	CP102253.1 Alistipes shahii WAL 8301 chromosome, complete genome
../wallen_disk/reads/SRR19064326_1.fastq.gz	gtdb_genomes_reps_r214/database/GCA/900/541/315/GCA_900541315.1_genomic.fna.gz	0.1809	0.1226	99.09	2.323	99.04-99.17	1.562	1.49-1.63	2	2.632	7802/12948	98.38	UQJF01000001.1 uncultured Clostridium sp. isolate UMGS337 genome assembly, contig: NODE_92_length_78578_cov_13.194949, whole genome shotgun sequence
../wallen_disk/reads/SRR19064326_1.fastq.gz	gtdb_genomes_reps_r214/database/GCA/025/147/765/GCA_025147765.1_genomic.fna.gz	0.1700	0.1375	98.72	2.183	98.63-98.79	1.468	1.41-1.54	2	2.272	8031/15190	97.97	CP102265.1 Blautia obeum ATCC 29174 chromosome, complete genome
../wallen_disk/reads/SRR19064326_1.fastq.gz	gtdb_genomes_reps_r214/database/GCF/001/487/165/GCF_001487165.1_genomic.fna.gz	0.1682	0.1386	98.44	2.159	98.37-98.51	1.452	1.40-1.51	2	2.230	7626/15776	97.68	NZ_LN913002.1 Blautia massiliensis strain GD8, whole genome shotgun sequence
../wallen_disk/reads/SRR19064326_1.fastq.gz	gtdb_genomes_reps_r214/database/GCA/934/647/945/GCA_934647945.1_genomic.fna.gz	0.1682	0.1007	99.70	2.159	99.63-99.75	1.452	1.40-1.51	2	2.070	8135/11542	98.88	CAKUFK010000001.1 MAG: uncultured Eubacteriales bacterium isolate REFINED_METABAT215_SUBJECT_CONTIGS_1500_ASSEMBLY_K77_MERGED__Pilot_MoBio_Fiber_I_11_1003.322 genome assembly, contig: Pilot_MoBio_Fiber_I_11_1003__NODE_27_length_444264_cov_19.739544, whole genome shotgun sequence
../wallen_disk/reads/SRR19064326_1.fastq.gz	gtdb_genomes_reps_r214/database/GCF/015/557/635/GCF_015557635.1_genomic.fna.gz	0.1672	0.1333	98.30	2.147	98.22-98.39	1.444	1.37-1.51	2	2.343	7137/15484	97.53	NZ_JADNOP010000010.1 Fusicatenibacter saccharivorans strain D41t1_190614_C8 NODE_10_length_148788_cov_71.1435, whole genome shotgun sequence
../wallen_disk/reads/SRR19064326_1.fastq.gz	gtdb_genomes_reps_r214/database/GCF/000/016/525/GCF_000016525.1_genomic.fna.gz	0.1556	0.0639	98.63	1.997	98.54-98.75	1.343	1.25-1.42	2	2.145	3814/7834	97.70	NC_009515.1 Methanobrevibacter smithii ATCC 35061, complete sequence
../wallen_disk/reads/SRR19064326_1.fastq.gz	gtdb_genomes_reps_r214/database/GCA/025/144/665/GCA_025144665.1_genomic.fna.gz	0.1555	0.0958	98.65	1.997	98.55-98.73	1.343	1.29-1.41	2	1.906	5826/11893	97.72	CP102294.1 Alistipes ihumii AP11 chromosome, complete genome
../wallen_disk/reads/SRR19064326_1.fastq.gz	gtdb_genomes_reps_r214/database/GCA/000/435/195/GCA_000435195.1_genomic.fna.gz	0.1524	0.0692	97.65	1.957	97.49-97.77	1.316	1.24-1.42	2	1.879	3092/8728	96.71	FR880119.1 Clostridium sp. CAG:169 genomic scaffold, scf4, whole genome shotgun sequence
../wallen_disk/reads/SRR19064326_1.fastq.gz	gtdb_genomes_reps_r214/database/GCF/000/949/455/GCF_000949455.1_genomic.fna.gz	0.1520	0.1385	98.99	1.952	98.92-99.07	1.313	1.26-1.35	2	2.033	9720/17864	98.06	NZ_JXXK01000001.1 Ruthenibacterium lactatiformans strain 585-1 contig00001, whole genome shotgun sequence
../wallen_disk/reads/SRR19064326_1.fastq.gz	gtdb_genomes_reps_r214/database/GCA/002/404/795/GCA_002404795.1_genomic.fna.gz	0.1489	0.0726	96.34	1.911	96.18-96.49	1.285	1.18-1.39	2	1.827	2191/9504	95.38	DHKK01000146.1 MAG TPA_asm: Clostridiales bacterium UBA4696 UBA4696_contig_1000, whole genome shotgun sequence
../wallen_disk/reads/SRR19064326_1.fastq.gz	gtdb_genomes_reps_r214/database/GCF/016/902/445/GCF_016902445.1_genomic.fna.gz	0.1464	0.0922	98.16	1.879	98.03-98.25	1.264	1.19-1.35	2	1.917	4945/12101	97.15	NZ_JACSNX010000001.1 Oscillibacter valericigenes strain An411 An411_contig-110_0, whole genome shotgun sequence
../wallen_disk/reads/SRR19064326_1.fastq.gz	gtdb_genomes_reps_r214/database/GCF/011/927/845/GCF_011927845.1_genomic.fna.gz	0.1444	0.1770	95.93	1.854	95.81-96.04	1.247	1.16-1.33	2	2.402	4831/23706	95.00	NZ_JAATLI010000001.1 Butyricimonas paravirosa strain DSM 105722 Ga0373284_01, whole genome shotgun sequence
../wallen_disk/reads/SRR19064326_1.fastq.gz	gtdb_genomes_reps_r214/database/GCF/000/010/425/GCF_000010425.1_genomic.fna.gz	0.1416	0.0656	98.63	1.818	98.51-98.74	1.223	1.15-1.31	2	1.899	4152/8919	97.56	NC_008618.1 Bifidobacterium adolescentis ATCC 15703, complete sequence
../wallen_disk/reads/SRR19064326_1.fastq.gz	gtdb_genomes_reps_r214/database/GCA/900/544/965/GCA_900544965.1_genomic.fna.gz	0.1410	0.0606	99.68	1.810	99.60-99.78	1.217	1.15-1.27	2	1.839	5516/8524	98.61	UQXE01000001.1 uncultured Clostridiales bacterium isolate UMGS726 genome assembly, contig: NODE_26_length_92025_cov_19.814385, whole genome shotgun sequence
../wallen_disk/reads/SRR19064326_1.fastq.gz	gtdb_genomes_reps_r214/database/GCF/900/142/265/GCF_900142265.1_genomic.fna.gz	0.1378	0.1083	98.10	1.770	97.99-98.20	1.190	1.12-1.26	2	2.112	5841/14863	97.03	NZ_FRAH01000163.1 Anaerotignum lactatifermentans DSM 14214, whole genome shotgun sequence
../wallen_disk/reads/SRR19064326_1.fastq.gz	gtdb_genomes_reps_r214/database/GCA/019/117/005/GCA_019117005.1_genomic.fna.gz	0.1370	0.0674	98.20	1.759	98.03-98.32	1.183	1.10-1.28	1	1.821	3801/9504	97.09	DXAO01000020.1 MAG TPA_asm: Candidatus Collinsella stercoripullorum isolate ChiGjej6B6-20822 ChiGjej6B6M5__C102054_L22011_SAMN08009849, whole genome shotgun sequence
../wallen_disk/reads/SRR19064326_1.fastq.gz	gtdb_genomes_reps_r214/database/GCF/008/121/495/GCF_008121495.1_genomic.fna.gz	0.1357	0.1068	98.88	1.742	98.79-98.97	1.171	1.12-1.22	1	1.802	7424/14950	97.77	NZ_CP043051.1 [Ruminococcus] gnavus ATCC 29149 strain JCM6515 chromosome, complete genome
../wallen_disk/reads/SRR19064326_1.fastq.gz	gtdb_genomes_reps_r214/database/GCA/025/149/785/GCA_025149785.1_genomic.fna.gz	0.1352	0.1011	98.40	1.735	98.30-98.49	1.167	1.12-1.22	2	1.959	6144/14318	97.31	CP102277.1 Coprococcus comes ATCC 27758 chromosome, complete genome
../wallen_disk/reads/SRR19064326_1.fastq.gz	gtdb_genomes_reps_r214/database/GCA/904/420/535/GCA_904420535.1_genomic.fna.gz	0.1314	0.0611	99.36	1.687	99.27-99.48	1.135	1.06-1.19	1	1.746	5132/9122	98.16	CAJFVQ010000001.1 Candidatus Cryptoclostridium obscurum isolate Coassembly_mag_106 genome assembly, contig: MAGpy_11413_min2k_bin_106_fak87_57212, whole genome shotgun sequence
../wallen_disk/reads/SRR19064326_1.fastq.gz	gtdb_genomes_reps_r214/database/GCF/006/542/665/GCF_006542665.1_genomic.fna.gz	0.1275	0.0933	98.84	1.637	98.76-98.94	1.101	1.05-1.15	1	1.857	6744/14233	97.62	NZ_AP019735.1 Alistipes communis strain 5CBH24 chromosome, complete genome
../wallen_disk/reads/SRR19064326_1.fastq.gz	gtdb_genomes_reps_r214/database/GCF/011/405/655/GCF_011405655.1_genomic.fna.gz	0.1272	0.0820	97.62	1.633	97.50-97.73	1.098	1.04-1.16	1	1.803	3939/12296	96.39	NZ_AP022829.1 Adlercreutzia hattorii strain 8CFCBH1 chromosome, complete genome
../wallen_disk/reads/SRR19064326_1.fastq.gz	gtdb_genomes_reps_r214/database/GCF/002/234/575/GCF_002234575.2_genomic.fna.gz	0.1258	0.1844	99.13	1.615	99.07-99.18	1.086	1.06-1.11	1	1.842	14635/28270	97.90	NZ_CP022464.2 Enterocloster bolteae strain ATCC BAA-613 chromosome, complete genome
../wallen_disk/reads/SRR19064326_1.fastq.gz	gtdb_genomes_reps_r214/database/GCA/900/545/515/GCA_900545515.1_genomic.fna.gz	0.1258	0.0764	98.95	1.615	98.85-99.05	1.086	1.03-1.14	1	1.746	5730/11850	97.68	UQZA01000001.1 uncultured Clostridiales bacterium isolate UMGS777 genome assembly, contig: NODE_3_length_269332_cov_9.326303, whole genome shotgun sequence
../wallen_disk/reads/SRR19064326_1.fastq.gz	gtdb_genomes_reps_r214/database/GCA/900/754/795/GCA_900754795.1_genomic.fna.gz	0.1251	0.0418	99.11	1.606	98.98-99.25	1.080	1.02-1.16	1	1.767	3350/6598	97.84	CAAEEA010000001.1 TPA_asm: Clostridia bacterium, isolate HGM13482, WGS project CAAEEA010000000 data, contig: ERS396508_43_k85_883, whole genome shotgun sequence
../wallen_disk/reads/SRR19064326_1.fastq.gz	gtdb_genomes_reps_r214/database/GCA/018/366/495/GCA_018366495.1_genomic.fna.gz	0.1250	0.0725	99.77	1.605	99.70-99.85	1.079	1.04-1.12	1	1.766	7136/11415	98.50	JAGZHZ010000002.1 Clostridiales bacterium isolate L3_130_000G1_dasL3_130_000G1_metabat.metabat.2 L3_130_000G1_scaffold_105, whole genome shotgun sequence
../wallen_disk/reads/SRR19064326_1.fastq.gz	gtdb_genomes_reps_r214/database/GCA/003/150/485/GCA_003150485.1_genomic.fna.gz	0.1222	0.0347	99.79	1.569	99.66-99.92	1.055	0.98-1.13	1	1.663	3076/4961	98.47	QALX01000007.1 MAG: Clostridiales bacterium isolate CIM:MAG 491 contig_159, whole genome shotgun sequence
../wallen_disk/reads/SRR19064326_1.fastq.gz	gtdb_genomes_reps_r214/database/GCF/000/478/885/GCF_000478885.1_genomic.fna.gz	0.1169	0.0741	95.08	1.500	94.89-95.29	1.009	0.90-1.11	1	1.726	1654/12261	93.74	NC_022567.1 Adlercreutzia equolifaciens DSM 19450, complete sequence
../wallen_disk/reads/SRR19064326_1.fastq.gz	gtdb_genomes_reps_r214/database/GCA/902/362/775/GCA_902362775.1_genomic.fna.gz	0.1114	0.0714	98.97	1.430	98.84-99.08	0.962	0.91-1.03	1	1.799	5710/12434	97.52	CABIXV010000001.1 Clostridiales bacterium isolate MGYG-HGUT-00059 genome assembly, contig: .14207_7_18.1, whole genome shotgun sequence
../wallen_disk/reads/SRR19064326_1.fastq.gz	gtdb_genomes_reps_r214/database/GCA/003/573/975/GCA_003573975.1_genomic.fna.gz	0.1089	0.0859	98.77	1.398	98.66-98.89	0.940	0.89-0.99	2	2.790	6324/14679	97.32	AP018533.1 Clostridiales bacterium CCNA10 DNA, complete genome
../wallen_disk/reads/SRR19064326_1.fastq.gz	gtdb_genomes_reps_r214/database/GCA/900/549/885/GCA_900549885.1_genomic.fna.gz	0.1067	0.0639	99.44	1.369	99.31-99.55	0.921	0.87-0.97	1	1.809	6000/11652	97.88	URQA01000001.1 uncultured Clostridiales bacterium isolate UMGS1232 genome assembly, contig: NODE_121_length_87095_cov_7.098794, whole genome shotgun sequence
../wallen_disk/reads/SRR19064326_1.fastq.gz	gtdb_genomes_reps_r214/database/GCF/000/173/975/GCF_000173975.1_genomic.fna.gz	0.1056	0.0770	99.02	1.356	98.90-99.11	0.912	0.87-0.95	2	2.283	6389/14047	97.49	NZ_ACEP01000175.1 Anaerobutyricum hallii DSM 3353 E_hallii-1.0_Cont496.1, whole genome shotgun sequence
../wallen_disk/reads/SRR19064326_1.fastq.gz	gtdb_genomes_reps_r214/database/GCF/000/469/345/GCF_000469345.1_genomic.fna.gz	0.1050	0.0803	98.39	1.349	98.27-98.48	0.907	0.87-0.96	1	1.719	5530/14800	96.87	NZ_KI271072.1 Eubacterium ramulus ATCC 29099 Scaffold1027, whole genome shotgun sequence
../wallen_disk/reads/SRR19064326_1.fastq.gz	gtdb_genomes_reps_r214/database/GCA/900/540/045/GCA_900540045.1_genomic.fna.gz	0.1038	0.0669	97.82	1.332	97.69-97.98	0.896	0.82-0.95	1	1.605	3808/12572	96.22	UQEF01000001.1 uncultured Clostridiales bacterium isolate UMGS196 genome assembly, contig: NODE_11_length_126164_cov_22.922456, whole genome shotgun sequence
../wallen_disk/reads/SRR19064326_1.fastq.gz	gtdb_genomes_reps_r214/database/GCF/900/099/625/GCF_900099625.1_genomic.fna.gz	0.1030	0.0574	98.44	1.322	98.27-98.57	0.889	0.83-0.95	1	1.606	3975/10807	96.83	NZ_FMTF01000051.1 Lactococcus lactis strain ATCC 19435, whole genome shotgun sequence
../wallen_disk/reads/SRR19064326_1.fastq.gz	gtdb_genomes_reps_r214/database/GCF/012/317/185/GCF_012317185.1_genomic.fna.gz	0.1015	0.1062	97.97	1.303	97.87-98.08	0.876	0.83-0.92	1	1.584	6256/19874	96.34	NZ_CP048838.1 [Clostridium] innocuum strain ATCC 14501 chromosome, complete genome
../wallen_disk/reads/SRR19064326_1.fastq.gz	gtdb_genomes_reps_r214/database/GCA/025/149/125/GCA_025149125.1_genomic.fna.gz	0.0996	0.1403	98.78	1.279	98.69-98.88	0.860	0.82-0.90	2	2.520	10949/27320	97.09	CP102272.1 [Clostridium] asparagiforme DSM 15981 chromosome, complete genome
../wallen_disk/reads/SRR19064326_1.fastq.gz	gtdb_genomes_reps_r214/database/GCF/001/517/625/GCF_001517625.2_genomic.fna.gz	0.0985	0.0745	98.65	1.265	98.53-98.76	0.851	0.80-0.90	1	1.967	5502/14279	96.97	NZ_LN999822.1 Clostridium sp. AT4 strain AT5, whole genome shotgun sequence
../wallen_disk/reads/SRR19064326_1.fastq.gz	gtdb_genomes_reps_r214/database/GCA/001/304/875/GCA_001304875.1_genomic.fna.gz	0.0952	0.0729	97.78	1.222	97.65-97.95	0.822	0.76-0.87	1	1.531	4195/14776	96.02	BBZO01000001.1 Clostridia bacterium UC5.1-2E3 DNA, contig: contig00001, whole genome shotgun sequence
../wallen_disk/reads/SRR19064326_1.fastq.gz	gtdb_genomes_reps_r214/database/GCF/003/479/605/GCF_003479605.1_genomic.fna.gz	0.0920	0.0606	97.71	1.181	97.55-97.90	0.794	0.73-0.84	1	1.482	3493/12794	95.90	NZ_QUHR01000001.1 Roseburia sp. AF12-17LB AF12-17LB.Scaf1, whole genome shotgun sequence
../wallen_disk/reads/SRR19064326_1.fastq.gz	gtdb_genomes_reps_r214/database/GCF/000/701/665/GCF_000701665.1_genomic.fna.gz	0.0919	0.0539	98.75	1.180	98.61-98.88	0.794	0.74-0.84	1	1.541	4235/11190	96.91	NZ_JNJN01000001.1 Agathobaculum desmolans ATCC 43058 T363DRAFT_scaffold00001.1_C, whole genome shotgun sequence
../wallen_disk/reads/SRR19064326_1.fastq.gz	gtdb_genomes_reps_r214/database/GCF/002/874/775/GCF_002874775.1_genomic.fna.gz	0.0919	0.0562	98.06	1.180	97.92-98.23	0.794	0.73-0.85	1	1.497	3548/11722	96.22	NZ_CP020991.1 Monoglobus pectinilyticus strain 14 chromosome
../wallen_disk/reads/SRR19064326_1.fastq.gz	gtdb_genomes_reps_r214/database/GCA/003/150/405/GCA_003150405.1_genomic.fna.gz	0.0916	0.0372	99.27	1.177	99.08-99.40	0.791	0.74-0.85	1	1.468	3324/7517	97.40	QAMM01000006.1 MAG: Clostridiales bacterium isolate CIM:MAG 739_1 contig_10074, whole genome shotgun sequence
../wallen_disk/reads/SRR19064326_1.fastq.gz	gtdb_genomes_reps_r214/database/GCF/010/120/595/GCF_010120595.1_genomic.fna.gz	0.0914	0.0426	98.75	1.173	98.54-98.90	0.789	0.74-0.85	1	1.553	3220/8584	96.89	NZ_CP038020.1 Streptococcus thermophilus strain ATCC 19258 chromosome, complete genome
../wallen_disk/reads/SRR19064326_1.fastq.gz	gtdb_genomes_reps_r214/database/GCF/020/564/355/GCF_020564355.1_genomic.fna.gz	0.0885	0.0591	98.89	1.136	98.74-99.02	0.764	0.72-0.81	1	1.511	4978/12905	96.97	NZ_JAJCRR010000001.1 Lachnospira pectinoschiza strain SL.1.13 OMCMFGFK_1, whole genome shotgun sequence
../wallen_disk/reads/SRR19064326_1.fastq.gz	gtdb_genomes_reps_r214/database/GCF/000/210/075/GCF_000210075.1_genomic.fna.gz	0.0861	0.1140	97.74	1.105	97.60-97.89	0.743	0.70-0.79	2	3.635	6793/25349	95.84	NC_021017.1 Bacteroides xylanisolvens XB1A, complete sequence
../wallen_disk/reads/SRR19064326_1.fastq.gz	gtdb_genomes_reps_r214/database/GCF/000/332/875/GCF_000332875.2_genomic.fna.gz	0.0843	0.0518	98.34	1.083	98.19-98.50	0.728	0.68-0.77	1	1.547	3856/12238	96.34	NZ_KB290627.1 Anaerostipes hadrus DSM 3319 Scfld0, whole genome shotgun sequence
../wallen_disk/reads/SRR19064326_1.fastq.gz	gtdb_genomes_reps_r214/database/GCA/944/384/895/GCA_944384895.1_genomic.fna.gz	0.0829	0.0398	99.08	1.065	98.92-99.24	0.716	0.66-0.76	1	1.473	3610/9249	97.01	CALWVB010000001.1 MAG: uncultured Clostridia bacterium isolate E14__bin329 genome assembly, contig: E14__k127_1076530, whole genome shotgun sequence
../wallen_disk/reads/SRR19064326_1.fastq.gz	gtdb_genomes_reps_r214/database/GCA/944/387/775/GCA_944387775.1_genomic.fna.gz	0.0781	0.0377	97.87	1.003	97.66-98.10	0.675	0.60-0.73	1	1.400	2413/9426	95.70	CALXGE010000001.1 MAG: uncultured Oscillospiraceae bacterium isolate BRZ_EH__bin56 genome assembly, contig: BRZ_EH__NODE_806_length_62453_cov_6.780765, whole genome shotgun sequence
