../wallen_disk/reads/SRR19064324_1.fastq.gz	gtdb_genomes_reps_r214/database/GCA/003/584/705/GCA_003584705.1_genomic.fna.gz	0.0751	0.0567	98.13	0.868	97.97-98.31	0.592	0.54-0.62	1	1.511	4393/17205	95.69	AP018536.1 Lachnospiraceae bacterium GAM79 DNA, complete genome
../wallen_disk/reads/SRR19064324_1.fastq.gz	gtdb_genomes_reps_r214/database/GCA/003/507/655/GCA_003507655.1_genomic.fna.gz	0.0746	0.0306	98.47	0.862	98.25-98.66	0.588	0.54-0.64	1	1.373	2703/9598	95.99	DNUZ01000039.1 MAG TPA_asm: Lachnospiraceae bacterium isolate UBA11774 contig_1120, whole genome shotgun sequence
../wallen_disk/reads/SRR19064324_1.fastq.gz	gtdb_genomes_reps_r214/database/GCA/900/755/095/GCA_900755095.1_genomic.fna.gz	0.0738	0.0491	95.69	0.853	95.30-95.93	0.582	0.51-0.66	2	2.752	1869/15512	93.40	CAAEFE010000001.1 TPA_asm: uncultured Bacteroides sp., isolate HGM04659, WGS project CAAEFE010000000 data, contig: ERS473029_19_k99_64, whole genome shotgun sequence
../wallen_disk/reads/SRR19064324_1.fastq.gz	gtdb_genomes_reps_r214/database/GCA/900/541/315/GCA_900541315.1_genomic.fna.gz	0.0658	0.0372	97.81	0.760	97.62-98.04	0.518	0.47-0.56	1	1.325	2694/12948	95.06	UQJF01000001.1 uncultured Clostridium sp. isolate UMGS337 genome assembly, contig: NODE_92_length_78578_cov_13.194949, whole genome shotgun sequence
../wallen_disk/reads/SRR19064324_1.fastq.gz	gtdb_genomes_reps_r214/database/GCF/003/201/875/GCF_003201875.1_genomic.fna.gz	0.0653	0.0829	97.02	0.755	96.87-97.16	0.515	0.48-0.55	1	1.326	4758/29706	94.26	NZ_QJKD01000001.1 Hungatella effluvii strain DSM 24995 Ga0244553_101, whole genome shotgun sequence
../wallen_disk/reads/SRR19064324_1.fastq.gz	gtdb_genomes_reps_r214/database/GCA/019/425/105/GCA_019425105.1_genomic.fna.gz	0.0640	0.0264	98.53	0.739	98.31-98.79	0.504	0.45-0.54	1	1.292	2421/9516	95.68	JAHYYD010000001.1 MAG: Actinobacteria bacterium isolate HRGM_Genome_0302 HRGM_Genome_0302_1, whole genome shotgun sequence
../wallen_disk/reads/SRR19064324_1.fastq.gz	gtdb_genomes_reps_r214/database/GCF/000/482/365/GCF_000482365.1_genomic.fna.gz	0.0627	0.0261	97.62	0.724	97.40-97.94	0.494	0.44-0.53	1	1.270	1798/9554	94.75	NZ_KI535306.1 Porphyromonas uenonis DSM 23387 = JCM 13868 strain DSM 23387 L215DRAFT_scaffold00001.1, whole genome shotgun sequence
../wallen_disk/reads/SRR19064324_1.fastq.gz	gtdb_genomes_reps_r214/database/GCF/014/467/075/GCF_014467075.1_genomic.fna.gz	0.0612	0.0407	98.33	0.708	98.17-98.56	0.483	0.44-0.51	1	1.310	3602/15557	95.39	NZ_AP023027.1 Anaerostipes caccae L1-92 strain JCM 13470 chromosome, complete genome
../wallen_disk/reads/SRR19064324_1.fastq.gz	gtdb_genomes_reps_r214/database/GCF/001/404/335/GCF_001404335.1_genomic.fna.gz	0.0594	0.0609	98.63	0.686	98.50-98.80	0.468	0.44-0.49	1	1.327	5987/23685	95.66	NZ_CYZU01000001.1 Faecalicatena contorta strain 2789STDY5834876, whole genome shotgun sequence
../wallen_disk/reads/SRR19064324_1.fastq.gz	gtdb_genomes_reps_r214/database/GCA/000/613/465/GCA_000613465.1_genomic.fna.gz	0.0564	0.0584	98.56	0.652	98.40-98.74	0.445	0.41-0.47	1	1.245	5806/24226	95.50	BAJA01000118.1 Bacteroides nordii WAL 11050 = JCM 12987 DNA, contig: JCM12987.contig00118, whole genome shotgun sequence
../wallen_disk/reads/SRR19064324_1.fastq.gz	gtdb_genomes_reps_r214/database/GCF/018/918/345/GCF_018918345.1_genomic.fna.gz	0.0537	0.0270	97.53	0.621	97.32-97.82	0.424	0.38-0.45	1	1.240	1901/11696	94.31	NZ_JAHLQI010000001.1 Butyricicoccus intestinisimiae strain MSJd-7 MS-7_ctg0001, whole genome shotgun sequence
../wallen_disk/reads/SRR19064324_1.fastq.gz	gtdb_genomes_reps_r214/database/GCF/000/233/455/GCF_000233455.1_genomic.fna.gz	0.0535	0.0658	98.99	0.618	98.82-99.14	0.421	0.40-0.44	1	1.567	7365/28294	95.75	NZ_JH376420.1 [Clostridium] citroniae WAL-17108 supercont1.1, whole genome shotgun sequence
../wallen_disk/reads/SRR19064324_1.fastq.gz	gtdb_genomes_reps_r214/database/GCF/900/104/615/GCF_900104615.1_genomic.fna.gz	0.0525	0.0251	99.05	0.607	98.83-99.32	0.414	0.38-0.45	1	1.303	2536/9756	95.75	NZ_LT629937.1 Phocea massiliensis strain Marseille-P2769T, whole genome shotgun sequence
../wallen_disk/reads/SRR19064324_1.fastq.gz	gtdb_genomes_reps_r214/database/GCF/000/188/295/GCF_000188295.1_genomic.fna.gz	0.0518	0.0179	96.25	0.599	95.72-96.79	0.408	0.33-0.48	1	2.019	849/8001	93.02	NZ_GL831112.1 Streptococcus vestibularis ATCC 49124 SCAFFOLD1, whole genome shotgun sequence
../wallen_disk/reads/SRR19064324_1.fastq.gz	gtdb_genomes_reps_r214/database/GCA/900/541/905/GCA_900541905.1_genomic.fna.gz	0.0504	0.0197	97.63	0.583	97.36-98.02	0.398	0.35-0.43	1	1.301	1444/9056	94.25	UQLQ01000001.1 uncultured Ruminococcaceae bacterium isolate UMGS404 genome assembly, contig: NODE_6_length_212102_cov_4.722566, whole genome shotgun sequence
../wallen_disk/reads/SRR19064324_1.fastq.gz	gtdb_genomes_reps_r214/database/GCF/000/313/565/GCF_000313565.1_genomic.fna.gz	0.0460	0.0307	97.92	0.531	97.72-98.20	0.362	0.32-0.38	1	1.305	2478/15300	94.30	NZ_HE578923.1 Dielma fastidiosa strain type strain: JC13, whole genome shotgun sequence
../wallen_disk/reads/SRR19064324_1.fastq.gz	gtdb_genomes_reps_r214/database/GCF/001/956/585/GCF_001956585.1_genomic.fna.gz	0.0440	0.0254	97.53	0.508	97.28-97.86	0.347	0.31-0.38	1	1.204	1874/13615	93.80	NZ_MSRR01000001.1 Actinomyces naeslundii strain NCTC 10301 NCTC10301_contig001, whole genome shotgun sequence
../wallen_disk/reads/SRR19064324_1.fastq.gz	gtdb_genomes_reps_r214/database/GCF/900/291/975/GCF_900291975.1_genomic.fna.gz	0.0404	0.0240	98.79	0.466	98.55-99.10	0.318	0.28-0.34	1	1.213	2716/13270	95.01	NZ_OMPN01000002.1 Intestinibacillus sp. Marseille-P4005, whole genome shotgun sequence
../wallen_disk/reads/SRR19064324_1.fastq.gz	gtdb_genomes_reps_r214/database/GCF/000/613/345/GCF_000613345.1_genomic.fna.gz	0.0402	0.0208	97.47	0.464	97.05-97.92	0.316	0.27-0.35	1	1.297	1497/11908	93.53	NZ_BAIS01000187.1 Prevotella disiens JCM 6334 = ATCC 29426 strain JCM 6334, whole genome shotgun sequence
../wallen_disk/reads/SRR19064324_1.fastq.gz	gtdb_genomes_reps_r214/database/GCF/011/405/655/GCF_011405655.1_genomic.fna.gz	0.0395	0.0212	96.36	0.456	95.97-96.76	0.311	0.26-0.36	1	1.185	1062/12296	92.40	NZ_AP022829.1 Adlercreutzia hattorii strain 8CFCBH1 chromosome, complete genome
../wallen_disk/reads/SRR19064324_1.fastq.gz	gtdb_genomes_reps_r214/database/GCF/000/026/225/GCF_000026225.1_genomic.fna.gz	0.0380	0.0326	96.48	0.439	96.08-96.83	0.299	0.26-0.34	1	1.209	1730/19934	92.42	NC_011740.1 Escherichia fergusonii ATCC 35469, complete sequence
../wallen_disk/reads/SRR19064324_1.fastq.gz	gtdb_genomes_reps_r214/database/GCF/001/553/855/GCF_001553855.1_genomic.fna.gz	0.0332	0.0133	96.31	0.383	95.67-96.96	0.261	0.21-0.33	1	1.153	678/9257	91.91	NZ_LQWV01000001.1 Streptococcus gordonii strain CCUG 33482 contig_1, whole genome shotgun sequence
../wallen_disk/reads/SRR19064324_1.fastq.gz	gtdb_genomes_reps_r214/database/GCF/000/011/065/GCF_000011065.1_genomic.fna.gz	0.0330	0.0384	97.14	0.381	96.79-97.44	0.260	0.23-0.29	1	1.313	2680/26733	92.85	NC_004663.1 Bacteroides thetaiotaomicron VPI-5482, complete sequence
../wallen_disk/reads/SRR19064324_1.fastq.gz	gtdb_genomes_reps_r214/database/GCF/020/564/355/GCF_020564355.1_genomic.fna.gz	0.0329	0.0183	98.71	0.380	98.46-99.07	0.259	0.23-0.28	1	1.240	2025/12905	94.20	NZ_JAJCRR010000001.1 Lachnospira pectinoschiza strain SL.1.13 OMCMFGFK_1, whole genome shotgun sequence
../wallen_disk/reads/SRR19064324_1.fastq.gz	gtdb_genomes_reps_r214/database/GCF/000/278/725/GCF_000278725.1_genomic.fna.gz	0.0323	0.0146	98.15	0.374	97.60-98.66	0.255	0.21-0.30	1	1.160	1345/10464	93.60	NZ_ALCA01000001.1 Actinomyces sp. ICM47 ctg120010148499, whole genome shotgun sequence
../wallen_disk/reads/SRR19064324_1.fastq.gz	gtdb_genomes_reps_r214/database/GCF/000/797/495/GCF_000797495.1_genomic.fna.gz	0.0321	0.0438	98.76	0.371	98.55-98.99	0.253	0.23-0.27	1	1.147	4851/31272	94.17	NZ_JTGN01000009.1 Robinsoniella peoriensis strain WT Contig_1, whole genome shotgun sequence
../wallen_disk/reads/SRR19064324_1.fastq.gz	gtdb_genomes_reps_r214/database/GCA/000/020/605/GCA_000020605.1_genomic.fna.gz	0.0318	0.0203	98.21	0.368	97.87-98.58	0.251	0.22-0.28	1	1.383	1844/14021	93.67	CP001107.1 [Eubacterium] rectale ATCC 33656 chromosome, complete genome
../wallen_disk/reads/SRR19064324_1.fastq.gz	gtdb_genomes_reps_r214/database/GCF/003/574/295/GCF_003574295.1_genomic.fna.gz	0.0315	0.0177	96.64	0.364	96.05-97.06	0.248	0.21-0.29	1	1.378	1038/12994	92.17	NZ_BHGK01000001.1 Mediterraneibacter butyricigenes strain KCTC 15684 Contigs1, whole genome shotgun sequence
../wallen_disk/reads/SRR19064324_1.fastq.gz	gtdb_genomes_reps_r214/database/GCF/001/025/215/GCF_001025215.1_genomic.fna.gz	0.0299	0.0128	98.69	0.346	98.36-99.15	0.236	0.20-0.26	1	1.268	1382/9671	93.92	NZ_AP012330.1 Bifidobacterium pseudocatenulatum DSM 20438 = JCM 1200 = LMG 10505 strain JCM 1200 chromosome, complete genome
../wallen_disk/reads/SRR19064324_1.fastq.gz	gtdb_genomes_reps_r214/database/GCF/003/480/315/GCF_003480315.1_genomic.fna.gz	0.0288	0.0171	96.86	0.332	96.26-97.41	0.227	0.19-0.28	1	1.243	1071/13649	92.12	NZ_QUIV01000001.1 Clostridium sp. AM33-3 AM33-3.Scaf1, whole genome shotgun sequence
../wallen_disk/reads/SRR19064324_1.fastq.gz	gtdb_genomes_reps_r214/database/GCF/001/025/175/GCF_001025175.1_genomic.fna.gz	0.0281	0.0118	95.26	0.325	94.39-96.19	0.222	0.16-0.30	1	1.893	441/9783	90.49	NZ_AP012324.1 Bifidobacterium breve DSM 20213 = JCM 1192 chromosome, complete genome
../wallen_disk/reads/SRR19064324_1.fastq.gz	gtdb_genomes_reps_r214/database/GCA/001/838/165/GCA_001838165.1_genomic.fna.gz	0.0276	0.0122	95.60	0.319	94.86-96.17	0.218	0.18-0.27	1	1.165	503/10166	90.76	KV835854.1 Actinomyces sp. HMSC035G02 genomic scaffold Scaffold0, whole genome shotgun sequence
../wallen_disk/reads/SRR19064324_1.fastq.gz	gtdb_genomes_reps_r214/database/GCF/023/347/255/GCF_023347255.1_genomic.fna.gz	0.0273	0.0158	95.92	0.316	95.31-96.64	0.215	0.17-0.26	1	1.631	726/12942	91.13	NZ_CP094466.1 Faecalibacterium sp. I4384 chromosome, complete genome
../wallen_disk/reads/SRR19064324_1.fastq.gz	gtdb_genomes_reps_r214/database/GCF/010/120/595/GCF_010120595.1_genomic.fna.gz	0.0271	0.0105	95.08	0.313	94.01-96.02	0.214	0.15-0.30	1	1.521	363/8584	90.30	NZ_CP038020.1 Streptococcus thermophilus strain ATCC 19258 chromosome, complete genome
../wallen_disk/reads/SRR19064324_1.fastq.gz	gtdb_genomes_reps_r214/database/GCA/025/148/965/GCA_025148965.1_genomic.fna.gz	0.0267	0.0149	97.46	0.309	96.85-97.95	0.211	0.18-0.25	1	1.215	1120/12774	92.45	CP102273.1 Intestinibacter bartlettii strain DSM 16795 chromosome, complete genome
../wallen_disk/reads/SRR19064324_1.fastq.gz	gtdb_genomes_reps_r214/database/GCA/000/436/335/GCA_000436335.1_genomic.fna.gz	0.0256	0.0090	96.38	0.295	95.58-97.12	0.201	0.15-0.26	1	1.139	488/8221	91.29	FR885331.1 Clostridium sp. CAG:217 genomic scaffold, scf3, whole genome shotgun sequence
../wallen_disk/reads/SRR19064324_1.fastq.gz	gtdb_genomes_reps_r214/database/GCF/009/767/585/GCF_009767585.1_genomic.fna.gz	0.0247	0.0168	98.25	0.286	97.77-98.75	0.195	0.17-0.22	1	1.120	1602/15197	93.00	NZ_WSNW01000023.1 Coprobacillus cateniformis strain RCA1-24 10234_10235, whole genome shotgun sequence
../wallen_disk/reads/SRR19064324_1.fastq.gz	gtdb_genomes_reps_r214/database/GCF/006/546/825/GCF_006546825.1_genomic.fna.gz	0.0245	0.0144	96.57	0.284	95.92-97.15	0.193	0.16-0.23	1	1.131	840/13788	91.37	NZ_VICC01000001.1 Actinomyces oris strain CCUG 34288 CCUG34288T_0000001, whole genome shotgun sequence
../wallen_disk/reads/SRR19064324_1.fastq.gz	gtdb_genomes_reps_r214/database/GCF/006/739/205/GCF_006739205.1_genomic.fna.gz	0.0242	0.0090	98.27	0.280	97.68-98.81	0.191	0.16-0.23	1	1.094	889/8600	92.94	NZ_AP019720.1 Streptococcus mutans strain NBRC 13955 chromosome, complete genome
../wallen_disk/reads/SRR19064324_1.fastq.gz	gtdb_genomes_reps_r214/database/GCF/001/487/165/GCF_001487165.1_genomic.fna.gz	0.0234	0.0161	97.48	0.271	96.91-97.95	0.185	0.16-0.22	1	1.300	1282/15776	92.22	NZ_LN913002.1 Blautia massiliensis strain GD8, whole genome shotgun sequence
../wallen_disk/reads/SRR19064324_1.fastq.gz	gtdb_genomes_reps_r214/database/GCF/000/262/545/GCF_000262545.1_genomic.fna.gz	0.0225	0.0105	96.10	0.260	95.20-96.96	0.177	0.13-0.24	1	1.301	509/10390	90.73	NZ_JH660658.1 Prevotella bivia DSM 20514 Prebiscaffold_1, whole genome shotgun sequence
../wallen_disk/reads/SRR19064324_1.fastq.gz	gtdb_genomes_reps_r214/database/GCF/001/434/535/GCF_001434535.1_genomic.fna.gz	0.0220	0.0077	98.26	0.254	97.49-98.98	0.173	0.14-0.22	1	1.116	766/8108	92.67	NZ_AYYW01000050.1 Ligilactobacillus animalis KCTC 3501 = DSM 20602 NODE_100, whole genome shotgun sequence
../wallen_disk/reads/SRR19064324_1.fastq.gz	gtdb_genomes_reps_r214/database/GCF/000/308/275/GCF_000308275.2_genomic.fna.gz	0.0218	0.0069	97.87	0.252	97.04-98.57	0.172	0.13-0.22	1	1.120	575/6954	92.27	NZ_HG529490.1 Levyella massiliensis strain 9403326, whole genome shotgun sequence
../wallen_disk/reads/SRR19064324_1.fastq.gz	gtdb_genomes_reps_r214/database/GCF/900/186/585/GCF_900186585.1_genomic.fna.gz	0.0213	0.0106	96.71	0.246	96.02-97.34	0.168	0.13-0.21	1	1.120	649/11519	91.14	NZ_FYDD01000004.1 Massiliimalia timonensis strain Marseille-P3753, whole genome shotgun sequence
../wallen_disk/reads/SRR19064324_1.fastq.gz	gtdb_genomes_reps_r214/database/GCA/900/762/715/GCA_900762715.1_genomic.fna.gz	0.0212	0.0091	96.87	0.245	96.05-97.60	0.167	0.13-0.21	1	1.316	594/9981	91.30	CAAFII010000001.1 MAG TPA_asm: Ruminococcaceae bacterium, isolate HGM13218, WGS project CAAFII010000000 data, contig: SRS148721_41_k99_659, whole genome shotgun sequence
../wallen_disk/reads/SRR19064324_1.fastq.gz	gtdb_genomes_reps_r214/database/GCF/000/010/425/GCF_000010425.1_genomic.fna.gz	0.0209	0.0081	96.50	0.241	95.49-97.46	0.165	0.12-0.22	1	1.157	459/8919	90.87	NC_008618.1 Bifidobacterium adolescentis ATCC 15703, complete sequence
../wallen_disk/reads/SRR19064324_1.fastq.gz	gtdb_genomes_reps_r214/database/GCF/000/426/605/GCF_000426605.1_genomic.fna.gz	0.0203	0.0114	95.84	0.235	95.10-96.66	0.160	0.12-0.20	1	1.087	529/13066	90.17	NZ_AUFR01000001.1 Propionibacterium acidifaciens DSM 21887 K336DRAFT_scaffold00001.1_C, whole genome shotgun sequence
../wallen_disk/reads/SRR19064324_1.fastq.gz	gtdb_genomes_reps_r214/database/GCF/900/199/635/GCF_900199635.1_genomic.fna.gz	0.0203	0.0118	96.01	0.235	95.01-96.72	0.160	0.12-0.21	1	1.411	606/13445	90.49	NZ_LT962681.1 Anaerotruncus massiliensis strain AT3, whole genome shotgun sequence
../wallen_disk/reads/SRR19064324_1.fastq.gz	gtdb_genomes_reps_r214/database/GCF/009/677/585/GCF_009677585.1_genomic.fna.gz	0.0198	0.0180	97.98	0.228	97.51-98.43	0.156	0.13-0.18	1	1.121	1700/21227	92.18	NZ_WKYV01000010.1 Lactonifactor sp. BIOML-A5 scaffold10_size117598, whole genome shotgun sequence
../wallen_disk/reads/SRR19064324_1.fastq.gz	gtdb_genomes_reps_r214/database/GCF/013/046/825/GCF_013046825.1_genomic.fna.gz	0.0192	0.0107	97.99	0.222	97.37-98.55	0.152	0.12-0.19	1	1.087	959/12533	92.04	NZ_CP053187.1 Turicibacter sanguinis strain MOL361 chromosome, complete genome
../wallen_disk/reads/SRR19064324_1.fastq.gz	gtdb_genomes_reps_r214/database/GCF/000/154/465/GCF_000154465.1_genomic.fna.gz	0.0186	0.0088	98.44	0.214	97.73-99.04	0.146	0.12-0.18	1	0.900	1165/10726	93.09	NZ_DS499581.1 Alistipes putredinis DSM 17216 Scfld_02_11, whole genome shotgun sequence
../wallen_disk/reads/SRR19064324_1.fastq.gz	gtdb_genomes_reps_r214/database/GCA/000/435/335/GCA_000435335.1_genomic.fna.gz	0.0185	0.0072	98.49	0.214	97.92-99.36	0.146	0.11-0.18	1	2.325	818/9165	92.50	FR891296.1 Clostridium sp. CAG:964 genomic scaffold, scf24, whole genome shotgun sequence
../wallen_disk/reads/SRR19064324_1.fastq.gz	gtdb_genomes_reps_r214/database/GCA/900/547/195/GCA_900547195.1_genomic.fna.gz	0.0177	0.0085	97.42	0.205	96.64-98.21	0.140	0.10-0.18	1	1.134	655/11058	91.29	URFQ01000001.1 uncultured Butyricicoccus sp. isolate UMGS961 genome assembly, contig: NODE_100_length_124429_cov_4.529186, whole genome shotgun sequence
../wallen_disk/reads/SRR19064324_1.fastq.gz	gtdb_genomes_reps_r214/database/GCF/002/899/675/GCF_002899675.1_genomic.fna.gz	0.0172	0.0194	96.98	0.199	96.30-97.50	0.136	0.11-0.17	1	1.112	1264/25208	90.80	NZ_PKUU01000001.1 Clostridium sp. chh4-2 Scaffold1, whole genome shotgun sequence
../wallen_disk/reads/SRR19064324_1.fastq.gz	gtdb_genomes_reps_r214/database/GCF/014/287/475/GCF_014287475.1_genomic.fna.gz	0.0166	0.0111	96.29	0.192	95.43-97.13	0.131	0.10-0.17	1	1.079	607/15557	90.07	NZ_JACOPF010000001.1 Mediterraneibacter sp. NSJ-55 DNA.506_ctg0001, whole genome shotgun sequence
../wallen_disk/reads/SRR19064324_1.fastq.gz	gtdb_genomes_reps_r214/database/GCF/002/834/235/GCF_002834235.1_genomic.fna.gz	0.0161	0.0071	97.76	0.186	96.94-98.77	0.127	0.09-0.16	1	1.193	611/10048	91.36	NZ_NNBY01000001.1 Ruminococcus bromii strain 5AMG contig000001, whole genome shotgun sequence
../wallen_disk/reads/SRR19064324_1.fastq.gz	gtdb_genomes_reps_r214/database/GCA/025/145/285/GCA_025145285.1_genomic.fna.gz	0.0156	0.0111	98.02	0.180	97.26-98.61	0.123	0.10-0.15	1	0.894	1279/16516	92.08	CP102251.1 Alistipes onderdonkii strain DSM 19147 chromosome, complete genome
../wallen_disk/reads/SRR19064324_1.fastq.gz	gtdb_genomes_reps_r214/database/GCF/900/099/625/GCF_900099625.1_genomic.fna.gz	0.0154	0.0072	96.40	0.178	95.25-97.60	0.121	0.08-0.18	1	1.084	406/10807	89.96	NZ_FMTF01000051.1 Lactococcus lactis strain ATCC 19435, whole genome shotgun sequence
../wallen_disk/reads/SRR19064324_1.fastq.gz	gtdb_genomes_reps_r214/database/GCF/001/061/665/GCF_001061665.1_genomic.fna.gz	0.0150	0.0062	95.95	0.174	94.83-97.22	0.118	0.08-0.17	1	1.062	305/9638	89.46	NZ_JVSP01000001.1 Rothia mucilaginosa strain 141_RMUC 150_100012_3652184_23+,145+,79+, whole genome shotgun sequence
../wallen_disk/reads/SRR19064324_1.fastq.gz	gtdb_genomes_reps_r214/database/GCF/009/496/165/GCF_009496165.1_genomic.fna.gz	0.0145	0.0054	96.42	0.168	95.22-97.94	0.114	0.07-0.17	1	1.135	303/8510	89.80	NZ_WIJQ01000010.1 Streptococcus mitis strain SM08 NODE_10_length_53743_cov_22.439328, whole genome shotgun sequence
../wallen_disk/reads/SRR19064324_1.fastq.gz	gtdb_genomes_reps_r214/database/GCA/900/105/895/GCA_900105895.1_genomic.fna.gz	0.0144	0.0047	96.67	0.166	95.18-98.03	0.113	0.07-0.18	1	1.060	282/7343	90.02	FNSH01000003.1 Atopobium minutum strain DSM 20586 genome assembly, contig: Ga0074722_13, whole genome shotgun sequence
../wallen_disk/reads/SRR19064324_1.fastq.gz	gtdb_genomes_reps_r214/database/GCA/018/363/915/GCA_018363915.1_genomic.fna.gz	0.0144	0.0053	95.49	0.166	94.07-97.15	0.113	0.06-0.18	1	1.071	226/8637	88.91	JAGZMY010000027.1 Anaerococcus vaginalis isolate L3_108_077G1_dasL3_108_077G1_concoct_2_sub L3_108_077G1_scaffold_1014, whole genome shotgun sequence
../wallen_disk/reads/SRR19064324_1.fastq.gz	gtdb_genomes_reps_r214/database/GCF/900/636/475/GCF_900636475.1_genomic.fna.gz	0.0137	0.0050	97.29	0.159	96.23-98.59	0.108	0.07-0.16	1	1.059	354/7893	90.47	NZ_LR134283.1 Streptococcus anginosus strain NCTC10713 chromosome 1, complete sequence
../wallen_disk/reads/SRR19064324_1.fastq.gz	gtdb_genomes_reps_r214/database/GCF/000/220/835/GCF_000220835.1_genomic.fna.gz	0.0136	0.0071	95.66	0.157	94.49-97.02	0.107	0.07-0.15	1	1.066	317/12098	88.92	NZ_GL985606.1 Actinomyces sp. oral taxon 448 str. F0400 SCAFFOLD1, whole genome shotgun sequence
../wallen_disk/reads/SRR19064324_1.fastq.gz	gtdb_genomes_reps_r214/database/GCF/000/420/505/GCF_000420505.1_genomic.fna.gz	0.0136	0.0046	98.65	0.157	97.59-99.59	0.107	0.08-0.15	1	1.057	540/7878	91.72	NZ_ATVB01000001.1 Alloscardovia omnicolens DSM 21503 G464DRAFT_scaffold00001.1_C, whole genome shotgun sequence
../wallen_disk/reads/SRR19064324_1.fastq.gz	gtdb_genomes_reps_r214/database/GCF/014/982/855/GCF_014982855.1_genomic.fna.gz	0.0135	0.0079	96.20	0.156	94.95-97.70	0.106	0.06-0.16	1	1.804	469/13732	89.68	NZ_JADCKF010000001.1 Pseudoflavonifractor gallinarum strain DSM 107456 seq1, whole genome shotgun sequence
../wallen_disk/reads/SRR19064324_1.fastq.gz	gtdb_genomes_reps_r214/database/GCF/000/017/585/GCF_000017585.1_genomic.fna.gz	0.0132	0.0042	95.63	0.153	94.20-97.41	0.104	0.05-0.16	1	1.118	187/7397	88.81	NC_009714.1 Campylobacter hominis ATCC BAA-381, complete sequence
../wallen_disk/reads/SRR19064324_1.fastq.gz	gtdb_genomes_reps_r214/database/GCF/000/378/725/GCF_000378725.1_genomic.fna.gz	0.0130	0.0044	96.08	0.150	94.47-97.56	0.102	0.06-0.16	1	1.100	229/7950	89.19	NZ_KB900367.1 Peptoniphilus lacrimalis DSM 7455 F594DRAFT_scaffold00001.1, whole genome shotgun sequence
../wallen_disk/reads/SRR19064324_1.fastq.gz	gtdb_genomes_reps_r214/database/GCF/000/014/425/GCF_000014425.1_genomic.fna.gz	0.0127	0.0044	98.65	0.147	97.63-99.86	0.100	0.06-0.14	1	1.052	484/7578	91.51	NC_008530.1 Lactobacillus gasseri ATCC 33323 = JCM 1131, complete sequence
../wallen_disk/reads/SRR19064324_1.fastq.gz	gtdb_genomes_reps_r214/database/GCA/000/758/905/GCA_000758905.1_genomic.fna.gz	0.0125	0.0035	97.13	0.144	95.50-99.29	0.098	0.04-0.16	1	1.047	256/6593	90.05	JRNA01000001.1 Clostridiales bacterium S5-A14a contig01, whole genome shotgun sequence
../wallen_disk/reads/SRR19064324_1.fastq.gz	gtdb_genomes_reps_r214/database/GCF/000/312/505/GCF_000312505.2_genomic.fna.gz	0.0125	0.0039	97.39	0.144	96.26-98.67	0.098	0.06-0.15	1	1.167	311/7383	90.29	NZ_HG326224.1 Fenollaria massiliensis strain 9401234, whole genome shotgun sequence
../wallen_disk/reads/SRR19064324_1.fastq.gz	gtdb_genomes_reps_r214/database/GCF/002/998/925/GCF_002998925.1_genomic.fna.gz	0.0124	0.0042	96.43	0.143	94.97-98.06	0.098	0.06-0.16	1	1.075	239/7753	89.38	NZ_CP027228.1 Mogibacterium diversum strain CCUG 47132 chromosome, complete genome
../wallen_disk/reads/SRR19064324_1.fastq.gz	gtdb_genomes_reps_r214/database/GCF/018/847/895/GCF_018847895.1_genomic.fna.gz	0.0123	0.0073	98.16	0.142	97.29-99.13	0.097	0.07-0.13	1	1.054	719/13596	90.95	NZ_CP072051.1 Akkermansia muciniphila strain Akk0196 chromosome, complete genome
../wallen_disk/reads/SRR19064324_1.fastq.gz	gtdb_genomes_reps_r214/database/GCF/001/293/125/GCF_001293125.1_genomic.fna.gz	0.0117	0.0040	98.01	0.135	96.75-99.39	0.092	0.06-0.14	1	1.044	385/7952	90.69	NZ_CP009312.1 Lawsonella clevelandensis strain X1036 chromosome, complete genome
../wallen_disk/reads/SRR19064324_1.fastq.gz	gtdb_genomes_reps_r214/database/GCA/900/544/375/GCA_900544375.1_genomic.fna.gz	0.0116	0.0053	98.23	0.135	97.17-99.41	0.092	0.06-0.13	1	1.060	550/10661	90.88	UQUZ01000001.1 uncultured Ruminococcaceae bacterium isolate UMGS668 genome assembly, contig: NODE_82_length_151150_cov_5.108342, whole genome shotgun sequence
../wallen_disk/reads/SRR19064324_1.fastq.gz	gtdb_genomes_reps_r214/database/GCF/001/591/845/GCF_001591845.1_genomic.fna.gz	0.0115	0.0042	98.64	0.133	97.33-100.16	0.091	0.05-0.13	1	1.063	489/8378	91.24	NZ_BCVR01000001.1 Lactobacillus acidophilus DSM 20079 = JCM 1132 = NBRC 13951 = CIP 76.13 strain NBRC 13951, whole genome shotgun sequence
../wallen_disk/reads/SRR19064324_1.fastq.gz	gtdb_genomes_reps_r214/database/GCF/001/553/115/GCF_001553115.1_genomic.fna.gz	0.0114	0.0039	95.80	0.132	94.01-97.65	0.090	0.04-0.15	1	1.043	186/8007	88.57	NZ_KQ960154.1 Peptoniphilus coxii strain DNF00729 Scaffold1, whole genome shotgun sequence
../wallen_disk/reads/SRR19064324_1.fastq.gz	gtdb_genomes_reps_r214/database/GCA/015/259/045/GCA_015259045.1_genomic.fna.gz	0.0112	0.0028	96.99	0.130	95.50-99.40	0.088	0.04-0.14	1	1.053	190/5667	89.63	JABZHD010000100.1 MAG: Atopobium sp. isolate JCVI_18_bin.1 NODE_100_length_4724_cov_1.646362, whole genome shotgun sequence
../wallen_disk/reads/SRR19064324_1.fastq.gz	gtdb_genomes_reps_r214/database/GCF/001/042/595/GCF_001042595.1_genomic.fna.gz	0.0111	0.0054	95.94	0.129	94.51-97.40	0.088	0.05-0.13	1	1.068	264/11120	88.63	NZ_AP012326.1 Bifidobacterium dentium JCM 1195 = DSM 20436 strain JCM 1195 chromosome, complete genome
../wallen_disk/reads/SRR19064324_1.fastq.gz	gtdb_genomes_reps_r214/database/GCF/900/106/845/GCF_900106845.1_genomic.fna.gz	0.0096	0.0055	98.06	0.111	96.95-99.39	0.076	0.05-0.11	1	1.082	500/12280	90.19	NZ_LT629846.1 Romboutsia timonensis strain Marseille-P326, whole genome shotgun sequence
../wallen_disk/reads/SRR19064324_1.fastq.gz	gtdb_genomes_reps_r214/database/GCA/900/538/575/GCA_900538575.1_genomic.fna.gz	0.0091	0.0043	96.53	0.105	95.02-97.93	0.072	0.04-0.11	1	1.152	269/11226	88.66	UPZA01000001.1 uncultured Ruminococcus sp. isolate UMGS40 genome assembly, contig: NODE_3_length_287486_cov_22.528694, whole genome shotgun sequence
../wallen_disk/reads/SRR19064324_1.fastq.gz	gtdb_genomes_reps_r214/database/GCF/000/425/045/GCF_000425045.1_genomic.fna.gz	0.0088	0.0037	99.01	0.102	97.92-100.46	0.069	0.04-0.10	1	1.544	511/9707	90.94	NZ_AULA01000001.1 Acidaminococcus intestini DSM 21505 H503DRAFT_scaffold00001.1_C, whole genome shotgun sequence
../wallen_disk/reads/SRR19064324_1.fastq.gz	gtdb_genomes_reps_r214/database/GCA/902/363/205/GCA_902363205.1_genomic.fna.gz	0.0088	0.0043	96.25	0.101	94.55-98.25	0.069	0.03-0.11	1	1.050	242/11598	88.26	CABIZH010000001.1 Veillonellaceae bacterium isolate MGYG-HGUT-00100 genome assembly, contig: .20298_2_31.1, whole genome shotgun sequence
../wallen_disk/reads/SRR19064324_1.fastq.gz	gtdb_genomes_reps_r214/database/GCF/000/158/035/GCF_000158035.1_genomic.fna.gz	0.0086	0.0109	96.52	0.099	95.55-97.80	0.068	0.04-0.10	1	1.043	696/29217	88.64	NZ_EQ973551.1 Bacteroides cellulosilyticus DSM 14838 Scfld188, whole genome shotgun sequence
../wallen_disk/reads/SRR19064324_1.fastq.gz	gtdb_genomes_reps_r214/database/GCF/900/104/605/GCF_900104605.1_genomic.fna.gz	0.0084	0.0037	97.27	0.097	95.82-99.00	0.066	0.04-0.10	1	1.068	281/10096	89.09	NZ_LT629953.1 Tidjanibacter massiliensis strain Marseille-P3084T, whole genome shotgun sequence
