pac_mock2_1gb.fq	/home/jshaw/scratch/tmp/skani-test/gtdb_genomes_reps_r214/database/GCF/014/269/205/GCF_014269205.2_genomic.fna.gz	90.65	90.65	NA-NA	6.314	HIGH	NA-NA	6	0.302	1160/24287	NZ_JABWRY020000001.1 Pseudomonas kermanshahensis strain SWRI100 1, whole genome shotgun sequence
pac_mock2_1gb.fq	/home/jshaw/scratch/tmp/skani-test/gtdb_genomes_reps_r214/database/GCF/000/328/665/GCF_000328665.1_genomic.fna.gz	90.65	90.65	NA-NA	1.000	LOW	NA-NA	1	0.048	508/10639	NC_019977.1 Methanomethylovorans hollandica DSM 15978, complete sequence
pac_mock2_1gb.fq	/home/jshaw/scratch/tmp/skani-test/gtdb_genomes_reps_r214/database/GCF/024/181/385/GCF_024181385.1_genomic.fna.gz	90.61	88.54	90.12-91.05	0.656	0.656	0.53-0.83	1	0.030	258/11235	NZ_CP051305.1 Treponema sp. OMZ 798 chromosome, complete genome
pac_mock2_1gb.fq	/home/jshaw/scratch/tmp/skani-test/gtdb_genomes_reps_r214/database/GCF/002/204/795/GCF_002204795.1_genomic.fna.gz	90.60	90.60	NA-NA	7.851	HIGH	NA-NA	6	0.321	1227/26216	NZ_NIXO01000001.1 Pseudomonas sp. K2I15 contig001, whole genome shotgun sequence
pac_mock2_1gb.fq	/home/jshaw/scratch/tmp/skani-test/gtdb_genomes_reps_r214/database/GCF/018/847/375/GCF_018847375.1_genomic.fna.gz	90.59	90.12	90.31-90.86	1.842	1.842	1.51-2.35	2	0.104	478/12041	NZ_CP072036.1 Akkermansia muciniphila strain Akk1573 chromosome, complete genome
pac_mock2_1gb.fq	/home/jshaw/scratch/tmp/skani-test/gtdb_genomes_reps_r214/database/GCF/016/406/145/GCF_016406145.1_genomic.fna.gz	90.58	90.58	NA-NA	6.601	HIGH	NA-NA	6	0.305	1074/23068	NZ_CP066306.1 Pseudomonas putida strain BR-PH17 chromosome, complete genome
pac_mock2_1gb.fq	/home/jshaw/scratch/tmp/skani-test/gtdb_genomes_reps_r214/database/GCF/022/749/515/GCF_022749515.1_genomic.fna.gz	90.57	85.35	88.51-92.14	0.164	0.164	0.10-0.32	1	0.009	70/9493	NZ_CP094242.1 Morococcus cerebrosus strain CIP 81.93 chromosome, complete genome
pac_mock2_1gb.fq	/home/jshaw/scratch/tmp/skani-test/gtdb_genomes_reps_r214/database/GCF/000/687/755/GCF_000687755.1_genomic.fna.gz	90.56	89.31	89.79-91.35	0.987	0.987	0.63-1.34	2	0.088	191/6355	NZ_JHXN01000001.1 Taylorella asinigenitalis ATCC 700933 T432DRAFT_scaffold00001.1_C, whole genome shotgun sequence
pac_mock2_1gb.fq	/home/jshaw/scratch/tmp/skani-test/gtdb_genomes_reps_r214/database/GCF/023/283/925/GCF_023283925.1_genomic.fna.gz	90.54	88.55	89.96-91.07	0.600	0.600	0.48-0.75	1	0.038	396/17166	NZ_JAKIKX010000001.1 Shewanella marisflavi strain JCM 12192 contig00001, whole genome shotgun sequence
pac_mock2_1gb.fq	/home/jshaw/scratch/tmp/skani-test/gtdb_genomes_reps_r214/database/GCF/014/268/455/GCF_014268455.2_genomic.fna.gz	90.54	90.54	NA-NA	6.920	HIGH	NA-NA	6	0.317	1094/23853	NZ_CP077085.1 Pseudomonas shahriarae strain SWRI52 chromosome, complete genome
pac_mock2_1gb.fq	/home/jshaw/scratch/tmp/skani-test/gtdb_genomes_reps_r214/database/GCF/013/386/825/GCF_013386825.1_genomic.fna.gz	90.53	90.53	NA-NA	7.604	HIGH	NA-NA	6	0.309	1306/28568	NZ_JACARC010000001.1 Pseudomonas sp. IPO3778 IPO_3778_S47_L003_contig_1, whole genome shotgun sequence
pac_mock2_1gb.fq	/home/jshaw/scratch/tmp/skani-test/gtdb_genomes_reps_r214/database/GCF/016/406/305/GCF_016406305.1_genomic.fna.gz	90.53	90.53	NA-NA	10.446	HIGH	NA-NA	10	0.478	820/17939	NZ_CP066369.1 Shewanella putrefaciens strain CGMCC-1.6515 chromosome, complete genome
pac_mock2_1gb.fq	/home/jshaw/scratch/tmp/skani-test/gtdb_genomes_reps_r214/database/GCF/012/935/715/GCF_012935715.1_genomic.fna.gz	90.52	90.52	NA-NA	6.735	HIGH	NA-NA	6	0.306	1309/28683	NZ_CP052860.1 Pseudomonas sp. ADAK13 chromosome, complete genome
pac_mock2_1gb.fq	/home/jshaw/scratch/tmp/skani-test/gtdb_genomes_reps_r214/database/GCF/011/752/565/GCF_011752565.1_genomic.fna.gz	90.50	90.50	NA-NA	7.548	HIGH	NA-NA	6	0.289	1195/26349	NZ_VWXK01000100.1 Pantoea sp. Ap-967 NODE_100_length_518_cov_51.823529/0, whole genome shotgun sequence
pac_mock2_1gb.fq	/home/jshaw/scratch/tmp/skani-test/gtdb_genomes_reps_r214/database/GCF/023/283/765/GCF_023283765.1_genomic.fna.gz	90.50	90.50	NA-NA	13.614	HIGH	NA-NA	10	0.464	855/18875	NZ_JAKILG010000001.1 Shewanella profunda strain DSM 15900 contig00001, whole genome shotgun sequence
pac_mock2_1gb.fq	/home/jshaw/scratch/tmp/skani-test/gtdb_genomes_reps_r214/database/GCF/000/368/965/GCF_000368965.1_genomic.fna.gz	90.49	85.33	89.16-92.29	0.173	0.173	0.09-0.27	1	0.008	114/15566	NZ_KB849778.1 Acinetobacter calcoaceticus DSM 30006 = CIP 81.8 acLsb-supercont1.1, whole genome shotgun sequence
pac_mock2_1gb.fq	/home/jshaw/scratch/tmp/skani-test/gtdb_genomes_reps_r214/database/GCA/022/728/415/GCA_022728415.1_genomic.fna.gz	90.47	85.75	89.27-92.00	0.202	0.202	0.11-0.31	1	0.009	123/14443	JAIJJM010000799.1 MAG: Collinsella sp. isolate Map_57_008 contig_100_10008, whole genome shotgun sequence
pac_mock2_1gb.fq	/home/jshaw/scratch/tmp/skani-test/gtdb_genomes_reps_r214/database/GCF/000/210/075/GCF_000210075.1_genomic.fna.gz	90.47	89.03	90.07-90.75	0.909	0.909	0.77-1.08	1	0.044	635/23311	NC_021017.1 Bacteroides xylanisolvens XB1A, complete sequence
pac_mock2_1gb.fq	/home/jshaw/scratch/tmp/skani-test/gtdb_genomes_reps_r214/database/GCF/001/952/855/GCF_001952855.1_genomic.fna.gz	90.45	90.45	NA-NA	7.660	HIGH	NA-NA	7	0.307	1232/27626	NZ_LPNO01000001.1 Pseudomonas sp. ATCC PTA-122608 scaffold_0, whole genome shotgun sequence
pac_mock2_1gb.fq	/home/jshaw/scratch/tmp/skani-test/gtdb_genomes_reps_r214/database/GCA/002/364/755/GCA_002364755.1_genomic.fna.gz	90.45	86.09	89.28-91.53	0.235	0.235	0.15-0.35	1	0.013	165/17108	DEZI01000027.1 MAG TPA_asm: Stenotrophomonas maltophilia isolate UBA3136 UBA3136_contig_1, whole genome shotgun sequence
pac_mock2_1gb.fq	/home/jshaw/scratch/tmp/skani-test/gtdb_genomes_reps_r214/database/GCF/007/858/275/GCF_007858275.1_genomic.fna.gz	90.44	90.44	NA-NA	7.941	HIGH	NA-NA	7	0.313	1118/25206	NZ_VFEV01000099.1 Pseudomonas proteolytica strain DSM 15321 100_572_25.9371, whole genome shotgun sequence
pac_mock2_1gb.fq	/home/jshaw/scratch/tmp/skani-test/gtdb_genomes_reps_r214/database/GCF/001/676/385/GCF_001676385.1_genomic.fna.gz	90.43	86.90	89.42-91.39	0.333	0.333	0.22-0.47	1	0.018	211/16402	NZ_LYVJ01000001.1 Stenotrophomonas maltophilia strain Sm46PAILV contig001, whole genome shotgun sequence
pac_mock2_1gb.fq	/home/jshaw/scratch/tmp/skani-test/gtdb_genomes_reps_r214/database/GCF/012/985/465/GCF_012985465.1_genomic.fna.gz	90.43	90.43	NA-NA	7.701	HIGH	NA-NA	7	0.309	1112/25105	NZ_JAAQWN010000010.1 Pseudomonas sp. WS 5079 10_181710_15.2042, whole genome shotgun sequence
pac_mock2_1gb.fq	/home/jshaw/scratch/tmp/skani-test/gtdb_genomes_reps_r214/database/GCF/000/739/065/GCF_000739065.1_genomic.fna.gz	90.42	90.42	NA-NA	16.657	HIGH	NA-NA	17	0.734	280/6358	NZ_CP009149.1 Methanocaldococcus bathoardescens strain JH146 chromosome, complete genome
pac_mock2_1gb.fq	/home/jshaw/scratch/tmp/skani-test/gtdb_genomes_reps_r214/database/GCF/001/653/475/GCF_001653475.1_genomic.fna.gz	90.42	87.57	89.19-91.40	0.447	0.447	0.31-0.63	1	0.021	100/6121	NZ_CP011487.1 Helicobacter pylori strain PNG84A chromosome, complete genome
pac_mock2_1gb.fq	/home/jshaw/scratch/tmp/skani-test/gtdb_genomes_reps_r214/database/GCF/007/858/285/GCF_007858285.1_genomic.fna.gz	90.41	90.41	NA-NA	8.086	HIGH	NA-NA	7	0.308	1045/23822	NZ_VFIL01000010.1 Pseudomonas brenneri strain DSM 15294 10_256788_39.1869, whole genome shotgun sequence
pac_mock2_1gb.fq	/home/jshaw/scratch/tmp/skani-test/gtdb_genomes_reps_r214/database/GCF/900/105/735/GCF_900105735.1_genomic.fna.gz	90.40	90.40	NA-NA	7.029	HIGH	NA-NA	6	0.307	1219/27800	NZ_LT629793.1 Pseudomonas yamanorum strain LMG 27247 chromosome I
pac_mock2_1gb.fq	/home/jshaw/scratch/tmp/skani-test/gtdb_genomes_reps_r214/database/GCF/019/823/065/GCF_019823065.1_genomic.fna.gz	90.40	90.40	NA-NA	6.032	HIGH	NA-NA	6	0.264	1081/24682	NZ_CP081966.1 Pseudomonas mosselii strain DSM 17497 chromosome, complete genome
pac_mock2_1gb.fq	/home/jshaw/scratch/tmp/skani-test/gtdb_genomes_reps_r214/database/GCF/000/025/525/GCF_000025525.1_genomic.fna.gz	90.39	90.39	NA-NA	16.825	HIGH	NA-NA	16	0.734	302/6926	NC_013887.1 Methanocaldococcus sp. FS406-22, complete sequence
pac_mock2_1gb.fq	/home/jshaw/scratch/tmp/skani-test/gtdb_genomes_reps_r214/database/GCA/001/618/085/GCA_001618085.1_genomic.fna.gz	90.37	85.58	88.53-92.36	0.194	0.194	0.09-0.34	1	0.011	73/9112	LAEK01000014.1 Neisseria flavescens strain CNF seq0014, whole genome shotgun sequence
pac_mock2_1gb.fq	/home/jshaw/scratch/tmp/skani-test/gtdb_genomes_reps_r214/database/GCF/000/382/445/GCF_000382445.1_genomic.fna.gz	90.37	89.76	90.10-90.61	1.630	1.630	1.36-1.88	2	0.078	620/17630	NZ_KB905472.1 Phocaeicola massiliensis B84634 = Timone 84634 = DSM 17679 = JCM 13223 strain DSM 17679 aczJl-supercont1.1, whole genome shotgun sequence
pac_mock2_1gb.fq	/home/jshaw/scratch/tmp/skani-test/gtdb_genomes_reps_r214/database/GCF/013/364/355/GCF_013364355.1_genomic.fna.gz	90.37	85.90	89.18-91.56	0.226	0.226	0.15-0.34	1	0.012	160/17824	NZ_CP054931.1 Stenotrophomonas sp. NA06056 chromosome, complete genome
pac_mock2_1gb.fq	/home/jshaw/scratch/tmp/skani-test/gtdb_genomes_reps_r214/database/GCF/016/925/675/GCF_016925675.1_genomic.fna.gz	90.37	90.37	NA-NA	7.016	HIGH	NA-NA	7	0.302	1059/24473	NZ_CP070506.1 Pseudomonas sp. SDM007 chromosome, complete genome
pac_mock2_1gb.fq	/home/jshaw/scratch/tmp/skani-test/gtdb_genomes_reps_r214/database/GCF/021/602/025/GCF_021602025.1_genomic.fna.gz	90.33	90.33	NA-NA	6.862	HIGH	NA-NA	6	0.268	1078/25196	NZ_BQHW01000001.1 Pseudomonas ceruminis strain BML-PP028 sequence001, whole genome shotgun sequence
pac_mock2_1gb.fq	/home/jshaw/scratch/tmp/skani-test/gtdb_genomes_reps_r214/database/GCA/900/757/715/GCA_900757715.1_genomic.fna.gz	90.32	89.57	89.91-90.63	1.426	1.426	1.09-1.81	2	0.074	337/10247	CAAEOZ010000001.1 TPA_asm: uncultured Veillonella sp., isolate HGM14188, WGS project CAAEOZ010000000 data, contig: ERS537359_13_k99_174, whole genome shotgun sequence
pac_mock2_1gb.fq	/home/jshaw/scratch/tmp/skani-test/gtdb_genomes_reps_r214/database/GCF/000/739/735/GCF_000739735.1_genomic.fna.gz	90.32	89.90	90.01-90.52	1.927	1.927	1.64-2.49	2	0.095	960/26078	NZ_BBJF01000050.1 Paraburkholderia ginsengisoli NBRC 100965, whole genome shotgun sequence
pac_mock2_1gb.fq	/home/jshaw/scratch/tmp/skani-test/gtdb_genomes_reps_r214/database/GCA/001/815/675/GCA_001815675.1_genomic.fna.gz	90.29	85.41	88.70-92.20	0.182	0.182	0.09-0.32	1	0.009	81/10777	KV821453.1 Neisseria sp. HMSC065D04 genomic scaffold Scaffold0, whole genome shotgun sequence
pac_mock2_1gb.fq	/home/jshaw/scratch/tmp/skani-test/gtdb_genomes_reps_r214/database/GCF/005/080/685/GCF_005080685.1_genomic.fna.gz	90.26	90.26	NA-NA	6.421	HIGH	NA-NA	6	0.267	1087/26019	NZ_CP039371.1 Pseudomonas putida strain 1290 chromosome, complete genome
pac_mock2_1gb.fq	/home/jshaw/scratch/tmp/skani-test/gtdb_genomes_reps_r214/database/GCF/902/859/915/GCF_902859915.1_genomic.fna.gz	90.25	89.79	90.03-90.47	1.853	1.853	1.64-2.12	2	0.090	1111/31325	NZ_CADIKK010000001.1 Paraburkholderia ultramafica strain LMG 28614 isolate LMG 28614, whole genome shotgun sequence
pac_mock2_1gb.fq	/home/jshaw/scratch/tmp/skani-test/gtdb_genomes_reps_r214/database/GCF/002/251/635/GCF_002251635.1_genomic.fna.gz	90.24	90.24	NA-NA	6.958	HIGH	NA-NA	7	0.289	1090/26287	NZ_NMOJ01000001.1 Pseudomonas mandelii strain 6A1 pm_1, whole genome shotgun sequence
pac_mock2_1gb.fq	/home/jshaw/scratch/tmp/skani-test/gtdb_genomes_reps_r214/database/GCF/003/584/685/GCF_003584685.1_genomic.fna.gz	90.24	86.60	89.10-91.91	0.320	0.320	0.17-0.48	1	0.013	87/7516	NZ_AP018549.1 Lactobacillus paragasseri strain JCM 5343 chromosome, complete genome
pac_mock2_1gb.fq	/home/jshaw/scratch/tmp/skani-test/gtdb_genomes_reps_r214/database/GCF/001/983/165/GCF_001983165.1_genomic.fna.gz	90.21	90.21	NA-NA	7.614	HIGH	NA-NA	6	0.276	1058/25788	NZ_MNPU01000100.1 Pseudomonas gessardii strain DSM 17152 100_3095_161.398, whole genome shotgun sequence
pac_mock2_1gb.fq	/home/jshaw/scratch/tmp/skani-test/gtdb_genomes_reps_r214/database/GCF/014/697/105/GCF_014697105.1_genomic.fna.gz	90.16	89.63	89.94-90.39	1.724	1.724	1.48-1.93	2	0.073	774/23059	NZ_JACJRF010000001.1 Anabaena subtropica FACHB-260 contig1, whole genome shotgun sequence
pac_mock2_1gb.fq	/home/jshaw/scratch/tmp/skani-test/gtdb_genomes_reps_r214/database/GCA/001/809/325/GCA_001809325.1_genomic.fna.gz	90.15	85.35	88.40-92.31	0.188	0.188	0.09-0.32	1	0.011	81/10976	KV796920.1 Neisseria sp. HMSC077D05 genomic scaffold Scaffold1, whole genome shotgun sequence
pac_mock2_1gb.fq	/home/jshaw/scratch/tmp/skani-test/gtdb_genomes_reps_r214/database/GCF/021/601/385/GCF_021601385.1_genomic.fna.gz	90.13	90.13	NA-NA	7.499	HIGH	NA-NA	6	0.252	937/23474	NZ_BQHO01000001.1 Pseudomonas parasichuanensis strain BML-PP020 sequence001, whole genome shotgun sequence
pac_mock2_1gb.fq	/home/jshaw/scratch/tmp/skani-test/gtdb_genomes_reps_r214/database/GCF/000/277/405/GCF_000277405.1_genomic.fna.gz	90.10	87.58	89.25-91.17	0.525	0.525	0.34-0.71	1	0.021	105/6397	NC_017741.1 Helicobacter pylori Shi112, complete sequence
pac_mock2_1gb.fq	/home/jshaw/scratch/tmp/skani-test/gtdb_genomes_reps_r214/database/GCF/000/730/425/GCF_000730425.1_genomic.fna.gz	90.09	90.09	NA-NA	6.798	HIGH	NA-NA	6	0.265	936/23800	NZ_CP008896.1 Pseudomonas fluorescens strain UK4 chromosome, complete genome
pac_mock2_1gb.fq	/home/jshaw/scratch/tmp/skani-test/gtdb_genomes_reps_r214/database/GCF/000/730/645/GCF_000730645.1_genomic.fna.gz	90.08	90.08	NA-NA	7.630	HIGH	NA-NA	6	0.254	778/19871	NZ_BBIU01000055.1 Pseudomonas parafulva NBRC 16636 = DSM 17004 strain NBRC 16636, whole genome shotgun sequence
pac_mock2_1gb.fq	/home/jshaw/scratch/tmp/skani-test/gtdb_genomes_reps_r214/database/GCF/014/268/935/GCF_014268935.2_genomic.fna.gz	90.07	90.07	NA-NA	6.395	HIGH	NA-NA	6	0.245	909/23251	NZ_JABWRJ020000001.1 Pseudomonas peradeniyensis strain BW13M1 1, whole genome shotgun sequence
pac_mock2_1gb.fq	/home/jshaw/scratch/tmp/skani-test/gtdb_genomes_reps_r214/database/GCF/003/637/685/GCF_003637685.1_genomic.fna.gz	90.06	87.83	89.11-90.99	0.593	0.593	0.36-0.84	1	0.023	112/6258	NZ_MVWW01000001.1 Helicobacter pylori strain HP12002 Contig_1, whole genome shotgun sequence
pac_mock2_1gb.fq	/home/jshaw/scratch/tmp/skani-test/gtdb_genomes_reps_r214/database/GCF/003/231/305/GCF_003231305.1_genomic.fna.gz	90.05	90.05	NA-NA	7.241	HIGH	NA-NA	6	0.242	935/24056	NZ_QKVM01000001.1 Pseudomonas sichuanensis strain WCHPs060039 1, whole genome shotgun sequence
pac_mock2_1gb.fq	/home/jshaw/scratch/tmp/skani-test/gtdb_genomes_reps_r214/database/GCF/019/139/535/GCF_019139535.1_genomic.fna.gz	90.03	90.03	NA-NA	6.416	HIGH	NA-NA	6	0.247	836/21674	NZ_CP077073.1 Pseudomonas muyukensis strain COW39 chromosome, complete genome
pac_mock2_1gb.fq	/home/jshaw/scratch/tmp/skani-test/gtdb_genomes_reps_r214/database/GCF/018/614/655/GCF_018614655.1_genomic.fna.gz	90.01	90.01	NA-NA	8.332	HIGH	NA-NA	7	0.264	933/24347	NZ_JAGGOG010000009.1 Pseudomonas fluorescens strain ISL-62 ISL62_10, whole genome shotgun sequence
pac_mock2_1gb.fq	/home/jshaw/scratch/tmp/skani-test/gtdb_genomes_reps_r214/database/GCF/000/425/785/GCF_000425785.1_genomic.fna.gz	90.01	90.01	NA-NA	7.040	HIGH	NA-NA	6	0.249	827/21589	NZ_KE384450.1 Pseudomonas taiwanensis DSM 21245 H620DRAFT_scaffold00001.1, whole genome shotgun sequence
pac_mock2_1gb.fq	/home/jshaw/scratch/tmp/skani-test/gtdb_genomes_reps_r214/database/GCF/009/689/985/GCF_009689985.1_genomic.fna.gz	90.01	87.53	88.99-91.16	0.521	0.521	0.34-0.73	1	0.021	102/6330	NZ_QBAW01000001.1 Helicobacter pylori strain CHL25 CHL25_Contig_1, whole genome shotgun sequence
pac_mock2_1gb.fq	/home/jshaw/scratch/tmp/skani-test/gtdb_genomes_reps_r214/database/GCA/017/599/285/GCA_017599285.1_genomic.fna.gz	89.99	85.25	88.47-91.80	0.200	0.200	0.09-0.33	1	0.008	89/12511	JAGFXX010000001.1 Luteovulum azotoformans strain ka25 chromosome 1, whole genome shotgun sequence
pac_mock2_1gb.fq	/home/jshaw/scratch/tmp/skani-test/gtdb_genomes_reps_r214/database/GCA/002/878/215/GCA_002878215.1_genomic.fna.gz	89.98	86.78	88.44-91.48	0.386	0.386	0.20-0.63	1	0.015	70/5667	PNJC01000010.1 MAG: Hydrogenobaculum sp. isolate ARK-05 NODE_1021_length_7802_cov_10.3543, whole genome shotgun sequence
pac_mock2_1gb.fq	/home/jshaw/scratch/tmp/skani-test/gtdb_genomes_reps_r214/database/GCF/009/724/245/GCF_009724245.1_genomic.fna.gz	89.97	89.97	NA-NA	8.042	HIGH	NA-NA	7	0.264	986/26097	NZ_WNNK01000010.1 Pseudomonas spelaei strain CCM 7893 Pseudomonas_CCM7893_cont10_216379nt_UniDepth_1.00x, whole genome shotgun sequence
pac_mock2_1gb.fq	/home/jshaw/scratch/tmp/skani-test/gtdb_genomes_reps_r214/database/GCF/003/205/295/GCF_003205295.1_genomic.fna.gz	89.95	89.95	NA-NA	7.624	HIGH	NA-NA	6	0.235	853/22753	NZ_QJRP01000010.1 Pseudomonas mosselii strain LB-090624 NODE_10_length_159979_cov_16.695318, whole genome shotgun sequence
pac_mock2_1gb.fq	/home/jshaw/scratch/tmp/skani-test/gtdb_genomes_reps_r214/database/GCF/016/648/105/GCF_016648105.1_genomic.fna.gz	89.94	89.94	NA-NA	7.559	HIGH	NA-NA	6	0.239	951/25416	NZ_JACVVE010000100.1 Pseudomonas sp. S31 NODE_100_length_348_cov_24.841751, whole genome shotgun sequence
pac_mock2_1gb.fq	/home/jshaw/scratch/tmp/skani-test/gtdb_genomes_reps_r214/database/GCF/012/935/695/GCF_012935695.1_genomic.fna.gz	89.93	89.93	NA-NA	6.995	HIGH	NA-NA	6	0.250	950/25513	NZ_CP052859.1 Pseudomonas sp. ADAK18 chromosome, complete genome
pac_mock2_1gb.fq	/home/jshaw/scratch/tmp/skani-test/gtdb_genomes_reps_r214/database/GCF/900/996/225/GCF_900996225.1_genomic.fna.gz	89.91	89.50	89.70-90.10	1.936	1.936	1.64-2.34	2	0.084	965/30030	NZ_CAAJGL010000001.1 Paraburkholderia sp. BCC1884, whole genome shotgun sequence
pac_mock2_1gb.fq	/home/jshaw/scratch/tmp/skani-test/gtdb_genomes_reps_r214/database/GCF/000/026/105/GCF_000026105.1_genomic.fna.gz	89.91	89.91	NA-NA	6.467	HIGH	NA-NA	6	0.234	855/23133	NC_008027.1 Pseudomonas entomophila L48, complete sequence
pac_mock2_1gb.fq	/home/jshaw/scratch/tmp/skani-test/gtdb_genomes_reps_r214/database/GCF/015/354/575/GCF_015354575.1_genomic.fna.gz	89.89	89.89	NA-NA	7.260	HIGH	NA-NA	6	0.232	877/23879	NZ_JACAFQ010000001.1 Pseudomonas sp. UFMG81 scaffold1.1, whole genome shotgun sequence
pac_mock2_1gb.fq	/home/jshaw/scratch/tmp/skani-test/gtdb_genomes_reps_r214/database/GCA/025/147/325/GCA_025147325.1_genomic.fna.gz	89.84	88.77	89.10-90.36	1.122	1.122	0.85-1.97	2	0.060	387/15519	CP102262.1 Bacteroides stercoris ATCC 43183 chromosome, complete genome
pac_mock2_1gb.fq	/home/jshaw/scratch/tmp/skani-test/gtdb_genomes_reps_r214/database/GCF/001/645/125/GCF_001645125.1_genomic.fna.gz	89.84	89.40	89.62-90.01	1.892	1.892	1.60-2.15	2	0.079	1053/33928	NZ_LXKA01000110.1 Paraburkholderia ginsengiterrae strain DCY85 NODE_1, whole genome shotgun sequence
pac_mock2_1gb.fq	/home/jshaw/scratch/tmp/skani-test/gtdb_genomes_reps_r214/database/GCA/011/752/525/GCA_011752525.1_genomic.fna.gz	89.84	89.84	NA-NA	8.417	HIGH	NA-NA	6	0.230	750/20801	VWXI01000010.1 Pantoea sp. Cy-639 NODE_10_length_211538_cov_47.474966, whole genome shotgun sequence
pac_mock2_1gb.fq	/home/jshaw/scratch/tmp/skani-test/gtdb_genomes_reps_r214/database/GCF/014/268/885/GCF_014268885.2_genomic.fna.gz	89.83	89.83	NA-NA	6.456	HIGH	NA-NA	6	0.233	785/21786	NZ_CP077095.1 Pseudomonas xantholysinigenes strain RW9S1A chromosome, complete genome
pac_mock2_1gb.fq	/home/jshaw/scratch/tmp/skani-test/gtdb_genomes_reps_r214/database/GCF/013/409/255/GCF_013409255.1_genomic.fna.gz	89.82	89.39	89.64-90.02	1.928	1.928	1.63-2.20	2	0.077	1002/32420	NZ_JACCAS010000001.1 Paraburkholderia bryophila strain H2C3C Ga0394401_01, whole genome shotgun sequence
pac_mock2_1gb.fq	/home/jshaw/scratch/tmp/skani-test/gtdb_genomes_reps_r214/database/GCF/019/139/895/GCF_019139895.1_genomic.fna.gz	89.82	89.82	NA-NA	6.461	HIGH	NA-NA	6	0.232	867/24174	NZ_CP077076.1 Pseudomonas fakonensis strain COW40 chromosome, complete genome
pac_mock2_1gb.fq	/home/jshaw/scratch/tmp/skani-test/gtdb_genomes_reps_r214/database/GCF/012/275/575/GCF_012275575.1_genomic.fna.gz	89.82	89.35	89.59-90.01	1.817	1.817	1.54-2.11	2	0.076	874/28649	NZ_NPIH01000001.1 Burkholderia sp. SG-MS1 scaffold_1, whole genome shotgun sequence
pac_mock2_1gb.fq	/home/jshaw/scratch/tmp/skani-test/gtdb_genomes_reps_r214/database/GCF/002/741/075/GCF_002741075.1_genomic.fna.gz	89.82	89.82	NA-NA	6.466	HIGH	NA-NA	6	0.229	819/22871	NZ_CP016634.1 Pseudomonas putida strain IEC33019 chromosome, complete genome
pac_mock2_1gb.fq	/home/jshaw/scratch/tmp/skani-test/gtdb_genomes_reps_r214/database/GCF/019/139/675/GCF_019139675.1_genomic.fna.gz	89.80	89.80	NA-NA	6.483	HIGH	NA-NA	6	0.228	803/22519	NZ_CP077077.1 Pseudomonas maumuensis strain COW77 chromosome, complete genome
pac_mock2_1gb.fq	/home/jshaw/scratch/tmp/skani-test/gtdb_genomes_reps_r214/database/GCF/004/519/305/GCF_004519305.1_genomic.fna.gz	89.80	89.80	NA-NA	8.096	HIGH	NA-NA	6	0.226	767/21522	NZ_SOZA01000001.1 Pseudomonas sp. RIT623 1, whole genome shotgun sequence
pac_mock2_1gb.fq	/home/jshaw/scratch/tmp/skani-test/gtdb_genomes_reps_r214/database/GCA/900/760/455/GCA_900760455.1_genomic.fna.gz	89.79	89.02	89.46-90.09	1.396	1.396	1.13-1.79	2	0.057	434/15959	CAAEZC010000001.1 TPA_asm: uncultured Paraprevotella sp., isolate HGM04805, WGS project CAAEZC010000000 data, contig: SRS016095_8_k99_143, whole genome shotgun sequence
pac_mock2_1gb.fq	/home/jshaw/scratch/tmp/skani-test/gtdb_genomes_reps_r214/database/GCF/900/142/195/GCF_900142195.1_genomic.fna.gz	89.79	89.52	89.68-90.07	2.221	2.221	1.71-2.37	2	0.082	936/29006	NZ_FRAB01000114.1 Paraburkholderia terricola strain LMG 20594, whole genome shotgun sequence
pac_mock2_1gb.fq	/home/jshaw/scratch/tmp/skani-test/gtdb_genomes_reps_r214/database/GCF/018/417/595/GCF_018417595.1_genomic.fna.gz	89.78	89.78	NA-NA	6.672	HIGH	NA-NA	6	0.229	826/23362	NZ_CP070982.1 Pseudomonas entomophila strain Small chromosome, complete genome
pac_mock2_1gb.fq	/home/jshaw/scratch/tmp/skani-test/gtdb_genomes_reps_r214/database/GCF/009/730/335/GCF_009730335.1_genomic.fna.gz	89.76	85.97	88.53-91.34	0.293	0.293	0.16-0.45	1	0.011	88/9549	NZ_CP046315.1 Schaalia odontolytica strain FDAARGOS_732 chromosome, complete genome
pac_mock2_1gb.fq	/home/jshaw/scratch/tmp/skani-test/gtdb_genomes_reps_r214/database/GCF/004/357/765/GCF_004357765.1_genomic.fna.gz	89.75	89.75	NA-NA	8.429	HIGH	NA-NA	6	0.225	778/22195	NZ_SMTE01000001.1 Pseudomonas putida strain II-2 II-2_scaffold1, whole genome shotgun sequence
pac_mock2_1gb.fq	/home/jshaw/scratch/tmp/skani-test/gtdb_genomes_reps_r214/database/GCF/024/127/895/GCF_024127895.1_genomic.fna.gz	89.75	89.75	NA-NA	7.984	HIGH	NA-NA	6	0.218	742/21229	NZ_JAMYBK010000001.1 Pseudomonas guariconensis strain S 4446-10 contig00001, whole genome shotgun sequence
pac_mock2_1gb.fq	/home/jshaw/scratch/tmp/skani-test/gtdb_genomes_reps_r214/database/GCF/008/369/295/GCF_008369295.1_genomic.fna.gz	89.74	89.74	NA-NA	8.164	HIGH	NA-NA	7	0.246	846/24226	NZ_VOBG01000001.1 Pseudomonas sp. ANT_H4 ctg00001_529613, whole genome shotgun sequence
pac_mock2_1gb.fq	/home/jshaw/scratch/tmp/skani-test/gtdb_genomes_reps_r214/database/GCA/025/147/485/GCA_025147485.1_genomic.fna.gz	89.74	89.13	89.50-90.04	1.623	1.623	1.26-1.85	2	0.073	514/18194	CP102263.1 Bacteroides uniformis strain ATCC 8492 chromosome, complete genome
pac_mock2_1gb.fq	/home/jshaw/scratch/tmp/skani-test/gtdb_genomes_reps_r214/database/GCF/015/680/235/GCF_015680235.1_genomic.fna.gz	89.73	89.73	NA-NA	7.701	HIGH	NA-NA	6	0.220	703/20199	NZ_JADLJL010000001.1 Pseudomonas guariconensis strain 20-MO00619-0 contig00001, whole genome shotgun sequence
pac_mock2_1gb.fq	/home/jshaw/scratch/tmp/skani-test/gtdb_genomes_reps_r214/database/GCF/009/707/515/GCF_009707515.1_genomic.fna.gz	89.73	89.73	NA-NA	8.220	HIGH	NA-NA	6	0.241	797/22936	NZ_WLYI01000100.1 Pseudomonas karstica strain CCM 7891 Pseudomonas_CCM7891_cont100_369nt_UniDepth1.25x, whole genome shotgun sequence
pac_mock2_1gb.fq	/home/jshaw/scratch/tmp/skani-test/gtdb_genomes_reps_r214/database/GCF/005/221/305/GCF_005221305.1_genomic.fna.gz	89.72	85.02	87.96-91.39	0.204	0.204	0.11-0.39	1	0.007	55/8426	NZ_CP039887.1 Neisseria subflava strain ATCC 49275 chromosome, complete genome
pac_mock2_1gb.fq	/home/jshaw/scratch/tmp/skani-test/gtdb_genomes_reps_r214/database/GCF/003/086/775/GCF_003086775.1_genomic.fna.gz	89.67	86.41	88.75-90.91	0.351	0.351	0.22-0.51	1	0.016	202/18689	NZ_CP026001.1 Stenotrophomonas sp. ZAC14D1_NAIMI4_1 chromosome
pac_mock2_1gb.fq	/home/jshaw/scratch/tmp/skani-test/gtdb_genomes_reps_r214/database/GCF/001/306/135/GCF_001306135.1_genomic.fna.gz	89.60	89.60	NA-NA	7.421	HIGH	NA-NA	7	0.245	808/24298	NZ_LGKP01000025.1 Herpetosiphon geysericola strain DSM 7119 contig_1, whole genome shotgun sequence
pac_mock2_1gb.fq	/home/jshaw/scratch/tmp/skani-test/gtdb_genomes_reps_r214/database/GCF/014/269/025/GCF_014269025.2_genomic.fna.gz	89.60	89.60	NA-NA	6.652	HIGH	NA-NA	6	0.221	664/19993	NZ_CP077094.1 Pseudomonas promysalinigenes strain RW10S1 chromosome, complete genome
pac_mock2_1gb.fq	/home/jshaw/scratch/tmp/skani-test/gtdb_genomes_reps_r214/database/GCF/023/472/875/GCF_023472875.1_genomic.fna.gz	89.59	85.47	87.73-91.31	0.245	0.245	0.11-0.42	1	0.015	69/8981	NZ_JAMDHR010000010.1 Neisseria perflava strain CCUG 17915 NODE_10_length_59262_cov_272.811946, whole genome shotgun sequence
pac_mock2_1gb.fq	/home/jshaw/scratch/tmp/skani-test/gtdb_genomes_reps_r214/database/GCF/003/269/035/GCF_003269035.1_genomic.fna.gz	89.58	89.24	89.41-89.75	2.081	2.081	1.74-2.36	2	0.075	937/31982	NZ_QLTK01000001.1 Paraburkholderia bryophila strain LMG 23644 Ga0139076_101, whole genome shotgun sequence
pac_mock2_1gb.fq	/home/jshaw/scratch/tmp/skani-test/gtdb_genomes_reps_r214/database/GCF/007/293/315/GCF_007293315.1_genomic.fna.gz	89.58	85.34	88.35-90.78	0.235	0.235	0.15-0.35	1	0.009	128/17430	NZ_VLXZ01000100.1 Bacillus sp. P16(2019) NODE_100_length_343_cov_0.834586, whole genome shotgun sequence
pac_mock2_1gb.fq	/home/jshaw/scratch/tmp/skani-test/gtdb_genomes_reps_r214/database/GCF/023/277/925/GCF_023277925.1_genomic.fna.gz	89.57	89.57	NA-NA	6.632	HIGH	NA-NA	6	0.215	740/22487	NZ_CP063832.1 Pseudomonas entomophila strain 23S chromosome, complete genome
