pac_mock2_1gb.fq	/home/jshaw/scratch/tmp/skani-test/gtdb_genomes_reps_r214/database/GCF/000/761/155/GCF_000761155.1_genomic.fna.gz	87.03	87.03	NA-NA	7.223	HIGH	NA-NA	7	0.098	251/18594	NZ_CP009533.1 Pseudomonas rhizosphaerae strain DSM 16299 chromosome, complete genome
pac_mock2_1gb.fq	/home/jshaw/scratch/tmp/skani-test/gtdb_genomes_reps_r214/database/GCF/012/113/595/GCF_012113595.1_genomic.fna.gz	87.03	85.62	86.51-87.70	0.902	0.902	0.64-1.18	1	0.014	218/26839	NZ_CP050831.1 Bacteroides sp. CBA7301 chromosome, complete genome
pac_mock2_1gb.fq	/home/jshaw/scratch/tmp/skani-test/gtdb_genomes_reps_r214/database/GCF/024/623/065/GCF_024623065.1_genomic.fna.gz	87.03	85.74	86.45-87.71	0.921	0.921	0.67-1.19	1	0.016	163/19227	NZ_JANJZR010000100.1 Bacteroides acidifaciens strain DSM 15896 NODE_100_length_13532_cov_54.725678, whole genome shotgun sequence
pac_mock2_1gb.fq	/home/jshaw/scratch/tmp/skani-test/gtdb_genomes_reps_r214/database/GCF/900/091/555/GCF_900091555.1_genomic.fna.gz	87.02	86.04	86.49-87.60	1.180	1.180	0.83-1.64	2	0.021	233/24602	NZ_FMCX01000020.1 Micromonospora mirobrigensis strain DSM 44830, whole genome shotgun sequence
pac_mock2_1gb.fq	/home/jshaw/scratch/tmp/skani-test/gtdb_genomes_reps_r214/database/GCA/000/403/945/GCA_000403945.1_genomic.fna.gz	87.02	87.02	NA-NA	12.920	HIGH	NA-NA	8	0.106	138/10287	APFI01000001.1 Desulfovibrio sp. Dsv1 Dsv1_NODE_101_len_15191_cov_13_888026.57_0, whole genome shotgun sequence
pac_mock2_1gb.fq	/home/jshaw/scratch/tmp/skani-test/gtdb_genomes_reps_r214/database/GCF/018/223/745/GCF_018223745.1_genomic.fna.gz	86.99	86.99	NA-NA	1.546	LOW	NA-NA	1	0.013	302/22727	NZ_CP073653.1 Clostridium beijerinckii strain DSM 791 chromosome, complete genome
pac_mock2_1gb.fq	/home/jshaw/scratch/tmp/skani-test/gtdb_genomes_reps_r214/database/GCF/018/070/575/GCF_018070575.1_genomic.fna.gz	86.99	86.13	86.48-87.53	1.298	1.298	0.94-1.74	2	0.023	249/25515	NZ_JAGPXN010000001.1 Micromonospora sp. C31 C31_contig_1, whole genome shotgun sequence
pac_mock2_1gb.fq	/home/jshaw/scratch/tmp/skani-test/gtdb_genomes_reps_r214/database/GCA/011/372/505/GCA_011372505.1_genomic.fna.gz	86.98	86.98	NA-NA	6.632	HIGH	NA-NA	5	0.079	117/8840	DRSQ01000001.1 MAG TPA_asm: Chlorobaculum parvum isolate HyVt-633 HyVt-633_k295_100930, whole genome shotgun sequence
pac_mock2_1gb.fq	/home/jshaw/scratch/tmp/skani-test/gtdb_genomes_reps_r214/database/GCF/023/656/545/GCF_023656545.1_genomic.fna.gz	86.96	85.98	86.47-87.47	1.184	1.184	0.88-1.55	2	0.020	231/24933	NZ_JAMOKF010000100.1 Micromonospora phytophila strain DSM 105363 NODE_100_length_16255_cov_14.815414, whole genome shotgun sequence
pac_mock2_1gb.fq	/home/jshaw/scratch/tmp/skani-test/gtdb_genomes_reps_r214/database/GCF/013/374/995/GCF_013374995.1_genomic.fna.gz	86.95	86.95	NA-NA	7.288	HIGH	NA-NA	6	0.094	330/25169	NZ_CP056030.1 Pseudomonas eucalypticola strain NP-1 chromosome, complete genome
pac_mock2_1gb.fq	/home/jshaw/scratch/tmp/skani-test/gtdb_genomes_reps_r214/database/GCF/016/598/485/GCF_016598485.1_genomic.fna.gz	86.94	85.94	86.45-87.51	1.162	1.162	0.84-1.49	2	0.019	248/27188	NZ_JAEMUW010000100.1 Micromonospora veneta strain CAP181 100_length_957_depth_4.03x, whole genome shotgun sequence
pac_mock2_1gb.fq	/home/jshaw/scratch/tmp/skani-test/gtdb_genomes_reps_r214/database/GCF/009/799/925/GCF_009799925.1_genomic.fna.gz	86.94	86.94	NA-NA	12.383	HIGH	NA-NA	6	0.073	222/17017	NZ_WELK01000010.1 Pseudomonas sp. R-28-1W-6 NODE_10_length_151348_cov_356.258260, whole genome shotgun sequence
pac_mock2_1gb.fq	/home/jshaw/scratch/tmp/skani-test/gtdb_genomes_reps_r214/database/GCF/900/105/555/GCF_900105555.1_genomic.fna.gz	86.94	86.94	NA-NA	7.060	HIGH	NA-NA	6	0.092	252/19318	NZ_FNTZ01000002.1 Pseudomonas coleopterorum strain LMG 28558, whole genome shotgun sequence
pac_mock2_1gb.fq	/home/jshaw/scratch/tmp/skani-test/gtdb_genomes_reps_r214/database/GCF/019/345/465/GCF_019345465.1_genomic.fna.gz	86.92	86.92	NA-NA	10.644	HIGH	NA-NA	7	0.087	267/20605	NZ_JAHKRC010000001.1 Pseudomonas sp. NKUCC02_KPG contig00001, whole genome shotgun sequence
pac_mock2_1gb.fq	/home/jshaw/scratch/tmp/skani-test/gtdb_genomes_reps_r214/database/GCF/001/043/005/GCF_001043005.1_genomic.fna.gz	86.92	86.92	NA-NA	10.956	HIGH	NA-NA	6	0.084	275/21224	NZ_JYKZ01000097.1 Pseudomonas psychrophila strain DSM 17535 100_549_0.689573, whole genome shotgun sequence
pac_mock2_1gb.fq	/home/jshaw/scratch/tmp/skani-test/gtdb_genomes_reps_r214/database/GCF/009/905/435/GCF_009905435.1_genomic.fna.gz	86.90	86.90	NA-NA	8.344	HIGH	NA-NA	6	0.090	305/23682	NZ_JAAAMT010000001.1 Pseudomonas sp. R5(2019) 5_1, whole genome shotgun sequence
pac_mock2_1gb.fq	/home/jshaw/scratch/tmp/skani-test/gtdb_genomes_reps_r214/database/GCF/907/164/555/GCF_907164555.1_genomic.fna.gz	86.90	86.71	86.63-87.34	2.438	2.438	1.53-2.78	2	0.034	303/25237	NZ_CAJQZC010000001.1 Paraburkholderia sp. LMG 31841, whole genome shotgun sequence
pac_mock2_1gb.fq	/home/jshaw/scratch/tmp/skani-test/gtdb_genomes_reps_r214/database/GCA/900/596/015/GCA_900596015.1_genomic.fna.gz	86.89	86.89	NA-NA	11.199	HIGH	NA-NA	7	0.090	231/18022	UVIF01000010.1 Pseudomonas sp. 286 isolate p4.G6 genome assembly, contig: 10, whole genome shotgun sequence
pac_mock2_1gb.fq	/home/jshaw/scratch/tmp/skani-test/gtdb_genomes_reps_r214/database/GCF/023/509/015/GCF_023509015.1_genomic.fna.gz	86.89	86.89	NA-NA	7.359	HIGH	NA-NA	7	0.094	340/26551	NZ_CP094975.1 Pseudomonas sp. PIA16 chromosome, complete genome
pac_mock2_1gb.fq	/home/jshaw/scratch/tmp/skani-test/gtdb_genomes_reps_r214/database/GCF/902/825/405/GCF_902825405.1_genomic.fna.gz	86.88	85.99	86.28-87.42	1.250	1.250	0.93-1.65	2	0.020	231/24867	NZ_CADEAU010000001.1 Micromonospora maritima isolate DSM 45782, whole genome shotgun sequence
pac_mock2_1gb.fq	/home/jshaw/scratch/tmp/skani-test/gtdb_genomes_reps_r214/database/GCF/900/091/565/GCF_900091565.1_genomic.fna.gz	86.87	85.87	86.29-87.55	1.167	1.167	0.81-1.53	2	0.020	213/23959	NZ_FMCV01000074.1 Micromonospora marina strain DSM 45555, whole genome shotgun sequence
pac_mock2_1gb.fq	/home/jshaw/scratch/tmp/skani-test/gtdb_genomes_reps_r214/database/GCA/902/388/365/GCA_902388365.1_genomic.fna.gz	86.87	86.31	86.54-87.24	1.650	1.650	1.22-1.93	2	0.022	223/21369	CABMPB010000001.1 uncultured Bacteroides sp. isolate MGYG-HGUT-02560 genome assembly, contig: GUT_GENOME149380_1, whole genome shotgun sequence
pac_mock2_1gb.fq	/home/jshaw/scratch/tmp/skani-test/gtdb_genomes_reps_r214/database/GCF/904/063/065/GCF_904063065.1_genomic.fna.gz	86.87	86.87	NA-NA	10.956	HIGH	NA-NA	7	0.088	252/19818	NZ_CAJFCL010000001.1 Pseudomonas paraversuta strain V4/DAB/S4/2a, whole genome shotgun sequence
pac_mock2_1gb.fq	/home/jshaw/scratch/tmp/skani-test/gtdb_genomes_reps_r214/database/GCA/016/866/305/GCA_016866305.1_genomic.fna.gz	86.86	86.86	NA-NA	10.814	HIGH	NA-NA	10	0.125	113/8912	VGMX01000001.1 MAG: Chlorobi bacterium isolate M_DeepCast_65m_m2_268 M_DeepCast_65m_m2_268_Ga0194120_10000047, whole genome shotgun sequence
pac_mock2_1gb.fq	/home/jshaw/scratch/tmp/skani-test/gtdb_genomes_reps_r214/database/GCF/001/043/025/GCF_001043025.1_genomic.fna.gz	86.86	86.86	NA-NA	10.302	HIGH	NA-NA	7	0.093	285/22487	NZ_JYLD01000010.1 Pseudomonas helleri strain DSM 29165 10_220866_45.2889, whole genome shotgun sequence
pac_mock2_1gb.fq	/home/jshaw/scratch/tmp/skani-test/gtdb_genomes_reps_r214/database/GCF/003/935/425/GCF_003935425.1_genomic.fna.gz	86.83	86.83	NA-NA	11.927	HIGH	NA-NA	7	0.089	275/21918	NZ_RHQN01000010.1 Pseudomonas sp. v388 NODE_10_length_273221_cov_45.948749, whole genome shotgun sequence
pac_mock2_1gb.fq	/home/jshaw/scratch/tmp/skani-test/gtdb_genomes_reps_r214/database/GCF/900/100/735/GCF_900100735.1_genomic.fna.gz	86.82	86.58	86.66-87.30	2.306	2.306	1.48-2.58	2	0.030	388/33851	NZ_FNCJ01000049.1 Paraburkholderia phenazinium strain LMG 2247, whole genome shotgun sequence
pac_mock2_1gb.fq	/home/jshaw/scratch/tmp/skani-test/gtdb_genomes_reps_r214/database/GCF/001/695/625/GCF_001695625.1_genomic.fna.gz	86.82	86.82	NA-NA	11.214	HIGH	NA-NA	7	0.090	280/22393	NZ_MBPN01000099.1 Pseudomonas defluvii strain WCHP16 NODE_100_length_18139_cov_42.7491, whole genome shotgun sequence
pac_mock2_1gb.fq	/home/jshaw/scratch/tmp/skani-test/gtdb_genomes_reps_r214/database/GCF/019/890/675/GCF_019890675.1_genomic.fna.gz	86.81	85.93	86.32-87.40	1.255	1.255	0.87-1.61	2	0.020	234/25752	NZ_JAIOAA010000001.1 Micromonospora sp. PLK6-60 1, whole genome shotgun sequence
pac_mock2_1gb.fq	/home/jshaw/scratch/tmp/skani-test/gtdb_genomes_reps_r214/database/GCF/900/106/095/GCF_900106095.1_genomic.fna.gz	86.80	86.80	NA-NA	7.116	HIGH	NA-NA	6	0.088	249/20053	NZ_FNUD01000002.1 Pseudomonas deceptionensis strain LMG 25555, whole genome shotgun sequence
pac_mock2_1gb.fq	/home/jshaw/scratch/tmp/skani-test/gtdb_genomes_reps_r214/database/GCF/003/236/335/GCF_003236335.1_genomic.fna.gz	86.80	86.19	86.44-87.20	1.588	1.588	1.18-1.87	2	0.023	268/26818	NZ_POUB01000100.1 Micromonospora deserti strain 13K206 NODE_100_length_19567_cov_53.5138, whole genome shotgun sequence
pac_mock2_1gb.fq	/home/jshaw/scratch/tmp/skani-test/gtdb_genomes_reps_r214/database/GCF/003/172/955/GCF_003172955.1_genomic.fna.gz	86.79	85.64	86.22-87.43	1.048	1.048	0.72-1.34	2	0.019	211/25811	NZ_QGKR01000085.1 Micromonospora acroterricola strain 5R2A7 NODE_100_length_21043_cov_10.0805_ID_199, whole genome shotgun sequence
pac_mock2_1gb.fq	/home/jshaw/scratch/tmp/skani-test/gtdb_genomes_reps_r214/database/GCF/900/475/285/GCF_900475285.1_genomic.fna.gz	86.79	86.79	NA-NA	6.903	HIGH	NA-NA	6	0.084	236/19104	NZ_LS483370.1 Pseudomonas taetrolens strain NCTC10697 chromosome 1, complete sequence
pac_mock2_1gb.fq	/home/jshaw/scratch/tmp/skani-test/gtdb_genomes_reps_r214/database/GCF/022/747/945/GCF_022747945.1_genomic.fna.gz	86.77	85.77	86.29-87.38	1.165	1.165	0.84-1.54	2	0.020	238/27708	NZ_JALDST010000001.1 Micromonospora sp. R77 1, whole genome shotgun sequence
pac_mock2_1gb.fq	/home/jshaw/scratch/tmp/skani-test/gtdb_genomes_reps_r214/database/GCF/900/090/235/GCF_900090235.1_genomic.fna.gz	86.75	85.92	86.24-87.15	1.320	1.320	1.02-1.71	2	0.021	257/28414	NZ_LT607750.1 Micromonospora echinaurantiaca strain DSM 43904 chromosome I
pac_mock2_1gb.fq	/home/jshaw/scratch/tmp/skani-test/gtdb_genomes_reps_r214/database/GCF/900/091/445/GCF_900091445.1_genomic.fna.gz	86.75	86.03	86.32-87.21	1.449	1.449	1.13-1.85	2	0.021	259/27492	NZ_LT607733.1 Micromonospora echinofusca strain DSM 43913 chromosome I
pac_mock2_1gb.fq	/home/jshaw/scratch/tmp/skani-test/gtdb_genomes_reps_r214/database/GCF/014/697/625/GCF_014697625.1_genomic.fna.gz	86.75	86.26	86.50-87.83	1.760	1.760	0.88-1.95	2	0.024	321/31372	NZ_JACJSG010000001.1 Anabaena azotica FACHB-119 contig1, whole genome shotgun sequence
pac_mock2_1gb.fq	/home/jshaw/scratch/tmp/skani-test/gtdb_genomes_reps_r214/database/GCF/016/881/005/GCF_016881005.1_genomic.fna.gz	86.74	86.74	NA-NA	11.457	HIGH	NA-NA	7	0.087	304/24974	NZ_JACOPV010000001.1 Pseudomonas arcuscaelestis strain P66 Seq1, whole genome shotgun sequence
pac_mock2_1gb.fq	/home/jshaw/scratch/tmp/skani-test/gtdb_genomes_reps_r214/database/GCF/907/164/575/GCF_907164575.1_genomic.fna.gz	86.74	86.74	NA-NA	6.569	HIGH	NA-NA	3	0.033	281/23086	NZ_CAJQYY010000001.1 Paraburkholderia sp. LMG 32171, whole genome shotgun sequence
pac_mock2_1gb.fq	/home/jshaw/scratch/tmp/skani-test/gtdb_genomes_reps_r214/database/GCF/018/847/895/GCF_018847895.1_genomic.fna.gz	86.74	86.25	86.30-87.36	1.773	1.773	1.11-2.52	2	0.027	128/12571	NZ_CP072051.1 Akkermansia muciniphila strain Akk0196 chromosome, complete genome
pac_mock2_1gb.fq	/home/jshaw/scratch/tmp/skani-test/gtdb_genomes_reps_r214/database/GCF/003/725/545/GCF_003725545.1_genomic.fna.gz	86.74	86.04	86.20-87.30	1.446	1.446	1.04-1.81	2	0.021	224/23681	NZ_RJLN01000001.1 Micromonospora sp. PPF5-17 1, whole genome shotgun sequence
pac_mock2_1gb.fq	/home/jshaw/scratch/tmp/skani-test/gtdb_genomes_reps_r214/database/GCF/009/193/325/GCF_009193325.2_genomic.fna.gz	86.73	86.24	86.45-87.42	1.770	1.770	1.01-1.95	2	0.019	208/20504	NZ_CP059856.1 Bacteroides zhangwenhongii strain HF-5287 chromosome, complete genome
pac_mock2_1gb.fq	/home/jshaw/scratch/tmp/skani-test/gtdb_genomes_reps_r214/database/GCF/023/896/955/GCF_023896955.1_genomic.fna.gz	86.73	85.55	86.16-87.43	1.022	1.022	0.72-1.36	2	0.018	218/27503	NZ_JAMHIW010000001.1 Micromonospora sp. RHAY321 1, whole genome shotgun sequence
pac_mock2_1gb.fq	/home/jshaw/scratch/tmp/skani-test/gtdb_genomes_reps_r214/database/GCF/003/205/495/GCF_003205495.1_genomic.fna.gz	86.72	86.72	NA-NA	12.808	HIGH	NA-NA	6	0.073	193/15964	NZ_QJRX01000010.1 Pseudomonas alcaligenes strain MB-090714 NODE_10_length_137625_cov_35.650475, whole genome shotgun sequence
pac_mock2_1gb.fq	/home/jshaw/scratch/tmp/skani-test/gtdb_genomes_reps_r214/database/GCA/900/112/325/GCA_900112325.1_genomic.fna.gz	86.71	85.82	86.27-87.26	1.261	1.261	0.91-1.62	2	0.019	223/25550	FOLJ01000034.1 Verrucosispora sediminis strain CGMCC 4.3550 genome assembly, contig: Ga0079915_134, whole genome shotgun sequence
pac_mock2_1gb.fq	/home/jshaw/scratch/tmp/skani-test/gtdb_genomes_reps_r214/database/GCF/004/803/755/GCF_004803755.1_genomic.fna.gz	86.70	86.70	NA-NA	7.662	HIGH	NA-NA	7	0.089	275/22907	NZ_CP032311.1 Pseudomonas sp. DG56-2 chromosome, complete genome
pac_mock2_1gb.fq	/home/jshaw/scratch/tmp/skani-test/gtdb_genomes_reps_r214/database/GCF/014/358/015/GCF_014358015.1_genomic.fna.gz	86.70	86.70	NA-NA	11.790	HIGH	NA-NA	7	0.086	262/21873	NZ_JACONV010000001.1 Pseudomonas triticumensis strain DOAB 1067 DOAB1067_contig_1, whole genome shotgun sequence
pac_mock2_1gb.fq	/home/jshaw/scratch/tmp/skani-test/gtdb_genomes_reps_r214/database/GCF/003/857/015/GCF_003857015.1_genomic.fna.gz	86.70	85.91	86.19-87.20	1.358	1.358	0.98-1.83	2	0.022	239/26484	NZ_QGGF01000372.1 Micromonospora globispora strain S2901 NODE_100_length_17311_cov_5.61895_ID_199, whole genome shotgun sequence
pac_mock2_1gb.fq	/home/jshaw/scratch/tmp/skani-test/gtdb_genomes_reps_r214/database/GCF/008/041/835/GCF_008041835.1_genomic.fna.gz	86.69	86.69	NA-NA	13.338	HIGH	NA-NA	6	0.067	225/18868	NZ_VRYE01000001.1 Pseudomonas mendocina strain EF27 EF27-1, whole genome shotgun sequence
pac_mock2_1gb.fq	/home/jshaw/scratch/tmp/skani-test/gtdb_genomes_reps_r214/database/GCF/001/294/575/GCF_001294575.1_genomic.fna.gz	86.68	86.68	NA-NA	6.880	HIGH	NA-NA	6	0.082	241/20239	NZ_CP012676.1 Pseudomonas versuta strain L10.10 chromosome, complete genome
pac_mock2_1gb.fq	/home/jshaw/scratch/tmp/skani-test/gtdb_genomes_reps_r214/database/GCF/007/830/265/GCF_007830265.1_genomic.fna.gz	86.66	85.88	86.20-87.15	1.375	1.375	1.05-1.77	2	0.018	231/25919	NZ_VLKE01000001.1 Micromonospora olivasterospora strain DSM 43868 JD77DRAFT_unitig_0_quiver.1, whole genome shotgun sequence
pac_mock2_1gb.fq	/home/jshaw/scratch/tmp/skani-test/gtdb_genomes_reps_r214/database/GCA/021/202/525/GCA_021202525.1_genomic.fna.gz	86.65	86.65	NA-NA	7.903	HIGH	NA-NA	3	0.034	134/11381	JAJQCV010000008.1 MAG: Akkermansiaceae bacterium isolate C.9_3 NODE_1000_length_10696_cov_7.892303, whole genome shotgun sequence
pac_mock2_1gb.fq	/home/jshaw/scratch/tmp/skani-test/gtdb_genomes_reps_r214/database/GCF/003/626/595/GCF_003626595.1_genomic.fna.gz	86.65	85.83	86.24-87.20	1.312	1.312	0.94-1.74	2	0.019	244/27836	NZ_RBAK01000001.1 Micromonospora endolithica strain JCM 12677 contig0001, whole genome shotgun sequence
pac_mock2_1gb.fq	/home/jshaw/scratch/tmp/skani-test/gtdb_genomes_reps_r214/database/GCF/900/090/305/GCF_900090305.1_genomic.fna.gz	86.64	85.70	86.18-87.31	1.220	1.220	0.84-1.62	2	0.018	205/24478	NZ_LT607751.1 Micromonospora siamensis strain DSM 45097 chromosome I
pac_mock2_1gb.fq	/home/jshaw/scratch/tmp/skani-test/gtdb_genomes_reps_r214/database/GCF/007/858/365/GCF_007858365.1_genomic.fna.gz	86.63	86.63	NA-NA	11.404	HIGH	NA-NA	7	0.081	245/20944	NZ_VFIO01000010.1 Pseudomonas saxonica strain DSM 108989 10_166467_22.3684, whole genome shotgun sequence
pac_mock2_1gb.fq	/home/jshaw/scratch/tmp/skani-test/gtdb_genomes_reps_r214/database/GCF/001/043/055/GCF_001043055.1_genomic.fna.gz	86.63	86.63	NA-NA	13.525	HIGH	NA-NA	7	0.081	221/18895	NZ_JYLF01000010.1 Pseudomonas weihenstephanensis strain DSM 29166 10_154467_40.591, whole genome shotgun sequence
pac_mock2_1gb.fq	/home/jshaw/scratch/tmp/skani-test/gtdb_genomes_reps_r214/database/GCF/900/091/625/GCF_900091625.1_genomic.fna.gz	86.61	85.83	86.16-87.17	1.376	1.376	1.02-1.73	2	0.018	255/29050	NZ_FMIC01000002.1 Micromonospora peucetia strain DSM 43363, whole genome shotgun sequence
pac_mock2_1gb.fq	/home/jshaw/scratch/tmp/skani-test/gtdb_genomes_reps_r214/database/GCF/900/090/285/GCF_900090285.1_genomic.fna.gz	86.60	85.87	86.10-87.06	1.438	1.438	1.07-1.86	2	0.020	234/26271	NZ_LT607754.1 Micromonospora inositola strain DSM 43819 chromosome I
pac_mock2_1gb.fq	/home/jshaw/scratch/tmp/skani-test/gtdb_genomes_reps_r214/database/GCF/900/091/515/GCF_900091515.1_genomic.fna.gz	86.59	85.74	86.11-87.19	1.289	1.289	0.94-1.71	2	0.019	223/26255	NZ_LT607410.1 Micromonospora purpureochromogenes strain DSM 43821 chromosome I
pac_mock2_1gb.fq	/home/jshaw/scratch/tmp/skani-test/gtdb_genomes_reps_r214/database/GCA/020/852/615/GCA_020852615.1_genomic.fna.gz	86.59	86.59	NA-NA	15.639	HIGH	NA-NA	10	0.112	97/8430	JADZAJ010000001.1 MAG: Nitrosomonas sp. isolate SJ624 c_000000006992, whole genome shotgun sequence
pac_mock2_1gb.fq	/home/jshaw/scratch/tmp/skani-test/gtdb_genomes_reps_r214/database/GCA/002/379/585/GCA_002379585.1_genomic.fna.gz	86.58	86.58	NA-NA	7.118	HIGH	NA-NA	7	0.082	228/19855	DFUE01000030.1 MAG TPA_asm: Pseudomonas sp. UBA4194 UBA4194_contig_100, whole genome shotgun sequence
pac_mock2_1gb.fq	/home/jshaw/scratch/tmp/skani-test/gtdb_genomes_reps_r214/database/GCA/013/153/845/GCA_013153845.1_genomic.fna.gz	86.57	86.57	NA-NA	16.031	HIGH	NA-NA	14	0.184	65/5677	JAADDS010000044.1 MAG: Methanococci archaeon isolate L_MetaBat.10 contig-127_10238, whole genome shotgun sequence
pac_mock2_1gb.fq	/home/jshaw/scratch/tmp/skani-test/gtdb_genomes_reps_r214/database/GCF/002/269/125/GCF_002269125.1_genomic.fna.gz	86.56	86.56	NA-NA	15.540	HIGH	NA-NA	7	0.076	215/18854	NZ_NQKI01000001.1 Pseudomonas lundensis strain L1802 Pseudomonas_lundensis_L1802_Contig1, whole genome shotgun sequence
pac_mock2_1gb.fq	/home/jshaw/scratch/tmp/skani-test/gtdb_genomes_reps_r214/database/GCF/000/020/645/GCF_000020645.1_genomic.fna.gz	86.56	86.56	NA-NA	5.842	HIGH	NA-NA	5	0.062	133/11683	NC_011060.1 Pelodictyon phaeoclathratiforme BU-1, complete sequence
pac_mock2_1gb.fq	/home/jshaw/scratch/tmp/skani-test/gtdb_genomes_reps_r214/database/GCF/010/560/025/GCF_010560025.1_genomic.fna.gz	86.54	85.37	86.03-87.22	1.038	1.038	0.70-1.35	2	0.016	186/25080	NZ_SAIY01000001.1 Verrucosispora sioxanthis strain CWR15 Contig_1, whole genome shotgun sequence
pac_mock2_1gb.fq	/home/jshaw/scratch/tmp/skani-test/gtdb_genomes_reps_r214/database/GCF/008/868/175/GCF_008868175.1_genomic.fna.gz	86.54	85.90	86.10-87.06	1.531	1.531	1.12-1.89	2	0.021	229/25426	NZ_WBKT01000001.1 Micromonospora sp. AMSO31t AMSO31000001, whole genome shotgun sequence
pac_mock2_1gb.fq	/home/jshaw/scratch/tmp/skani-test/gtdb_genomes_reps_r214/database/GCF/004/348/595/GCF_004348595.1_genomic.fna.gz	86.54	85.90	86.09-87.04	1.513	1.513	1.06-1.95	2	0.021	219/24332	NZ_SMKD01000100.1 Micromonospora sp. KC723 NODE_100_length_22305_cov_32.8169, whole genome shotgun sequence
pac_mock2_1gb.fq	/home/jshaw/scratch/tmp/skani-test/gtdb_genomes_reps_r214/database/GCF/003/583/405/GCF_003583405.1_genomic.fna.gz	86.54	85.88	86.11-87.02	1.474	1.474	1.06-1.85	2	0.021	213/23854	NZ_QXEC01000001.1 Micromonospora radicis strain AZ1-13 1, whole genome shotgun sequence
pac_mock2_1gb.fq	/home/jshaw/scratch/tmp/skani-test/gtdb_genomes_reps_r214/database/GCF/008/326/345/GCF_008326345.1_genomic.fna.gz	86.53	86.02	86.09-87.07	1.686	1.686	1.05-1.91	1	0.014	98/10451	NZ_BJEN01000001.1 Cutibacterium modestum strain M12 contig01, whole genome shotgun sequence
pac_mock2_1gb.fq	/home/jshaw/scratch/tmp/skani-test/gtdb_genomes_reps_r214/database/GCF/900/089/605/GCF_900089605.1_genomic.fna.gz	86.52	85.80	86.06-87.11	1.435	1.435	1.06-1.88	2	0.020	225/25973	NZ_LT594324.1 Micromonospora narathiwatensis strain DSM 45248 chromosome I
pac_mock2_1gb.fq	/home/jshaw/scratch/tmp/skani-test/gtdb_genomes_reps_r214/database/GCA/903/970/465/GCA_903970465.1_genomic.fna.gz	86.52	86.52	NA-NA	7.020	HIGH	NA-NA	6	0.079	247/21954	CAJCIO010000001.1 Gammaproteobacteria bacterium isolate BOG_genome_mining.2 genome assembly, contig: k141_10350256, whole genome shotgun sequence
pac_mock2_1gb.fq	/home/jshaw/scratch/tmp/skani-test/gtdb_genomes_reps_r214/database/GCF/009/712/475/GCF_009712475.1_genomic.fna.gz	86.52	85.70	85.97-87.16	1.314	1.314	0.92-1.80	2	0.021	195/23345	NZ_VCJO01000010.1 Micromonospora sp. CP22 NODE_10_length_213027_cov_157.483358, whole genome shotgun sequence
pac_mock2_1gb.fq	/home/jshaw/scratch/tmp/skani-test/gtdb_genomes_reps_r214/database/GCF/000/467/105/GCF_000467105.1_genomic.fna.gz	86.51	86.51	NA-NA	11.486	HIGH	NA-NA	6	0.068	216/19260	NZ_BATI01000122.1 Pseudomonas alcaligenes NBRC 14159, whole genome shotgun sequence
pac_mock2_1gb.fq	/home/jshaw/scratch/tmp/skani-test/gtdb_genomes_reps_r214/database/GCF/903/181/435/GCF_903181435.1_genomic.fna.gz	86.51	85.26	85.77-87.11	0.988	0.988	0.72-1.26	1	0.011	138/19350	NZ_CAEUHO010000001.1 Bacteroides acidifaciens isolate NZ_B_acidifaciens_9G3_hyb, whole genome shotgun sequence
pac_mock2_1gb.fq	/home/jshaw/scratch/tmp/skani-test/gtdb_genomes_reps_r214/database/GCF/001/485/535/GCF_001485535.1_genomic.fna.gz	86.50	86.50	NA-NA	12.948	HIGH	NA-NA	13	0.145	134/11996	NZ_BCMZ01000001.1 Halobacterium sp. CBA1132, whole genome shotgun sequence
pac_mock2_1gb.fq	/home/jshaw/scratch/tmp/skani-test/gtdb_genomes_reps_r214/database/GCF/900/109/115/GCF_900109115.1_genomic.fna.gz	86.50	85.53	85.91-87.18	1.189	1.189	0.78-1.57	2	0.019	203/25826	NZ_FNYV01000029.1 Micromonospora phaseoli strain CGMCC 4.7038, whole genome shotgun sequence
pac_mock2_1gb.fq	/home/jshaw/scratch/tmp/skani-test/gtdb_genomes_reps_r214/database/GCF/900/091/585/GCF_900091585.1_genomic.fna.gz	86.50	85.74	85.98-86.98	1.398	1.398	1.05-1.83	2	0.019	211/24850	NZ_FMHT01000003.1 Micromonospora nigra strain DSM 43818, whole genome shotgun sequence
pac_mock2_1gb.fq	/home/jshaw/scratch/tmp/skani-test/gtdb_genomes_reps_r214/database/GCF/008/868/155/GCF_008868155.1_genomic.fna.gz	86.49	85.62	85.96-87.15	1.268	1.268	0.85-1.65	2	0.019	215/26447	NZ_WBKR01000001.1 Micromonospora sp. ALFpr18c PR18C000001, whole genome shotgun sequence
pac_mock2_1gb.fq	/home/jshaw/scratch/tmp/skani-test/gtdb_genomes_reps_r214/database/GCA/019/747/075/GCA_019747075.1_genomic.fna.gz	86.49	86.49	NA-NA	7.680	HIGH	NA-NA	7	0.082	128/11501	JAIERF010000308.1 MAG: Pseudomonadaceae bacterium isolate co.spades.METABAT.1kb_078 c_000000207360, whole genome shotgun sequence
pac_mock2_1gb.fq	/home/jshaw/scratch/tmp/skani-test/gtdb_genomes_reps_r214/database/GCF/001/567/585/GCF_001567585.1_genomic.fna.gz	86.49	85.28	85.94-87.04	1.000	1.000	0.74-1.38	2	0.017	212/29474	NZ_LRQV01000001.1 Micromonospora rosaria strain DSM 803 contig001, whole genome shotgun sequence
pac_mock2_1gb.fq	/home/jshaw/scratch/tmp/skani-test/gtdb_genomes_reps_r214/database/GCF/020/884/795/GCF_020884795.1_genomic.fna.gz	86.48	85.54	85.93-87.16	1.190	1.190	0.76-1.69	2	0.018	202/25616	NZ_BBZF01000001.1 Micromonospora sp. TP-A0468, whole genome shotgun sequence
pac_mock2_1gb.fq	/home/jshaw/scratch/tmp/skani-test/gtdb_genomes_reps_r214/database/GCF/014/174/475/GCF_014174475.1_genomic.fna.gz	86.48	86.48	NA-NA	12.224	HIGH	NA-NA	6	0.072	205/18515	NZ_JACJUD010000001.1 Pseudomonas ullengensis strain UL070 contig1, whole genome shotgun sequence
pac_mock2_1gb.fq	/home/jshaw/scratch/tmp/skani-test/gtdb_genomes_reps_r214/database/GCA/900/475/325/GCA_900475325.1_genomic.fna.gz	86.47	86.47	NA-NA	6.926	HIGH	NA-NA	6	0.076	258/23363	LS483371.1 Paucimonas lemoignei strain NCTC10937 genome assembly, chromosome: 1
pac_mock2_1gb.fq	/home/jshaw/scratch/tmp/skani-test/gtdb_genomes_reps_r214/database/GCF/900/589/395/GCF_900589395.1_genomic.fna.gz	86.46	86.46	NA-NA	10.059	HIGH	NA-NA	6	0.074	271/24620	NZ_UUIS01000096.1 Pseudomonas viridiflava isolate p2.C9, whole genome shotgun sequence
pac_mock2_1gb.fq	/home/jshaw/scratch/tmp/skani-test/gtdb_genomes_reps_r214/database/GCF/018/968/705/GCF_018968705.1_genomic.fna.gz	86.46	86.46	NA-NA	6.606	HIGH	NA-NA	6	0.073	254/23119	NZ_CP076668.1 Pseudomonas cichorii strain LJ2 chromosome, complete genome
pac_mock2_1gb.fq	/home/jshaw/scratch/tmp/skani-test/gtdb_genomes_reps_r214/database/GCA/016/802/835/GCA_016802835.1_genomic.fna.gz	86.45	85.75	86.04-86.93	1.444	1.444	1.04-1.90	2	0.020	207/24327	JAEVHO010000001.1 Micromonospora sp. ATA32 contig_001, whole genome shotgun sequence
pac_mock2_1gb.fq	/home/jshaw/scratch/tmp/skani-test/gtdb_genomes_reps_r214/database/GCF/003/664/255/GCF_003664255.1_genomic.fna.gz	86.45	85.91	86.18-87.00	1.692	1.692	1.19-1.92	2	0.019	277/30739	NZ_RCCV01000001.1 Micromonospora sp. M71_S20 Ga0265259_11, whole genome shotgun sequence
pac_mock2_1gb.fq	/home/jshaw/scratch/tmp/skani-test/gtdb_genomes_reps_r214/database/GCF/900/089/595/GCF_900089595.1_genomic.fna.gz	86.45	85.90	86.01-86.97	1.688	1.688	1.15-1.95	2	0.018	241/26775	NZ_LT594323.1 Micromonospora auratinigra strain DSM 44815 chromosome I
pac_mock2_1gb.fq	/home/jshaw/scratch/tmp/skani-test/gtdb_genomes_reps_r214/database/GCF/900/090/315/GCF_900090315.1_genomic.fna.gz	86.44	85.96	86.14-86.89	1.785	1.785	1.06-1.96	2	0.020	258/28128	NZ_FMHZ01000002.1 Micromonospora citrea strain DSM 43903, whole genome shotgun sequence
pac_mock2_1gb.fq	/home/jshaw/scratch/tmp/skani-test/gtdb_genomes_reps_r214/database/GCA/018/070/465/GCA_018070465.1_genomic.fna.gz	86.44	85.52	85.82-87.05	1.221	1.221	0.79-1.66	2	0.019	197/25185	JAGPXT010000001.1 Micromonospora sp. C95 C95_contig_1, whole genome shotgun sequence
