pac_mock2_1gb.fq	gtdb_genomes_reps_r214/database/GCF/907/164/555/GCF_907164555.1_genomic.fna.gz	86.89	86.69	86.74-87.24	2.418	2.418	1.73-2.65	2	0.034	752/62953	NZ_CAJQZC010000001.1 Paraburkholderia sp. LMG 31841, whole genome shotgun sequence
pac_mock2_1gb.fq	gtdb_genomes_reps_r214/database/GCF/900/100/735/GCF_900100735.1_genomic.fna.gz	86.89	86.53	86.72-87.11	2.004	2.004	1.70-2.19	2	0.030	951/84205	NZ_FNCJ01000049.1 Paraburkholderia phenazinium strain LMG 2247, whole genome shotgun sequence
pac_mock2_1gb.fq	gtdb_genomes_reps_r214/database/GCF/900/142/845/GCF_900142845.1_genomic.fna.gz	86.88	86.60	86.75-87.16	2.245	2.245	1.73-2.44	2	0.029	970/83783	NZ_FSRU01000003.1 Paraburkholderia phenazinium strain GAS95, whole genome shotgun sequence
pac_mock2_1gb.fq	gtdb_genomes_reps_r214/database/GCF/900/090/245/GCF_900090245.1_genomic.fna.gz	86.86	86.16	86.64-87.13	1.462	1.462	1.22-1.74	2	0.022	613/61985	NZ_FMDN01000064.1 Micromonospora halophytica strain DSM 43171, whole genome shotgun sequence
pac_mock2_1gb.fq	gtdb_genomes_reps_r214/database/GCF/900/090/295/GCF_900090295.1_genomic.fna.gz	86.86	86.18	86.61-87.10	1.498	1.498	1.28-1.73	2	0.021	661/66535	NZ_LT607753.1 Micromonospora coxensis strain DSM 45161 chromosome I
pac_mock2_1gb.fq	gtdb_genomes_reps_r214/database/GCF/014/334/015/GCF_014334015.1_genomic.fna.gz	86.85	86.39	86.68-88.52	1.827	1.827	0.61-1.96	2	0.018	706/65925	NZ_CP060488.1 Bacteroides sp. M10 chromosome
pac_mock2_1gb.fq	gtdb_genomes_reps_r214/database/GCA/900/596/015/GCA_900596015.1_genomic.fna.gz	86.85	86.85	NA-NA	11.744	HIGH	NA-NA	7	0.088	575/45462	UVIF01000010.1 Pseudomonas sp. 286 isolate p4.G6 genome assembly, contig: 10, whole genome shotgun sequence
pac_mock2_1gb.fq	gtdb_genomes_reps_r214/database/GCF/001/043/055/GCF_001043055.1_genomic.fna.gz	86.85	86.85	NA-NA	11.696	HIGH	NA-NA	7	0.088	599/47390	NZ_JYLF01000010.1 Pseudomonas weihenstephanensis strain DSM 29166 10_154467_40.591, whole genome shotgun sequence
pac_mock2_1gb.fq	gtdb_genomes_reps_r214/database/GCF/009/799/925/GCF_009799925.1_genomic.fna.gz	86.85	86.85	NA-NA	10.873	HIGH	NA-NA	6	0.078	537/42527	NZ_WELK01000010.1 Pseudomonas sp. R-28-1W-6 NODE_10_length_151348_cov_356.258260, whole genome shotgun sequence
pac_mock2_1gb.fq	gtdb_genomes_reps_r214/database/GCF/014/697/625/GCF_014697625.1_genomic.fna.gz	86.84	86.34	86.67-87.09	1.739	1.739	1.43-1.92	2	0.025	817/77578	NZ_JACJSG010000001.1 Anabaena azotica FACHB-119 contig1, whole genome shotgun sequence
pac_mock2_1gb.fq	gtdb_genomes_reps_r214/database/GCF/900/105/555/GCF_900105555.1_genomic.fna.gz	86.84	86.84	NA-NA	7.176	HIGH	NA-NA	7	0.090	608/48232	NZ_FNTZ01000002.1 Pseudomonas coleopterorum strain LMG 28558, whole genome shotgun sequence
pac_mock2_1gb.fq	gtdb_genomes_reps_r214/database/GCF/018/070/575/GCF_018070575.1_genomic.fna.gz	86.83	86.10	86.57-87.11	1.426	1.426	1.22-1.65	2	0.022	616/63707	NZ_JAGPXN010000001.1 Micromonospora sp. C31 C31_contig_1, whole genome shotgun sequence
pac_mock2_1gb.fq	gtdb_genomes_reps_r214/database/GCF/902/825/405/GCF_902825405.1_genomic.fna.gz	86.82	86.09	86.55-87.08	1.412	1.412	1.19-1.67	2	0.021	593/61633	NZ_CADEAU010000001.1 Micromonospora maritima isolate DSM 45782, whole genome shotgun sequence
pac_mock2_1gb.fq	gtdb_genomes_reps_r214/database/GCF/000/154/465/GCF_000154465.1_genomic.fna.gz	86.81	85.48	85.89-87.58	0.931	0.931	0.66-1.89	2	0.013	190/24642	NZ_DS499581.1 Alistipes putredinis DSM 17216 Scfld_02_11, whole genome shotgun sequence
pac_mock2_1gb.fq	gtdb_genomes_reps_r214/database/GCF/007/858/365/GCF_007858365.1_genomic.fna.gz	86.81	86.81	NA-NA	11.418	HIGH	NA-NA	7	0.085	649/52106	NZ_VFIO01000010.1 Pseudomonas saxonica strain DSM 108989 10_166467_22.3684, whole genome shotgun sequence
pac_mock2_1gb.fq	gtdb_genomes_reps_r214/database/GCF/900/091/555/GCF_900091555.1_genomic.fna.gz	86.80	86.03	86.51-87.08	1.375	1.375	1.19-1.64	2	0.021	578/61310	NZ_FMCX01000020.1 Micromonospora mirobrigensis strain DSM 44830, whole genome shotgun sequence
pac_mock2_1gb.fq	gtdb_genomes_reps_r214/database/GCF/900/475/285/GCF_900475285.1_genomic.fna.gz	86.80	86.80	NA-NA	7.000	HIGH	NA-NA	6	0.086	592/47691	NZ_LS483370.1 Pseudomonas taetrolens strain NCTC10697 chromosome 1, complete sequence
pac_mock2_1gb.fq	gtdb_genomes_reps_r214/database/GCF/900/109/755/GCF_900109755.1_genomic.fna.gz	86.80	86.80	NA-NA	9.840	HIGH	NA-NA	7	0.085	670/53981	NZ_FOAR01000077.1 Pseudomonas agarici strain LMG 2112, whole genome shotgun sequence
pac_mock2_1gb.fq	gtdb_genomes_reps_r214/database/GCF/003/626/595/GCF_003626595.1_genomic.fna.gz	86.80	86.08	86.51-87.07	1.440	1.440	1.24-1.69	2	0.022	668/69618	NZ_RBAK01000001.1 Micromonospora endolithica strain JCM 12677 contig0001, whole genome shotgun sequence
pac_mock2_1gb.fq	gtdb_genomes_reps_r214/database/GCF/003/725/545/GCF_003725545.1_genomic.fna.gz	86.79	86.18	86.48-87.05	1.567	1.567	1.33-1.80	2	0.022	591/59463	NZ_RJLN01000001.1 Micromonospora sp. PPF5-17 1, whole genome shotgun sequence
pac_mock2_1gb.fq	gtdb_genomes_reps_r214/database/GCF/900/091/565/GCF_900091565.1_genomic.fna.gz	86.78	86.01	86.50-87.03	1.376	1.376	1.14-1.63	2	0.021	558/59645	NZ_FMCV01000074.1 Micromonospora marina strain DSM 45555, whole genome shotgun sequence
pac_mock2_1gb.fq	gtdb_genomes_reps_r214/database/GCA/013/153/845/GCA_013153845.1_genomic.fna.gz	86.75	86.75	NA-NA	15.930	HIGH	NA-NA	14	0.194	171/14010	JAADDS010000044.1 MAG: Methanococci archaeon isolate L_MetaBat.10 contig-127_10238, whole genome shotgun sequence
pac_mock2_1gb.fq	gtdb_genomes_reps_r214/database/GCF/900/091/445/GCF_900091445.1_genomic.fna.gz	86.75	86.01	86.46-87.00	1.422	1.422	1.23-1.66	2	0.020	639/68357	NZ_LT607733.1 Micromonospora echinofusca strain DSM 43913 chromosome I
pac_mock2_1gb.fq	gtdb_genomes_reps_r214/database/GCF/001/294/575/GCF_001294575.1_genomic.fna.gz	86.73	86.73	NA-NA	7.128	HIGH	NA-NA	7	0.086	611/50425	NZ_CP012676.1 Pseudomonas versuta strain L10.10 chromosome, complete genome
pac_mock2_1gb.fq	gtdb_genomes_reps_r214/database/GCA/002/379/585/GCA_002379585.1_genomic.fna.gz	86.72	86.72	NA-NA	7.109	HIGH	NA-NA	7	0.084	595/49271	DFUE01000030.1 MAG TPA_asm: Pseudomonas sp. UBA4194 UBA4194_contig_100, whole genome shotgun sequence
pac_mock2_1gb.fq	gtdb_genomes_reps_r214/database/GCF/001/043/005/GCF_001043005.1_genomic.fna.gz	86.70	86.70	NA-NA	11.071	HIGH	NA-NA	6	0.081	633/52783	NZ_JYKZ01000097.1 Pseudomonas psychrophila strain DSM 17535 100_549_0.689573, whole genome shotgun sequence
pac_mock2_1gb.fq	gtdb_genomes_reps_r214/database/GCF/008/326/345/GCF_008326345.1_genomic.fna.gz	86.70	85.96	86.29-87.14	1.377	1.377	1.09-1.82	1	0.013	239/26052	NZ_BJEN01000001.1 Cutibacterium modestum strain M12 contig01, whole genome shotgun sequence
pac_mock2_1gb.fq	gtdb_genomes_reps_r214/database/GCF/016/881/005/GCF_016881005.1_genomic.fna.gz	86.70	86.70	NA-NA	11.285	HIGH	NA-NA	7	0.086	748/62400	NZ_JACOPV010000001.1 Pseudomonas arcuscaelestis strain P66 Seq1, whole genome shotgun sequence
pac_mock2_1gb.fq	gtdb_genomes_reps_r214/database/GCF/003/935/425/GCF_003935425.1_genomic.fna.gz	86.70	86.70	NA-NA	11.772	HIGH	NA-NA	7	0.086	657/54834	NZ_RHQN01000010.1 Pseudomonas sp. v388 NODE_10_length_273221_cov_45.948749, whole genome shotgun sequence
pac_mock2_1gb.fq	gtdb_genomes_reps_r214/database/GCF/903/181/435/GCF_903181435.1_genomic.fna.gz	86.70	85.38	86.29-87.16	0.954	0.954	0.73-1.12	1	0.012	359/48135	NZ_CAEUHO010000001.1 Bacteroides acidifaciens isolate NZ_B_acidifaciens_9G3_hyb, whole genome shotgun sequence
pac_mock2_1gb.fq	gtdb_genomes_reps_r214/database/GCA/900/546/645/GCA_900546645.1_genomic.fna.gz	86.70	85.48	86.11-87.48	1.011	1.011	0.64-1.42	2	0.017	217/28132	URDR01000001.1 uncultured Bacteroides sp. isolate UMGS901 genome assembly, contig: NODE_21_length_85763_cov_25.590283, whole genome shotgun sequence
pac_mock2_1gb.fq	gtdb_genomes_reps_r214/database/GCA/902/388/365/GCA_902388365.1_genomic.fna.gz	86.69	86.19	86.47-86.94	1.759	1.759	1.42-1.92	2	0.022	531/53194	CABMPB010000001.1 uncultured Bacteroides sp. isolate MGYG-HGUT-02560 genome assembly, contig: GUT_GENOME149380_1, whole genome shotgun sequence
pac_mock2_1gb.fq	gtdb_genomes_reps_r214/database/GCF/002/269/125/GCF_002269125.1_genomic.fna.gz	86.68	86.68	NA-NA	11.929	HIGH	NA-NA	7	0.083	564/47328	NZ_NQKI01000001.1 Pseudomonas lundensis strain L1802 Pseudomonas_lundensis_L1802_Contig1, whole genome shotgun sequence
pac_mock2_1gb.fq	gtdb_genomes_reps_r214/database/GCF/900/090/315/GCF_900090315.1_genomic.fna.gz	86.67	86.02	86.46-86.90	1.527	1.527	1.30-1.77	2	0.021	657/69996	NZ_FMHZ01000002.1 Micromonospora citrea strain DSM 43903, whole genome shotgun sequence
pac_mock2_1gb.fq	gtdb_genomes_reps_r214/database/GCA/021/202/525/GCA_021202525.1_genomic.fna.gz	86.66	86.66	NA-NA	4.962	HIGH	NA-NA	3	0.035	338/28606	JAJQCV010000008.1 MAG: Akkermansiaceae bacterium isolate C.9_3 NODE_1000_length_10696_cov_7.892303, whole genome shotgun sequence
pac_mock2_1gb.fq	gtdb_genomes_reps_r214/database/GCF/004/803/755/GCF_004803755.1_genomic.fna.gz	86.66	86.66	NA-NA	7.170	HIGH	NA-NA	6	0.083	676/57281	NZ_CP032311.1 Pseudomonas sp. DG56-2 chromosome, complete genome
pac_mock2_1gb.fq	gtdb_genomes_reps_r214/database/GCF/003/172/955/GCF_003172955.1_genomic.fna.gz	86.66	85.66	86.31-87.03	1.163	1.163	0.94-1.39	2	0.019	532/64435	NZ_QGKR01000085.1 Micromonospora acroterricola strain 5R2A7 NODE_100_length_21043_cov_10.0805_ID_199, whole genome shotgun sequence
pac_mock2_1gb.fq	gtdb_genomes_reps_r214/database/GCF/019/890/675/GCF_019890675.1_genomic.fna.gz	86.65	85.98	86.36-86.89	1.484	1.484	1.25-1.74	2	0.021	595/64303	NZ_JAIOAA010000001.1 Micromonospora sp. PLK6-60 1, whole genome shotgun sequence
pac_mock2_1gb.fq	gtdb_genomes_reps_r214/database/GCF/018/847/895/GCF_018847895.1_genomic.fna.gz	86.65	86.27	86.31-87.01	1.963	1.963	1.53-2.40	2	0.027	321/31306	NZ_CP072051.1 Akkermansia muciniphila strain Akk0196 chromosome, complete genome
pac_mock2_1gb.fq	gtdb_genomes_reps_r214/database/GCF/902/506/505/GCF_902506505.1_genomic.fna.gz	86.64	86.64	NA-NA	11.185	HIGH	NA-NA	6	0.074	498/42431	NZ_LR733411.1 Pseudomonas sp. 8AS isolate Pseudomonas sp. 8AS, whole genome shotgun sequence
pac_mock2_1gb.fq	gtdb_genomes_reps_r214/database/GCF/900/141/745/GCF_900141745.1_genomic.fna.gz	86.64	86.24	86.44-86.84	1.957	1.957	1.64-2.31	2	0.027	837/82364	NZ_FSRM01000002.1 Paraburkholderia phenazinium strain GAS86, whole genome shotgun sequence
pac_mock2_1gb.fq	gtdb_genomes_reps_r214/database/GCF/016/598/485/GCF_016598485.1_genomic.fna.gz	86.64	86.06	86.34-86.87	1.609	1.609	1.36-1.84	2	0.022	645/67827	NZ_JAEMUW010000100.1 Micromonospora veneta strain CAP181 100_length_957_depth_4.03x, whole genome shotgun sequence
pac_mock2_1gb.fq	gtdb_genomes_reps_r214/database/GCF/004/348/595/GCF_004348595.1_genomic.fna.gz	86.62	85.96	86.31-86.90	1.493	1.493	1.28-1.74	2	0.021	557/60716	NZ_SMKD01000100.1 Micromonospora sp. KC723 NODE_100_length_22305_cov_32.8169, whole genome shotgun sequence
pac_mock2_1gb.fq	gtdb_genomes_reps_r214/database/GCA/016/866/305/GCA_016866305.1_genomic.fna.gz	86.62	86.62	NA-NA	11.359	HIGH	NA-NA	10	0.120	259/22230	VGMX01000001.1 MAG: Chlorobi bacterium isolate M_DeepCast_65m_m2_268 M_DeepCast_65m_m2_268_Ga0194120_10000047, whole genome shotgun sequence
pac_mock2_1gb.fq	gtdb_genomes_reps_r214/database/GCF/003/857/015/GCF_003857015.1_genomic.fna.gz	86.61	85.90	86.39-86.95	1.430	1.430	1.18-1.69	2	0.021	588/65515	NZ_QGGF01000372.1 Micromonospora globispora strain S2901 NODE_100_length_17311_cov_5.61895_ID_199, whole genome shotgun sequence
pac_mock2_1gb.fq	gtdb_genomes_reps_r214/database/GCF/007/830/265/GCF_007830265.1_genomic.fna.gz	86.60	85.76	86.27-86.90	1.310	1.310	1.08-1.54	2	0.018	544/63708	NZ_VLKE01000001.1 Micromonospora olivasterospora strain DSM 43868 JD77DRAFT_unitig_0_quiver.1, whole genome shotgun sequence
pac_mock2_1gb.fq	gtdb_genomes_reps_r214/database/GCF/022/747/945/GCF_022747945.1_genomic.fna.gz	86.60	85.76	86.30-86.89	1.305	1.305	1.10-1.55	2	0.019	591/69247	NZ_JALDST010000001.1 Micromonospora sp. R77 1, whole genome shotgun sequence
pac_mock2_1gb.fq	gtdb_genomes_reps_r214/database/GCF/900/091/515/GCF_900091515.1_genomic.fna.gz	86.60	85.91	86.31-86.85	1.476	1.476	1.21-1.75	2	0.019	593/65724	NZ_LT607410.1 Micromonospora purpureochromogenes strain DSM 43821 chromosome I
pac_mock2_1gb.fq	gtdb_genomes_reps_r214/database/GCF/000/982/955/GCF_000982955.1_genomic.fna.gz	86.59	85.83	86.28-86.88	1.377	1.377	1.15-1.58	2	0.020	601/68653	NZ_KQ058649.1 Micromonospora sp. HK10 Scaffold1, whole genome shotgun sequence
pac_mock2_1gb.fq	gtdb_genomes_reps_r214/database/GCF/900/089/585/GCF_900089585.1_genomic.fna.gz	86.59	85.73	86.31-86.88	1.297	1.297	1.10-1.55	2	0.018	565/66793	NZ_FLRH01000001.1 Micromonospora sediminicola strain DSM 45794, whole genome shotgun sequence
pac_mock2_1gb.fq	gtdb_genomes_reps_r214/database/GCA/903/970/465/GCA_903970465.1_genomic.fna.gz	86.59	86.59	NA-NA	6.930	HIGH	NA-NA	6	0.080	630/54736	CAJCIO010000001.1 Gammaproteobacteria bacterium isolate BOG_genome_mining.2 genome assembly, contig: k141_10350256, whole genome shotgun sequence
pac_mock2_1gb.fq	gtdb_genomes_reps_r214/database/GCF/008/868/175/GCF_008868175.1_genomic.fna.gz	86.58	86.01	86.35-86.84	1.623	1.623	1.40-1.88	2	0.021	587/62834	NZ_WBKT01000001.1 Micromonospora sp. AMSO31t AMSO31000001, whole genome shotgun sequence
pac_mock2_1gb.fq	gtdb_genomes_reps_r214/database/GCF/900/090/305/GCF_900090305.1_genomic.fna.gz	86.56	85.89	86.25-86.83	1.498	1.498	1.25-1.77	2	0.020	544/60779	NZ_LT607751.1 Micromonospora siamensis strain DSM 45097 chromosome I
pac_mock2_1gb.fq	gtdb_genomes_reps_r214/database/GCA/018/070/465/GCA_018070465.1_genomic.fna.gz	86.56	85.65	86.26-86.93	1.224	1.224	1.01-1.48	2	0.019	516/62886	JAGPXT010000001.1 Micromonospora sp. C95 C95_contig_1, whole genome shotgun sequence
pac_mock2_1gb.fq	gtdb_genomes_reps_r214/database/GCF/000/020/645/GCF_000020645.1_genomic.fna.gz	86.55	86.55	NA-NA	6.672	HIGH	NA-NA	5	0.067	332/29188	NC_011060.1 Pelodictyon phaeoclathratiforme BU-1, complete sequence
pac_mock2_1gb.fq	gtdb_genomes_reps_r214/database/GCF/900/091/585/GCF_900091585.1_genomic.fna.gz	86.55	85.81	86.29-86.82	1.410	1.410	1.18-1.69	2	0.019	539/61944	NZ_FMHT01000003.1 Micromonospora nigra strain DSM 43818, whole genome shotgun sequence
pac_mock2_1gb.fq	gtdb_genomes_reps_r214/database/GCF/004/217/615/GCF_004217615.1_genomic.fna.gz	86.55	85.76	86.31-86.85	1.369	1.369	1.18-1.59	2	0.019	603/70452	NZ_SHLD01000001.1 Micromonospora kangleipakensis strain DSM 45612 Ga0197552_11, whole genome shotgun sequence
pac_mock2_1gb.fq	gtdb_genomes_reps_r214/database/GCF/900/089/605/GCF_900089605.1_genomic.fna.gz	86.54	85.88	86.27-86.83	1.519	1.519	1.31-1.76	2	0.020	578/64699	NZ_LT594324.1 Micromonospora narathiwatensis strain DSM 45248 chromosome I
pac_mock2_1gb.fq	gtdb_genomes_reps_r214/database/GCA/016/802/835/GCA_016802835.1_genomic.fna.gz	86.52	85.71	86.22-86.82	1.333	1.333	1.10-1.60	2	0.019	507/60378	JAEVHO010000001.1 Micromonospora sp. ATA32 contig_001, whole genome shotgun sequence
pac_mock2_1gb.fq	gtdb_genomes_reps_r214/database/GCF/003/664/255/GCF_003664255.1_genomic.fna.gz	86.52	85.79	86.24-86.79	1.442	1.442	1.25-1.70	2	0.019	659/76151	NZ_RCCV01000001.1 Micromonospora sp. M71_S20 Ga0265259_11, whole genome shotgun sequence
pac_mock2_1gb.fq	gtdb_genomes_reps_r214/database/GCF/900/089/595/GCF_900089595.1_genomic.fna.gz	86.50	85.85	86.20-86.76	1.523	1.523	1.32-1.80	2	0.019	590/66918	NZ_LT594323.1 Micromonospora auratinigra strain DSM 44815 chromosome I
pac_mock2_1gb.fq	gtdb_genomes_reps_r214/database/GCF/005/503/145/GCF_005503145.1_genomic.fna.gz	86.50	86.24	86.37-86.79	2.197	2.197	1.71-2.41	2	0.028	924/91047	NZ_SCNV01000100.1 Burkholderia sp. 4M9327F10 NODE_100_length_19147_cov_10.471262, whole genome shotgun sequence
pac_mock2_1gb.fq	gtdb_genomes_reps_r214/database/GCF/002/885/955/GCF_002885955.2_genomic.fna.gz	86.50	85.24	86.12-86.86	0.958	0.958	0.78-1.17	1	0.014	457/64591	NZ_POQS01000001.1 Achromobacter pulmonis strain ANB-1 scaffold1, whole genome shotgun sequence
pac_mock2_1gb.fq	gtdb_genomes_reps_r214/database/GCF/004/348/325/GCF_004348325.1_genomic.fna.gz	86.49	85.75	86.25-86.80	1.393	1.393	1.14-1.63	2	0.019	546/64101	NZ_SMKF01000100.1 Micromonospora sp. KC213 NODE_100_length_21637_cov_26.56, whole genome shotgun sequence
pac_mock2_1gb.fq	gtdb_genomes_reps_r214/database/GCA/005/402/585/GCA_005402585.1_genomic.fna.gz	86.49	85.72	86.21-86.80	1.375	1.375	1.15-1.61	2	0.019	597/70831	BIFP01000001.1 Micromonosporaceae bacterium KJ-029 DNA, scaffold1_cov36, whole genome shotgun sequence
pac_mock2_1gb.fq	gtdb_genomes_reps_r214/database/GCF/900/589/395/GCF_900589395.1_genomic.fna.gz	86.48	86.48	NA-NA	11.172	HIGH	NA-NA	7	0.075	682/61471	NZ_UUIS01000096.1 Pseudomonas viridiflava isolate p2.C9, whole genome shotgun sequence
pac_mock2_1gb.fq	gtdb_genomes_reps_r214/database/GCF/008/806/585/GCF_008806585.1_genomic.fna.gz	86.47	85.77	86.19-86.80	1.452	1.452	1.17-1.71	2	0.020	628/73162	NZ_WAAS01000001.1 Micromonospora sp. AMSO12t AMSO12000001, whole genome shotgun sequence
pac_mock2_1gb.fq	gtdb_genomes_reps_r214/database/GCF/009/600/315/GCF_009600315.1_genomic.fna.gz	86.47	86.47	NA-NA	11.640	HIGH	NA-NA	6	0.072	558/50551	NZ_WIWC01000100.1 Pseudomonas helleri strain FSL R10-2339 NODE_100_length_698_cov_1.523349, whole genome shotgun sequence
pac_mock2_1gb.fq	gtdb_genomes_reps_r214/database/GCF/004/348/675/GCF_004348675.1_genomic.fna.gz	86.46	85.72	86.19-86.76	1.404	1.404	1.16-1.67	2	0.019	556/65909	NZ_SMKN01000100.1 Micromonospora sp. KC606 NODE_100_length_21076_cov_17.4131, whole genome shotgun sequence
pac_mock2_1gb.fq	gtdb_genomes_reps_r214/database/GCF/900/090/285/GCF_900090285.1_genomic.fna.gz	86.45	85.83	86.19-86.72	1.569	1.569	1.30-1.87	2	0.019	576/65709	NZ_LT607754.1 Micromonospora inositola strain DSM 43819 chromosome I
pac_mock2_1gb.fq	gtdb_genomes_reps_r214/database/GCF/003/205/495/GCF_003205495.1_genomic.fna.gz	86.45	86.45	NA-NA	11.667	HIGH	NA-NA	6	0.069	436/39803	NZ_QJRX01000010.1 Pseudomonas alcaligenes strain MB-090714 NODE_10_length_137625_cov_35.650475, whole genome shotgun sequence
pac_mock2_1gb.fq	gtdb_genomes_reps_r214/database/GCF/900/091/545/GCF_900091545.1_genomic.fna.gz	86.44	85.65	86.12-86.76	1.360	1.360	1.15-1.56	2	0.018	564/68643	NZ_LT607411.1 Micromonospora viridifaciens strain DSM 43909 chromosome I
pac_mock2_1gb.fq	gtdb_genomes_reps_r214/database/GCF/900/091/475/GCF_900091475.1_genomic.fna.gz	86.44	85.73	86.14-86.73	1.454	1.454	1.19-1.72	2	0.018	556/65771	NZ_FMIB01000002.1 Micromonospora chersina strain DSM 44151, whole genome shotgun sequence
pac_mock2_1gb.fq	gtdb_genomes_reps_r214/database/GCA/903/901/395/GCA_903901395.1_genomic.fna.gz	86.43	86.43	NA-NA	5.781	HIGH	NA-NA	5	0.059	270/24792	CAIUQW010000001.1 uncultured Chlorobiales bacterium isolate LaPlata-15m-a_bin-602 genome assembly, contig: bin-602:001/457, whole genome shotgun sequence
pac_mock2_1gb.fq	gtdb_genomes_reps_r214/database/GCA/900/112/325/GCA_900112325.1_genomic.fna.gz	86.42	85.68	86.16-86.68	1.407	1.407	1.16-1.67	2	0.019	532/64049	FOLJ01000034.1 Verrucosispora sediminis strain CGMCC 4.3550 genome assembly, contig: Ga0079915_134, whole genome shotgun sequence
pac_mock2_1gb.fq	gtdb_genomes_reps_r214/database/GCF/014/648/395/GCF_014648395.1_genomic.fna.gz	86.40	85.77	86.13-86.64	1.536	1.536	1.28-1.79	2	0.019	593/69063	NZ_BMRA01000001.1 Micromonospora fulviviridis strain JCM 3259 sequence01, whole genome shotgun sequence
pac_mock2_1gb.fq	gtdb_genomes_reps_r214/database/GCF/012/726/175/GCF_012726175.1_genomic.fna.gz	86.40	85.61	86.00-86.79	1.343	1.343	1.03-1.65	2	0.020	411/50759	NZ_JAASAD010000001.1 Micromonospora sp. HNM0581 HNM0581, whole genome shotgun sequence
pac_mock2_1gb.fq	gtdb_genomes_reps_r214/database/GCF/019/697/375/GCF_019697375.1_genomic.fna.gz	86.40	85.37	86.08-86.73	1.143	1.143	0.94-1.37	2	0.016	503/67815	NZ_JAHCDI010000001.1 Micromonospora tarapacensis strain Llam7 contig_1, whole genome shotgun sequence
pac_mock2_1gb.fq	gtdb_genomes_reps_r214/database/GCF/002/210/435/GCF_002210435.1_genomic.fna.gz	86.40	85.45	86.05-86.72	1.203	1.203	0.98-1.44	2	0.017	574/75028	NZ_MZMV01000001.1 Micromonospora wenchangensis strain CCTCC AA 2012002 contig001, whole genome shotgun sequence
pac_mock2_1gb.fq	gtdb_genomes_reps_r214/database/GCF/024/807/945/GCF_024807945.1_genomic.fna.gz	86.39	86.39	NA-NA	8.862	HIGH	NA-NA	6	0.073	791/73701	NZ_JANUFD010000001.1 Pseudomonas sp. JUb42 Ga0480632_01, whole genome shotgun sequence
pac_mock2_1gb.fq	gtdb_genomes_reps_r214/database/GCF/900/090/105/GCF_900090105.1_genomic.fna.gz	86.39	85.73	86.10-86.67	1.510	1.510	1.26-1.80	2	0.019	558/65960	NZ_FMDM01000037.1 Micromonospora humi strain DSM 45647, whole genome shotgun sequence
pac_mock2_1gb.fq	gtdb_genomes_reps_r214/database/GCF/020/515/695/GCF_020515695.1_genomic.fna.gz	86.38	86.38	NA-NA	10.967	HIGH	NA-NA	7	0.075	701/65511	NZ_JAIWJA010000010.1 Pseudomonas sp. MWU16-30317 NODE_10_length_260848_cov_139.302, whole genome shotgun sequence
pac_mock2_1gb.fq	gtdb_genomes_reps_r214/database/GCF/900/590/755/GCF_900590755.1_genomic.fna.gz	86.38	86.38	NA-NA	11.362	HIGH	NA-NA	7	0.074	619/57893	NZ_UUOC01000052.1 Pseudomonas viridiflava isolate p4.B4, whole genome shotgun sequence
pac_mock2_1gb.fq	gtdb_genomes_reps_r214/database/GCF/009/712/475/GCF_009712475.1_genomic.fna.gz	86.38	85.72	86.11-86.71	1.500	1.500	1.23-1.80	2	0.020	493/58418	NZ_VCJO01000010.1 Micromonospora sp. CP22 NODE_10_length_213027_cov_157.483358, whole genome shotgun sequence
pac_mock2_1gb.fq	gtdb_genomes_reps_r214/database/GCF/003/583/405/GCF_003583405.1_genomic.fna.gz	86.36	85.79	86.07-86.67	1.609	1.609	1.31-1.89	2	0.021	515/59562	NZ_QXEC01000001.1 Micromonospora radicis strain AZ1-13 1, whole genome shotgun sequence
pac_mock2_1gb.fq	gtdb_genomes_reps_r214/database/GCF/001/485/535/GCF_001485535.1_genomic.fna.gz	86.36	86.36	NA-NA	13.632	HIGH	NA-NA	13	0.138	318/29943	NZ_BCMZ01000001.1 Halobacterium sp. CBA1132, whole genome shotgun sequence
pac_mock2_1gb.fq	gtdb_genomes_reps_r214/database/GCF/023/896/955/GCF_023896955.1_genomic.fna.gz	86.36	85.49	86.05-86.68	1.269	1.269	1.02-1.55	2	0.018	536/69068	NZ_JAMHIW010000001.1 Micromonospora sp. RHAY321 1, whole genome shotgun sequence
pac_mock2_1gb.fq	gtdb_genomes_reps_r214/database/GCF/003/131/185/GCF_003131185.1_genomic.fna.gz	86.36	86.36	NA-NA	10.402	HIGH	NA-NA	7	0.071	676/63754	NZ_QFFU01000001.1 Pseudomonas ovata strain F51 Scaffold1, whole genome shotgun sequence
pac_mock2_1gb.fq	gtdb_genomes_reps_r214/database/GCF/003/236/305/GCF_003236305.1_genomic.fna.gz	86.36	85.56	86.05-86.67	1.337	1.337	1.09-1.59	2	0.018	513/64590	NZ_POTX01000100.1 Micromonospora endophytica (Xie et al. 2001) Li et al. 2019 strain DSM 45430 NODE_100_length_19740_cov_33.5537, whole genome shotgun sequence
pac_mock2_1gb.fq	gtdb_genomes_reps_r214/database/GCA/900/475/325/GCA_900475325.1_genomic.fna.gz	86.36	86.36	NA-NA	6.977	HIGH	NA-NA	6	0.074	618/58350	LS483371.1 Paucimonas lemoignei strain NCTC10937 genome assembly, chromosome: 1
pac_mock2_1gb.fq	gtdb_genomes_reps_r214/database/GCF/000/282/975/GCF_000282975.1_genomic.fna.gz	86.34	86.34	NA-NA	12.073	HIGH	NA-NA	7	0.073	546/51861	NZ_ALJC01000001.1 Pseudomonas psychrophila HA-4 contig000001, whole genome shotgun sequence
pac_mock2_1gb.fq	gtdb_genomes_reps_r214/database/GCF/000/467/105/GCF_000467105.1_genomic.fna.gz	86.33	86.33	NA-NA	10.497	HIGH	NA-NA	6	0.065	505/48044	NZ_BATI01000122.1 Pseudomonas alcaligenes NBRC 14159, whole genome shotgun sequence
pac_mock2_1gb.fq	gtdb_genomes_reps_r214/database/GCF/018/398/425/GCF_018398425.1_genomic.fna.gz	86.33	86.33	NA-NA	6.330	HIGH	NA-NA	6	0.066	470/44752	NZ_JADPMV010000001.1 Pseudomonas lalucatii strain R1b54 1, whole genome shotgun sequence
pac_mock2_1gb.fq	gtdb_genomes_reps_r214/database/GCF/900/091/425/GCF_900091425.1_genomic.fna.gz	86.33	85.52	86.01-86.63	1.346	1.346	1.15-1.64	2	0.017	547/69744	NZ_LT598496.1 Micromonospora krabiensis strain DSM 45344 chromosome I
pac_mock2_1gb.fq	gtdb_genomes_reps_r214/database/GCF/008/041/835/GCF_008041835.1_genomic.fna.gz	86.33	86.33	NA-NA	10.992	HIGH	NA-NA	6	0.061	492/46957	NZ_VRYE01000001.1 Pseudomonas mendocina strain EF27 EF27-1, whole genome shotgun sequence
pac_mock2_1gb.fq	gtdb_genomes_reps_r214/database/GCF/003/605/735/GCF_003605735.1_genomic.fna.gz	86.33	86.33	NA-NA	10.914	HIGH	NA-NA	7	0.077	718/68531	NZ_QXTJ01000021.1 Pseudomonas sp. LS-2 Contig1, whole genome shotgun sequence
pac_mock2_1gb.fq	gtdb_genomes_reps_r214/database/GCF/014/164/785/GCF_014164785.1_genomic.fna.gz	86.32	86.32	NA-NA	12.218	HIGH	NA-NA	6	0.067	445/42547	NZ_JACJFN010000001.1 Pseudomonas guryensis strain SR9 contig1, whole genome shotgun sequence
pac_mock2_1gb.fq	gtdb_genomes_reps_r214/database/GCF/020/884/795/GCF_020884795.1_genomic.fna.gz	86.32	85.68	86.03-86.61	1.529	1.529	1.25-1.83	2	0.019	533/64171	NZ_BBZF01000001.1 Micromonospora sp. TP-A0468, whole genome shotgun sequence
pac_mock2_1gb.fq	gtdb_genomes_reps_r214/database/GCF/019/457/475/GCF_019457475.1_genomic.fna.gz	86.31	86.31	NA-NA	12.663	HIGH	NA-NA	12	0.130	424/40679	NZ_CP080413.1 Shewanella sp. FJAT-51860 chromosome, complete genome
pac_mock2_1gb.fq	gtdb_genomes_reps_r214/database/GCF/013/694/245/GCF_013694245.1_genomic.fna.gz	86.31	85.56	85.95-86.61	1.403	1.403	1.18-1.71	2	0.017	521/65610	NZ_CP059322.1 Micromonospora ferruginea strain 28ISP2-46 chromosome
pac_mock2_1gb.fq	gtdb_genomes_reps_r214/database/GCF/003/172/935/GCF_003172935.1_genomic.fna.gz	86.31	85.64	86.04-86.60	1.491	1.491	1.27-1.71	2	0.019	631/77097	NZ_QGKS01000275.1 Micromonospora sp. 4G51 NODE_100_length_24008_cov_12.575_ID_199, whole genome shotgun sequence
pac_mock2_1gb.fq	gtdb_genomes_reps_r214/database/GCF/002/192/695/GCF_002192695.1_genomic.fna.gz	86.31	85.82	86.14-86.76	1.685	1.685	1.10-1.87	2	0.018	629/72077	NZ_MTLG01000001.1 Achromobacter xylosoxidans strain B_1 Cont1, whole genome shotgun sequence
pac_mock2_1gb.fq	gtdb_genomes_reps_r214/database/GCF/900/091/625/GCF_900091625.1_genomic.fna.gz	86.30	85.61	86.02-86.59	1.469	1.469	1.25-1.74	2	0.017	587/72635	NZ_FMIC01000002.1 Micromonospora peucetia strain DSM 43363, whole genome shotgun sequence
