pac_mock2_1gb.fq	gtdb_genomes_reps_r214/database/GCF/023/283/485/GCF_023283485.1_genomic.fna.gz	91.28	91.28	NA-NA	22.930	HIGH	NA-NA	12	0.599	2406/40676	NZ_JAKILU010000001.1 Shewanella glacialipiscicola strain LMG 23744 contig00001, whole genome shotgun sequence
pac_mock2_1gb.fq	gtdb_genomes_reps_r214/database/GCF/009/391/885/GCF_009391885.1_genomic.fna.gz	91.28	91.28	NA-NA	6.428	HIGH	NA-NA	6	0.378	3566/60341	NZ_VZII01000072.1 Pseudomonas sp. MN1F NODE_101_length_9848_cov_249.688263, whole genome shotgun sequence
pac_mock2_1gb.fq	gtdb_genomes_reps_r214/database/GCF/013/522/705/GCF_013522705.1_genomic.fna.gz	91.28	91.28	NA-NA	7.802	HIGH	NA-NA	7	0.408	3373/57081	NZ_JAAMRE010000010.1 Pseudomonas lurida strain 114A4 NODE_10_length_145587_cov_69.296783, whole genome shotgun sequence
pac_mock2_1gb.fq	gtdb_genomes_reps_r214/database/GCF/900/120/335/GCF_900120335.1_genomic.fna.gz	91.28	87.84	90.55-91.85	0.353	0.353	0.28-0.47	1	0.023	291/16185	NZ_LT635477.1 Helicobacter pylori isolate HE147/09 chromosome I
pac_mock2_1gb.fq	gtdb_genomes_reps_r214/database/GCF/023/518/235/GCF_023518235.1_genomic.fna.gz	91.25	86.99	90.82-91.95	0.249	0.249	0.19-0.30	1	0.017	629/47265	NZ_CP090423.1 Stenotrophomonas maltophilia strain GYH chromosome, complete genome
pac_mock2_1gb.fq	gtdb_genomes_reps_r214/database/GCF/000/601/455/GCF_000601455.1_genomic.fna.gz	91.25	85.72	90.10-92.63	0.144	0.144	0.09-0.21	1	0.009	238/28265	NZ_AZQP01000001.1 Fervidicella metallireducens AeB contig00001, whole genome shotgun sequence
pac_mock2_1gb.fq	gtdb_genomes_reps_r214/database/GCF/009/932/375/GCF_009932375.1_genomic.fna.gz	91.25	91.25	NA-NA	7.688	HIGH	NA-NA	6	0.370	3303/56473	NZ_BLJG01000001.1 Pseudomonas juntendi strain BML3 BML3_contig_1, whole genome shotgun sequence
pac_mock2_1gb.fq	gtdb_genomes_reps_r214/database/GCF/000/263/715/GCF_000263715.2_genomic.fna.gz	91.24	91.24	NA-NA	6.887	HIGH	NA-NA	6	0.399	3603/61895	NZ_CM001514.1 Pseudomonas synxantha BG33R chromosome, whole genome shotgun sequence
pac_mock2_1gb.fq	gtdb_genomes_reps_r214/database/GCF/001/439/805/GCF_001439805.1_genomic.fna.gz	91.23	91.23	NA-NA	7.953	HIGH	NA-NA	7	0.401	3201/55046	NZ_JYLK01000010.1 Pseudomonas trivialis strain DSM 14937 10_195706_32.184, whole genome shotgun sequence
pac_mock2_1gb.fq	gtdb_genomes_reps_r214/database/GCF/001/439/785/GCF_001439785.1_genomic.fna.gz	91.22	91.22	NA-NA	7.582	HIGH	NA-NA	6	0.385	3363/58125	NZ_JYLI01000010.1 Pseudomonas poae strain DSM 14936 10_225749_36.7331, whole genome shotgun sequence
pac_mock2_1gb.fq	gtdb_genomes_reps_r214/database/GCF/000/368/965/GCF_000368965.1_genomic.fna.gz	91.19	85.43	90.24-92.82	0.138	0.138	0.08-0.18	1	0.008	296/39073	NZ_KB849778.1 Acinetobacter calcoaceticus DSM 30006 = CIP 81.8 acLsb-supercont1.1, whole genome shotgun sequence
pac_mock2_1gb.fq	gtdb_genomes_reps_r214/database/GCA/017/744/435/GCA_017744435.1_genomic.fna.gz	91.19	91.19	NA-NA	7.000	HIGH	NA-NA	6	0.363	3201/55918	JAGIBG010000010.1 Pseudomonas sp. isolate BIN42 scaffold10_cov0, whole genome shotgun sequence
pac_mock2_1gb.fq	gtdb_genomes_reps_r214/database/GCF/003/002/025/GCF_003002025.1_genomic.fna.gz	91.18	90.87	91.10-91.28	2.206	2.206	2.02-2.36	2	0.130	4449/86646	NZ_PVZB01000001.1 Paraburkholderia sp. BL25I1N1 Ga0139058_101, whole genome shotgun sequence
pac_mock2_1gb.fq	gtdb_genomes_reps_r214/database/GCF/000/196/795/GCF_000196795.1_genomic.fna.gz	91.17	86.08	90.28-92.12	0.180	0.180	0.13-0.25	1	0.011	394/41039	NC_014259.1 Acinetobacter oleivorans DR1, complete sequence
pac_mock2_1gb.fq	gtdb_genomes_reps_r214/database/GCF/019/145/205/GCF_019145205.1_genomic.fna.gz	91.17	91.17	NA-NA	7.687	HIGH	NA-NA	6	0.390	3611/63444	NZ_JAHSTT010000001.1 Pseudomonas khavaziana strain SWRI124 1, whole genome shotgun sequence
pac_mock2_1gb.fq	gtdb_genomes_reps_r214/database/GCF/013/464/485/GCF_013464485.1_genomic.fna.gz	91.15	87.35	90.62-91.81	0.298	0.298	0.24-0.36	1	0.020	735/48704	NZ_RAUX01000001.1 Stenotrophomonas maltophilia strain E77 sm-E77_lib12335_1, whole genome shotgun sequence
pac_mock2_1gb.fq	gtdb_genomes_reps_r214/database/GCA/900/762/515/GCA_900762515.1_genomic.fna.gz	91.14	90.52	90.97-91.28	1.608	1.608	1.47-1.71	2	0.096	2327/51077	CAAFHA010000001.1 TPA_asm: uncultured Odoribacter sp., isolate HGM05329, WGS project CAAFHA010000000 data, contig: SRS144506_36_k99_68, whole genome shotgun sequence
pac_mock2_1gb.fq	gtdb_genomes_reps_r214/database/GCF/004/684/085/GCF_004684085.1_genomic.fna.gz	91.13	87.27	90.63-91.71	0.292	0.292	0.24-0.35	1	0.018	672/45706	NZ_SRHZ01000001.1 Stenotrophomonas maltophilia strain D5.1 Contig_1, whole genome shotgun sequence
pac_mock2_1gb.fq	gtdb_genomes_reps_r214/database/GCF/002/571/225/GCF_002571225.1_genomic.fna.gz	91.11	85.01	90.27-92.10	0.118	0.118	0.09-0.16	1	0.007	370/56855	NZ_NVEC01000100.1 Bacillus sp. AFS059628 AFS059628_102_B4_Contig100_140514, whole genome shotgun sequence
pac_mock2_1gb.fq	gtdb_genomes_reps_r214/database/GCF/000/010/425/GCF_000010425.1_genomic.fna.gz	91.10	91.10	NA-NA	1.021	LOW	NA-NA	1	0.056	1136/20398	NC_008618.1 Bifidobacterium adolescentis ATCC 15703, complete sequence
pac_mock2_1gb.fq	gtdb_genomes_reps_r214/database/GCF/900/105/675/GCF_900105675.1_genomic.fna.gz	91.10	91.10	NA-NA	6.861	HIGH	NA-NA	6	0.378	3744/67309	NZ_LT629786.1 Pseudomonas synxantha strain LMG 2190 chromosome I
pac_mock2_1gb.fq	gtdb_genomes_reps_r214/database/GCF/004/519/405/GCF_004519405.1_genomic.fna.gz	91.10	91.10	NA-NA	7.672	HIGH	NA-NA	6	0.374	3508/63094	NZ_SGWI01000001.1 Pseudomonas sp. BCA17 strain BCA-17 1, whole genome shotgun sequence
pac_mock2_1gb.fq	gtdb_genomes_reps_r214/database/GCA/001/067/655/GCA_001067655.1_genomic.fna.gz	91.10	85.25	89.94-92.74	0.125	0.125	0.06-0.18	1	0.009	192/27004	JUNU01000302.1 Neisseria lactamica strain 919_NLAC 1000_2721_45213, whole genome shotgun sequence
pac_mock2_1gb.fq	gtdb_genomes_reps_r214/database/GCF/002/112/505/GCF_002112505.1_genomic.fna.gz	91.09	91.09	NA-NA	7.419	HIGH	NA-NA	6	0.348	3286/59280	NZ_NEHW01000001.1 Pseudomonas sp. R28(2017) R28_1, whole genome shotgun sequence
pac_mock2_1gb.fq	gtdb_genomes_reps_r214/database/GCF/001/320/245/GCF_001320245.1_genomic.fna.gz	91.08	91.08	NA-NA	7.518	HIGH	NA-NA	6	0.347	3353/60674	NZ_BCBA01000001.1 Pseudomonas sp. NBRC 111124, whole genome shotgun sequence
pac_mock2_1gb.fq	gtdb_genomes_reps_r214/database/GCF/900/156/405/GCF_900156405.1_genomic.fna.gz	91.08	91.08	NA-NA	12.463	HIGH	NA-NA	10	0.546	2282/41392	NZ_FTNN01000032.1 Shewanella morhuae strain ATCC BAA-1205, whole genome shotgun sequence
pac_mock2_1gb.fq	gtdb_genomes_reps_r214/database/GCF/000/476/275/GCF_000476275.1_genomic.fna.gz	91.06	87.74	90.22-91.64	0.361	0.361	0.29-0.47	1	0.022	281/16218	NZ_CBOM010000001.1 Helicobacter pylori SA213A, whole genome shotgun sequence
pac_mock2_1gb.fq	gtdb_genomes_reps_r214/database/GCF/000/313/935/GCF_000313935.1_genomic.fna.gz	91.06	86.17	90.13-91.80	0.191	0.191	0.15-0.27	1	0.012	379/38222	NZ_AMSS01000001.1 Acinetobacter sp. WC-141 ctg7180000006320, whole genome shotgun sequence
pac_mock2_1gb.fq	gtdb_genomes_reps_r214/database/GCF/000/368/065/GCF_000368065.1_genomic.fna.gz	91.04	87.18	90.52-91.63	0.295	0.295	0.23-0.34	1	0.017	574/40416	NZ_KB851195.1 Acinetobacter seifertii strain NIPH 973 acMai-supercont1.1, whole genome shotgun sequence
pac_mock2_1gb.fq	gtdb_genomes_reps_r214/database/GCF/012/689/525/GCF_012689525.1_genomic.fna.gz	91.03	90.73	90.92-91.15	2.253	2.253	1.97-2.42	2	0.122	5016/102391	NZ_CP051514.1 Paraburkholderia aromaticivorans strain AR20-38 chromosome 1, complete sequence
pac_mock2_1gb.fq	gtdb_genomes_reps_r214/database/GCF/000/493/815/GCF_000493815.1_genomic.fna.gz	90.97	90.97	NA-NA	6.951	HIGH	NA-NA	5	0.266	1313/24645	NZ_AXUR01000001.1 Fusobacterium nucleatum W1481 Contig1, whole genome shotgun sequence
pac_mock2_1gb.fq	gtdb_genomes_reps_r214/database/GCF/021/602/585/GCF_021602585.1_genomic.fna.gz	90.97	90.97	NA-NA	7.341	HIGH	NA-NA	6	0.335	3086/57948	NZ_BQIP01000001.1 Pseudomonas faucium strain BML-PP048 sequence01, whole genome shotgun sequence
pac_mock2_1gb.fq	gtdb_genomes_reps_r214/database/GCF/003/097/235/GCF_003097235.1_genomic.fna.gz	90.97	90.97	NA-NA	6.704	HIGH	NA-NA	6	0.339	3249/61049	NZ_QEQQ01000001.1 Pseudomonas sp. CC120222-01a N430DRAFT_scaffold00001.1, whole genome shotgun sequence
pac_mock2_1gb.fq	gtdb_genomes_reps_r214/database/GCA/024/349/685/GCA_024349685.1_genomic.fna.gz	90.97	90.97	NA-NA	6.380	HIGH	NA-NA	6	0.339	3112/58522	AP025944.1 Pseudomonas sp. LRP2-20 DNA, complete genome
pac_mock2_1gb.fq	gtdb_genomes_reps_r214/database/GCF/007/858/255/GCF_007858255.1_genomic.fna.gz	90.96	90.96	NA-NA	7.761	HIGH	NA-NA	6	0.362	3307/62299	NZ_VFEU01000010.1 Pseudomonas rhodesiae strain DSM 14020 10_202291_35.0929, whole genome shotgun sequence
pac_mock2_1gb.fq	gtdb_genomes_reps_r214/database/GCF/009/883/635/GCF_009883635.2_genomic.fna.gz	90.95	90.95	NA-NA	6.414	HIGH	NA-NA	6	0.338	3230/61087	NZ_CP026115.2 Pseudomonas putida strain W5 chromosome, complete genome
pac_mock2_1gb.fq	gtdb_genomes_reps_r214/database/GCF/000/217/915/GCF_000217915.1_genomic.fna.gz	90.94	90.94	NA-NA	10.526	HIGH	NA-NA	10	0.539	2312/43876	NZ_AFOZ01000047.1 Shewanella sp. HN-41 44_47, whole genome shotgun sequence
pac_mock2_1gb.fq	gtdb_genomes_reps_r214/database/GCF/009/296/165/GCF_009296165.1_genomic.fna.gz	90.90	90.90	NA-NA	7.862	HIGH	NA-NA	6	0.355	2988/57502	NZ_VUAZ01000001.1 Pseudomonas kitaguniensis strain MAFF 212408 MAFF212408_contig_1, whole genome shotgun sequence
pac_mock2_1gb.fq	gtdb_genomes_reps_r214/database/GCF/022/627/325/GCF_022627325.1_genomic.fna.gz	90.87	90.87	NA-NA	7.586	HIGH	NA-NA	6	0.322	2859/55572	NZ_JAETZZ010000001.1 Pseudomonas putida strain HAI-2 contig1, whole genome shotgun sequence
pac_mock2_1gb.fq	gtdb_genomes_reps_r214/database/GCF/011/067/105/GCF_011067105.1_genomic.fna.gz	90.85	89.42	90.54-91.07	0.922	0.922	0.83-1.06	1	0.052	1027/32928	NZ_CP049357.1 Deinococcus wulumuqiensis R12 chromosome, complete genome
pac_mock2_1gb.fq	gtdb_genomes_reps_r214/database/GCF/014/269/035/GCF_014269035.2_genomic.fna.gz	90.84	90.84	NA-NA	7.651	HIGH	NA-NA	6	0.319	2837/55688	NZ_JABWRP020000001.1 Pseudomonas vlassakiae strain RW4S2 1, whole genome shotgun sequence
pac_mock2_1gb.fq	gtdb_genomes_reps_r214/database/GCF/900/520/355/GCF_900520355.1_genomic.fna.gz	90.83	85.31	89.90-91.84	0.151	0.151	0.10-0.21	1	0.008	279/38440	NZ_LS999521.1 Acinetobacter calcoaceticus isolate Acinetobacter calcoaceticus str. 2117 chromosome 1, complete sequence
pac_mock2_1gb.fq	gtdb_genomes_reps_r214/database/GCF/000/730/665/GCF_000730665.1_genomic.fna.gz	90.83	90.83	NA-NA	7.732	HIGH	NA-NA	6	0.318	2680/52881	NZ_BBIV01000097.1 Pseudomonas plecoglossicida NBRC 103162 = DSM 15088 strain NBRC 103162, whole genome shotgun sequence
pac_mock2_1gb.fq	gtdb_genomes_reps_r214/database/GCF/002/025/705/GCF_002025705.1_genomic.fna.gz	90.80	90.80	NA-NA	6.359	HIGH	NA-NA	6	0.319	3009/59847	NZ_CP018846.1 Pseudomonas putida strain AA7 chromosome, complete genome
pac_mock2_1gb.fq	gtdb_genomes_reps_r214/database/GCF/022/749/515/GCF_022749515.1_genomic.fna.gz	90.80	85.05	89.59-92.73	0.134	0.134	0.07-0.21	1	0.009	155/23459	NZ_CP094242.1 Morococcus cerebrosus strain CIP 81.93 chromosome, complete genome
pac_mock2_1gb.fq	gtdb_genomes_reps_r214/database/GCF/000/282/535/GCF_000282535.1_genomic.fna.gz	90.79	90.79	NA-NA	7.543	HIGH	NA-NA	6	0.317	2893/57744	NZ_AKJC01000001.1 Pseudomonas sp. GM84 PMI38_contig2.2, whole genome shotgun sequence
pac_mock2_1gb.fq	gtdb_genomes_reps_r214/database/GCF/003/637/685/GCF_003637685.1_genomic.fna.gz	90.79	87.89	90.17-91.35	0.432	0.432	0.34-0.53	1	0.023	285/15609	NZ_MVWW01000001.1 Helicobacter pylori strain HP12002 Contig_1, whole genome shotgun sequence
pac_mock2_1gb.fq	gtdb_genomes_reps_r214/database/GCF/000/687/755/GCF_000687755.1_genomic.fna.gz	90.79	89.34	90.28-91.25	0.881	0.881	0.69-1.12	2	0.089	478/15731	NZ_JHXN01000001.1 Taylorella asinigenitalis ATCC 700933 T432DRAFT_scaffold00001.1_C, whole genome shotgun sequence
pac_mock2_1gb.fq	gtdb_genomes_reps_r214/database/GCF/023/920/705/GCF_023920705.1_genomic.fna.gz	90.79	85.62	89.78-91.97	0.174	0.174	0.12-0.25	1	0.010	331/40680	NZ_CP094657.1 Acinetobacter sp. XS-4 chromosome, complete genome
pac_mock2_1gb.fq	gtdb_genomes_reps_r214/database/GCF/003/044/425/GCF_003044425.1_genomic.fna.gz	90.77	85.50	89.71-92.56	0.154	0.154	0.08-0.23	1	0.009	188/24176	NZ_POWW01000001.1 Neisseria sicca strain C2007003584 C2007003584_S11_ctg_1424, whole genome shotgun sequence
pac_mock2_1gb.fq	gtdb_genomes_reps_r214/database/GCF/000/731/675/GCF_000731675.1_genomic.fna.gz	90.77	90.77	NA-NA	6.302	HIGH	NA-NA	6	0.313	2903/58431	NZ_JMIT01000001.1 Pseudomonas capeferrum strain WCS358 WCS358-Sc1, whole genome shotgun sequence
pac_mock2_1gb.fq	gtdb_genomes_reps_r214/database/GCF/013/386/765/GCF_013386765.1_genomic.fna.gz	90.76	90.76	NA-NA	7.812	HIGH	NA-NA	7	0.341	3473/70188	NZ_JACARE010000001.1 Pseudomonas yamanorum strain IPO3780 IPO_3780_S49_L003_contig_1, whole genome shotgun sequence
pac_mock2_1gb.fq	gtdb_genomes_reps_r214/database/GCF/016/406/325/GCF_016406325.1_genomic.fna.gz	90.73	90.73	NA-NA	10.898	HIGH	NA-NA	10	0.519	2118/43188	NZ_CP066370.1 Shewanella putrefaciens strain ATCC 8071 chromosome, complete genome
pac_mock2_1gb.fq	gtdb_genomes_reps_r214/database/GCF/000/145/215/GCF_000145215.1_genomic.fna.gz	90.73	90.73	NA-NA	19.384	HIGH	NA-NA	17	0.706	1171/23913	NC_014392.1 Caldicellulosiruptor obsidiansis OB47, complete sequence
pac_mock2_1gb.fq	gtdb_genomes_reps_r214/database/GCF/014/269/205/GCF_014269205.2_genomic.fna.gz	90.71	90.71	NA-NA	6.421	HIGH	NA-NA	6	0.308	2938/60398	NZ_JABWRY020000001.1 Pseudomonas kermanshahensis strain SWRI100 1, whole genome shotgun sequence
pac_mock2_1gb.fq	gtdb_genomes_reps_r214/database/GCF/003/044/445/GCF_003044445.1_genomic.fna.gz	90.69	85.46	89.28-92.66	0.157	0.157	0.08-0.26	1	0.009	183/23846	NZ_POWX01000001.1 Neisseria mucosa strain C2008000159 C2008000159_S12_ctg_3077, whole genome shotgun sequence
pac_mock2_1gb.fq	gtdb_genomes_reps_r214/database/GCF/016/406/145/GCF_016406145.1_genomic.fna.gz	90.68	90.68	NA-NA	6.476	HIGH	NA-NA	6	0.311	2751/57045	NZ_CP066306.1 Pseudomonas putida strain BR-PH17 chromosome, complete genome
pac_mock2_1gb.fq	gtdb_genomes_reps_r214/database/GCF/002/874/965/GCF_002874965.1_genomic.fna.gz	90.68	90.68	NA-NA	6.965	HIGH	NA-NA	6	0.332	3269/67895	NZ_CP025624.1 Pseudomonas sp. NC02 chromosome, complete genome
pac_mock2_1gb.fq	gtdb_genomes_reps_r214/database/GCF/000/235/465/GCF_000235465.1_genomic.fna.gz	90.68	90.68	NA-NA	6.296	HIGH	NA-NA	5	0.267	993/20640	NZ_JH378894.1 Fusobacterium sp. oral taxon 370 str. F0437 Scfld2, whole genome shotgun sequence
pac_mock2_1gb.fq	gtdb_genomes_reps_r214/database/GCF/002/204/795/GCF_002204795.1_genomic.fna.gz	90.66	90.66	NA-NA	7.848	HIGH	NA-NA	6	0.328	3141/65658	NZ_NIXO01000001.1 Pseudomonas sp. K2I15 contig001, whole genome shotgun sequence
pac_mock2_1gb.fq	gtdb_genomes_reps_r214/database/GCA/000/227/275/GCA_000227275.1_genomic.fna.gz	90.65	85.11	89.23-92.30	0.137	0.137	0.07-0.22	1	0.008	175/25954	JH164964.1 Neisseria sp. GT4A_CT1 genomic scaffold supercont1.1, whole genome shotgun sequence
pac_mock2_1gb.fq	gtdb_genomes_reps_r214/database/GCF/023/283/765/GCF_023283765.1_genomic.fna.gz	90.62	90.62	NA-NA	14.282	HIGH	NA-NA	11	0.492	2238/47356	NZ_JAKILG010000001.1 Shewanella profunda strain DSM 15900 contig00001, whole genome shotgun sequence
pac_mock2_1gb.fq	gtdb_genomes_reps_r214/database/GCF/012/935/715/GCF_012935715.1_genomic.fna.gz	90.60	90.60	NA-NA	6.825	HIGH	NA-NA	6	0.319	3348/71339	NZ_CP052860.1 Pseudomonas sp. ADAK13 chromosome, complete genome
pac_mock2_1gb.fq	gtdb_genomes_reps_r214/database/GCF/000/328/665/GCF_000328665.1_genomic.fna.gz	90.56	90.56	NA-NA	1.000	LOW	NA-NA	1	0.046	1220/26426	NC_019977.1 Methanomethylovorans hollandica DSM 15978, complete sequence
pac_mock2_1gb.fq	gtdb_genomes_reps_r214/database/GCF/000/210/075/GCF_000210075.1_genomic.fna.gz	90.54	89.08	90.36-90.70	0.902	0.902	0.83-0.99	1	0.045	1628/58609	NC_021017.1 Bacteroides xylanisolvens XB1A, complete sequence
pac_mock2_1gb.fq	gtdb_genomes_reps_r214/database/GCF/000/277/405/GCF_000277405.1_genomic.fna.gz	90.54	87.57	89.92-91.07	0.427	0.427	0.35-0.55	1	0.021	263/16094	NC_017741.1 Helicobacter pylori Shi112, complete sequence
pac_mock2_1gb.fq	gtdb_genomes_reps_r214/database/GCF/014/268/455/GCF_014268455.2_genomic.fna.gz	90.54	90.54	NA-NA	6.969	HIGH	NA-NA	7	0.319	2734/59552	NZ_CP077085.1 Pseudomonas shahriarae strain SWRI52 chromosome, complete genome
pac_mock2_1gb.fq	gtdb_genomes_reps_r214/database/GCF/000/739/065/GCF_000739065.1_genomic.fna.gz	90.50	90.50	NA-NA	16.743	HIGH	NA-NA	16	0.759	715/15766	NZ_CP009149.1 Methanocaldococcus bathoardescens strain JH146 chromosome, complete genome
pac_mock2_1gb.fq	gtdb_genomes_reps_r214/database/GCF/013/386/825/GCF_013386825.1_genomic.fna.gz	90.50	90.50	NA-NA	7.695	HIGH	NA-NA	6	0.306	3242/71559	NZ_JACARC010000001.1 Pseudomonas sp. IPO3778 IPO_3778_S47_L003_contig_1, whole genome shotgun sequence
pac_mock2_1gb.fq	gtdb_genomes_reps_r214/database/GCA/003/044/645/GCA_003044645.1_genomic.fna.gz	90.50	85.63	89.45-92.03	0.179	0.179	0.10-0.26	1	0.009	188/23034	POXL01000001.1 Neisseria subflava strain C2011009653 C2011009653_S23_ctg_859, whole genome shotgun sequence
pac_mock2_1gb.fq	gtdb_genomes_reps_r214/database/GCF/001/676/385/GCF_001676385.1_genomic.fna.gz	90.50	86.70	89.98-91.18	0.296	0.296	0.23-0.37	1	0.016	490/40935	NZ_LYVJ01000001.1 Stenotrophomonas maltophilia strain Sm46PAILV contig001, whole genome shotgun sequence
pac_mock2_1gb.fq	gtdb_genomes_reps_r214/database/GCF/011/752/565/GCF_011752565.1_genomic.fna.gz	90.50	90.50	NA-NA	7.571	HIGH	NA-NA	6	0.288	2957/65377	NZ_VWXK01000100.1 Pantoea sp. Ap-967 NODE_100_length_518_cov_51.823529/0, whole genome shotgun sequence
pac_mock2_1gb.fq	gtdb_genomes_reps_r214/database/GCF/001/952/855/GCF_001952855.1_genomic.fna.gz	90.48	90.48	NA-NA	7.686	HIGH	NA-NA	6	0.307	3108/69111	NZ_LPNO01000001.1 Pseudomonas sp. ATCC PTA-122608 scaffold_0, whole genome shotgun sequence
pac_mock2_1gb.fq	gtdb_genomes_reps_r214/database/GCF/019/823/065/GCF_019823065.1_genomic.fna.gz	90.47	90.47	NA-NA	6.258	HIGH	NA-NA	6	0.280	2748/61317	NZ_CP081966.1 Pseudomonas mosselii strain DSM 17497 chromosome, complete genome
pac_mock2_1gb.fq	gtdb_genomes_reps_r214/database/GCF/900/105/735/GCF_900105735.1_genomic.fna.gz	90.45	90.45	NA-NA	6.910	HIGH	NA-NA	6	0.307	3081/69084	NZ_LT629793.1 Pseudomonas yamanorum strain LMG 27247 chromosome I
pac_mock2_1gb.fq	gtdb_genomes_reps_r214/database/GCF/007/858/285/GCF_007858285.1_genomic.fna.gz	90.44	90.44	NA-NA	8.026	HIGH	NA-NA	7	0.307	2645/59561	NZ_VFIL01000010.1 Pseudomonas brenneri strain DSM 15294 10_256788_39.1869, whole genome shotgun sequence
pac_mock2_1gb.fq	gtdb_genomes_reps_r214/database/GCF/012/985/465/GCF_012985465.1_genomic.fna.gz	90.44	90.44	NA-NA	7.958	HIGH	NA-NA	6	0.306	2777/62554	NZ_JAAQWN010000010.1 Pseudomonas sp. WS 5079 10_181710_15.2042, whole genome shotgun sequence
pac_mock2_1gb.fq	gtdb_genomes_reps_r214/database/GCF/023/283/925/GCF_023283925.1_genomic.fna.gz	90.44	88.51	90.09-90.75	0.616	0.616	0.54-0.70	1	0.036	972/42791	NZ_JAKIKX010000001.1 Shewanella marisflavi strain JCM 12192 contig00001, whole genome shotgun sequence
pac_mock2_1gb.fq	gtdb_genomes_reps_r214/database/GCF/016/406/305/GCF_016406305.1_genomic.fna.gz	90.43	90.43	NA-NA	10.651	HIGH	NA-NA	10	0.468	1987/44922	NZ_CP066369.1 Shewanella putrefaciens strain CGMCC-1.6515 chromosome, complete genome
pac_mock2_1gb.fq	gtdb_genomes_reps_r214/database/GCF/007/858/275/GCF_007858275.1_genomic.fna.gz	90.43	90.43	NA-NA	8.049	HIGH	NA-NA	7	0.309	2781/62958	NZ_VFEV01000099.1 Pseudomonas proteolytica strain DSM 15321 100_572_25.9371, whole genome shotgun sequence
pac_mock2_1gb.fq	gtdb_genomes_reps_r214/database/GCF/021/602/025/GCF_021602025.1_genomic.fna.gz	90.42	90.42	NA-NA	7.357	HIGH	NA-NA	6	0.275	2764/62816	NZ_BQHW01000001.1 Pseudomonas ceruminis strain BML-PP028 sequence001, whole genome shotgun sequence
pac_mock2_1gb.fq	gtdb_genomes_reps_r214/database/GCA/019/412/865/GCA_019412865.1_genomic.fna.gz	90.40	88.75	90.10-90.62	0.811	0.811	0.74-0.90	1	0.042	1440/58250	DXOJ01000001.1 MAG TPA_asm: Bacteroides sp. isolate HRGM_Genome_1395 HRGM_Genome_1395_1, whole genome shotgun sequence
pac_mock2_1gb.fq	gtdb_genomes_reps_r214/database/GCF/018/847/375/GCF_018847375.1_genomic.fna.gz	90.37	89.88	90.16-90.57	1.798	1.798	1.57-2.09	2	0.095	1099/30027	NZ_CP072036.1 Akkermansia muciniphila strain Akk1573 chromosome, complete genome
pac_mock2_1gb.fq	gtdb_genomes_reps_r214/database/GCF/016/925/675/GCF_016925675.1_genomic.fna.gz	90.36	90.36	NA-NA	6.975	HIGH	NA-NA	7	0.300	2634/61098	NZ_CP070506.1 Pseudomonas sp. SDM007 chromosome, complete genome
pac_mock2_1gb.fq	gtdb_genomes_reps_r214/database/GCA/022/728/415/GCA_022728415.1_genomic.fna.gz	90.35	85.76	89.54-91.55	0.211	0.211	0.13-0.28	1	0.009	304/35611	JAIJJM010000799.1 MAG: Collinsella sp. isolate Map_57_008 contig_100_10008, whole genome shotgun sequence
pac_mock2_1gb.fq	gtdb_genomes_reps_r214/database/GCF/000/382/445/GCF_000382445.1_genomic.fna.gz	90.32	89.68	90.13-90.49	1.577	1.577	1.43-1.72	2	0.074	1493/43770	NZ_KB905472.1 Phocaeicola massiliensis B84634 = Timone 84634 = DSM 17679 = JCM 13223 strain DSM 17679 aczJl-supercont1.1, whole genome shotgun sequence
pac_mock2_1gb.fq	gtdb_genomes_reps_r214/database/GCF/009/689/985/GCF_009689985.1_genomic.fna.gz	90.31	87.89	89.77-90.85	0.534	0.534	0.41-0.67	1	0.024	288/15764	NZ_QBAW01000001.1 Helicobacter pylori strain CHL25 CHL25_Contig_1, whole genome shotgun sequence
pac_mock2_1gb.fq	gtdb_genomes_reps_r214/database/GCF/000/739/735/GCF_000739735.1_genomic.fna.gz	90.31	89.99	90.21-90.47	2.173	2.173	1.87-2.32	2	0.099	2491/65428	NZ_BBJF01000050.1 Paraburkholderia ginsengisoli NBRC 100965, whole genome shotgun sequence
pac_mock2_1gb.fq	gtdb_genomes_reps_r214/database/GCF/002/251/635/GCF_002251635.1_genomic.fna.gz	90.30	90.30	NA-NA	6.909	HIGH	NA-NA	6	0.292	2773/65450	NZ_NMOJ01000001.1 Pseudomonas mandelii strain 6A1 pm_1, whole genome shotgun sequence
pac_mock2_1gb.fq	gtdb_genomes_reps_r214/database/GCF/024/181/385/GCF_024181385.1_genomic.fna.gz	90.30	88.54	90.00-90.60	0.763	0.763	0.67-0.88	1	0.032	644/28058	NZ_CP051305.1 Treponema sp. OMZ 798 chromosome, complete genome
pac_mock2_1gb.fq	gtdb_genomes_reps_r214/database/GCA/001/815/675/GCA_001815675.1_genomic.fna.gz	90.27	85.15	89.25-92.34	0.162	0.162	0.07-0.24	1	0.009	183/26708	KV821453.1 Neisseria sp. HMSC065D04 genomic scaffold Scaffold0, whole genome shotgun sequence
pac_mock2_1gb.fq	gtdb_genomes_reps_r214/database/GCF/001/983/165/GCF_001983165.1_genomic.fna.gz	90.26	90.26	NA-NA	7.929	HIGH	NA-NA	7	0.287	2689/64389	NZ_MNPU01000100.1 Pseudomonas gessardii strain DSM 17152 100_3095_161.398, whole genome shotgun sequence
pac_mock2_1gb.fq	gtdb_genomes_reps_r214/database/GCF/005/080/685/GCF_005080685.1_genomic.fna.gz	90.26	90.26	NA-NA	6.445	HIGH	NA-NA	6	0.267	2698/64714	NZ_CP039371.1 Pseudomonas putida strain 1290 chromosome, complete genome
pac_mock2_1gb.fq	gtdb_genomes_reps_r214/database/GCF/000/025/525/GCF_000025525.1_genomic.fna.gz	90.25	90.25	NA-NA	16.749	HIGH	NA-NA	16	0.697	718/17261	NC_013887.1 Methanocaldococcus sp. FS406-22, complete sequence
pac_mock2_1gb.fq	gtdb_genomes_reps_r214/database/GCF/001/653/475/GCF_001653475.1_genomic.fna.gz	90.24	87.53	89.53-90.86	0.467	0.467	0.36-0.59	1	0.020	246/15255	NZ_CP011487.1 Helicobacter pylori strain PNG84A chromosome, complete genome
pac_mock2_1gb.fq	gtdb_genomes_reps_r214/database/GCF/013/364/355/GCF_013364355.1_genomic.fna.gz	90.22	85.91	89.44-91.02	0.240	0.240	0.18-0.31	1	0.012	402/44622	NZ_CP054931.1 Stenotrophomonas sp. NA06056 chromosome, complete genome
pac_mock2_1gb.fq	gtdb_genomes_reps_r214/database/GCA/000/612/485/GCA_000612485.1_genomic.fna.gz	90.19	85.42	89.29-91.08	0.197	0.197	0.14-0.27	1	0.010	261/34593	CP007494.1 Bordetella holmesii ATCC 51541, complete genome
pac_mock2_1gb.fq	gtdb_genomes_reps_r214/database/GCF/014/697/105/GCF_014697105.1_genomic.fna.gz	90.17	89.67	90.01-90.29	1.780	1.780	1.62-1.93	2	0.074	1957/57578	NZ_JACJRF010000001.1 Anabaena subtropica FACHB-260 contig1, whole genome shotgun sequence
pac_mock2_1gb.fq	gtdb_genomes_reps_r214/database/GCA/900/757/715/GCA_900757715.1_genomic.fna.gz	90.15	89.43	89.91-90.37	1.469	1.469	1.26-1.69	2	0.070	792/25254	CAAEOZ010000001.1 TPA_asm: uncultured Veillonella sp., isolate HGM14188, WGS project CAAEOZ010000000 data, contig: ERS537359_13_k99_174, whole genome shotgun sequence
pac_mock2_1gb.fq	gtdb_genomes_reps_r214/database/GCF/902/859/915/GCF_902859915.1_genomic.fna.gz	90.14	89.79	90.04-90.28	2.091	2.091	1.88-2.20	2	0.090	2771/78028	NZ_CADIKK010000001.1 Paraburkholderia ultramafica strain LMG 28614 isolate LMG 28614, whole genome shotgun sequence
pac_mock2_1gb.fq	gtdb_genomes_reps_r214/database/GCF/003/231/305/GCF_003231305.1_genomic.fna.gz	90.12	90.12	NA-NA	8.058	HIGH	NA-NA	6	0.254	2381/59921	NZ_QKVM01000001.1 Pseudomonas sichuanensis strain WCHPs060039 1, whole genome shotgun sequence
pac_mock2_1gb.fq	gtdb_genomes_reps_r214/database/GCF/021/601/385/GCF_021601385.1_genomic.fna.gz	90.11	90.11	NA-NA	7.253	HIGH	NA-NA	6	0.250	2309/58315	NZ_BQHO01000001.1 Pseudomonas parasichuanensis strain BML-PP020 sequence001, whole genome shotgun sequence
pac_mock2_1gb.fq	gtdb_genomes_reps_r214/database/GCF/000/730/425/GCF_000730425.1_genomic.fna.gz	90.10	90.10	NA-NA	6.856	HIGH	NA-NA	6	0.268	2347/59426	NZ_CP008896.1 Pseudomonas fluorescens strain UK4 chromosome, complete genome
pac_mock2_1gb.fq	gtdb_genomes_reps_r214/database/GCF/000/730/645/GCF_000730645.1_genomic.fna.gz	90.09	90.09	NA-NA	8.301	HIGH	NA-NA	6	0.255	1958/49685	NZ_BBIU01000055.1 Pseudomonas parafulva NBRC 16636 = DSM 17004 strain NBRC 16636, whole genome shotgun sequence
pac_mock2_1gb.fq	gtdb_genomes_reps_r214/database/GCF/016/648/105/GCF_016648105.1_genomic.fna.gz	90.09	90.09	NA-NA	7.850	HIGH	NA-NA	6	0.252	2501/63467	NZ_JACVVE010000100.1 Pseudomonas sp. S31 NODE_100_length_348_cov_24.841751, whole genome shotgun sequence
