Read_file	Genome_file	Adjusted_ANI	Naive_ANI	ANI_5-95_percentile	Eff_cov	Eff_lambda	Lambda_5-95_percentile	Median_cov	Mean_cov	Containment_ind	Contig_name
pac_mock2_1gb.fq	gtdb_genomes_reps_r214/database/GCF/001/027/105/GCF_001027105.1_genomic.fna.gz	100.00	89.38	101.64-104.82	0.007	0.007	0.01-0.01	1	0.031	849/27552	NZ_CP011526.1 Staphylococcus aureus strain DSM 20231 chromosome, complete genome
pac_mock2_1gb.fq	gtdb_genomes_reps_r214/database/GCF/000/021/645/GCF_000021645.1_genomic.fna.gz	100.00	95.82	101.50-102.00	0.166	0.166	0.15-0.18	1	0.286	4865/18301	NC_011661.1 Dictyoglomus turgidum DSM 6724, complete sequence
pac_mock2_1gb.fq	gtdb_genomes_reps_r214/database/GCF/000/308/215/GCF_000308215.1_genomic.fna.gz	100.00	95.48	100.91-101.34	0.182	0.182	0.17-0.19	1	0.261	6214/26072	NZ_CAJE01000026.1 Methanomassiliicoccus luminyensis B10, whole genome shotgun sequence
pac_mock2_1gb.fq	gtdb_genomes_reps_r214/database/GCF/000/011/205/GCF_000011205.1_genomic.fna.gz	100.00	90.98	99.71-101.77	0.042	0.042	0.03-0.05	1	0.056	1407/26380	NC_003106.2 Sulfurisphaera tokodaii str. 7, complete sequence
pac_mock2_1gb.fq	gtdb_genomes_reps_r214/database/GCF/000/007/305/GCF_000007305.1_genomic.fna.gz	100.00	91.91	99.72-101.39	0.061	0.061	0.04-0.08	1	0.104	1363/18622	NC_003413.1 Pyrococcus furiosus DSM 3638, complete sequence
pac_mock2_1gb.fq	gtdb_genomes_reps_r214/database/GCF/000/015/865/GCF_000015865.1_genomic.fna.gz	100.00	94.10	100.26-100.84	0.135	0.135	0.12-0.15	1	0.164	5487/36097	NC_009012.1 Acetivibrio thermocellus ATCC 27405, complete sequence
pac_mock2_1gb.fq	gtdb_genomes_reps_r214/database/GCF/000/022/325/GCF_000022325.1_genomic.fna.gz	100.00	96.47	100.36-100.68	0.285	0.285	0.27-0.30	1	0.345	8927/27180	NC_012034.1 Caldicellulosiruptor bescii DSM 6725, complete sequence
pac_mock2_1gb.fq	gtdb_genomes_reps_r214/database/GCF/000/196/135/GCF_000196135.1_genomic.fna.gz	100.00	98.48	100.34-100.49	0.775	0.775	0.75-0.80	1	0.896	12886/20702	NC_005090.1 Wolinella succinogenes DSM 1740, complete sequence
pac_mock2_1gb.fq	gtdb_genomes_reps_r214/database/GCF/000/015/805/GCF_000015805.1_genomic.fna.gz	100.00	99.45	100.30-100.41	1.382	1.382	1.32-1.43	2	1.790	16834/19955	NC_009073.1 Pyrobaculum calidifontis JCM 11548, complete sequence
pac_mock2_1gb.fq	gtdb_genomes_reps_r214/database/GCF/000/017/205/GCF_000017205.1_genomic.fna.gz	100.00	92.12	99.91-100.74	0.071	0.071	0.06-0.08	1	0.103	4999/63733	NC_009656.1 Pseudomonas aeruginosa PA7, complete sequence
pac_mock2_1gb.fq	gtdb_genomes_reps_r214/database/GCA/003/543/175/GCA_003543175.1_genomic.fna.gz	100.00	95.77	100.06-100.47	0.273	0.273	0.25-0.29	1	0.300	3973/15153	DPJC01000012.1 MAG TPA_asm: Hydrogenobaculum sp. isolate UBA8840 contig_1217, whole genome shotgun sequence
pac_mock2_1gb.fq	gtdb_genomes_reps_r214/database/GCF/000/017/945/GCF_000017945.1_genomic.fna.gz	100.00	99.02	100.15-100.28	1.137	1.137	1.10-1.18	2	1.380	9474/12857	NC_009776.1 Ignicoccus hospitalis KIN4/I, complete sequence
pac_mock2_1gb.fq	gtdb_genomes_reps_r214/database/GCA/003/510/745/GCA_003510745.1_genomic.fna.gz	100.00	98.85	100.13-100.26	1.036	1.036	1.00-1.07	1	1.178	10869/15577	DOKW01000009.1 MAG TPA_asm: Sulfurihydrogenibium sp. isolate UBA8851 contig_10540, whole genome shotgun sequence
pac_mock2_1gb.fq	gtdb_genomes_reps_r214/database/GCF/000/007/185/GCF_000007185.1_genomic.fna.gz	100.00	99.26	100.15-100.25	1.342	1.342	1.29-1.39	2	1.512	13632/17180	NC_003551.1 Methanopyrus kandleri AV19, complete sequence
pac_mock2_1gb.fq	gtdb_genomes_reps_r214/database/GCF/000/016/125/GCF_000016125.1_genomic.fna.gz	100.00	99.56	100.04-100.10	1.863	1.863	1.82-1.92	2	2.288	15311/17579	NC_009135.1 Methanococcus maripaludis C5, complete sequence
pac_mock2_1gb.fq	gtdb_genomes_reps_r214/database/GCF/000/018/865/GCF_000018865.1_genomic.fna.gz	100.00	99.33	100.00-100.07	1.591	1.591	1.55-1.62	2	1.618	41407/50983	NC_010175.1 Chloroflexus aurantiacus J-10-fl, complete sequence
pac_mock2_1gb.fq	gtdb_genomes_reps_r214/database/GCF/000/008/565/GCF_000008565.1_genomic.fna.gz	100.00	98.70	99.96-100.05	1.067	1.067	1.04-1.10	1	1.137	21049/31592	NC_001263.1 Deinococcus radiodurans R1 chromosome 1, complete sequence
pac_mock2_1gb.fq	gtdb_genomes_reps_r214/database/GCF/000/020/225/GCF_000020225.1_genomic.fna.gz	100.00	99.68	99.98-100.03	2.284	2.284	2.22-2.34	2	2.418	23683/26184	NC_010655.1 Akkermansia muciniphila ATCC BAA-835, complete sequence
pac_mock2_1gb.fq	gtdb_genomes_reps_r214/database/GCF/000/021/565/GCF_000021565.1_genomic.fna.gz	100.00	100.00	NA-NA	16.356	HIGH	NA-NA	16	16.356	19854/19854	NC_012440.1 Persephonella marina EX-H1, complete sequence
pac_mock2_1gb.fq	gtdb_genomes_reps_r214/database/GCF/000/010/305/GCF_000010305.1_genomic.fna.gz	100.00	100.00	NA-NA	27.843	HIGH	NA-NA	28	27.812	46380/46383	NC_012489.1 Gemmatimonas aurantiaca T-27, complete sequence
pac_mock2_1gb.fq	gtdb_genomes_reps_r214/database/GCF/001/639/275/GCF_001639275.1_genomic.fna.gz	100.00	100.00	NA-NA	9.958	HIGH	NA-NA	9	9.785	20311/20313	NZ_LWMU01000001.1 Methanobrevibacter oralis strain DSM 7256 MBORA_contig000001, whole genome shotgun sequence
pac_mock2_1gb.fq	gtdb_genomes_reps_r214/database/GCF/000/016/785/GCF_000016785.1_genomic.fna.gz	100.00	100.00	NA-NA	27.181	HIGH	NA-NA	25	25.728	18088/18092	NC_009486.1 Thermotoga petrophila RKU-1, complete sequence
pac_mock2_1gb.fq	gtdb_genomes_reps_r214/database/GCF/000/016/545/GCF_000016545.1_genomic.fna.gz	100.00	100.00	NA-NA	26.616	HIGH	NA-NA	26	26.606	27682/27691	NC_009437.1 Caldicellulosiruptor saccharolyticus DSM 8903, complete sequence
pac_mock2_1gb.fq	gtdb_genomes_reps_r214/database/GCF/002/952/055/GCF_002952055.1_genomic.fna.gz	100.00	100.00	NA-NA	8.910	HIGH	NA-NA	9	8.905	26498/26513	NZ_CP021255.1 Desulfobulbus oralis strain HOT041/ORNL chromosome, complete genome
pac_mock2_1gb.fq	gtdb_genomes_reps_r214/database/GCF/000/196/115/GCF_000196115.1_genomic.fna.gz	100.00	100.00	NA-NA	7.825	HIGH	NA-NA	8	7.819	70057/70098	NC_005027.1 Rhodopirellula baltica SH 1, complete sequence
pac_mock2_1gb.fq	gtdb_genomes_reps_r214/database/GCF/000/019/085/GCF_000019085.1_genomic.fna.gz	100.00	100.00	NA-NA	7.364	HIGH	NA-NA	7	7.354	21654/21668	NC_010321.1 Thermoanaerobacter pseudethanolicus ATCC 33223, complete sequence
pac_mock2_1gb.fq	gtdb_genomes_reps_r214/database/GCF/000/018/945/GCF_000018945.1_genomic.fna.gz	100.00	100.00	NA-NA	40.357	HIGH	NA-NA	40	40.321	18552/18564	NC_011978.1 Thermotoga neapolitana DSM 4359, complete sequence
pac_mock2_1gb.fq	gtdb_genomes_reps_r214/database/GCF/000/166/095/GCF_000166095.1_genomic.fna.gz	100.00	100.00	NA-NA	15.479	HIGH	NA-NA	15	15.464	12323/12335	NC_014658.1 Methanothermus fervidus DSM 2088, complete sequence
pac_mock2_1gb.fq	gtdb_genomes_reps_r214/database/GCF/000/020/465/GCF_000020465.1_genomic.fna.gz	100.00	100.00	NA-NA	13.210	HIGH	NA-NA	13	13.170	26589/26617	NC_010803.1 Chlorobium limicola DSM 245, complete sequence
pac_mock2_1gb.fq	gtdb_genomes_reps_r214/database/GCF/000/011/105/GCF_000011105.1_genomic.fna.gz	100.00	100.00	NA-NA	7.391	HIGH	NA-NA	7	7.373	17241/17261	NC_000961.1 Pyrococcus horikoshii OT3, complete sequence
pac_mock2_1gb.fq	gtdb_genomes_reps_r214/database/GCA/000/018/565/GCA_000018565.1_genomic.fna.gz	100.00	100.00	NA-NA	7.450	HIGH	NA-NA	7	7.441	65830/65911	CP000875.1 Herpetosiphon aurantiacus DSM 785, complete genome
pac_mock2_1gb.fq	gtdb_genomes_reps_r214/database/GCF/000/091/665/GCF_000091665.1_genomic.fna.gz	99.99	99.99	NA-NA	15.916	HIGH	NA-NA	15	15.883	17242/17278	NC_000909.1 Methanocaldococcus jannaschii DSM 2661, complete sequence
pac_mock2_1gb.fq	gtdb_genomes_reps_r214/database/GCF/000/016/065/GCF_000016065.1_genomic.fna.gz	99.99	98.04	99.94-100.04	0.765	0.765	0.75-0.78	1	0.800	24564/45330	NC_009092.1 Shewanella loihica PV-4, complete sequence
pac_mock2_1gb.fq	gtdb_genomes_reps_r214/database/GCF/900/167/395/GCF_900167395.1_genomic.fna.gz	99.98	99.98	NA-NA	10.415	HIGH	NA-NA	10	10.238	26522/26652	NZ_FUWK01000085.1 Nitrosomonas europaea strain ATCC 25978, whole genome shotgun sequence
pac_mock2_1gb.fq	gtdb_genomes_reps_r214/database/GCF/000/015/125/GCF_000015125.1_genomic.fna.gz	99.97	99.97	NA-NA	5.170	HIGH	NA-NA	5	5.072	28986/29291	NC_008639.1 Chlorobium phaeobacteroides DSM 266, complete sequence
pac_mock2_1gb.fq	gtdb_genomes_reps_r214/database/GCF/000/012/825/GCF_000012825.1_genomic.fna.gz	99.96	99.44	99.94-99.98	1.849	1.849	1.81-1.89	2	1.904	40706/48455	NC_009614.1 Phocaeicola vulgatus ATCC 8482, complete sequence
pac_mock2_1gb.fq	gtdb_genomes_reps_r214/database/GCF/001/481/685/GCF_001481685.1_genomic.fna.gz	99.96	99.96	NA-NA	4.600	HIGH	NA-NA	4	4.548	13699/13855	NZ_CP006867.1 Ignicoccus islandicus DSM 13165 chromosome, complete genome
pac_mock2_1gb.fq	gtdb_genomes_reps_r214/database/GCF/000/011/065/GCF_000011065.1_genomic.fna.gz	99.96	98.39	99.93-100.00	0.924	0.924	0.91-0.94	1	0.932	37111/61388	NC_004663.1 Bacteroides thetaiotaomicron VPI-5482, complete sequence
pac_mock2_1gb.fq	gtdb_genomes_reps_r214/database/GCA/000/007/325/GCA_000007325.1_genomic.fna.gz	99.96	99.96	NA-NA	5.061	HIGH	NA-NA	5	4.997	20651/20910	AE009951.2 Fusobacterium nucleatum subsp. nucleatum ATCC 25586, complete genome
pac_mock2_1gb.fq	gtdb_genomes_reps_r214/database/GCF/000/006/985/GCF_000006985.1_genomic.fna.gz	99.95	99.95	NA-NA	4.769	HIGH	NA-NA	5	4.687	20721/21030	NC_002932.3 Chlorobaculum tepidum TLS, complete sequence
pac_mock2_1gb.fq	gtdb_genomes_reps_r214/database/GCF/000/013/645/GCF_000013645.1_genomic.fna.gz	99.94	99.55	99.93-99.95	2.112	2.112	2.08-2.15	2	2.166	81956/94299	NC_007951.1 Paraburkholderia xenovorans LB400 chromosome 1, complete sequence
pac_mock2_1gb.fq	gtdb_genomes_reps_r214/database/GCF/000/009/705/GCF_000009705.1_genomic.fna.gz	99.89	99.32	99.87-99.92	1.764	1.764	1.74-1.80	2	2.040	56864/70207	NC_003272.1 Nostoc sp. PCC 7120 = FACHB-418, complete sequence
pac_mock2_1gb.fq	gtdb_genomes_reps_r214/database/GCF/000/016/425/GCF_000016425.1_genomic.fna.gz	99.89	98.36	99.85-99.94	0.944	0.944	0.92-0.96	1	0.948	30526/50945	NC_009380.1 Salinispora tropica CNB-440, complete sequence
pac_mock2_1gb.fq	gtdb_genomes_reps_r214/database/GCF/000/008/185/GCF_000008185.1_genomic.fna.gz	99.80	97.82	99.73-99.87	0.753	0.753	0.73-0.77	1	0.712	14123/27945	NC_002967.9 Treponema denticola ATCC 35405, complete sequence
pac_mock2_1gb.fq	gtdb_genomes_reps_r214/database/GCF/000/306/945/GCF_000306945.1_genomic.fna.gz	99.79	96.04	99.67-99.94	0.355	0.355	0.33-0.37	1	0.343	10555/36926	NC_018518.1 Bordetella pertussis 18323, complete sequence
pac_mock2_1gb.fq	gtdb_genomes_reps_r214/database/GCF/000/010/505/GCF_000010505.1_genomic.fna.gz	99.78	97.62	99.69-99.86	0.691	0.691	0.67-0.72	1	0.665	10087/21287	NC_010729.1 Porphyromonas gingivalis ATCC 33277, complete sequence
pac_mock2_1gb.fq	gtdb_genomes_reps_r214/database/GCF/000/156/375/GCF_000156375.1_genomic.fna.gz	99.75	99.75	NA-NA	3.168	HIGH	NA-NA	3	2.848	25884/27995	NZ_DS996397.1 Desulfovibrio piger ATCC 29098 Scfld442, whole genome shotgun sequence
pac_mock2_1gb.fq	gtdb_genomes_reps_r214/database/GCF/000/008/665/GCF_000008665.1_genomic.fna.gz	99.73	99.00	99.69-99.77	1.556	1.556	1.51-1.59	2	1.333	15723/21459	NC_000917.1 Archaeoglobus fulgidus DSM 4304, complete sequence
pac_mock2_1gb.fq	gtdb_genomes_reps_r214/database/GCF/000/022/565/GCF_000022565.1_genomic.fna.gz	99.72	97.28	99.66-99.80	0.609	0.609	0.59-0.63	1	0.575	17268/40576	NC_012483.1 Acidobacterium capsulatum ATCC 51196, complete sequence
pac_mock2_1gb.fq	gtdb_genomes_reps_r214/database/GCF/000/007/985/GCF_000007985.2_genomic.fna.gz	99.65	97.91	99.59-99.71	0.843	0.843	0.82-0.86	1	0.749	19416/37413	NC_002939.5 Geobacter sulfurreducens PCA, complete sequence
pac_mock2_1gb.fq	gtdb_genomes_reps_r214/database/GCF/021/282/585/GCF_021282585.1_genomic.fna.gz	99.50	99.50	NA-NA	5.838	HIGH	NA-NA	5	4.908	54262/63420	NZ_JAJSPR010000100.1 Pseudomonas alloputida strain NMI2441_06 NODE_100_length_3132_cov_481.337, whole genome shotgun sequence
pac_mock2_1gb.fq	gtdb_genomes_reps_r214/database/GCF/000/012/905/GCF_000012905.2_genomic.fna.gz	99.36	91.63	99.00-99.89	0.083	0.083	0.07-0.09	1	0.069	3023/45415	NC_007493.2 Cereibacter sphaeroides 2.4.1 chromosome 1, complete sequence
pac_mock2_1gb.fq	gtdb_genomes_reps_r214/database/GCF/008/124/605/GCF_008124605.1_genomic.fna.gz	99.25	99.25	NA-NA	12.900	HIGH	NA-NA	12	9.935	18344/23200	NZ_VRYN01000001.1 Halobacterium salinarum DSM 3754 Ga0061114_scaffold00001.1, whole genome shotgun sequence
pac_mock2_1gb.fq	gtdb_genomes_reps_r214/database/GCF/000/007/225/GCF_000007225.1_genomic.fna.gz	99.21	96.30	99.11-99.37	0.496	0.496	0.47-0.52	1	0.386	6755/21725	NC_003364.1 Pyrobaculum aerophilum str. IM2, complete sequence
pac_mock2_1gb.fq	gtdb_genomes_reps_r214/database/GCF/900/638/555/GCF_900638555.1_genomic.fna.gz	98.89	92.92	98.47-99.31	0.153	0.153	0.13-0.17	1	0.111	2086/20290	NZ_LR134525.1 Neisseria meningitidis strain NCTC10025 chromosome 1, complete sequence
pac_mock2_1gb.fq	gtdb_genomes_reps_r214/database/GCF/003/968/655/GCF_003968655.1_genomic.fna.gz	98.78	98.78	NA-NA	5.433	HIGH	NA-NA	5	3.576	13930/20384	NZ_RXYK01000010.1 Chlorobium phaeovibrioides strain BrKhr17 NODE_10_length_80169_cov_14.7459, whole genome shotgun sequence
pac_mock2_1gb.fq	gtdb_genomes_reps_r214/database/GCF/000/019/785/GCF_000019785.1_genomic.fna.gz	98.74	93.18	98.47-98.94	0.177	0.177	0.16-0.19	1	0.126	5407/48330	NC_010524.1 Leptothrix cholodnii SP-6, complete sequence
pac_mock2_1gb.fq	gtdb_genomes_reps_r214/database/GCF/002/799/245/GCF_002799245.1_genomic.fna.gz	98.71	93.24	98.42-98.92	0.183	0.183	0.17-0.20	1	0.129	5365/46959	NZ_NEQV01000001.1 Stenotrophomonas maltophilia strain EA1 Contig_1_consensus_ctg_5_15_2, whole genome shotgun sequence
pac_mock2_1gb.fq	gtdb_genomes_reps_r214/database/GCF/000/392/875/GCF_000392875.1_genomic.fna.gz	98.66	95.46	98.54-98.79	0.436	0.436	0.41-0.46	1	0.286	6688/28232	NZ_KB944588.1 Enterococcus faecalis ATCC 19433 acAqW-supercont1.1, whole genome shotgun sequence
pac_mock2_1gb.fq	gtdb_genomes_reps_r214/database/GCF/001/645/105/GCF_001645105.1_genomic.fna.gz	98.51	98.51	NA-NA	6.692	HIGH	NA-NA	6	4.164	41409/65854	NZ_LKEG01000001.1 Pseudomonas marginalis strain ICMP 3553 C1001, whole genome shotgun sequence
pac_mock2_1gb.fq	gtdb_genomes_reps_r214/database/GCF/900/456/975/GCF_900456975.1_genomic.fna.gz	98.47	98.47	NA-NA	9.145	HIGH	NA-NA	8	5.626	31336/50593	NZ_UGYM01000002.1 Shewanella baltica strain NCTC10735, whole genome shotgun sequence
pac_mock2_1gb.fq	gtdb_genomes_reps_r214/database/GCF/006/716/065/GCF_006716065.1_genomic.fna.gz	98.44	97.68	98.41-98.47	1.509	1.509	1.48-1.54	2	0.937	26662/55151	NZ_VFOL01000001.1 Salinispora arenicola strain DSM 44819 Ga0264271_11, whole genome shotgun sequence
pac_mock2_1gb.fq	gtdb_genomes_reps_r214/database/GCF/000/166/775/GCF_000166775.1_genomic.fna.gz	97.86	94.25	97.55-98.13	0.271	0.271	0.25-0.29	1	0.144	4362/27387	NC_014720.1 Caldicellulosiruptor kronotskyensis 2002, complete sequence
pac_mock2_1gb.fq	gtdb_genomes_reps_r214/database/GCF/003/697/165/GCF_003697165.2_genomic.fna.gz	97.80	93.26	97.61-97.99	0.255	0.255	0.24-0.27	1	0.130	5674/49293	NZ_CP033092.2 Escherichia coli DSM 30083 = JCM 1649 = ATCC 11775 chromosome, complete genome
pac_mock2_1gb.fq	gtdb_genomes_reps_r214/database/GCF/000/008/545/GCF_000008545.1_genomic.fna.gz	97.41	97.41	NA-NA	29.424	HIGH	NA-NA	27	12.154	8176/18434	NC_000853.1 Thermotoga maritima MSB8, complete sequence
pac_mock2_1gb.fq	gtdb_genomes_reps_r214/database/GCF/000/016/385/GCF_000016385.1_genomic.fna.gz	97.27	88.20	95.94-99.07	0.048	0.048	0.02-0.07	1	0.021	432/21214	NC_009376.1 Pyrobaculum arsenaticum DSM 13514, complete sequence
pac_mock2_1gb.fq	gtdb_genomes_reps_r214/database/GCA/923/184/405/GCA_923184405.1_genomic.fna.gz	97.25	91.25	96.63-97.82	0.146	0.146	0.12-0.17	1	0.064	1238/21147	OV299793.1 Neisseria meningitidis strain NM-1853 genome assembly, scaffold: scaffold00001, whole genome shotgun sequence
pac_mock2_1gb.fq	gtdb_genomes_reps_r214/database/GCF/002/945/325/GCF_002945325.1_genomic.fna.gz	96.95	96.43	96.86-97.03	1.842	1.842	1.73-1.95	2	0.936	5454/16814	NZ_CP026606.1 Methanococcus maripaludis strain DSM 2067 chromosome, complete genome
pac_mock2_1gb.fq	gtdb_genomes_reps_r214/database/GCF/000/784/835/GCF_000784835.1_genomic.fna.gz	96.94	96.94	NA-NA	27.828	HIGH	NA-NA	26	9.811	6969/18249	NZ_JSFH01000001.1 Thermotoga sp. Mc24 Contig1, whole genome shotgun sequence
pac_mock2_1gb.fq	gtdb_genomes_reps_r214/database/GCA/900/760/795/GCA_900760795.1_genomic.fna.gz	96.91	96.42	96.84-96.97	1.878	1.878	1.81-1.99	2	0.736	13136/40735	CAAFAI010000001.1 TPA_asm: Bacteroidaceae bacterium, isolate HGM04771, WGS project CAAFAI010000000 data, contig: SRS021948_34_k99_167, whole genome shotgun sequence
pac_mock2_1gb.fq	gtdb_genomes_reps_r214/database/GCF/009/759/685/GCF_009759685.1_genomic.fna.gz	96.89	92.35	96.59-97.15	0.250	0.250	0.23-0.28	1	0.096	3309/39072	NZ_CP046654.1 Acinetobacter baumannii strain ATCC 19606 chromosome, complete genome
pac_mock2_1gb.fq	gtdb_genomes_reps_r214/database/GCA/019/414/725/GCA_019414725.1_genomic.fna.gz	96.70	95.93	96.63-96.77	1.483	1.483	1.42-1.56	2	0.579	9119/33039	DXLM01000001.1 MAG TPA_asm: Bacteroides sp. isolate HRGM_Genome_0403 HRGM_Genome_0403_1, whole genome shotgun sequence
pac_mock2_1gb.fq	gtdb_genomes_reps_r214/database/GCF/001/457/615/GCF_001457615.1_genomic.fna.gz	96.65	89.22	95.97-97.33	0.083	0.083	0.07-0.10	1	0.053	1815/62376	NZ_LN831024.1 Pseudomonas aeruginosa strain NCTC10332 chromosome 1, complete sequence
pac_mock2_1gb.fq	gtdb_genomes_reps_r214/database/GCF/002/965/065/GCF_002965065.1_genomic.fna.gz	96.62	91.51	96.31-96.93	0.200	0.200	0.18-0.22	1	0.072	2882/45063	NZ_PTRE01000100.1 Escherichia sp. MOD1-EC7003 MOD1-EC7003_100_length_365_cov_541, whole genome shotgun sequence
pac_mock2_1gb.fq	gtdb_genomes_reps_r214/database/GCA/000/445/185/GCA_000445185.1_genomic.fna.gz	96.62	96.62	NA-NA	7.579	HIGH	NA-NA	7	2.534	8792/25567	AVAF01000001.1 MAG: Thermoanaerobacter sp. A7A NODE_13_length_6096_cov_691.959473, whole genome shotgun sequence
pac_mock2_1gb.fq	gtdb_genomes_reps_r214/database/GCA/003/722/315/GCA_003722315.1_genomic.fna.gz	96.60	96.60	NA-NA	7.413	HIGH	NA-NA	7	2.520	8325/24359	CP033580.1 Thermoanaerobacter ethanolicus JW 200 chromosome, complete genome
pac_mock2_1gb.fq	gtdb_genomes_reps_r214/database/GCF/004/211/955/GCF_004211955.1_genomic.fna.gz	96.55	91.46	96.18-96.87	0.200	0.200	0.18-0.22	1	0.071	2962/47189	NZ_RHJI01000010.1 Escherichia sp. E1V33 1V33_10_consensus, whole genome shotgun sequence
pac_mock2_1gb.fq	gtdb_genomes_reps_r214/database/GCA/019/414/665/GCA_019414665.1_genomic.fna.gz	96.51	96.08	96.45-96.59	1.976	1.976	1.85-2.07	2	0.651	7239/25045	DXLO01000001.1 MAG TPA_asm: Bacteroides sp. isolate HRGM_Genome_0405 HRGM_Genome_0405_1, whole genome shotgun sequence
pac_mock2_1gb.fq	gtdb_genomes_reps_r214/database/GCA/021/307/345/GCA_021307345.1_genomic.fna.gz	96.47	91.11	96.12-96.78	0.182	0.182	0.16-0.20	1	0.062	2419/43321	CP089930.1 Escherichia coli strain E69 chromosome, complete genome
pac_mock2_1gb.fq	gtdb_genomes_reps_r214/database/GCF/019/655/335/GCF_019655335.1_genomic.fna.gz	96.45	96.45	NA-NA	9.677	HIGH	NA-NA	9	2.987	15958/48917	NZ_BPFD01000001.1 Shewanella hafniensis strain ATCC BAA-1207 sequence001, whole genome shotgun sequence
pac_mock2_1gb.fq	gtdb_genomes_reps_r214/database/GCF/003/315/235/GCF_003315235.1_genomic.fna.gz	96.35	90.91	95.79-96.87	0.174	0.174	0.14-0.21	1	0.057	1088/20884	NZ_QNRU01000001.1 Neisseria gonorrhoeae strain DSM 9188 Ga0244522_101, whole genome shotgun sequence
pac_mock2_1gb.fq	gtdb_genomes_reps_r214/database/GCF/013/009/555/GCF_013009555.1_genomic.fna.gz	96.14	95.68	96.09-96.19	1.938	1.938	1.85-2.00	2	0.575	13743/54014	NZ_CP046176.1 Phocaeicola dorei strain DSM 17855 chromosome, complete genome
pac_mock2_1gb.fq	gtdb_genomes_reps_r214/database/GCA/000/176/735/GCA_000176735.1_genomic.fna.gz	96.05	90.81	95.41-96.62	0.186	0.186	0.15-0.22	1	0.055	1004/19933	ADBE01000139.1 Neisseria polysaccharea ATCC 43768 N_polysaccharea-1.0.1_Cont284.1, whole genome shotgun sequence
pac_mock2_1gb.fq	gtdb_genomes_reps_r214/database/GCF/003/030/305/GCF_003030305.1_genomic.fna.gz	96.05	90.36	95.52-96.66	0.160	0.160	0.13-0.19	1	0.046	1056/24450	NZ_CP023676.1 Cutibacterium acnes strain ATCC 6919 chromosome, complete genome
pac_mock2_1gb.fq	gtdb_genomes_reps_r214/database/GCF/001/720/585/GCF_001720585.1_genomic.fna.gz	96.05	89.60	95.47-96.73	0.120	0.120	0.10-0.14	1	0.035	1449/43561	NZ_MABH01000001.1 Cereibacter johrii strain JA192 Edena_55_len:9378, whole genome shotgun sequence
pac_mock2_1gb.fq	gtdb_genomes_reps_r214/database/GCF/000/026/225/GCF_000026225.1_genomic.fna.gz	96.04	90.73	95.73-96.29	0.184	0.184	0.16-0.20	1	0.054	2225/45474	NC_011740.1 Escherichia fergusonii ATCC 35469, complete sequence
pac_mock2_1gb.fq	gtdb_genomes_reps_r214/database/GCF/000/147/695/GCF_000147695.2_genomic.fna.gz	96.03	96.03	NA-NA	7.519	HIGH	NA-NA	7	2.070	7223/25343	NC_015958.1 Thermoanaerobacter wiegelii Rt8.B1, complete sequence
pac_mock2_1gb.fq	gtdb_genomes_reps_r214/database/GCF/005/843/885/GCF_005843885.1_genomic.fna.gz	96.00	90.89	95.70-96.39	0.198	0.198	0.17-0.22	1	0.058	2543/49071	NZ_CP040443.1 Escherichia sp. E4742 chromosome, complete genome
pac_mock2_1gb.fq	gtdb_genomes_reps_r214/database/GCF/000/173/615/GCF_000173615.1_genomic.fna.gz	95.99	94.71	95.84-96.15	1.047	1.047	0.96-1.13	1	0.303	2704/14602	NZ_ABZS01000228.1 Sulfurihydrogenibium yellowstonense SS-5 gcontig_18, whole genome shotgun sequence
pac_mock2_1gb.fq	gtdb_genomes_reps_r214/database/GCF/009/729/055/GCF_009729055.1_genomic.fna.gz	95.98	87.64	94.94-97.68	0.060	0.060	0.03-0.08	1	0.019	454/27142	NZ_CP045484.1 Sulfurisphaera ohwakuensis strain TA-1 chromosome, complete genome
pac_mock2_1gb.fq	gtdb_genomes_reps_r214/database/GCF/012/843/875/GCF_012843875.1_genomic.fna.gz	95.93	95.93	NA-NA	3.220	HIGH	NA-NA	3	0.815	7774/28217	NZ_JABAFY010000001.1 Desulfovibrio piger strain PG-251-APC-1 Contig_1, whole genome shotgun sequence
pac_mock2_1gb.fq	gtdb_genomes_reps_r214/database/GCF/011/881/725/GCF_011881725.1_genomic.fna.gz	95.86	90.64	95.47-96.28	0.188	0.188	0.16-0.21	1	0.054	2033/42793	NZ_JAATUR010000100.1 Escherichia coli strain SCPM-O-B-8794 100length=599, whole genome shotgun sequence
pac_mock2_1gb.fq	gtdb_genomes_reps_r214/database/GCF/000/213/785/GCF_000213785.1_genomic.fna.gz	95.80	91.80	95.24-96.21	0.302	0.302	0.26-0.36	1	0.082	1065/15117	NC_015557.1 Hydrogenobaculum sp. 3684, complete sequence
pac_mock2_1gb.fq	gtdb_genomes_reps_r214/database/GCA/001/602/925/GCA_001602925.1_genomic.fna.gz	95.80	95.80	NA-NA	5.245	HIGH	NA-NA	5	1.279	6098/23071	LUZT01000020.1 MAG: Chlorobiales bacterium Clorobi_01 Chlorobi_01_contig_10178, whole genome shotgun sequence
pac_mock2_1gb.fq	gtdb_genomes_reps_r214/database/GCA/905/200/945/GCA_905200945.1_genomic.fna.gz	95.79	95.45	95.73-95.86	2.203	2.203	2.08-2.32	2	0.637	6553/27779	CAJKMG010000001.1 TPA_asm: uncultured Akkermansia sp. isolate ERR414247-bin.14 genome assembly, contig: NODE_1_length_362532_cov_11.812060, whole genome shotgun sequence
pac_mock2_1gb.fq	gtdb_genomes_reps_r214/database/GCF/902/459/535/GCF_902459535.1_genomic.fna.gz	95.60	95.27	95.56-95.64	2.232	2.232	2.16-2.31	2	0.556	18127/81540	NZ_LR699553.1 Paraburkholderia dioscoreae isolate PDMSB31 chromosome I
pac_mock2_1gb.fq	gtdb_genomes_reps_r214/database/GCF/000/014/425/GCF_000014425.1_genomic.fna.gz	95.53	91.27	95.09-95.91	0.272	0.272	0.24-0.31	1	0.066	1035/17575	NC_008530.1 Lactobacillus gasseri ATCC 33323 = JCM 1131, complete sequence
pac_mock2_1gb.fq	gtdb_genomes_reps_r214/database/GCA/020/161/265/GCA_020161265.1_genomic.fna.gz	95.43	95.43	NA-NA	7.366	HIGH	NA-NA	7	1.723	14079/60038	JAIUOC010000010.1 MAG: Chloroflexi bacterium isolate HERP1 spades-bin.75~NODE_121_length_326074_cov_3.61005, whole genome shotgun sequence
pac_mock2_1gb.fq	gtdb_genomes_reps_r214/database/GCF/014/836/715/GCF_014836715.1_genomic.fna.gz	95.42	90.31	95.02-95.83	0.194	0.194	0.17-0.22	1	0.049	1918/45243	NZ_JACSQI010000010.1 Escherichia whittamii strain Sa2BVA5 NODE_10_length_189467_cov_8.267575, whole genome shotgun sequence
pac_mock2_1gb.fq	gtdb_genomes_reps_r214/database/GCA/003/044/455/GCA_003044455.1_genomic.fna.gz	95.35	90.50	94.84-95.77	0.213	0.213	0.18-0.25	1	0.050	997/22045	POWY01000001.1 Neisseria bergeri strain C2008000328 C2008000328_S13_ctg_2420, whole genome shotgun sequence
pac_mock2_1gb.fq	gtdb_genomes_reps_r214/database/GCF/024/181/605/GCF_024181605.1_genomic.fna.gz	95.34	93.45	95.18-95.52	0.752	0.752	0.71-0.81	1	0.172	3329/27230	NZ_CP054477.1 Treponema denticola strain OMZ 823 chromosome, complete genome
pac_mock2_1gb.fq	gtdb_genomes_reps_r214/database/GCF/901/482/445/GCF_901482445.1_genomic.fna.gz	95.27	90.45	94.72-95.73	0.217	0.217	0.18-0.26	1	0.050	916/20568	NZ_LR590477.1 Neisseria lactamica strain NCTC10617 chromosome 1
pac_mock2_1gb.fq	gtdb_genomes_reps_r214/database/GCA/014/896/455/GCA_014896455.1_genomic.fna.gz	95.24	95.24	NA-NA	7.410	HIGH	NA-NA	7	1.580	4708/21321	JADBKJ010000001.1 MAG: Thermoanaerobacter sp. isolate Bu09 bin.9_contig1, whole genome shotgun sequence
pac_mock2_1gb.fq	gtdb_genomes_reps_r214/database/GCA/020/721/225/GCA_020721225.1_genomic.fna.gz	95.17	95.17	NA-NA	12.922	HIGH	NA-NA	13	2.750	5631/26158	DYNE01000043.1 MAG TPA_asm: Pelodictyon luteolum isolate SulCav_FS08_3_51_27 SulCav_FS08-3_1039_length_19552_cov_13.561061, whole genome shotgun sequence
pac_mock2_1gb.fq	gtdb_genomes_reps_r214/database/GCF/024/181/645/GCF_024181645.1_genomic.fna.gz	95.16	93.41	95.02-95.32	0.811	0.811	0.76-0.86	1	0.171	3346/27647	NZ_CP058624.1 Treponema denticola strain OMZ 854 chromosome, complete genome
pac_mock2_1gb.fq	gtdb_genomes_reps_r214/database/GCA/900/755/095/GCA_900755095.1_genomic.fna.gz	95.09	93.69	94.99-95.21	0.973	0.973	0.92-1.01	1	0.203	4753/35887	CAAEFE010000001.1 TPA_asm: uncultured Bacteroides sp., isolate HGM04659, WGS project CAAEFE010000000 data, contig: ERS473029_19_k99_64, whole genome shotgun sequence
